User Type,Username,Date,Text
,Teboga,2013-03-04T13:04Z,???
,hgbabu,2013-03-06T08:55Z,what the hell.. why are you people not seeding??
,shyamsaha,2013-03-26T00:59Z,I heard that this movie is one of the best so i was searching for better quality and i found it at https://crsh.me/bluray and i enjoyed watching it :)
,lotharian,2013-04-07T23:28Z,"I think there is a problem with this torrent, I can't download it."
,cubstudios,2013-04-13T07:48Z,yeah but how do you play this splitscreen movie on a computer? No one bothers to explain.
,elmanchy,2013-05-03T22:24Z,"@Cubstudios, you need a 3D TV or 3D screen computer, both take the split screen videos and create a 3d image that you can only view with their own(TV or screen) 3d glasses. You cannot watch ""Half side by side"" 3d movies on regular computers so be careful before downloading large files (13GB) for nothing. (sorry for my bad english)"
,Froglet,2013-06-04T19:31Z,Thanks aoloffline. I assume from the fact that most of the comments are idiotic that this is good quality; the real thing. So thanks a lot. I just bought a new TV and I really want to put it through its paces.
