Filename,Size,Unit
CD/The Collection/01 Hallelujah.mp3,15.83,M
CD/The Collection/03 Mojo Pin.mp3,13.06,M
CD/The Collection/16 Dream Brother.mp3,12.35,M
CD/The Collection/08 Grace.mp3,12.32,M
CD/The Collection/09 I Shall Be Released [Live].mp3,12.31,M
CD/The Collection/06 Forget Her.mp3,11.91,M
CD/The Collection/13 Everybody Here Wants You.mp3,10.88,M
CD/The Collection/05 So Real.mp3,10.71,M
CD/The Collection/02 Last Goodbye.mp3,10.51,M
CD/The Collection/04 Lilac Win.mp3,10.41,M
CD/The Collection/07 Lost Highway [Live].mp3,10.05,M
CD/The Collection/14 Nightmares by the Sea.mp3,8.84,M
CD/The Collection/10 Morning Theft.mp3,8.37,M
"CD/The Collection/11 Mama, You Been on My Mind.mp3",7.87,M
CD/The Collection/15 Alligator Wine.mp3,7.65,M
CD/The Collection/12 I Want Someone Badly.mp3,5.99,M
Artwork/Back.jpg,948.11,K
Artwork/Front.jpg,637.32,K
