User Type,Username,Date,Text
,velocidademaxima,2013-01-17T19:26Z,seeds por favor o filme e bom!!
,BRAboi,2013-01-19T03:05Z,"HORRÍVEL, GRAVADO DE DENTRO DO CINEMA, PÉSSIMO, NÃO PERCAM TEMPO BAIXANDO ESSA PORCARIA."
,luizjunio,2013-01-19T18:39Z,"e bom o cara nao tem o que falar logico que e gravado do cinema.
le a qualidade que ele coloco ze ruela o filme e bom tb e lançamento!!!!"
,luizjunio,2013-01-19T18:45Z,muito bom
,diegodg,2013-01-19T21:19Z,"Infelizmente imagem muito ruim.

Imagem: 4
Som: 5"
,Ele.Eme.,2013-01-26T21:45Z,Gravado no cinema --'
,BRAboi,2013-02-02T21:56Z,"luizjunio, zé ruela é a mãe!"
,jefersonzc,2013-02-05T01:07Z,"Tem mesmo sempre um mané para falar que é gravado de dentro do cinema ¬¬
Custa ler???"
,adriano18,2013-02-12T00:09Z,a pior gravação de cinema eu já vi a qualidade ta mto ruim ñ baixem
,dualbleed,2013-03-31T01:00Z,"Qualidade do video: 08 ==> MENTIRA, nota 3 já é até muito. Não percam tempo com esse lixo de gravação. Tá certo que é gravado de cinema, mas não precisava ser inassistível."
,patozoide,2013-04-05T10:44Z,"Valeu a intenção mas isso tá uma merda!!! Quem puder compartilha um DVD por favor. O filme parece bom mas essa gravação de merda não dá pra ver! Video 0 Áudio 0. Sem foco, tremendo, parte da tela cortada, filmado de lado... Uma merda mesmo! Valeu o velocidademaxima, mas a velocidade é inimiga da perfeição! Foi o mais rápido pra compartilhar mas vai ver que bosta ficou a gravação!"
