User Type,Username,Date,Text
,Prabath1234,2013-01-11T07:06Z,"Hey  sec,you doing final strike-force card this weekend bro?
It's free."
[V],SecTPB,2013-01-11T07:07Z,"Yes, I am doing Strikeforce, along with the preliminaries. I will offer up several different qualities of both events. "
,MustafaHH,2013-01-12T10:50Z,"I'll have a small request. Can you upload your torrents to xtremewrestlingtorrents*net at the same time you upload them to TPB. At least their we will have a faster download.

Thanks for your great works."
