Filename,Size,Unit
"ACSM's Advanced Exercise Physiology, 2nd Edition [2012].pdf",29.72,M
"ACSM's Certification Review, 3rd Edition [2010].pdf",155.9,M
ACSM's Exercise is Medicine. A Clinicians Guide to Exercise Prescription [2009].pdf,2.62,M
ACSM's Foundations of Strength Training and Conditioning [2012].pdf,23.06,M
"ACSM's Guidelines for Exercise Testing & Prescription, 7th Edition [2006].pdf",96.58,M
"ACSM's Guidelines for Exercise Testing & Prescription, 8th edition [2009].pdf",4.75,M
"ACSM's Health-Related Physical Fitness Assessment Manual, 2nd Edition [2008].pdf",72.68,M
ACSM's Introduction to Exercise Science [2011].pdf,11.03,M
"ACSM's Primary Care Sports Medicine, 2nd Edition [2007].chm",44.9,M
"ACSM's Resources for Clinical Exercise Physiology, 2nd Edition [2010].pdf",2.22,M
"ACSM's Resources for the Personal Trainer, 2nd edition [2007].pdf",30,M
