User Type,Username,Date,Text
,Chartsandgrafs,2013-03-07T09:26Z,"Wow, two of the best albums of the 80s - Let It Be and New Day Rising - in the same day.  

Can't wait to see what's next."
[V],politux,2013-03-07T13:08Z,"Great sound on this rip, I can actually understand Husker Du lyrics.  Dynamic range is excellent."
,tverlaine,2013-03-12T18:01Z,"Agree Agree
Most everything sounds better on vinyl,but these recent few are absolutely essential on vinyl.CD does not do nearly enough justice. I'm sure I'm singing to the choir here- Thanks so much 24.96"
