User Type,Username,Date,Text
,SteelerJ17,2013-04-09T23:52Z,I will have Django Unchained by the 16th of this month or later. So be on the lookout for that. 
[T],Magash,2013-04-10T00:18Z,"Cool, keep up the good work you're going to have your pink skull soon."
,SteelerJ17,2013-04-10T00:46Z,@Magash Thank you for liking my work. I enjoy uploading them for all of you. 
,4gringo,2013-04-10T02:43Z,Thank you for the English and Español Latino audio and subs!
,SteelerJ17,2013-04-10T21:50Z,@4gringo You're welcome! Thank you for seeding them if you are
,Dicruz63,2013-04-14T03:44Z,"Gracias por todas las peliculas que haz subido.
Quisiera pedirte si de pronto tienes Actividad Paranormal 3.
Muchas Gracias. "
,Dicruz63,2013-04-14T03:47Z,"Gracias por todas las peliculas que haz subido.
Quisiera pedirte por favor si tienes Actividad Paranormal 3.
Muchas gracias, excelente tu trabajo, sigue así."
,SteelerJ17,2013-04-14T20:51Z,@Dicruz63 El problema! así que en la búsqueda de lo. 
