User Type,Username,Date,Text
,HALL2013,2013-03-01T22:00Z,"I don't do the A or V ratings things, but i'm watching this on my 52"" and it is very watchable and the audio is fine. I'm only 10 minutes in, but as far as I can tell everything is good especially for a CAM."
,logan-x-art,2013-03-01T23:00Z,"I will be using your source for dub and I dont give a fuck about getting permission...

Let those scene whores know...

I dont give a fuck...do something about it..."
,hawkins4,2013-03-02T00:07Z,...and ur lil doggie too.............
,Zanteater,2013-03-02T08:41Z,"[§][§][§][§][§][§]--CAUTION DOWNLOADERS!--[§][§][§][§][§][§]

This movie stars ""The Rock"" 

[§][§][§][§][§][§]--SERIOUS REPERCUSSIONS --[§][§][§][§][§][§]"
,Kevintripod,2013-03-02T11:53Z,"A little dark, blurry and grainy.

V7
A7
"
,Kevintripod,2013-03-02T11:54Z,"A little dark, blurry and grainy.

V7
A7"
,Kra3zd,2013-03-02T16:20Z,"Fuck all SPAMMING bitches and FUCK people that talk shit from behind their computer screens.

Thanks scene4all for another quality UL."
,aztralcap,2013-03-02T19:59Z,"V 6-7
A 7
not bad from a camera
Thank you scene4all. love your stuff"
,Farzin67,2013-03-02T20:20Z,"Thanks for the upload.
A: 6
V: 5
will wait for a better version."
,God_8,2013-03-03T01:12Z,"Yet another Satanic demon possessed mind control movie from the Baphomet of  HELLYWOOD faggots . When will you people ever wake up to this wicked evil sick Illuminati Slave form of unholy entertainment. 

The Rock is a faggot slave of the Illuminati  and he is demon possessed !


If you want to know the truth check out the youtube channel shieldoftheson

Watch the video series entitled: Hollywood The Devil's Playground

Then you will think twice about ever watching another hollywood movie in your life !"
,michaelrwatson,2013-03-03T07:18Z,"@scene4all: WHY NO SAMPLE, dickhead?"
,DrugSquad66,2013-03-03T08:56Z,the illuminati are about as powerful and relevant as catshit. upload 5 1/2 - 10
,paprboy,2013-03-03T14:00Z,"""NO ONE IS ALLOWED TO USE OUR SOURCE FOR DUB WITHOUT OUR PERMISSION. LEARN TO
UNDERSTAND AND RESPECT THIS. ITS HERE FOR A REASON"" 

That made me lol.... Scene groups giving a shit about copyrights, demanding everyone to not copy their work ^^"
,SomeBoyFromVillage,2013-03-03T14:20Z,"thnx!
a/6,5
v/6,5

*_^"
,Billo51,2013-03-08T15:15Z,"Like most Cam, and MP3, etc. The Quality`s not as good as a DVD download, But We all know this, Right? So Quit Bitchen people. Thanks scene4all.!!... Oh ya, Hey God_8 If this Movie and ""The Rock"" are all Hell Bent Crap .!!.. What are you watching it for? I Thought your supposed to treat people with Kindness? Your right about one thing, a lot of Bad things Happen in Hollywood... No Disrespect intended.!!..."
,beestripe,2013-03-09T02:30Z,Looks like scene4all is actually Julian Assange.
,cryghost,2013-03-09T05:06Z,"thank for your sharing, but maybe with subtle "
,notet0self,2013-03-09T09:33Z,"to GOD_8, Illuminati...sound like off your rocker, hollywood is a Concepcion...can't believe there's still crazy fk's like you around, hope a car hits you crossing the street cuz your nuts beyond reason, hope you get hit by a car crossin the street, the world would be a better place without people bitching about free things, reviewing and giving their nuts opinion, you should be in a psych-ward, your just as bad as the people who attacked the world trade centre in 9/11 crazy fk"
,richkla,2013-03-09T21:26Z,"Thanx scene4all for the effort.
Excellent quality for the cam."
,Tlow90,2013-03-10T00:44Z,"@god_8 ummmm....u say that hollywood is hell and that its all evil and everything, and yet here u are on this site where nothing but movies are uploaded. talking about all that and u are here commenting on something that shouldnt even concern u at all. stop trolling and let ppl enjoy their movies...."
,khefron2004,2013-03-12T03:18Z,"I won't even download you bullshit ""scene4all"" you some faggot ass ""get my permission"" cocksucking queers. Fuck your STOLEN source nobody else ""CAN"" use. you all are some bumb motherfuckers. "
,michaelrwatson,2013-03-14T06:50Z,"@God_8: ""The Rock is a faggot slave of the Illuminati""

I'm laughind so hard i can hradly type!! Thanks for your stupid post--i am going to download this rip straightwaay. Btw, say hello to Allah when you meet him soon, you raging nutjob."
,macwun,2013-03-27T10:56Z,and yet here u are on this site where nothing but movies are uploaded: rofl. some noob who isn't aware of all the other stuff that's on this site. But I agree that guy is nuts
,macwun,2013-03-27T10:57Z,"NO ONE IS ALLOWED TO USE OUR SOURCE FOR DUB WITHOUT OUR PERMISSION. LEARN TO
UNDERSTAND AND RESPECT THIS. ITS HERE FOR A REASON""  ROFLMAO yet you have pirated a copyrighted movie? how about: get fucked. im going to use your source as many times as I Can. what you gonna do about it? Exactly : nothing. so stfu and don't ever write shit like that on a torrent again ok?"
,vonwisdom,2013-03-28T00:19Z,"opendhaka 
suck a donkey dink"
,base1268,2013-03-31T17:19Z,"Why can't people learn how to use a video camera properly.... ??

Auto focus is for people who don't know how to use a camera... and ONLY for still photography.

use manual focus for fuck sake !!"
,chainfire4126,2013-04-10T04:37Z,"NO ONE IS ALLOWED TO USE OUR SOURCE FOR DUB WITHOUT OUR PERMISSION. LEARN TO
UNDERSTAND AND RESPECT THIS. ITS HERE FOR A REASON"" ROFLMAO yet you have pirated a copyrighted movie? how about: get fucked. im going to use your source as many times as I Can. what you gonna do about it? Exactly : nothing. so stfu and don't ever write shit like that on a torrent again ok?
------------what will they do?--------------
-----simple as removing their source-----
abuse the privilege and ruin it for all.  I for one tend to get a lot of my shit from S4A and would rather that they kept up the great work. =/ I remember the days of AXXO and would deff prefer to not have to find another source... its a righteous pain in the ass."
,horus1sun,2013-04-16T20:08Z,YAWNNNNNNNNNNN when will the rock die in a plan crash or something?
,starlite2,2013-04-21T01:46Z,"Personally, I have a lot of respect for Dwayne Johnson. I suppose I began to notice him starting with his excellent work in Be Cool where he proved he has plenty of talent. The man came out of costumed choreographed wrestling for crissakes... and is now a top ten box office action star. Action stars kind of have a limit to what they can do with their roles, and like, say, Bruce Willis, Mr. Johnson has pushed his roles to the limits and carried the films he's starred in. I'm gonna say it... I'd like to see a sequel to The Rundown. If any of his critics here are half as successful... I'd give them half as much respect. Hell... if any of his critics have more than 100 bucks in their bank account, I'd slap 'em on the back and tell them to keep up the good work... I try to be a positive reinforcer, and that's just the way I roll. "
,HooK_43,2013-05-08T00:34Z,"HEY IF YOU STEEL MY STOLEN CADILAC THAT I STOLE, I WILL HAVE YOU ARRESTED AND PUT YOU IN JAIL.......ROTFLMFAO "
