User Type,Username,Date,Text
,skyebrntt,2013-03-26T10:48Z,"Thank you soooo much!!! i don't use iTunes so i couldn't buy it, but i'll figure something out, Ariana has a great voice."
,brunorlferreira,2013-03-28T19:58Z,This Girls deserves for you all to buy her song on iTunes! She gives us a so good Mariah Carey trip that I fell in love instantly with her. Good Job Grande!
,Kleavage,2013-04-30T09:54Z,Great summer song. Thanks for torrent!
,Techgeek1985,2013-05-05T19:52Z,"Thank you. I love this song, so thank you very much for uploading this torrent! :)"
,StikEE_hardcore,2013-05-15T21:06Z,"Thanks to my niece, i found out about her through the show Victorious, and i instantly fell for her cuteness, she deserves this big break!!! (unfortunately can't buy her songs in itunes but at least i support her :D)

p.s.
to avoid people from thinking i'm a creepy old man with a niece:
we're both almost the same age (19) :P"
