User Type,Username,Date,Text
[V],psspss,2013-04-05T16:59Z,"did you watch the Dark Skies Movie 2012... not too bad Im half way through 

its still a rip off - its a reduce copycat of the dark skies tv series from the 90s.. also on ufos roswell and alien abductions.. which I shared already if not got it.. grab it.. its really good too

and of course project ufo/bluebook series 1 and 2 from the 70s?

if people are seeding those torrents still?"
[V],psspss,2013-04-05T17:00Z,oppps 2013 not 2012 for movie lol going a bed.. make sure to seed else it will be caught by the ratio watcher in utorrent!
[V],psspss,2013-04-06T00:56Z,"so some leeched still lol added more data yet again
"
[V],psspss,2013-04-06T01:42Z,ok 35 have it now.. leave yas to it.. need to keep saving data for more stuff
