User Type,Username,Date,Text
,shih9019,2013-04-14T15:36Z,SERIOUSLY?? THIS IS YOUR VERSION OF HD CAM ... DAMN THEN I NEED SOME OF WHAT YOU ARE TAKING ... ALOT OF BACKGROUND LAUGHTER ...  VERY UNCLEAR FUZZY SCENES APPROX 15 MIN IS DECENT. YOU WONT GET A SKULL UNLESS YOU ARE HONEST.
,hungry4momoney,2013-04-14T17:39Z,"my intentions are not for a skull they are for viewers to get a copy of the movie, i apologize for the labeling as it was labeled this way when i downloaded it. thank you for your feed back. APPARENTLY THIS IS NOT A HD CAM. apologies for the misrepresentation.  "
,BabiesDontNeedSpleens,2013-04-27T11:22Z,"Thanks for the UL,  ignore the chatter. There are plenty of them not doing anything except taking up space. You see what people write on so many things..."
,danteK1,2013-04-29T19:06Z,"hungry4momoney Thanks for your sharing mate !
much appreciated"
,quietguy404,2013-05-20T12:35Z,"this video is terrible. when will recorders learn to turn off their auto focus? it would have been loads better if they do that. video 4 because its constantly going out of focus. audio 7 clear to hear but not perfect, some audience sounds now and then but not bad. thanks uploader but have a word to the recorder please. this aint so good. im waiting for a better copy. "
