User Type,Username,Date,Text
[V],tykoon123,2013-05-04T10:11Z,Seed and Enjoy :)
[V],SJonam,2013-05-04T21:11Z,its looking little better than HD Cam but not DVDScr ;) still great rls friend...
,rake1979,2013-05-05T14:20Z,"Dosto what about A/V quality ??? tykoon123 request you to please provide the quality from your side too.

S Jonam what abt A/V and M rating ?"
[V],SJonam,2013-05-05T20:22Z,"Same video posted as HDCam here - http://thepiratebay.sx/torrent/8438203/Shootout_At_Wadala_%282013%29_1CD_HD_Scam_Rip_Xvid_MP3_Hindi 

download print provided by SAM ;)"
,mrohith,2013-05-10T11:35Z,upload chotta bheem &throne of bali {telegu movie thadaka anyone pleaseeeeeeeeeeeeeeeeeeeeeeeeeeeeeeeeeeeeeeeeeeeeeeeeeeeeeeeeeeeeeeeeeeeeeeeeeeeeeeeeeeeeeeeeeeeeeeeeeeeeeeeeeeeeeeeeeeee}
