Filename,Size,Unit
Xtras/SIN-ister Clips/NAZI Checkpoint guards KICK in car door.avi,593.99,M
Xtras/Signs of the Times/6_16_11 Radiation Test Bereford_ S Dakota - 77.0 CPM.avi,367.41,M
Elijah.avi,236.15,M
Daniel.avi,235.93,M
Joseph's Reunioun.avi,233.98,M
Elisha.avi,231.73,M
Ruth.avi,229.12,M
Solomon.avi,226.84,M
Abraham and Isaac.avi,225.69,M
Samuel the Boy Prophet.avi,225.55,M
David and Goliath.avi,216.65,M
Joseph in Egypt.avi,213.06,M
Moses.avi,203.05,M
Esther.avi,186.95,M
Xtras/The Holy Spirit/Sherwood Pictures  Evangelicals and Catholics Together.flv,168.4,M
Xtras/Signs of the Times/Aaron was killed by the govt - Robert Swartz on his sons death.avi,168.1,M
Xtras/Signs of the Times/Dr Royal Raymond Rife Story - The  Portrait of a Genius.avi,87.97,M
Xtras/SIN-ister Clips/Police take Newborn after Mother Refuses Hep B Vaccination.avi,86.81,M
Xtras/SIN-ister Clips/The Quiet Coup Of America That No One Noticed Or Stood Up Against.avi,71.35,M
Xtras/War and Rumors of Wars/Endtime News Updates 12-13-12_ The Muslim Connection.flv,55.74,M
Xtras/Martyrs of Today/IDOP 2010  Salavat - Uzbekistan Persecution.mp4,55.52,M
Xtras/The Holy Spirit/Sackcloth Ashes ASSASSINS CREED The REVELATION Entering the Kingdom thru much Tribulation.flv,52.8,M
Xtras/SIN-ister Clips/Psychiatry  Hidden Influence.flv,48.81,M
Xtras/Signs of the Times/Facebook Purges Pro-Gun Accounts 12_27_2012.mp4,46.14,M
Xtras/The Holy Spirit/Prophecy Signs.flv,42.37,M
Xtras/The Holy Spirit/The Beast Govt Mark of Cain X The Borgs Pt 4.flv,41.14,M
Xtras/SIN-ister Clips/Pinks Preview_ Strange Sounds_ Sinkholes.avi,36.87,M
Xtras/Signs of the Times/Brain Cell Death _ Magnetic-Field_ Induced DNA Strand Breaks in Brain Cells of the Rat.avi,36.37,M
Xtras/Signs of the Times/How to Kill_ Control Christians behind the scenes from Ripple Effect.avi,35.88,M
Xtras/Signs of the Times/Concerned Citizens uncovers Sewage Sludge policy.mp4,34.49,M
Xtras/SIN-ister Clips/New EQ swarms reported at Hierro_ Canary Islands.avi,24.61,M
Xtras/War and Rumors of Wars/Germany_Deutschland Immigrants Creating Their Own Societies Authorities In Denial.mp4,22.51,M
Xtras/Signs of the Times/Federal Court Rules in Favor of RFID at TX School.avi,21.6,M
Xtras/The Holy Spirit/Prayercast   Trinidad and Tobago.flv,21.01,M
Xtras/SIN-ister Clips/RADIATION UPDATE_ Jan. 2_ 2013.avi,19.45,M
Xtras/Signs of the Times/Health Benefits of Aloe Vera.avi,19.13,M
Xtras/The Holy Spirit/Who Am I Casting Crowns.flv,19.07,M
Xtras/SIN-ister Clips/live together.avi,18.64,M
Xtras/Signs of the Times/Fountains of the Great Deep - Hydroplate Theory - Dr Walt Brown.flv,18.44,M
Xtras/The Holy Spirit/I Believe  from Creation Calls by Brian Doerksen.mp4,17.81,M
Xtras/Signs of the Times/1000s of Bluebottle JELLYFISH on Oreti Beach.mp4,17.08,M
Xtras/The Holy Spirit/Liberal or Conservative  A 2 Minute Parable   Life Lesson.mp4,15.95,M
Xtras/The Holy Spirit/What is Salvation  In 2 Minutes - Paul Washer .flv,15.63,M
Xtras/SIN-ister Clips/Man Captures Video Of Strange Explosion In Sky CBS Sacramento 12_30_12.avi,14.91,M
Xtras/The Holy Spirit/Jesus Paid It All O Praise the One.flv,13.93,M
Xtras/The Holy Spirit/Chris Tomlin - Holy is the Lord w  Bible verses.flv,12.23,M
Xtras/The Holy Spirit/Matt Redman - Blessed Be Your Name 2.flv,12.13,M
Xtras/Signs of the Times/At least 55 KILLED in TWIN BLASTS at Damascus intel compound_ TERRORISTS BLAMED REPORT.mp4,11.9,M
Xtras/Martyrs of Today/I d rather have Jesus AV Chruch in Goa India.flv,10.38,M
Xtras/SIN-ister Clips/Rebels Dismiss Calls for Peace Talks.flv,10.14,M
Xtras/SIN-ister Clips/Outer Space Looks Like Neurons In A Brain.mp4,10.03,M
Xtras/Signs of the Times/American Planes Spray Plague Infected Fleas   Medicine in 1950 Korean War.flv,9.8,M
Xtras/War and Rumors of Wars/Giant Robot Debuts In Japan.flv,8.53,M
Xtras/Signs of the Times/Is This A Base On The Moon.flv,8.3,M
Xtras/SIN-ister Clips/NUCLEAR UPDATE_ Jan. 14_ 2013.avi,7.4,M
Xtras/The Holy Spirit/Our God is an Awesome God.flv,7,M
Xtras/The Holy Spirit/I can only imagine - Mercy Me.flv,6.52,M
Xtras/SIN-ister Clips/Mysterious Booms Rock Arizona.mp4,6.47,M
Xtras/SIN-ister Clips/UFO_ Rio_ Brasil - Why so many UFO sightings in S Amer.avi,5.02,M
Nest 12 Animated Old Testament Stories.JPG,47.84,K
Nest The Complete 12  Video Set.jpg,42.42,K
POtHS - Why We Do What We Do.txt,7.89,K
Info.txt,1.92,K
Torrent downloaded from Conspiracyhub.com.txt,47,B
