User Type,Username,Date,Text
,RubaDubGoat,2013-02-13T21:16Z,I'm seeding :)
,gamesalot9,2013-02-14T00:23Z,I will seed as much as I can with no limit once I'm done downloading. Thanks for taking your time to share this. Can you please submit the quality details of these albums
,RubaDubGoat,2013-02-15T06:53Z,"Please people, seed! :( I'm stuck at 60.5%..."
,RubaDubGoat,2013-02-16T16:04Z,"I have uploaded 9.84 GB, and im only at 64%. I'm going to stop at 11 GB."
,FRSgaming,2013-03-02T00:25Z,Come on and seed please. I've been attempting to download for 4 days.
,sfitz,2013-05-06T02:14Z,"Agh, will someone please seed. I'm stuck at 66%."
