User Type,Username,Date,Text
,01110101101,2013-01-23T23:24Z,thanks!
,BertilGM,2013-01-23T23:40Z,"Thank you, allot faster then the regular downloader"
,pomitroni,2013-01-24T00:16Z,"Thank you good sir, the regular download takes fucking ages"
,low8all,2013-01-24T00:52Z,"People are snatching and not seeding - which is what I would expect from a bunch of fucktards not wanting to deal with the loss in bandwidth by playing and seeding at the same time. 

So, since there is not a single 100%'er in the swarm - save yourself the hassle and just keep your PoE client going - you'll get it faster."
,Kaleglath,2013-01-24T01:57Z,Trust me guys when im 100% done this will be seeded. im nearly complete. my name on PoE is PremiumNoob
,Kazurin,2013-01-24T01:59Z,"Stuck at 99.9%, fucking ban this uploader"
,apbuser,2013-01-24T02:25Z,"I don't see any 100% seeders, those who have finished please hang around."
,Kaleglath,2013-01-24T02:34Z,99.9% is lovely and all BUT I WANT FASTER THE .5% dl speed so i can get 100% !!!! 6 minutes ETA apparently tho....
,Kaleglath,2013-01-24T02:35Z,tell yall what. once im 100% done on my POE client ( the slow ass dling mother fucker.. ill upload it and keep it seeding...)
,Kaleglath,2013-01-24T02:39Z,for the ones at 99.9% open the poe folder.. the legit one. take the data file from the 99.9% done and copy it into the legit game the .1% dl's in a meer second
,faszkalap_akos,2013-01-24T02:49Z,"start the game with Client.exe, it downloads like 0.1MB and works even if this is at 99.9%"
,apbuser,2013-01-24T03:19Z,"To all those suck in the 99% range, close the torrent and run the client.exe and the game will download the remaining files."
,rkefreddyk2011,2013-01-24T06:40Z,"apbuser
is correct "
,pomitroni,2013-01-24T09:07Z,"Im stuck at 99.9% and im seeding with 8Mb/sec, guys stop being assholes and seed"
,Chauthe,2013-01-24T09:14Z,"I'm assuming I still need a beta key to play this since I missed out on the ""open"" session?  =/"
,wavetrex,2013-01-24T13:02Z,"No need for any key whatsoever.
It's completely free.

This torrent was made to help people that can only update very slowly from their official servers."
,sieg89,2013-01-24T15:05Z,"THAT last 0,01% lol i  1 hour at 0.3KB/S"
,Latase,2013-01-24T17:04Z,"you just download the one very big file and then let the official client do the rest. from 99,9% to 100% in 1 second."
