User Type,Username,Date,Text
,fliter16,2013-01-12T18:51Z,"could use more seeders or a DDL to speed things along

this is downloading absurdly slow"
,fliter16,2013-01-12T19:58Z,"download finally finished, torrent health is improving

quality is good, amplitude is good, but I'll have to listen to the rest of the album to really judge this

I hope it's not the best they can do"
,wiseguyy,2013-02-08T08:40Z,Cheers!
,MissWatanabe,2013-02-10T21:48Z,"Great Quality, Album Cover WORKS, & It's such a GREAT SONG! ♥ ♥ ♥ "
