User Type,Username,Date,Text
,ziffel323,2013-02-21T23:51Z,"Thanks NepsterJay

Can you please up Photoshop CS6 One On One 'Master' course?"
,cool1919,2013-03-01T18:18Z,"can u please upload ""Responsive Design Fundamentals with James Williamson"" released Oct 31, 2012? thanks"
,HERO533,2013-03-07T06:36Z,thank you so much
,kirmazna,2013-03-14T16:28Z,"Any chance of having Lotus notes from Lynda Nepster, cant find 'em anywhere :("
,mandy12,2013-03-15T07:04Z,Please Upload Lynda -Asp.net essential training new Course in 2013 
,darajeur,2013-05-01T20:34Z,Verry helpfull Nepster Thanks a lot
