User Type,Username,Date,Text
[V],MANTESH,2013-05-09T17:13Z,Thanks .....sounds good
,agent222,2013-05-09T17:51Z,"I question the label ""r6"". According to IMDB, this hasn't been released theatricaly in either China, or, North Korea. So how could there be a rip of a retail DVD from that region, sync 'd to sn English soundtrack? "
,viv_jen.,2013-05-09T18:38Z,with subs?
,notnowplz,2013-05-10T00:03Z,jap speaking in the beginning!!!!!!...I'll wait!!!!
,mikedcracker,2013-05-11T12:28Z,any good subtitles for this copy ?
