Filename,Size,Unit
get skinny/07 the game is on.mp3,12.54,M
"get skinny/11 i am me. no, i am you.mp3",11.06,M
get skinny/12 shallow pond in a sunken cave.mp3,9.72,M
get skinny/02 third degree technology.mp3,8.53,M
get skinny/08 run with purpose.mp3,7.79,M
get skinny/04 dust in the firelight.mp3,7.54,M
get skinny/06 thoughts of restless souls.mp3,7.05,M
get skinny/05 to sleep through dawn.mp3,6.7,M
get skinny/13 requiem.mp3,6.47,M
get skinny/03 the boy who started a fire.mp3,6.04,M
get skinny/10 semantics of a long forgotten future.mp3,5.67,M
get skinny/09 brush the treetops.mp3,4.84,M
get skinny/01 dissociate.mp3,4.66,M
get skinny/get skinny.jpg,204.28,K
