User Type,Username,Date,Text
,2.5Kburn,2013-05-21T05:56Z,"@bamf001:
[idk if anyone else is having this problem, but I freeze/crash approximately 5 sec after the intro video plays (while Lara is thrashing around in the water).

It freezes then crashes with error:
""Disc error while reading file BIGFILE.002.tiger""

Any ideas/help?]

Try downloading the update patch off of the nosTEAM website, they nearly always fix these sorts of problems.  If that fails, reinstall (or redownload and reinstall, if necessary) and see if that takes care of it.
Failing those options, I can't offer any advice."
,piratenumber11,2013-05-23T18:25Z,"Could someone, please, help me? I have tried two things: installing according to the instructions, and unraring rar 2, but none of those work. When I click on the shortcut, or the app in the directory, I only get loading on the cursor, but nothing pops out - no loading screen, no error... nothing happens. I tried running as admin. I have no idea what else I can try (I checked my antivirus for quarantine and it is not blocking the game)"
,softbanana,2013-05-28T20:20Z,This will take me foreva'!
,Rickyboy1992,2013-06-05T03:04Z,I just beat this game. It works flawlessly. Multiplayer does NOT work like every other torrent I've downloaded from noSTEAM.  But I only got the game for the SP. 
