User Type,Username,Date,Text
,VanRheen,2013-03-05T00:50Z,nosTEAM never lets me or anyone down!!
,BluntzNzigzags,2013-03-05T00:53Z,bro i love you!(no homo)
,espizh,2013-03-05T00:55Z,extremely slow download
,minhhieule89,2013-03-05T00:57Z,Thanks for all the games that you've uploaded.
,ttoohot4yoazz,2013-03-05T01:17Z,Please seed peeps! hope this game works... nosTEAM is the best;)
,VanRheen,2013-03-05T01:23Z,@ttoohot4yoazz all of nosTEAM's games work.
,clubbi,2013-03-05T01:29Z,"Thank you Nosteam !!! Love you !!!
Hope I don't fail my finals now lol"
[S],soda,2013-03-05T01:46Z,"nosTEAM, please join our forum (there is a link in the footer) or IRC channel to talk to a moderator re. an issue with your account."
,killerwins123,2013-03-05T02:12Z,Please seed. Wanna get to play this tonight!
,Valamyr82,2013-03-05T02:57Z,"This seems to have all the features that matter at the best size, but shouldnt nosTEAM have a skull?"
,killerwins123,2013-03-05T03:34Z,"Can anyone confirm if this works?

nosTEAM has a good rep, but cant waste download"
,killerwins123,2013-03-05T03:42Z,seeeeeeeed ..
,assassin01,2013-03-05T06:30Z,thanks for all the uploads bro your the best
,Yiani,2013-03-05T08:13Z,hey nosteam is it possible if you can upload MLB 2k13 if it does come out for PC or MLB 2k12 
,dr.pluto,2013-03-05T10:35Z,"nosTEAM delivers again! last it was crysis 3
Hope this works just as well!"
,topnewgames,2013-03-05T11:41Z,"wow,ce rapid l-ati pus "
,Zozur,2013-03-05T11:56Z,"@nosTEAM:

No offence but have you repacked Skidrow's work?
Everytime I notice, you upload your scene after the Skid rowdies. I love your releases anyway! :D"
,supNegga,2013-03-05T12:38Z,"TY nosTEAM for the UL
Just stopped and deleted the SKIDROW torrent for ur's.."
,Ada9990,2013-03-05T17:27Z,the sims 3 university life please nosTEAM :)
,nosTEAM,2013-03-05T18:53Z,@ sanciou88 - save game is working if you run game as Administrator 
,attak79,2013-03-05T18:55Z,"It's working like a charm!
No need crack,saveing is ok,so great work!
Thx!"
,xXyunaXx,2013-03-05T19:20Z,"I registered an account just to say thanks!
but the download is painfully slow please seed~
thanks!"
,DThunder0,2013-03-05T20:02Z,"This works but game crashes at some point, making it impossible to go further."
,xXyunaXx,2013-03-05T20:13Z,"so little seeders.. so many leechers..
please PLEASE SEED MOARRRR!!!"
,Crystal123456789,2013-03-05T20:44Z,"plzz!!!!!!!!!!! upload batman arkam city or asilum
sorry for bad spelling"
,assassin01,2013-03-05T21:16Z,could you upload army of two
,culum97,2013-03-05T22:49Z,Hi ^^nosTEAM^^ can you please update Torchlight II v1.21.5.1
,loshmy,2013-03-05T23:34Z,Great job...keep going nosteam
,ibenny604,2013-03-05T23:47Z,cant wait for this to download but its only at 5% with 2 days left. seed please?
,zesend,2013-03-06T00:02Z,"Hi guys, I've seen conflicting posts on various torrent sites about this game about multiplayer. Some people say that multiplayer works with the torrent, some say it doesn't. So what is the verdict?"
,Twizted7,2013-03-06T00:13Z,"I'm stuck on the Ascension level.....There's a strange glitch when I'm about jump across the windy-bridge....Lara just looks down and nothing else happens?  If ANYONE has a fix for this, please post it. "
,Knightarchx,2013-03-06T00:28Z,Are you going to be getting Virgil's Downfall?
,darthvader906,2013-03-06T04:56Z,"Mad props again to ^^nosTEAM^^... worked flawlessly like usual. Gonna seed the shit out of it for a while. Uploading right now at 10MB/s >:D 

Get to it yall!"
,nosTEAM,2013-03-06T07:27Z,If you’re using nVidia’s GTX graphics card then TURN OFF TESSELLATION 
,loshmy,2013-03-06T13:00Z,SEEEEEEEEEEEEEEEEEEEEEEEEEEEEEEEED
,MoneyGuy,2013-03-06T19:24Z,It's saying that it will take 40 weeks to download it please seed people i am stuck at 82.7%...
,trifillos,2013-03-07T01:23Z,"NOSTEAM,IMPORTANT MESSAGE!!

 I have the same problem with Twizted7..
Can you tell us what we have to do to fix it???

PLEASE ANSWER!"
,RavenousRaven,2013-03-07T05:18Z,For those having frequent crashes and using geforce graphics turn off tesselation!!!!!!!!!!!!!!!!!!!!!!!!!!!! until nvidia optimizes the game
,jameydboi,2013-03-07T08:58Z,"PLz Help - when i click on it and then Press Play

It said Something Wrong like "" a problem Has caused this program to stop Working, 

I have All the Same exact Specs. as you specified but The video Card, I went to DXDiag and checked it says i Have 
""Mobile Intel (R) 4 Series Express Chipset Family""

SOO my question is,,, Is that a good enough video Card??"
,zaidiraq,2013-03-07T14:59Z,thank you very very musch nos team thank you for your hard work i download the game and i  install the game its work so thank you again nos team to you respect and appreciation from iraq
,zaidiraq,2013-03-07T15:05Z,thank you very very much nos team thank you for your hard work i download the game and i  install the game its work so thank you again nos team to you respect and appreciation from iraq
,MisterAwesome23,2013-03-07T16:31Z,Please nosTEAM could you upload Max Payne 3 ?? oh and great job as usual :)
,Performer81,2013-03-07T17:48Z,I have to kill somebody with a grenade launcher in a qt event but i cant shoot. Help.
,Darkxshadow,2013-03-08T00:59Z,does this support Arabic language?
,Darkxshadow,2013-03-08T01:00Z,does this support arabic language?
,TaleMunja,2013-03-08T01:08Z,"Simply the best torrents ever, you guys rock!
 nosTeam is the best, honestly.

 I will seed long as i can.
 Thank you seeders, thank you nosTeam, the best pirates on web! LOVE YOU"
,Majestik1,2013-03-08T01:30Z,"PROBLEMS RUNNING???
>turn OFF ""Exclusive Fullscreen"" in options when the pop up happens via 'options'
PEACE my niggaz..."
,RickyTheFish,2013-03-08T07:29Z,"I keep getting an error: incorrect function. I'm not sure what exactly that means, but I cannot get this to download. Anyone else having that same problem, or know what I can do to fix it?"
,yoyoitsevan,2013-03-08T11:56Z,"it took me a long time, sorting through a lot of bullshit to find this, so if you guys are looking for a legit trainer that works for this where you don't have to fill out a dumb survey or pay a bunch of money, there's a guy name Fling that made one and I can definitely say it works. You can find it here.. http://forum.cheatengine.org/viewtopic.php?p=5461048&sid=e3e02b4f875cb47ba2c190cc07b1e639"
,mariaats,2013-03-08T15:53Z,"Can you please help me!!!?
When I click on it and press play after a while it says something like ''A problem has caused this program to stop working''.
Does anyone know what I must do?"
,jolealien,2013-03-08T16:49Z,Does it really crash at some point and is there any way to fix that?
,RevSyn,2013-03-08T16:52Z,Fucking Leechers...
,luxy10,2013-03-08T21:31Z,"Check out my gameplay on youtube...channel name  ""Legolas4234"" enjoy :)"
,frankus01,2013-03-08T23:37Z,nosTEAM perfect! CLEAN! no viruses just like i bought it. Thanks again.
,AegisFate,2013-03-09T03:32Z,"Ok, I had the problem with ""Failed to Initialize Direct3D with current setting Options"" when pressing Play and the Options in the launcher crashed it. Basically you have to turn off ExclusiveFullScreen. Don't know where there is an option to turn that off in Windows 8. Press the windows key + R to bring up Run and run regedit. So basically, you have to go into the registry under HKEY_CURRENT_USERSoftwareCrystal DynamicsTomb Raider . There, you have to create a subkey under Tomb Raider called Graphics. In Graphics you need to create a DWORD called ExclusiveFullScreen and set it to 0. There will allow to you go pass the Play problem. People have been saying to edit the registry and find such and such values. If you can't get pass the launcher, the game doesn't create any registry values, so there is nothing to edit. After you get pass the launcher and go back to the Tomb Raider registry, you will see a whole bunch of new values there.
I just figured this fix out so bare with me on the instructions if they're not 100% clear.
Post feedback!"
,DestricteD-,2013-03-09T07:30Z,"I GOT THE SAME PROBLEM... How it fix it?

Twizted7 en 2013-03-06 00:13 CET:
I'm stuck on the Ascension level.....There's a strange glitch when I'm about jump across the windy-bridge....Lara just looks down and nothing else happens? If ANYONE has a fix for this, please post it."
,dertoko,2013-03-09T18:04Z,does this version include different audio languages?or is it english-only?
,RickyTheFish,2013-03-09T18:58Z,"Finally got the game to download... for some reason, the ""Error: Incorrect Function"" was only when I tried to download it to my D drive, but it worked fine on the C drive. Strange, considering they are partitions on the same physical drive... anyway, that's neither here nor there.

No viruses, installs and runs perfectly. After installation, a browser window is automatically opened that allows a patch to be downloaded as well. You don't HAVE to get it to run the game, but you have that option.

Thanks a bunch nosTEAM!"
,VincentXyooj,2013-03-09T20:21Z,Thanks so much for this but OMFG!!! The download time is so long aha... 
,TylerMane,2013-03-09T22:31Z,"Can you please upload the Arma III Alpha
I love all of your torrents :D"
,Perfekt409,2013-03-10T00:28Z,"I've tried patches,register file and still doing the same thing. Starts and screen comes up - no tombraider servers found - click ok but it don't go away to start the game.Running vista64 4gb mem, no steam.Any ideas?"
,RickyTheFish,2013-03-10T11:42Z,"@Perfekt409: Try installing Steam. I know it doesn't make a lot of sense, but some games need Steam installed even if they don't use it. As an example, Borderlands 2 is this way... my brother installed it and it would not run. We tried everything to get it working. He installed Steam, and it ran perfectly immediately after.

So, try installing Steam (you don't need to create an account if you don't want to) and see if that helps. Cheers!"
,Perfekt409,2013-03-10T19:09Z,"I installed Steam - no good
Disabled Windows Defender - no good
Installed on Windows 7 - same thing
Tried a lot of things but still no go.
youtube
watch
?v=BfS4f64kYSk"
,Perfekt409,2013-03-10T19:23Z,"Well this is embarrassing..
It was showing what was unlocked and each time I clicked OK it was showing something new that was unlocked.After going through them all the game starts.
Sometimes you just feel like an idiot."
,RickyTheFish,2013-03-10T20:01Z,"@Perfekt409: Oh, you mean all the DLC ingame stuff that's unlocked? Yeah, you have to click ""OK"" like 15 times, haha. It's a bit annoying, but hey, who can complain about getting a bunch of DLC, right?"
,dowialx,2013-03-10T20:20Z,"Great torrent, but the game doesn't work for me :. Anyone knows how to fix the crash at the start. I open the game, then click play. In the new window there is a black screen, and after ~5s it crashes and says ''A problem has caused this program to stop working''. I've already seen a few posts with the same problem, but I still don't know the answer. Can anyone help? :"
,tusek1,2013-03-10T22:37Z,it works ^^
,alex32571,2013-03-11T00:01Z,"Installed perfectly on Windows 7 Professional 64bit (: Saves and such work, no crashes yet. (12% into the game) How do I use the DLC? The downloadable content seems to be disabled since it can't connect to the servers because it's cracked..."
,moistedparagon,2013-03-11T02:32Z,"please upload sims2/sims3 c: 
thanks"
,dora77,2013-03-11T13:01Z,Is there Tomb of The Lost Adventurer in it?
,fkr2020,2013-03-11T20:54Z,"thanks nosTEAM
it works flawlessly
win7 on a crappy PC"
,Majnstrim,2013-03-11T22:40Z,"I have problem, please help. When i try install i have this error: CRC failed in Tomb Rader 2013bigfile.002.tiger

Help. :c"
,nosTEAM,2013-03-12T11:24Z,"@ Majnstrim :  Stop torrent ,Force Re-Check files ,Start torrent ,when is done 100% reinstall game. Some seeders sent to you damaged files."
,farawayforever,2013-03-12T23:15Z,"Hey, I really love nosTeam, but, this torrent speed is really LOW. :("
,farawayforever,2013-03-12T23:21Z,"The torrent speed is low, So, i downloaded a dlc pack: http://thepiratebay.sx/torrent/8223497/Tomb.Raider.2013.Pack-DLC , but i dont know how to install!!, help please :)"
,frankus01,2013-03-13T08:20Z,I just want to say PERFECT! I'm playing this with a 9800 gtx+ on low setting and it's never crashed and I'm 75% done.. Thanks again nosTEAM
,crywolf1001,2013-03-14T22:38Z,thx nosTEAM i'm downloading now 76% i will seeeeeeeeeeeed :)
,anonmouze,2013-03-15T05:56Z,It keeps crashing for some reason. Really annoying! Anyone fixed this?
,sayansoul,2013-03-15T10:23Z,"Alright people, i had to register only to say: SEED DAMN IT!
I'm always seeding, but why it has to have all these leechers?? why don't you guys understand, if you keep seeding, you'll help more people to get the damn game and it will be more easier to fix the problems, maybe even fix them all, with the help of everybody."
,174,2013-03-15T11:12Z,"works perfectly fine and the dlc s are great too

best work till date by nosteam

it is the best game i have seen in past 2-3 months after far cry 3. Tomb Raider 2013 is better than crysis 3 and dead space 3

requirements are also very low. crysis lagged on low settings on my pc and dead space 3 lagged on medium but TR is working with no lag even on medium

Maybe it can be the greatest competitor for goty

Thanks nosteam again you are great"
,174,2013-03-15T11:16Z,"usually torrents on my PC are downloaded at an avg speed of 55 kb/s but this time it was 10 or 20 but after some time the dwnld speed reached to 100 - 200 kb/s

This was a miracle for me and the game was downloaded in just 1 day"
,ninacrf,2013-03-15T23:56Z,@anonmouze http://crashwiki.com/tomb-raider-crashes-blackscreen-restart-options-crash-unpacking-direct3d-crash-graphics-and-textures-glitches/
,RafVne2,2013-03-16T06:11Z,"@nosTEAM
Thanks for the up. 
Even before I download it I know it will work flawlessly."
,frankus01,2013-03-16T06:15Z,"I just finished the game with no issues,never crash. Awesome job nosTEAM. "
,gtafun,2013-03-16T06:21Z,"Hey guys. I have one critical question:

How can i make VISIBLE my Stereoscopic 3d in my ""Options"" ????????????

I'm getting this ""Failed to initialize Direct3D with current settings"" message error. I've tried EVERYTHING,i've downloaded the game several times from different uploaders,but nothing.Always i get the same message.

Any help,aprecieted.

I use ATI Radeon HD 5570"
,gtafun,2013-03-16T12:16Z,*VISIBLE = CLICKABLE
,soulhudson,2013-03-16T14:48Z,I can't found game session in the multiplayer.Help please
,vela345,2013-03-17T19:49Z,"I can't save my game at all. I've tried restarting the game to see if my save is there and it just starts me anew. Does anybody know how to fix this? I even tried Skidrow's crack. 

Please help :(."
,manjifan,2013-03-18T06:26Z,could you guys please put up Skyrim ! please! 
,Jt1220,2013-03-18T10:04Z,Please SEEEEDDD!!
,exham,2013-03-18T16:54Z,"Ok everyone SORRY in advance this is such a n00b question..

After I install this...

(BY THE WAY WORKS 100% follow all directions I am playing it on ULTIMATE settings triple buffering and it looks F*@king AMAZING! SO thrilled now I definitely wont have to buy it!)

Do I need to keep the files I downloaded or can I delete or move those to external drive after I have successfully installed?

Thanks for any info!   :)"
,exham,2013-03-18T16:55Z,OH AND OF COURSE I PLAN TO SEED FIRST!!!!  At LEAST A FEW WEEKS. I am just wondering for when my hard drive starts to fill up!
,Dante83abc,2013-03-18T18:31Z,"Thx for the Game, but I have problems with installation. I don't see the part1 file. In which folder it is? 
I'm not a noob. I installed many games, but in this case I just don't see the right file."
,anthonyp1010,2013-03-19T14:45Z,i need help i start the game and the congratulations box comes up i press ok but it keeps comming back how do i fix this anyone please
,gtafun,2013-03-19T21:21Z,"Does anybody use ATI Radeon HD 5570 in here????????

Cause i still get the ""Failed to initialize Direct3D with current settings"" message error.

Do u use NVidia ALL of you????

damn!"
,dtrain84,2013-03-21T06:52Z,"using ati radeon hd 7770, ill let you know how it turns out"
,gtafun,2013-03-21T12:41Z,"@dtrain84  thanks,mate.Someone told me that if anybody use ATI radeon,can't play this game.Must wait for a patch(?)"
,euphoria4949,2013-03-21T13:50Z,"@gtafun - No that's BS, it's actually NVidia that are having problems! They wasn't given the full release in time for a optimised patch to be configured.

Just to clarify, what is the problem you're having???"
,gtafun,2013-03-21T14:57Z,"@euphoria4949 - Really? I'm having the ""Failed to initialize Direct 3D with current settings"" message error when i try to run the game(as Administrator).

I open the ""Options"" , but the ""Stereoscopic 3D"" isnn't clicable(as i mentioned before).

I tried everything from this page http://crashwiki.com/tomb-raider-crashes-blackscreen-restart-options-crash-unpacking-direct3d-crash-graphics-and-textures-glitches/

Nothing. I have installed the last patch(i think is the last) : v1.00.722.3"
,euphoria4949,2013-03-21T15:49Z,"@gtafun - OK, have you run 3D on any other games on that PC???
Also, have you checked to see if you are running the latest Catalyst???"
,gtafun,2013-03-21T16:11Z,"@euphoria4949 - I can play Skyrim with ATI 5570.

No,i don't know if i run the latest Catalyst.

Can i download it for free from somewhere?An how?

My version 3D is : 8.14.10.0708

My version Catalyst is : 2009.1019.2131.36819"
,euphoria4949,2013-03-21T17:36Z,"@gtafun - Ok, well the first thing you should do is download the latest Catalyst drivers from the AMD site, just Google AMD drivers and select your graphics card and operating system.

Secondly, when you say you can play Skyrim, do you mean in 2D or 3D???
Because what I read from that error message ""Failed to initialize 3D with current settings"" was that your card can't handle the game in 3D, i.e. maybe the setting need to be on the lowest possible to be able to run in 3D.
3D puts a massive strain on any card and with the greatest of respect, (I'm not bashing your PC), but the 5570 is a low-end budget card that is more suited to older games that don't require huge amounts of processing.
That's why I was asking if you had run a hugely complex game like Tomb Raider in 3D before on that card.

Again, I'm not slagging off your PC, I'm merely trying to offer realist help and advice."
,gtafun,2013-03-21T19:58Z,"@euphoria4949 - You seem to know a lot of this stuff,mate.Thanks for the advices.No offense (of course.

To be honest,i don't know if i run Skyrim on 2D or 3D.

I just updated my drivers and i can run the game,finally(i didn't play it though,so i can't tell you if i have any problems in the game).

So,if anybody has the same problem as me,just remember to update your drivers.

Thanks,mate,again."
,euphoria4949,2013-03-21T22:33Z,"@gtafun - No problem, happy to help."
,zongoo,2013-03-22T15:02Z,constantly crashes....anyone having a similar problem? i have a gtx 670...
,Blargh_7,2013-03-22T15:47Z,"Game work OK. (played at 47% for now)

win.7/64bit. 
AMD FX-4100
8Gb. RAM
ATI HD 6800 series
Asus Sabretoth 990fx"
,DevilRose,2013-03-22T23:31Z,"I'm having similar problems as a couple others. During the mission ""Another Fine Mess"" after i get to the Sheltered Camp Day Camp and move on towards the wind, everything's fine up until the part where you have to jump from the ledge to the part of the ""floor"" ig it is that's still attached. At that point, the camera acts as if Lara's jumping and landing, gripping with her hands, but it doesn't actually show her or anything else but the ""floor"" and the ledge. help? i saw somebody said to turn the tessalation off but it already is. could it be because i'm running in low quality all around? haven't had any problems with it till now. Please Help!"
,chancet,2013-03-23T00:22Z,"About save files:  If you mess up your save files during an update, remove your installation completely.  Also remove any instance of tomb raider from regedit (go start >> search ""regedit"" >> Press F3 >> search for ""tomb raider"" >> delete all related entries.  Now your save files should work in the game again."
,EriannMX,2013-03-23T11:43Z,"I just completed tis game (with this torrent) to a 100% I can confirm it works flawlessly (some crashes but I blame my OC card).

Before I played I installed a patch thats available at NOS Team's website so maybe try that first for those having problems.

Now if I could just play MP...."
,DevilRose,2013-03-23T21:27Z,"So i downloaded the update as said by EriannMX, but i still get the same problem. anything else i can try? i love this game so far and i don't want to uninstall it, but if that's what i have to do, then so be it."
,mamaxslater,2013-03-24T17:41Z,"i have a problem, when i click in the ""play"" buttom the game launches but the screen is black and then i got an error message in another small window sayin: could not initialize DirectInput!

can some one help me?"
,Zer0_2,2013-03-25T02:17Z,"Hey nosTEAM.........thanks for the game..........so what's up...you don't remember me do ya?? 
I am Shivansh....played Borderlands 2 with you and Nelson...remember........ ?? :D"
,stackerman,2013-03-26T02:23Z,did the install but some sectors failed need help trying to get it to work.
,xavix007,2013-03-27T08:31Z,"please I need some HELP..
After the instalation of the game ( I did all the instructions... I think ) and after the screen - play, it appears "" congratulations! you have sucessfully installed downloadable content! you unlocked.....in the coastal forest region"" then i press ok and the same screen appears again and again and again,without giving me access to main screen. pls help me asap !!!!!"
,Usseffs,2013-03-27T13:49Z,Gone half way with good download speed .. now its just SHIT IM DOWNLOADING AT 1 - 10 kb/s !!!!!!!!!!!
,kikki_hiiri,2013-03-27T15:27Z,"I suggest everyone to NOT download this torrent. The official SKIDROW -release already contains all the relevant DLC's (addons) AND you can update it with official patches when SKIDROW releases cracked versions thereof.

http://thepiratebay.sx/torrent/8218725/Tomb.Raider-SKIDROW"
,kikki_hiiri,2013-03-27T16:10Z,Also please do download the SKIDROW -released patch: http://thepiratebay.sx/torrent/8268988/Tomb.Raider.v1.0.722.3.Update-SKIDROW
,isabellaj,2013-03-27T18:48Z,"Works Great
Game's Great too ...
Thanks for Sharing."
,parc07,2013-03-29T15:15Z,"how  comes it doesn't save?There is a save when I in the game. But when I quit game and back into game, the save disappears. How comes?????"
,timmythedog,2013-03-30T00:11Z,I cant see any DLC in the menus... i've only just started game and it looks and play s awesome but in description it says there are xtras... where are they?   great torrent btw
,isabellaj,2013-03-30T03:48Z,"Work's Good,
Thanks for sharing"
,Yiani,2013-03-30T08:42Z,"hey nosteam im having a problem i downloaded this game yesterday when you click on it to run it comes up with a menu saying play game options, tomb raider web etc. and when i click play game it is a black screen then a few seconds later it says tomb raider has stopped working. what do i have to do to fix this problem and play the game? Any help or ideas would be greatly appreciated. im running it on windows vista and i have an amd turion x2 64 bit videocard"
,inksec2,2013-03-31T14:12Z,Works Great on Win8 64bit!
,kindalikethat,2013-04-05T02:40Z,Download is so slow...
,PLZdontJAILme,2013-04-05T05:22Z,"Not the most shared TombRaider, but anyway I'll use this torrent, because I trust nosTEAM"
,TCostalonga,2013-04-06T02:21Z,"Thanks for the upload!
The game works perfectly!"
,kindalikethat,2013-04-07T07:11Z,"Really, is EVERY torrent of this game this slow? I'm downloading at 40kb/s... sigh"
,Dan4u,2013-04-12T23:44Z,Not sure why some peeps are getting slow speeds - I downloaded at around 4 meg - took about 35 minutes with a 40meg (8 up) connection.
,zhertin,2013-04-13T07:36Z,"Working good so far. Thanks for this. Just one question, how can I update this version? would skidrow patches/cracks work?"
,blackmagi,2013-04-14T16:10Z,"Everytime i turn on the game window pop's out that is saying ,,error out of table range"" can somebody plss help me ? :|"
,MonK_TanG,2013-04-22T07:34Z,"What version is this ? I would like to know, as I have a variety of patches  and trainers for this game. Just not the actual game yet.... ^_^"
,MonK_TanG,2013-04-22T07:40Z,What version is this ?
,sh1g1,2013-04-24T04:04Z,seed please... 4 kbps download speed on 50 mbps connection.. seeeeeeeed D:
,Pro4208,2013-04-28T04:12Z,"Just wanted to thank the entire @nosTEAM genuinely and completely. This torrent, along with every other torrent I have used from you guys (Deus Ex, Prototype 2, Sleeping Dogs, Mass Effect 3), works flawlessly and is incredibly easy to install. 

Even though it takes a little longer to download than some of the more popular torrents (due to lack of seeders) it is more then worth it. Not having to dick around with installing DLC, blocking shit in firewalls, etc. makes your torrents the best.

Please, keep up the good work!"
,roan1430,2013-05-05T17:54Z,need seeds plz only 100 kbps
,sweden198,2013-05-12T13:17Z,1.7MB/s
,sweden198,2013-05-12T14:28Z,Very slow:( 40 kB/s :( :( :(
,beatdis,2013-05-13T13:25Z,"My game stops in the radio tower, I Cannot tune up the radio, the buttons doesn't work !! somebody with the some problem??"
,bamf001,2013-05-18T11:41Z,"idk if anyone else is having this problem, but I freeze/crash approximately 5 sec after the intro video plays (while Lara is thrashing around in the water).

It freezes then crashes with error:
""Disc error while reading file BIGFILE.002.tiger""

Any ideas/help?"
