User Type,Username,Date,Text
,fixatia,2013-03-04T17:46Z,thank you ShoReleases and RKSTR
,Mopsi1210,2013-03-04T18:24Z,Thank you! 
,mssjuly,2013-03-05T00:24Z,Thank you! :)
,wakeupscreaming,2013-03-05T03:48Z,"How am I supposed to download torrents with ""Torch"" when it's only available on Windows? I'm on a mac. Way to go PirateBay."
,M_Dudikoff,2013-05-13T15:52Z,thanks guys.. lucky i got my gf into this ATL series.  shes been hooked for 4 seasons. nuthin beats black humour.. the others bore me to tears..
