Filename,Size,Unit
PSHELL_2/Apress Pro Windows PowerShell (2008).pdf,10.36,M
PSHELL_2/Manning Learn Windows PowerShell in a Month of Lunches (2011).pdf,10.27,M
"PSHELL_2/Manning PowerShell in Depth, An Administrator's Guide (2013).pdf",17.46,M
PSHELL_2/Addison-Wesley Essential PowerShell (2008).pdf,14.89,M
PSHELL_1/Wrox Press Professional Windows PowerShell for Exchange Server 2007 Service Pack 1 (2008).pdf,19.62,M
PSHELL_1/Wrox Press Professional SQL Server 2008 Administration with Windows PowerShell (2009).pdf,7.79,M
PSHELL_1/Wrox Press Professional Windows PowerShell (2007).pdf,6.29,M
PSHELL_1/Wrox Press Professional Windows PowerShell Programming (2008).pdf,4.89,M
PSHELL_2/Manning Windows PowerShell In Action (2007).pdf,6.83,M
PSHELL_2/Manning Windows Powershell in Action 2nd (2011).pdf,13.97,M
"PSHELL_2/SAMS PowerShell for SharePoint 2010, How-to (2011).pdf",3.95,M
PSHELL_2/SAMS Windows PowerShell Unleashed (2007).pdf,2.4,M
PSHELL_2/Wiley Windows PowerShell 2 for Dummies (2009).pdf,5.62,M
PSHELL_2/Packt Publishing SQL Server 2012 with PowerShell V3 Cookbook (2012).pdf,18.61,M
PSHELL_2/Packt Publishing Microsoft Windows PowerShell 3.0 First Look (2012).pdf,6.6,M
PSHELL_2/Microsoft Press Windows PowerShell Scripting Guide (2008).pdf,17.96,M
PSHELL_2/OReilly Windows PowerShell Cookbook (2008).pdf,2.11,M
PSHELL_2/OReilly Windows PowerShell Pocket Reference (2008).pdf,579.84,K
PSHELL_1/Wrox Press Microsoft SQL Server 2008 Administration with Windows PowerShell (2009).pdf,8.7,M
PSHELL_1/Wiley Windows PowerShell 2.0 Bible (2011).pdf,17.3,M
"PSHELL_1/Microsoft Press Windows PowerShell 3.0, Step by Step (2013).pdf",14.57,M
PSHELL_1/OReilly Windows PowerShell Cookbook 2nd (2010).pdf,4.4,M
PSHELL_1/OReilly Windows PowerShell Cookbook 3rd (2013).pdf,15.37,M
"PSHELL_1/Microsoft Press Windows PowerShell 2.0, Administrator's Pocket Consultant (2009).pdf",2.5,M
PSHELL_1/Manning PowerShell in Practice (2010).pdf,23.35,M
PSHELL_1/Course Technology Microsoft Windows PowerShell Programming for the Absolute Beginner (2007).pdf,4.9,M
PSHELL_1/MCGraw-Hill Osborne PowerShell for Microsoft SharePoint 2010 Administrators (2011).pdf,4.87,M
PSHELL_1/Manning PowerShell and WMI (2012).pdf,14.86,M
PSHELL_1/OReilly Windows PowerShell Pocket Reference 2nd (2013).pdf,2.55,M
PSHELL_1/OReilly Windows PowerShell for Developers (2012).pdf,7.09,M
PSHELL_1/Sybex Automating Active Directory Administration with Windows PowerShell 2.0 (2011).pdf,6.57,M
PSHELL_1/Sybex Automating Microsoft Windows Server 2008 R2 with Windows PowerShell 2.0 (2011).pdf,14.65,M
"PSHELL_1/Wiley Microsoft PowerShell, VBScript and JScript Bible (2009).pdf",12.95,M
"PSHELL_1/Sapien Press Windows PowerShell v1.0, TFM 2nd (2007).pdf",18.82,M
PSHELL_1/Packt Publishing Windows Server 2012 Automation with PowerShell Cookbook (2013).pdf,4.81,M
PSHELL_1/Packt Publishing Instant Oracle Database and PowerShell How-to (2013).pdf,3.71,M
PSHELL_1/Packt Publishing Microsoft Exchange 2010 PowerShell Cookbook (2011).pdf,7.69,M
"PSHELL_1/Packt Publishing Microsoft SharePoint 2010 and Windows PowerShell 2.0, Expert Cookbook (2011).pdf",4.52,M
PSHELL_1/Course Technology Microsoft Windows PowerShell 2.0 Programming for the Absolute Beginner 2nd (2009).pdf,5.69,M
