User Type,Username,Date,Text
[V],HobbitWarez,2013-02-02T02:14Z,"Android Applications [02-01-13]

Aegean GO launcherEX Theme v1.0-AnDrOiD
Alloy Red Theme CM10.1 v1.0-requires CM9 CM10 CM10.1 AOKP Rom-AnDrOiD
Android Tweaker (PRO) v2.0.0 Android App
Apex Launcher Pro v1.4.3 beta 1-Android 4.0 Plus-AnDrOiD
AppLock Pro v1.61 Android App
Backpacker GPS Trails Pro v5.3.4 Android App
Beacon LED Flash notification v3.2 Android App
Boat Browser Pro v5.1 Android App
Call & Message blocker v4.2.1 Android App
Cameringo v1.2 Android App
Carbon - App Sync and Backup (Premium) v1.1.2.1-Android 4.0 Plus-AnDrOiD
Changelog Droid Premium v3.5.1 Android App
DosBox Turbo v1.5.5 Android App
exDialer and Contacts Donate v117-AnDrOiD
File Explorer Plus with Root v1.3.0-AnDrOiD
FlashLight HD LED Pro v1.49-AnDrOiD
FriendCaster Pro for Face.book v5.3-AnDrOiD
F-Stop Media Gallery Pro v2.2.1-AnDrOiD
Go!Chat for Face.book Pro v6.1-AnDrOiD
Graph Professional v1.0.7 Android App
Handy Note Pro v5.1 Android App
HD Widgets v3.8.1 Android App
Hold Screen ON - Face detection v2.6 Android App
iLauncher v2.2.3.1 Android App
IM+ Pro v6.4.6-AnDrOiD
iSense Music - 3D Music Player v1.005 + MEGA THEME PACK 1 Android App
jetAudio Plus v2.0.0-AnDrOiD
Jumpgate Live Wallpaper v1.25-AnDrOiD
KD Collage Pro v2.04 Android App
Knots 3D v3.1.0 Android App
LockerPro Lockscreen v2.7.5 Android App
Mantano Ebook Reader Premium v2.3.11 Android App
Memento Database PRO v2.1.0-AnDrOiD
meteosphere v1.0.4-Android 4.0 Plus-AnDrOiD
Mindroid v1.1.1 (Fully Unlocked) Android App
MoviesBook v3.0.8 Android App
Next Launcher 3D v1.17 Android App
Next Launcher Theme Meego v1.0-AnDrOiD
Notes on Life Pro v5.1 Android App
Notification Toggle Premium v2.6.3 Android App
Paint FX - Photo Effects Editor v1.2 Android App
Pdf to Speech Pro v12.1-AnDrOiD
Percent Calculator Pro v1.6.b.7 Android App
PocketInvEditor Pro v1.7 Android App
PPSSPP Gold v0.6.1 Android App
PrinterShare Mobile Print Premium v7.9.8-AnDrOiD
PrintHand Mobile Print Premium v2.0.5-AnDrOiD
Radardroid Pro v2.59-AnDrOiD
Real Tunes HD v1.0
Recast Weather and Widgets v1.0.10 Android App
RMoney Manager Expense Tracker v1.1 Android App
runtastic PRO v3.6 build 31-AnDrOiD
SayIt - Voice Launcher v1.1 Android App
Schedule Deluxe Plus v2.14.b Android App
Send Anywhere PRO v3.1.11 Android App
Sliding Messaging Pro v3.991-Android 4.0 Plus-AnDrOiD
Smart Distance Pro v2.1.7 Android App
Smiler v1.094 Android App
Snap Camera v1.7.1-AnDrOiD
Soccer Scores Pro - FotMob v9.1.1 Android App
SpecTrek v1.13 Android App
SuperSU v1.04 + SuperSU Pro v1.00 ROOTED DEVICES ONLY Android App
Tapatalk Forum App v2.4.11 Mod (All Colors Purchased)-AnDrOiD
Tha Icon Changer v1.0-AnDrOiD
The Pirate Bay Browser Premium v4.4-AnDrOiD
Tiles UCCW Skins v1.3-AnDrOiD
Tweetings for Twitter v2.14.11 Android App
UCCW Theme Grids And Tiles v1.1-AnDrOiD
Unity Launcher v1.2 Android App
Weather Flow Live Wallpaper v1.83-AnDrOiD
Zen Colors Sleep & Relax HD v1.0 Android App"
,SmokeShadows,2013-02-02T02:37Z,Whoo yeauh! good stuff!!
,SmokeShadows,2013-02-02T02:41Z,"omfg man you are the best, i just had to comment twice on this one, you got this android stuff in a headlock! haha holy crap man, i cant explain how awsome you are, thanks to you a million times over!"
,d4mm3rung,2013-02-02T05:10Z,"If I may suggest adding Daily Workouts by Daily Workout Apps, LLC; it'd be much appreciated. I have all the others like AB, BUTT, LEG, ARM, and CARDIO but the Daily Workouts combines them all into one. :) "
,limeyguy33,2013-02-02T06:43Z,Thank you very much.
[V],blaze69,2013-02-02T14:59Z,Thank U Soo Very Much and Keep up The Great Work. Ur Uploads Are Very Much Appreciated :)
,Bloksee,2013-02-04T15:13Z,"Thank you HobbitWarez, your Android packs are a dream come true, mobile software nirvana. Stay a pirate for a while longer, pleeeease!"
,spastik80,2013-02-05T02:15Z,Yet another awesome pack of apps! Would it be possible to get Aqua Mail Pro?
