Filename,Size,Unit
Three Sisters - Susan Mallery.mobi,580.9,K
Three Sisters - Susan Mallery.jpg,46.65,K
Three Sisters - Susan Mallery.opf,4.87,K
Downloaded and Tracked/Torrent Download From SilverTorrent.org.txt,89,B
Downloaded and Tracked/Facebook And Twitter.txt,75,B
Downloaded and Tracked/Torrent Downloaded From ExtraTorrent.com.txt,46,B
Downloaded and Tracked/Torrent downloaded from P2PDL.com.txt,33,B
Downloaded and Tracked/Torrent downloaded from Kat.ph.txt,30,B
Downloaded and Tracked/STPicz.com Free Image Hosting.txt,29,B
