Filename,Size,Unit
South Park S12E01 Tonsil Trouble.mkv,49.8,M
South Park S12E02 Britney's New Look.mkv,49.83,M
South Park S12E03 Major Boobage.mkv,49.83,M
South Park S12E04 Canada On Strike.mkv,49.89,M
South Park S12E05 Eek! A Penis!.mkv,49.81,M
South Park S12E06 Super Logging.mkv,49.76,M
South Park S12E07 Super Fun Time.mkv,49.75,M
South Park S12E08 The China Probrem.mkv,49.86,M
South Park S12E09 Breast Cancer Show Ever.mkv,49.89,M
South Park S12E10 Pandemic.mkv,49.83,M
South Park S12E11 Pandemic 2 The Startling.mkv,49.89,M
South Park S12E12 About Last Night.mkv,49.85,M
South Park S12E13 Elementary School Musical.mkv,49.88,M
South Park S12E14 The Ungroundable.mkv,49.78,M
