Filename,Size,Unit
South Park S09E01 Mr  Garrison's Fancy New Vagina.mkv,49.47,M
"South Park S09E02 Die Hippie, Die.mkv",49.51,M
South Park S09E03 Wing.mkv,49.6,M
South Park S09E04 Best Friends Forever.mkv,49.59,M
South Park S09E05 The Losing Edge.mkv,49.53,M
South Park S09E06 The Death of Eric Cartman.mkv,49.49,M
South Park S09E07 Erection Day.mkv,49.5,M
South Park S09E08 Two Days Before the Day After Tomorrow.mkv,49.56,M
South Park S09E09 Marjorine.mkv,49.6,M
South Park S09E10 Follow That Egg.mkv,49.58,M
South Park S09E11 Ginger Kids.mkv,49.57,M
South Park S09E12 Trapped in the Closet.mkv,49.56,M
South Park S09E13 Free Willzyx.mkv,49.51,M
South Park S09E14 Bloody Mary.mkv,49.56,M
