Filename,Size,Unit
A Paul  Last Supper.avi,824.53,M
Xtras/Signs of the Times/African Children Paralyzed After Receiving Vaccine.avi,269.24,M
Xtras/SIN-ister Clips/American Public is Treated as An Enemy of the State - Daniel Ellsberg on tyranny and the NDAA.avi,252.08,M
Xtras/Signs of the Times/2013 IS STRANGE Part 1 JAN FEB.avi,158.7,M
Xtras/The Holy Spirit/REBUILDING THE TEMPLE REVISITED Guest  Jimmy DeYoung (2).flv,146.75,M
Xtras/SIN-ister Clips/CISPA cyber bill resurrected in Congress.avi,136.72,M
Xtras/SIN-ister Clips/Anti-drone clothing to hide from Big Brother.avi,131.67,M
Xtras/SIN-ister Clips/Beware of the Ides Of March_ Its going to be bad_ very bad Govt Automatic Cuts.avi,125.91,M
Xtras/Signs of the Times/2_2_13 Multiple 6+ Mag EQs within week.avi,116.29,M
Xtras/Signs of the Times/2_8_13  EQ Update ANOTHER 7.0 Mag - Soloman Islands.avi,111.09,M
Xtras/War and Rumors of Wars/Unmanned Attack Fighter Jets Tested in Virginia Technology Race With China.mp4,96.75,M
Xtras/Signs of the Times/BREAKING DISCLOSURE OF GIANT UFO DISCOVERED IN GREENLAND 01_13_13.avi,87.67,M
Xtras/The Holy Spirit/The Bible  Isaiah.mp4,77.28,M
Xtras/Signs of the Times/10 Real-Life Animal Superpowers.avi,76.12,M
Xtras/The Holy Spirit/Glory in the Highest - Chris Tomlin .mp4,76.05,M
Xtras/Martyrs of Today/Rich Pastor_ Poor Pastor - Persecution in the Gate.avi,73.82,M
Xtras/Signs of the Times/27 foods you should never buy again.avi,55.1,M
Xtras/The Holy Spirit/SHOCKING Testimony of Heaven Hell and Angels by Nigerian Pastor.flv,53.36,M
Xtras/War and Rumors of Wars/The Final Prophecies Extended Trailer.mp4,52.99,M
Xtras/SIN-ister Clips/Avoid Doctors to Protect Your Health.avi,51.95,M
Xtras/The Holy Spirit/Gods Ten Commandments - Philip Klevmoen On NZONE.avi,50.88,M
Xtras/Signs of the Times/6.8 EQ Hits Chile  Volcano Activity - Mt St Helens Oregon_ Mt Fuji_1_30_13.avi,42.8,M
Xtras/Signs of the Times/Algerian HOSTAGES KILLED in FAILED rescue MISSION Mali WAR retaliation.avi,42.48,M
Xtras/SIN-ister Clips/Another MK-Ultra Assassination of _American Sniper.avi,41.04,M
Xtras/Signs of the Times/93pct Of All New Income Went To The Top 1pct_ Bernie Sanders.avi,41.04,M
Xtras/SIN-ister Clips/Barack Obama is a 32rd degree Prince Hall Freemason.mp4,38.61,M
Xtras/The Holy Spirit/How He Loves Us by David Crowder Band.avi,38.21,M
Xtras/SIN-ister Clips/Booming Sounds in Missouri Ozarks warning of coming earthquake on New Madrid Fault_.avi,35.85,M
Xtras/SIN-ister Clips/Bird populations being poisoned.avi,34.54,M
Xtras/Signs of the Times/8.0 Santa Cruz Islands EQ  Six 6.0 or Greater_ Over Fifty 5.0 or Greater Since  2_6_13.avi,31.89,M
Xtras/The Holy Spirit/Kari Jobe - Steady My Heart.mp4,31.16,M
Xtras/SIN-ister Clips/Busted - Cops Caught Beating a Tazed_ Cuffed Man in  Bridgeport CT     Jan2013.avi,29.54,M
Xtras/Signs of the Times/5.1 Nevada EQ Swarm Extinction Level Supervolcano in Pacific.avi,29.48,M
Xtras/SIN-ister Clips/Algeria HOSTAGE CRISIS ended with 23 CAPTIVE_ 32 ISLAMIST MILITANTS confirmed DEAD MALI RETALIATION.avi,27.73,M
Xtras/The Holy Spirit/Robots and increase in knowledge a last days sign2.flv,24.65,M
Xtras/The Holy Spirit/Stop Trying to Save Yourself - Kevin Williams.flv,21.13,M
Xtras/SIN-ister Clips/At Least 35 People Killed In Attack On Pakistan Army Checkpoint.avi,16.27,M
Xtras/The Holy Spirit/Revelation 6 6 is coming fast.flv,15.47,M
Xtras/Signs of the Times/A Sign__ Popes Dove of Peace Almost Killed but Survives - Watch the Signs.avi,13.55,M
Xtras/SIN-ister Clips/American Pastor Saeed Imprisoned in Iran.flv,12.33,M
Xtras/The Holy Spirit/Give Thanks.flv,11.86,M
Xtras/The Holy Spirit/Aaron Shust - Risen Today.avi,11.7,M
Xtras/The Holy Spirit/Casting Crowns - Praise you in this storm2.flv,11.68,M
Xtras/Signs of the Times/Alert - Chris Dorner 1st Human Tracked by Drone on US Soil.avi,9.47,M
Xtras/The Holy Spirit/Glorious Day (Living He loved me) Casting Crowns.flv,8.81,M
Xtras/Martyrs of Today/SOMALIA ISLAMIC EXTREMISTS BEHEADED A YOUNG CHRISTIAN MAN.avi,5.57,M
Xtras/SIN-ister Clips/Alien-Like Skulls Found During Mexico Dig.avi,2.45,M
Build a church.odt,24.08,K
POtHS - Why We Do What We Do.txt,7.89,K
Torrent downloaded from Conspiracyhub.com.txt,47,B
