User Type,Username,Date,Text
,2dvs4u2cme,2013-05-30T22:10Z,PLS SEED!!!!!!!!!!??????? I have half the DL please seed I will seed back 
,2dvs4u2cme,2013-06-04T03:02Z,"seed pls I have 97 percent done pls pls 
and thanks for the upload too many thanks but pls seed "
,2dvs4u2cme,2013-06-04T03:03Z,I am taking this test in a month and need to the best I can 
,2dvs4u2cme,2013-06-12T14:20Z,pls seeeeeeeeeeeeeeeeeeeeeeeeeeeeeeeeeeeeeeeeeeeeeeeeeeeeeeeeeeeeeeeeeeeeeeeeeeeeeeeeeeeeeeeeeeeeeeeeeeeeeeeeeeeeeeeeeeeeeeeeeeeeeeeeeeeeeeeeeeeeeeeeeeeeeeeeeeeeeeeeeeeeeeeeeeeeeeeeeeeeeeeed 
