User Type,Username,Date,Text
,MrCh0,2013-02-21T06:29Z,what is this? 0days?
,MrCh0,2013-02-21T06:29Z,"forget it, I see."
,comixscholar,2013-02-21T06:50Z,"No, but by the same uploader/organizer. As far as I know it's a collection of random comics that are NOT 0-day issues, i.e. not from the day in the title. I see it as a grab bag. "
[V],STFmaryville,2013-02-21T13:00Z,"Hitlist week includes everything the scanning groups released this week that wasn't a new comic. in other words, all the new scans of back issues."
,MrCh0,2013-02-21T16:27Z,Thanks for clarifying that mate.
