Filename,Size,Unit
The Love That I Crave (Strategy's Strata Club).flac,38.94,M
Hey Boy (DJ Alan Fortarte).flac,38.71,M
Hock It (YACHT feat. Claire L. Evans).flac,23.92,M
The Sky Opened Wide Like the Tide (Lucky Dragons New Age Powermix).flac,21.81,M
''Come on Petunia''.flac,21.4,M
Hey Hey Hey Boy (K Maricich).flac,17.36,M
Hey Boy.flac,16.48,M
The Love That I Crave.flac,16.27,M
The Sky Opened Wide Like the Tide.flac,15.67,M
Knowing the Things That I Know.flac,15.56,M
Rock It.flac,12.38,M
We are Over Here (Lucky Dragons).flac,9.52,M
Let's Play Boys Chase Girls.flac,4.91,M
Begin Remix.flac,183.55,K
folder.jpg,36.7,K
