User Type,Username,Date,Text
,jwwirth,2013-02-05T23:01Z,"Password protected?!

It is well known that there is no need to archive videos."
,A.Prime,2013-02-06T05:56Z,Bull shit... don't waste your time downloading this...
,shwingy,2013-02-20T01:45Z,"went through the bogus steps to get the password, it is ""hunger"" checked all the files, it is legit"
,sybar90,2013-03-03T10:51Z,"Hey can somebody please create a torrent with only the:

Schweser CFA 2013 Level 1 Practice Exams, Mock Exams and Secret Sauce.

Not the entire package this is the only content I still need"
,ahahchew,2013-03-03T17:41Z,The video jumps from 35 to 38.. so meaning there is a missing of 36 and 37?
,ahahchew,2013-03-03T17:45Z,My video seems to not be moving.. Just people talking.. anything that I can do about?
,kartik21,2013-04-21T23:21Z,"LEGIT , PASSWORD : hunger
"
,stillingle,2013-05-26T12:06Z,"What a fucking DOUCHE NOZZLE. You need to get kicked out and put on your ass for being suck a prick. Either you share files or you do not share files, but don;t make people jump through hoops to get something. Go fuck yourself, just like your other torrent you fucking jackass..."
,stillingle,2013-05-26T12:08Z,"What a fucking DOUCHE NOZZLE. You need to get kicked out and put on your ass for being suck a prick. Either you share files or you do not share files, but don;t make people jump through hoops to get something. Go fuck yourself, just like your other torrent you fucking jackass...
"
