User Type,Username,Date,Text
,johyyny,2013-01-13T18:34Z,"Many thanks again for all these great comics you've been sharing/scanning/translating :)

Do you have copies of corto maltese in english? Or, if they're not available, do you know of any scanlation project of Pratt's works? They're very hard to find in english

Until now, I've only found these:
The Early Years 
Fable of Venice
Ballad of the Salt Sea"
[T],data9724,2013-01-13T22:32Z,"Sorry, but thats about all thats out in scanned format. "
,Triscar,2013-01-19T01:07Z,"Please help , several stuck at 96.6 % since the very beginning. Nice releases. Thanks."
[T],data9724,2013-01-19T11:17Z,"There are 15 seeders of this at the moment. All i can do are to tell you to keep trying, or check if you got issues on your end."
,Triscar,2013-01-19T15:55Z,Done.Thaaaanks!!.
