User Type,Username,Date,Text
,Dimmis80,2013-03-06T02:37Z,"First to post again.It does not mater i suppose..Anyways MsFenmore girly thanks a lot for the first episode of this week bold and have a great week whatever u like it.Cheers.;-)Btw i don't like Erick with Taylor.Christ what a joke..And i don't think it will have a good end especialy for big Erick.Brooke may have a point there for Taylor.We will see.!But i still i dont like it and i think it does not fit from my point of view.Later guys.

PS:Ricky boy grow up dude.!!!LOLLLLL"
,leasine,2013-03-06T03:28Z,Thank you Ms Fenmore!
,Fleetgang,2013-03-06T07:17Z,"Thanks, have a great week!"
,disneydreams,2013-03-06T19:57Z,thanks msfenmore
,disneydreams,2013-03-06T19:58Z,I agree with Dimmis80 i dont like taylor with eric either. and i am so tired of her saying all the time her family never gets anything. I think that she is out to try and take the company away so her family can win it. 
