User Type,Username,Date,Text
,.kai.,2013-03-07T07:43Z,the password for the sd data is 'krulez'
,stevephp,2013-03-07T08:12Z,"why put this in a rar file, then password it whatsthe point."
,.kai.,2013-03-07T08:19Z,Sorry @stevephp ....forgot to remove the password.....
,.kai.,2013-03-07T10:40Z,seed please....
,samljer,2013-03-11T06:22Z,"an amazing game from ""Maxis""

ea is only the publisher."
,L00king4,2013-04-25T00:42Z,Why dont you seed? 51 Mb is like 10 min of seeding on slow nett
,L00king4,2013-05-15T20:11Z,"Got the download today. Password ""krulez"" is right, and game start. Just put the ""com.eamobile.sims3_row_qwf"" folder in  ""Android/data""

Bad news: The game is in Chinese, and I dont know how, or if you can change language.

Anyone knows how?"
,.kai.,2013-05-18T18:02Z,If U Know a Little Trick in gaming....u can change the language easily
