Filename,Size,Unit
Build a church.odt,24.08,K
Jacob and Joseph/Jacob and Joseph.avi,1.42,G
Jacob and Joseph/Jacob and Joseph.jpg,18.32,K
Jacob/Jacob.avi,904.64,M
Jacob/Jacob.jpg,14.06,K
Joseph/Joseph.avi,1.75,G
Joseph/Joseph.jpg,127.35,K
Marriage Supper.pdf,609.98,K
Torrent downloaded from Conspiracyhub.com.txt,47,B
Xtras/Martyrs of Today/6 Million Muslims convert to Christianity - Al-Jazeerah.flv,11.78,M
Xtras/Martyrs of Today/Martyrs - Jovan Mackenzy Feat Tony from Hazakim and Evangel.flv,7.51,M
Xtras/Martyrs of Today/PERSECUTION  Jews in Egypt feel UNWANTED   THREATENED in post REVOLUTION Cairo.flv,13.26,M
Xtras/Signs of the Times/$2.3 Million NYC Public Bathroom Questioned.flv,7.26,M
Xtras/Signs of the Times/7 Companies caught spying on People Bedrooms using webcams.flv,43.69,M
Xtras/Signs of the Times/9 29 12 Brightest Comet in History Coming Soon.flv,6.77,M
Xtras/Signs of the Times/Ancient Evidence Of Mars Stream Bed Found.flv,2.37,M
Xtras/Signs of the Times/Arab Spring  Demorcracy.flv,13.59,M
Xtras/Signs of the Times/Assange to UN  US trying to build Regime of Secrecy.flv,86.61,M
Xtras/Signs of the Times/BREAKING RUSSIAN TROOPS HERE ON US SOIL.flv,13.57,M
Xtras/Signs of the Times/California Passes Law Allowing Autonomous Cars.flv,12.77,M
Xtras/Signs of the Times/Communists Vs Gods and Buddhas.flv,7.06,M
Xtras/Signs of the Times/Crystal Skulls - AA Debunked.flv,67.42,M
Xtras/Signs of the Times/Elongated Skulls Shock American Physician.flv,10.2,M
Xtras/Signs of the Times/Ezekiel's Wheel's - AA Debunked.flv,71.98,M
Xtras/Signs of the Times/Greek Rally Turns Violent In Athens.flv,8.74,M
Xtras/SIN-ister Clips/False Flags  the American Interest.flv,70.72,M
Xtras/SIN-ister Clips/Greece remedy tortures people more than disease.flv,22.89,M
Xtras/SIN-ister Clips/Information Wants To Be Free.flv,26.5,M
Xtras/SIN-ister Clips/Iran Mahmoud Ahmadinejad call for NWO 9-26-12.flv,9.73,M
Xtras/SIN-ister Clips/Jews in Egypt feel PERSECUTED in post REVOLUTION Cairo.flv,13.26,M
Xtras/SIN-ister Clips/Madrid RIOT police CLASH with Protesters.flv,11.82,M
Xtras/SIN-ister Clips/Mass Chemist Faked Results.flv,5.48,M
Xtras/SIN-ister Clips/Mind Your Mind.flv,17.41,M
Xtras/SIN-ister Clips/Morning-After Pills Given At NYC Schools No Parental Permission.flv,15.19,M
Xtras/SIN-ister Clips/NASA Archives Alien Anomalies caught on film.flv,52.52,M
Xtras/SIN-ister Clips/NYC Parent This Is More Than A Condom.flv,6.2,M
Xtras/SIN-ister Clips/Obama - Lenin in a nutshell.flv,4.81,M
Xtras/SIN-ister Clips/Obama the FreeMason - The Head wound of the bible.avi,357.62,M
Xtras/SIN-ister Clips/Painkillers kill more Americans than Heroin Cocaine Combined.flv,22.16,M
Xtras/SIN-ister Clips/Pentagon developing Submarine Drones.avi,7.32,M
Xtras/SIN-ister Clips/Physicists Expects Aliens.flv,2.93,M
Xtras/SIN-ister Clips/PITN_ Singularity Transhumanism Zombie Apocalypse.mp4,98.95,M
Xtras/SIN-ister Clips/Psychiatry  Man Redefined.flv,42.3,M
Xtras/SIN-ister Clips/US Govt Experiments on US Citizens.flv,23.86,M
Xtras/The Holy Spirit/7 Trumpets of Revelation   Trailer.mp4,14.95,M
Xtras/The Holy Spirit/A Call to Anguish by David Wilkerson - Pt 2.flv,6.34,M
Xtras/The Holy Spirit/A Lying Wonder Gary C Price.flv,38.62,M
Xtras/The Holy Spirit/A Miracle -Love the Law of Elohim Your Creator & Live Free Under His Blessings.mp4,66.89,M
Xtras/The Holy Spirit/A Muslim Student Challenges Ravi Zacharias (3).flv,19.05,M
Xtras/The Holy Spirit/AFTV China Commercial Low Quality.flv,5.17,M
Xtras/The Holy Spirit/ALL CHRISTIAN YOUTUBE CHANNELS - IMPORTANT WARNING MESSAGE.flv,32.99,M
Xtras/The Holy Spirit/Casting Crown- Already There w LYRICS.mp4,35.8,M
Xtras/The Holy Spirit/Katalys Crew - Dont cast your pearls before swine.flv,32.55,M
Xtras/The Holy Spirit/Newworldson - Learning to Be the Light.flv,11.65,M
Xtras/The Holy Spirit/NUNCA ANDARAS SOLO - You'll Never Walk Alone.mp4,44.62,M
Xtras/The Holy Spirit/Open the Eyes of my Heart Lord w lyrics.flv,11.86,M
Xtras/The Holy Spirit/Revelation Song - Phillips Craig   Dean.flv,16.14,M
Xtras/The Holy Spirit/Starfield - Son of God - Instrumental w lyrics.flv,11.37,M
Xtras/War and Rumors of Wars/Collaboration and Resistance in Nazi Europe - What police states are afraid of.flv,22.29,M
Xtras/War and Rumors of Wars/Truthers  Some Libyan people what you to know something 9-13-12.flv,13.54,M
Xtras/War and Rumors of Wars/UFO Firing Laser Beam Across Another Object SOHO C3 NASA 2012-05-16.mp4,57.43,M
