User Type,Username,Date,Text
,stmux,2013-05-04T00:12Z,"Don't bother downloading.  Just another cock sucker piece of shit trying to make money by password protecting uploaded files.
mux"
,stmux,2013-05-04T01:14Z,Password protected.  Asshole!
,axeinc,2013-05-04T09:51Z,Fucking password asshole blacklist the dickhead
,axeinc,2013-05-04T09:51Z,A fucking dickhead blackliste the asshole
,sels2005j,2013-05-08T08:37Z,"don't worry about password. The password is [xas] without [].
"
,widdywool,2013-05-09T14:36Z,XAS does not work.do not waste your time. there should be some way to keep Mr. Dickhead from wasting everyone's time
,widdywool,2013-05-09T14:39Z,XAS does not work.do not waste your time. There should be some way to keep Mr. Dickhead from wasting everyone's time
