User Type,Username,Date,Text
,Firemeter007,2013-03-31T17:42Z,@thenoobish Well thank you so much!!! Its the 4th copy I'm downloading... All the rest said region free but was pal/ntsc-U... 
,jory4u2nv,2013-04-01T02:27Z,"Thank you so much for this thenoobish!!! I don't know if my comment on one of your uploads was the reason why you uploaded this, but really, you're the man!"
,jory4u2nv,2013-04-01T04:23Z,Now if only we can get this seeded? I've been downloading for 2 hours and so far I got 2.85MB at 459b/sec. Can somebody help please? Thanks again BTW thenoobish!
,galaxybay,2013-04-10T08:17Z,im stuck at 98.8% ... 
,lokolokomo,2013-04-14T16:06Z,"Can you upload more ntsc-j games,Thanks You thenoobish and Jessica."
,BlueskyOO,2013-05-27T01:04Z,Could you seed please!!
