User Type,Username,Date,Text
[V],psspss,2013-05-03T05:18Z,"note I wont be doing best ink any more as afgs
doing them

unless they miss one"
,Gingasnapz,2013-05-03T06:24Z,can u get the new show  THE PRS BUREAU
[V],psspss,2013-05-03T06:28Z,ok 20 have it.. leaving yas to it
[V],psspss,2013-05-03T06:30Z,probably.. I have like 7 other paranormal web series to add yet.. but I just dont have the bandwidth to grab them all and share.. I have less then 2gb a day limit now until it resets in 17 days
[V],psspss,2013-05-03T06:44Z,"sounds like Ryan is a gonna then.. 
http://www.twisted-news.com/tag/the-prs-bureau/

also seems like American ghost hunter AGH that only make stuff available via a paid subscription

this paranormal state new group wont be releasing stuff freely so I prob wont find much of their investigations..

arr money corrupts huh.. 

have you a link to the stuff you want from it?"
[V],psspss,2013-05-03T13:21Z,"this is one of the many groups I was going to add
seems et has beaten me with this one
but i think they have a season 2 episodes up too

its not xvids though so may not play on a few devices

http://thepiratebay.sx/torrent/8434009/Resident.Undead.Paranormal.Season.1.Complete.WEB.x264#filelistContainer"
[V],psspss,2013-05-04T06:41Z,"

you might like the fun trader dealer auction shows
called lord of war.. its looks ok.. not watched it myself and have mp4s of it 200to270mb each

theres 16 episodes all up"
[V],psspss,2013-05-04T06:41Z,thats gun not fun :)
[V],psspss,2013-05-04T06:43Z,"
i see thers a Series called da vincis demons

which is a biodrama of him looks interesting

although previewing it has a feel of game of thrones :)"
