User Type,Username,Date,Text
,johntay29,2013-06-17T19:23Z,yep teen about 10 years ago.
,zakimar5,2013-06-17T23:40Z,"OINK!

And if the waist isn't small, the boobs are fat, not huge."
,expressfile,2013-06-18T01:46Z,"Ok guys, Mature lady with fat boobs :) is that ok ? :)"
,mustafa-crap,2013-06-18T05:16Z," expressfil
""Ok guys, Mature lady with fat boobs :) is that ok ? :)""

No not OK because you tell fucking lies."
,wetWeasel,2013-06-18T08:43Z,"oh fuck it, I'd do her. Hell, I'd do her mother. Why so picky guys? it's not like you're paying for these pictures, or that it's likely you'll take home anything better from your local bar."
