User Type,Username,Date,Text
,papayrus,2013-04-25T15:44Z,HAHAHAHAHAHAHAHA You lose again. You know why? Because your a loser just like hollywood and pipa has become MAJOR LOSERS.
,rafiklouis7,2013-04-25T19:56Z,"Fake as the latest 3 episodes (21, 22, 23) are still pending

Check http://www.imdb.com/title/tt0898266/episodes?season=6&ref_=tt_eps_sn_6"
,schlaBAM,2013-04-26T01:44Z,"@rafiklouis7: Read closer. it specifically says S02E23, this is not season 6. derp."
,philipo,2013-04-27T23:31Z,"The... hell... Pleas read before weed xP
Yeah its season 2 !"
