User Type,Username,Date,Text
,brtrgy,2013-02-17T22:13Z,"Thank you so much for my rugby fix, just brilliant!"
,Josh-rko,2013-02-18T02:03Z,Thanks heaps for this as I don't have Sky and I work night shift so your downloads come in real handy for when I need to catch up. Cheers
,Oileiyeah,2013-02-18T07:52Z,"as always, you're my go to man for rugby! thank you shemyaza"
,cactusjack666,2013-02-20T01:53Z,thanks dude keep the rugby coming
,matiop26,2013-02-24T22:28Z,Thanks! Hope you will have week 2 for us its my only chance to watch it.
