User Type,Username,Date,Text
,Garyhall,2013-05-09T01:37Z,"Your the best YIFY!

Thanks"
,andyfukinj,2013-05-09T09:06Z,"Since all these fool spammers were talking shit on YIFY's uploads  ( My personal favorite uploader of good stolen movies) , I thought I would let everyone on here know there is actually a YIFY website out there you can download from. "
,Mazinati,2013-05-13T01:47Z,The movie is bugged. No sound at all... -.-
,Ranger97bc,2013-05-26T20:10Z,"Looks Good & I have sound, so Mazinati it must be your problem. Thanks Yify"
