User Type,Username,Date,Text
,linkchaos,2013-04-09T20:11Z,"Failed to load SteamUI.dll

did i do something wrong?"
,criticalmass5,2013-04-14T12:35Z,"i tried to install all the games in the library but every single one says: ""an error occurred while trying to install game (no licenses)""  dont know if i did something wrong, i followed what you wrote. so as of now i say this don't work."
,graves26,2013-04-23T02:00Z,none of the games work  because we have no license 
,mmd123,2013-05-01T16:29Z,...yea...this so doesnt work...it still requires a payment for EVERYTHING...
