User Type,Username,Date,Text
,JN444,2013-03-02T08:44Z,Why would anyone listen to this shit head
,pjones452,2013-03-02T08:46Z,your kidding right? He's the greatest talk show host in the world asshole check his ratings.
,pjones452,2013-03-02T09:08Z,no seeds brother but thanks!
[V],CAPTAIN7SS,2013-03-02T09:52Z,savage is a brilliant new yorker...his technique is very new york....fast...witty...multi-pointed....and probably over your head
,cancab,2013-03-02T11:10Z,"thanks again cap
JN444 you just keep drinking the koolaide
along with the other sheepople"
,Gabri77,2013-03-02T14:08Z,Thanks Cap!
