User Type,Username,Date,Text
[V],sujaidr,2013-04-09T19:21Z,i dont have a seed box so i'll provide maximum initial seeding but for the torrent to be alive please seed back too :-) ENJOY
,LKschwag,2013-04-13T01:13Z,"Thanks.. Works great.

A:10
V:10"
,HammyFag,2013-04-25T01:00Z,"Works great on VLC, nice movie too! Seeding!"
,giorgio470,2013-05-12T07:34Z,Great quality! Thanks much!
,seteva,2013-05-16T14:21Z,"Will this copy work if I copy to a DVD? Is there a block on it?  BTW, thanks :)"
,ses123,2013-06-01T02:39Z,"love your work. You are awesome, these movie torrents are fantastic quality, cheers"
