User Type,Username,Date,Text
,chpez,2013-06-13T17:56Z,"COOl et MERCI Anonymous , mais tu as oublié les épisodes 2 et 3 de V.T.Liberator (°_^) .

Si ça serai possible de les postés , ce serai GÉNIAL (^_^) . "
,NothingElseToSay,2013-06-13T18:34Z,"J'ai fais ce que j'ai pu mais impossible de les trouves à l'heure actuelle, dés que je les ai je les envoie."
,chpez,2013-06-13T20:29Z,"DAC , j'ai pensé que c'était un oublie (^_^) .

Et encore MERCI , si tu as d'autre série , n’hésite pas (°_^) (^0^) . "
