User Type,Username,Date,Text
[V],zyx55e,2013-02-03T16:57Z,"guyz, kamal hasan is almost broke by producing dis film. if it dosent sell he'll hv to sell even his house to repay his debtors. plus the courts hv stayed the rls of dis film too.

the least v can do to help him is not circulate this 1 on the forums/net so dat folks go to the theatre n pay for wotchin it so dat he gets back his investment.

V need to sacrifice dis much for such a talented actor/producer/director .

SaM bro M sure u'll understand n appreciate the facts."
,pro346pro,2013-02-04T03:18Z,^^this the pirate bay go away^^ I'm going to add this to my seed box so no one has to pay to watch it 
