User Type,Username,Date,Text
[V],psspss,2013-03-10T09:34Z,"http://thepiratebay.sx/torrent/8238497/My_Ghost_Story_S06E03_Sanford_School_Sprits_HDTV_XviD-AFG


I wont add my converted of this series but heres next episode up by legend"
[V],psspss,2013-03-10T13:07Z,"josh gates talks about all the shows hes in and destin truth and stuff you dont get to hear in
the 

 Coast_To_CoastAM_04-March-2013_Paranormal_Expeditions_2hr31min.xvid.avi
"
,SerSpec-V,2013-03-10T23:23Z,Where is Spacing Out?
[V],psspss,2013-03-11T03:39Z,"openminds is there

they arent adding the spacing out liek they said 

just they too vusy havign fun and interviewing at the congress to sit down and edit and add new spacing outs anyhow they only adding the days of congress spacing out specials for now"
,bigjim1102,2013-03-11T18:27Z,"Cheers, psspss!"
[V],psspss,2013-03-12T01:03Z,"opps a few typos again.. was in a rush to answer and leave the house that day LOL

this is the only site you cant edit comments LOL"
[V],psspss,2013-03-12T12:32Z,"the dreams one I thought would of been good but the host is total religio nut and the guest and all they talk about.. relating it to goddy sh1t oh well

seems the better c2cam seem to come 2010 onwards some shows very good and some just rubbish"
