User Type,Username,Date,Text
,Rosapanten,2013-03-13T19:45Z,"I use VLC, but don't work.
Please help."
,philipo,2013-03-15T11:45Z,Me too. Cant open either in vlc or with deamon tools or handbrake!
,uni_soul,2013-03-16T07:02Z,"---------------- DO YOU HAVE THIS ??? ---------------------
 Hey bro, i am looking for a porn movie that was posted somewhere in the last quarter of 2012. I had downloaded it but lost it somewhere, it was posted again sometime in Feb-2013 but i didn't download, i was under an impression that i have it... unfortunately i lost it. I don't know the porn actress's name.

 ---- FEATURES....
 So here's what it contains... There is a lady leaning against the wall (scene is shot outside).. she's wearing brown sun shades... and some kind of transparent top that are thigh length (brown color)... right at the beginning of the"
,FanPIX,2013-03-24T22:23Z,"Did'nt work 4me either, even maked an new iso of  it... :("
