User Type,Username,Date,Text
,tomix16,2013-06-18T12:41Z,"Une fois le tout télécharger, on procède comme ceci !!

- Installez le fichier SimCity 5 à la racine de votre disque dur, en générale c'est C:
- Renomez le dossier en SimCity
- Allez dans le dossier SimCity que vous venez de renommez et continuez dans Extra, double clic sur le fichier Electronic Arts, Inc CA.crt (dossier Extra )et certifier le fichier , faire Placer les certificats dans le magasin suivant , et sélectionne Autorité de certification racines de confiance.
- Toujours dans le dossier Extra, on trouve un fichier Host, ouvrez le avec notepad ou bloc note et copié ce qui il a dedans, on peux très bien faire un copié de ce fichier et ecrasez l'autre mais pour ceux qui ont déjà inscrit des adresses dedans cela permet de les conserver !! donc allez ensuite ICI C:Windows, System32, Drivers, Etc et ouvrez toujours le fichier host avec notepad ou bloc note et copiez les adresses à la suite des autres !!
- Pour ceux qui ont skype, on peux desactiver les ports 80 et 443 en allant tout simplement dans Outils, Options, Avancées, Connexion et là on décoche et on relance son skype !!
- Copiez les fichiers que vous avez téléchargé sur le patch 1.5 et coller les dans le dossier SimCity.
- Faites un clic droit sur le dossier SimCity et faites propriété et décocher lecture seul, il va vous demander si vous voulez l'appliquer aux dossiers et fichiers de ce dossiers faites oui, faites le également pour le dossier Origin Games qui se trouve dans C: Programmes ou Program Files, Origin Games. 
- Ensuite retourner dans le dossier SimCity et lancez le start.exe, logiquement sa devrait fonctionner, au cas ou, faire stop et relancer le start server.
- Dans le dossier SimCity, allez dans le dossier Extra et lancez l'installation de OriginSetup_9.1.15.109.exe
- Entrez dans origin et identifiez-vous avec l'ID : 3dmgame@3dmgame.com    .....      Mot de passe : 3dmgame
- Si tout va bien une page pour nom de SimCity DRMLESS server beta devrait apparaitre.
- Entrez dans boutique,Mes jeux pour voir simcity et faites télécharger en sélectionnant pour langue le français.
- Laissez le jeu se télécharger et jouer.
* Au cas si vous avez l'erreur Tampered, cliquez sur activate dans le start server et relancez le jeu !!! *"
,savvapn,2013-06-18T13:11Z,My Origin says that im offline please help!
,savvapn,2013-06-18T13:47Z,"""To activate you need to run the game at least one time while the server is running to be able to activate it!""    It says when i click on ACTIVATE button!
""You must be online when logging in for the first time.""      Origin says
""Dummy certificate does not seem to be installed""       Tells me the server!"
,Vyss,2013-06-18T14:03Z,@savvapn run Origin as administrator
,DoctorGreenThumb,2013-06-18T14:58Z,"lol to everyone who has problems understanding how to get it to work
just google ""you tube SimCity.2013.NO.DRM.CRACKED -VULPESZEDRA""
watch the video how to install "
,DizizG,2013-06-18T15:01Z,"""This worked for me!

TO SOLVE THE DUMMY CERTIFICATE ERROR:
1-First make sure your Simcity Folder is Not Read Only
2- Then Start start.exe Then Start Server and it will give you that Error
3-After it does DONT﻿ DO ANYTHING Don't Click Stop server and DON'T close start.exe
4-Go to﻿ Extra folder install Certificate then back to start.exe and click Check﻿ Components
Then it will say everything sounds﻿ good i really hope this helps!"" -Gerden

Worked for me also but when unchecking the read-only box for the sim city folder leave the properties window open!!!!!!! or windows 8 will restore it to read-only"
,Adnerian,2013-06-18T16:11Z,"Hey, guys. I am stucked at the non-valid licence Tampered(0x000A) error.

 I have read-only box unclicked (or so I think. I removed the tick on every file and gift all permision to all my computer users. But I can't clean the black square on folders).
And yes, I am using this windows 8  &%##&!!

 Please, can someone help this dummy user?"
,Adnerian,2013-06-18T16:21Z,"Ok, I am retarded. Just forgot to restart Origin and Server after unclicking read-only... -.-'

Works fine, for now. 
Ty much for the torrent, Mr.Stifmeister :D"
,savvapn,2013-06-18T16:42Z,@Vyss i did it didnt work
,exonic112,2013-06-18T18:33Z,"I'm stuck at the end of the step. Since my native language isn't English, the productkey doesnt support my language. Is there a way to avoid it or to change my language for SimCity? I already tried to change the language on Origin, without any success.."
,linasbj,2013-06-18T18:43Z,"When I try to launch the game, it says ""We are unable to connect to EA servers to activate SimCity on this computer using your account. Please try again later"". Obviously, I have to activate the game, so I click the button in the Start.exe application, but there it says ""You need to run the game at least one time while the server is running to be able to activate it"". So I'm stuck in a rut. Any ideas? Everything else up to this point went pretty well."
,MISTAH1N1,2013-06-18T20:48Z,"Guys, what do you do about the Origin update? When I install Origin, it auto goes to updating it. Thats the problem no one mentioned here. When I disconnect my net, it gives error that net needs to be connected.

When I press activate server, I﻿ get error saying hostnames do not point at the private server"
,MISTAH1N1,2013-06-18T21:39Z,Ok solved my problem. The hosts file messed up somehow. I replaced it and everything works.
,Vyss,2013-06-18T22:38Z,"@savvapn Make sure you have your SIMCITY folder in C:/ and not set as read-only. Then run Start.exe and click Start Server button on it and it will say ""everything sounds good"". After that, run origin as administrator. Hope this helps."
,DizizG,2013-06-18T23:53Z,cheats don't seem to work :/
,NZ-Wanderer,2013-06-19T00:42Z,"Thank you for this, downloading and seeding :)
It's a pity we can't setup our own proper servers for this tho, now that would be great..."
,osee,2013-06-19T01:37Z,"when i try to start the server i just get -Dummy certificate does not seem to be installed
can someone tell me what to do? (preferably in Swedish)"
,Jobulani,2013-06-19T01:46Z,Anybody can help me please? when i click in Start Server i get this error: http://i.imgur.com/FI9LzfV.png
,JocaDASA,2013-06-19T01:46Z,"Ok guys gonna answer some questions and add some things to the installation :
VERY IMPORTANT 1.!!!! 
1.When you copy the host file you must either restart you're computer or use Command Prompt :
ipconfig /flushdns
This is important because in order for the server to ""talk"" to origin the DNS must be changed
2.Some people asked is this gonna be multiplayer?
Well i think that there is a way..And that is to have one pirated server(that would ""imitate"" origin) that all other player would connect to.
3.Will this be able to play on Hamachi,Evolve etc.
That would present a problem...But tehnicly i think that there are 2 ways...One is to stay connected all the time in order for the save games to be preserved but that's not very good... :P ...The other way is when you connect, one server is the hosts and automatically sends sends data to everyone else,and when you end the ""multiplayer"" game the other cities will be the same until you connect again...But that way is very very unstable and can present many problems.
Hope this helped.. :)
You can send any problems with the game or questions to my mail joca.dasa@yahoo.com :)"
,LukeBongwater,2013-06-19T02:54Z,"Ok... I know how to get this working and all... I have since the first night it was released, but I deleted it because of many bugs in the 1.2 and 1.3 version. No cheats... Missing items..... invisible menus.... cant delete regions and etc... But I would like to know if these bugs are worked out now with this 1.5 version? I absolutly refuse to buy this game and support EA games! Seeing the stiff man release this makes me wanna believe this is not a bullshit version! Are the kinks worked out... can anyone verify????"
,ifhy,2013-06-19T03:48Z,"This torrent DOES work. Just follow the instructions clearly. 
Bugs: 

No cheats in sandbox.
Can't delete regions.
I don't know if it's just me but local regions don't seem to share anything, hard to say though.


It should take legit less than 10 minutes to set it up and get going.. Just start the server, (But don't close it) and you're good too go!"
,NZ-Wanderer,2013-06-19T04:00Z,"Does anyone know is there any way to have the ""virtual"" server running on a separate computer that remains running all the time? "
,Tremmert,2013-06-19T04:16Z,"The game works fine, just follow the instructions LeXX (sorry if I mispelled your name here, didn't check back) provided, on page 3 or 4 I guess.

I've got 2 questions:
1 - Is it possible in any way to play this on a virtual server? Hamachi/Tunngle
2 - Is it me, or is there only 1 region to choose? I've got only 1 region, which fits 3 cities. Did I do something wrong on the install or it's just like that?

Thanks."
,sigma51,2013-06-19T04:18Z,"
It's too bad there is no demo for this game, after reading the shitty reviews about EA and the DRM i've been contemplating if its even worth the time. Whats your opinion guys? buy it or trash it?"
,tcc88,2013-06-19T06:00Z,"Simcity the game and: ""You must be online when logging in for the first time"" is the errors name. Please help, I tried everything. "
