User Type,Username,Date,Text
[V],Mr.Stifmeister,2013-06-16T15:27Z,"Finally simcity is out for us, the pirates! :D
Please follow install description CAREFULLY!

ENJOY! :)"
,Delia666,2013-06-16T15:46Z,"Thanks for the install notes >..< , the other torrent didnt have these speciffic notes so it didnt work for me . This one did XD ."
,ghighina,2013-06-16T16:05Z,Mr.Stifmeister You are always the best
,madmike521,2013-06-16T17:30Z,"I have this error with the hosts file: 
""Some needed hostnames do not point to the private server. Check your windows hosts file, otherwise you'll not be able to log in.""

Can anyone help??"
,gulisa,2013-06-16T17:35Z,"
Seed people,dont be fucks....We all need download this,so seed this masterwork"
,gulisa,2013-06-16T17:39Z,"Nah,its dead,nobody seed,download speed is 0.3 kb/s,totally not possible to download :("
,gulisa,2013-06-16T17:45Z,"Any toorent were dont have this fuking cunt LEECER bitches to ruin every fuking awesome download....Nobody seed,fuck u lecher bitches !"
,janogrexa,2013-06-16T17:47Z,i was doing everything as listed in install notes but if i try to install that origin after installation my origin.exe is automatically deleted so i cant continue. any solution guys??
,janogrexa,2013-06-16T17:49Z,"i was doing everything as listed in install notes but if i try to install that origin after installation my origin.exe is automatically deleted so i cant continue. any solution guys??

FIXED!!!: just renamed the OriginTMP.exe to Origin.exe and everytihng works now.. i hope it helps to you ;)"
,gulisa,2013-06-16T17:53Z,"REAPLOAD plz dude,this is dead,nobody seed..."
,Killher,2013-06-16T18:02Z,"SHUT THE FUCK UP GULISA. It's a BRAND NEW torrent. You are fucking blessed to even lay your eyes on this torrent. The reason it won't download is because of people like you. Complaining about d/l speeds when YOU'RE NOT SEEDING EITHER. So set this shit to d/l, and find something else to do with your life faggot."
[V],Mr.Stifmeister,2013-06-16T18:04Z,"@gulisa: Stop spamming, its seeding and there is much seeders right know including my servers.
Tried download it on my home PC and down speed was around 6-8MB/s."
,hoxies,2013-06-16T18:16Z,i seed 100 kb/s.   downloaf 322kb/s
,dissucks,2013-06-16T18:30Z,"Works great, reread the instructions if you need too, and if it still doesnt work then reread again.    And as for seeding i was DL at 800kbs-1.3mb/s so quit your bitching.  I seeded the 2gb and im done.  If you cant use torrent software or your net properly then get the fuck out. simple as that. "
,dissucks,2013-06-16T18:51Z,Ok It ran fine and now when I start the server it says dummy cert does not seem to be installed and not able to reach private server blah blah.  This just worked 10mins ago.  Any ideas?
[V],Mr.Stifmeister,2013-06-16T19:03Z,@dissucks: Do step 4-6 again.
,MisterAwesome23,2013-06-16T19:06Z,"@Mr.Stifmeister
i always get ""dummy cert does not seem to be installed"" can you help me pls ?"
,shakatrok,2013-06-16T19:09Z,"I get:
-Private server returned an unknown response, Origin will not be able to login in to.
-Not able to reach the private server, SimCity will not be able to login in to.

Any Ideas??"
,shakatrok,2013-06-16T19:27Z,"Ok a restart fixed that problem.
Now I have Origin installed, and Sim City downloaded, but when i try to start it says that its getting started but nothing happens, except that the windows is getting closed after a few seconds.
Any Ideas?"
[V],Mr.Stifmeister,2013-06-16T19:35Z,"If you get server cant start ect, make sure you right click on SIMCITY folder and properties then in the window UN-CHECK Read-only.

@shakatrok: Try that i wrote above and then run start.exe and make sure all 3 ports are green and start server.

For ""Dummy certificate is not installed"" error, try Install Certificate again, step 4."
,MisterAwesome23,2013-06-16T19:52Z,"Fuck yea, im downloading it right now every other release didnt work but this one did! Fuck man i love you stif :D"
,Nikkigardens,2013-06-16T20:05Z,"Great up as always stif, but dummy cert will not work for me, but you are still the best as always "
,AtraxS16,2013-06-16T20:08Z,"Thank you for the upload.
I must ask before I download, is this the same as the original release from vulpeszedra v1.2?
Because that one is beta with limited regions, features, no regional trade or sharing, and so on... 

Or is this the full game with regional features working?"
,moeburn1,2013-06-16T20:09Z,"Is the included Origin installer cracked/different in any way, or can I just use the Origin I already have installed on my PC?  Does it need internet access, or can I use my existing user/pass offline?"
,hoxies,2013-06-16T20:09Z,omg port 80 alredy binded by SYSTEM OMG???? WTF what have i do now?? please help me!  and i cant install certificate i try 5 times and cant do it
,TheTorrentter,2013-06-16T20:12Z,vmware workstation privent the server from working because it uses the port 443 you should disable VM or uninstall it
[T],Roobb,2013-06-16T20:26Z,Thanks for this. Works great!
,AtraxS16,2013-06-16T20:31Z,"@Roobb  Can you confirm if this is the beta version or the full version of the game?
Thank you."
,AtraxS16,2013-06-16T21:10Z,"Yup, it's the same BETA, no point in playing this. Once you expand too much and your resources are gone, you are wither doomed or going in circles, because you can't trade with your other cities in the region. Also, you have no use of tourism, gambling or things like that.
Waiting for the full game release.
Thnx for the upload anyways."
,ravupadh,2013-06-16T21:14Z,Is this torrent more updated and better than this one: http://thepiratebay.sx/torrent/8558755/SIMCITY_2013_DRMLESS_CRACKED-VULPESZEDRA
,ravupadh,2013-06-16T21:16Z,@AtraxS16 Even if it's the beta won't Origin update it to the full game anyway?
,grasakk,2013-06-16T21:18Z,"After switching hosts file,origin won't start,any solutions?"
,unkmmp,2013-06-16T21:22Z,Detailed installation tutorial: http://kickass.to/simcity-2013-drmless-server-installation-tutorial-t7521557.html
,grasakk,2013-06-16T21:33Z,"ALL is OK,if u a having problems whit origin,yust reinstal origin and log in and you can download game.
If u wanna back ur original origin games,yust delete hosts file in C:WindowsSystem32Driversetc
and u will have ur original origin games back,when u wanna play simcity yust again repleace hosts fine in C:WindowsSystem32Driversetc whit one provided in Extras folder."
,hgepotato,2013-06-16T21:47Z,"I downloaded and I confirm it works but hell it was lot of struggle to make it work. Restarting, deleting origin, game, reinstalling. Damn I don't even know what exactly I did to make it work. Propably clicking  Activate button made it work because before I couldn't start, it gave me an error. Thank you for release Stif. Anyway, this game is huge dissapointment for me, I say after playing tutorial. What's more, without online this game is pretty much crap."
,AtraxS16,2013-06-16T21:58Z,"@ravupadh Nope, it still remains the beta, because allot of the features are missing, not just regions.
Full retail game has arround 4GB.

Don't get me wrong, this is OK to play, it works, it's fine, but after a few hours you reach limitations of one city, and then you should expand to other cities in the region and trade amongs them, but that just doesn't work.
In my opinion, this is great for someone who wan'ts to try before buying, just to see how things work.
I will buy it, it's a cool game, but not nearly as difficult as SimCity 4. It's much more simplified, but still fun, specially playing with friends."
,D0gmeat,2013-06-16T22:06Z,"Remember even if you got this thing to work, bear in mind the retail game still is rife with bugs and unresolved game issues. If and when a new patch is released, you will need to redo all of this to get the game updated."
[V],Murlok,2013-06-16T22:08Z,thx :)
,andsur,2013-06-16T22:10Z,"System requirements can be found here : http://checkrequirements.com/game/simcity-2013-pc
Thx stif !"
,ravupadh,2013-06-16T23:10Z,@AtraxS16 How is it beta though if it's 1.5? And also I think region play requires online connectivity which has to do with the pirate game being played offline.
,AtraxS16,2013-06-17T00:30Z,"@ravupadh It is a 1.5 version of the CRACK. The original game is currently at 4.0.1 version.
Yes, in original game you have to be connected whatever you play, but if this version of the game was a full release, you would be able to use regional features IF you choose private server, so not with friends, just your region and your cities in that region. That doesn't require connection, because it is all on your local server, virtual in this case.
Look, try it out, and you'll see.
There are 3 torrents so far on tpb for this version of the game, all the same and all pretty much misslabeled.
The original uploader of this version labeled it correctly, he said it was beta, but everyone else who uploaded it later on actually write in notes that it is a full game.
I don't care, but it is missleading. And since none of the uploaders answered to my question if this is the beta, I'll assume it is.
If you start to download the game, you'll see in the list of files in utorrent that the zipped files are labeled as BETA.
Cheers."
,Timbo6669,2013-06-17T03:07Z,"Atrax - What are you? the title/label police?? who cares how exact the title is...its free, cracked yet still complain...yes, this has many features disabled because of the online play is disabled...not hard to figure out..and its small, so download and see for yourself instead of being a tool.."
,Timbo6669,2013-06-17T03:08Z,not once does it say its the 1.5 version of 'the game'...its how you read and comprehend it...it CLEARLY says Cracked.1.5-.blabla..not - Simcity v1.5...idiot..
,Timbo6669,2013-06-17T03:11Z,where does it say full game in notes??
,fenash,2013-06-17T03:16Z,"I installed it for the first time without problems, even started it. But after reboot i cant turn on private server . It says ""-Dummy certificate does not seem to be installed -Private server returned an unknown response, Origin will not be able to login in to. -Not able to reach the private server, SimCity will not be able to login in to."" I tried everything, reinstalling origin + whole game, started again from point 1 install notes etc. Even deleting certificate from certmgr.msc and installing again didnt help. Any ideas? "
,ravupadh,2013-06-17T05:24Z,So this is still just the beta version of the game? What a piece of shit. Might as well go and buy the game by myself.
,Killher,2013-06-17T05:57Z,"Just buy the game. This shit doesn't work. And if it does, it's just for a few people. I spent hours trying to get this to work. Fuck it."
,Timbo6669,2013-06-17T06:27Z,"yeah, everything has to go right for it to work..Its is like the beta but a little more content than the original. many stuff disabled..but totolly playable and enjoyable.."
,Delia666,2013-06-17T07:46Z,Is this the full game ? ... Or beta >.
,atif_ahmed33,2013-06-17T08:11Z,"After this installation , I cant even open the origin website , how do I reset all the settings to default ??? !!!!"
,deaddog_,2013-06-17T08:13Z,"For most people who can't get it to work, close PMB.exe in your processes. if no dice, then I don't know."
[V],Mr.Stifmeister,2013-06-17T08:39Z,"This is the full game, but the server emu is beta, so some stuff may not work.
And if you get errors like server cant start, make sure the filepath to start.exe dont have any spaces.
So i recommend placing the SIMCITY folder directly inside your HDD, so the filepatch becomes C:SIMCITY .

But as Timbo6669 says, its totolly playable and enjoyable :D"
,wasitreal,2013-06-17T09:19Z,"2.03GiB ? Surprised.

Thanks ;)"
,barbar00,2013-06-17T09:38Z,"Port 80 Not available already binded by System
how to fix"
[V],Mr.Stifmeister,2013-06-17T09:49Z,"If you get port 80 used by system, just search on google ""port 80 in use by system"" and you will get much results of how to fix it."
,fikix,2013-06-17T10:50Z,Does this work on 32-bit compters as well??
,barbar00,2013-06-17T10:56Z,tnx
,mcmig,2013-06-17T11:28Z,"For people with ""PORT 80 CLOSED"" problem just exit skype :P"
,mcmig,2013-06-17T11:31Z,"For people with ""Port 80 closed"" problem just exit skype :P"
,theprimal68,2013-06-17T12:49Z,"For people with ""Dummy Certificate does not seem to installed"":

In my case it was an easy fix. Right-Click your SimCity-Folder, choose ""properties"" and make sure the folder is NOT read-only. I (running Win7) had to change that and after that it was working fine."
,bumtzi89,2013-06-17T13:51Z,System requirements can be found here : http://checkrequirements.com/game/simcity-2013-pc
,AtraxS16,2013-06-17T14:12Z,"@Timbo6669  Chill, dude. I'm not complaining, I'm just saying that it doesn't say anywhere that this is limited release.
I did try the game back when it was 1.2 when the original cracker uploaded it, and yes it works, nor did I ever say it DOESN'T WORK! 
Idiot, read my posts, and then say what you need to say, dumbass.
It's still barely playable version of the game.
I'm not a ""label"" police, but I think EVERYONE would benefit if there were correct and precise descriptions and labels, that's the wholew point.
Upload a torrent that is misslabeled, an you'll get allot of crap from allot of people. Not everyone has unlimited bandwith and data plans, people would like to know what they are downloading, and that's the only reason I wrote what I wrote."
,Tomi351,2013-06-17T14:41Z,"Sweet, works well. Anyone know when larger maps will be available? Also, is it possible to play this over Hamachi?"
,Delia666,2013-06-17T15:22Z,Any way to change the Vulpes zedra icon ingame ?
,Delia666,2013-06-17T15:56Z,"and we need more maps >.< , official has like 10 or so maps while this one has only one and its the smallest ..."
,DizizG,2013-06-17T16:11Z,"hi, I am running Windows 8 and can't solve the ""Dummy Certificate does not seem to installed"" be unchecking the ""Read Only"" box in the folder settings. Anyway to fix this??? Followed the instructions to a T."
,hoxies,2013-06-17T16:40Z,DizizG i have same problem and windows 8 too.. i think this is not work on w8
,nightlem,2013-06-17T16:49Z,"guys help plz, when I run start.exe, then click start server,then start playing simcity, there is an message about lisence ""... reason code =tampered(0x00A)"". I already click activate button in start.exe and use sertification in 4-6 steps many times. I dont know what to do( Win7 32 bit"
,Mojkie,2013-06-17T17:06Z,When i click on start exe it starts .. but says server down and all ports unavailable and the program freezes...
,Mojkie,2013-06-17T17:46Z,"Okay now my only problem is this: ""-Dummy certificate does not seem to be installed""

But i followed every instruction right.. and i re do 4-6 step to make sure after it got me that error..
Can someone help??"
,PurelyEpic,2013-06-17T18:02Z,Oh my god it's finally here! I thought the hackers just gave up.
,OuTSiDeRs,2013-06-17T18:43Z,"Hello everybody we are new here and willing to help :D...
First off:
1.Make sure you followed the instructions exactly as its says
2.Make your ""SIMCITY"" folder placed in local drive(example: ""c://"")
3.Uncheck read-only of SIMCITY folder and override it
4.Make sure that you have installed given Origin and not other version(IMPORTANT!)
5.And most important of all before starting server be sure to click on ""ACTIVATE""
and then on start server.
6.Optional: turn Origin in offline mode
7.Optional: turn off show Origin in Game option in Origin itself
8.Optional: Run Origin and Server as Admin
TIP: Reinstall Certificate anytime you feel like needing to
PS. Be sure to reply me if this works for you on 
HelpMeOuTSiDeR@gmail.com"
,DizizG,2013-06-17T19:07Z,How does one override it :)...keeps checking the read only box
,ultimategtaplayer,2013-06-17T19:28Z,Yes it works and very well but one thing i don't understand why there is only one region available and will there ever be other regions available
,Mojkie,2013-06-17T20:05Z,"""-Dummy certificate does not seem to be installed""

PLEASE someone tell me what to do!
I did that stupid certificate thingy a 1000 times now and this is still an error when trying to start the server"
,Patey,2013-06-17T20:20Z,"anyone having issues with the dummy certificate-

try running cmd as admin and using the command netsh winsock RESET

solved the same problem for me."
,Patey,2013-06-17T20:24Z,"also, I'm attempting to alter this to work for multiplayer, anyone interested in helping me test it?"
,thwan,2013-06-17T20:50Z,"I don't have permission to start the file!!! HELP!!! PLEAAAAAAAAAAASE!! I really want to play the game, but start.exe says an error like ""Windows cannot access the specific device, path, or file. You may not have the appropriate permissions to access the item"" Please help!!! I would prefer the uploader to help, but I'm desperate for anyone!! PLEASE COMMENT TO HELP ME D;"
,OuTSiDeRs,2013-06-17T21:14Z,"@ DizizG
You did it right, its normal to go back because its system default. :)

PS. @ Everyone
If you have question for me, be free to email me HelpMeOuTSiDeR@gmail.com and i will try to answer as many as possible"
,starf576,2013-06-17T22:37Z,"Hey, thanks for the release!

Sadly, I have a problem: I did everything as instructed, but when I try to launch the game in Origin, it either does nothing or says:

""Invalid license, Code: Tampered (0x000A)""

Did I miss something? Please help, if you know the solution. Thanks."
,Fluid56,2013-06-17T23:09Z,"game is shit, avoid at all costs."
,boffalo,2013-06-17T23:14Z,"When I try to run the start it says that it cant find the stunnel folder.
Help!"
,Timbo6669,2013-06-17T23:42Z,hey guys it took me three failed attempts to get it to work..i had problem with previous origin software and games..i uninstalled everything under the origin license and in registery and program data folders..dunno if it all helped or one thing i did made it work i dunno...but if something doesnt looklike it worked orweent too quick..start over...a pain but playing it now!! good luck
,DMT82,2013-06-17T23:57Z,"I downloaded this one and followed all the steps.
When I start up the server, its says everything looks good.

When I go to the Origin and install the game and press on start, it loads for some seconds but the game will not start. Have restarted the computer but didnt work.
Someone knows the problem?

Im on Windows 8, 64bit, and on this site is says that it will work on Win8 32/64
http://kickass.to/simcity-2013-drmless-server-installation-tutorial-t7521557.html"
,DMT82,2013-06-18T00:04Z,"SOLVED:

By clickin on Activate button in the server while Origin is up, after that I got some error.
Closed the server and Origin and started it up again, clicked on Activate again and on simcity and now it works."
,DizizG,2013-06-18T01:34Z,Seems no one has the solution for the certificate error..i guess gotta wait for another torrent :/
,Timbo6669,2013-06-18T02:48Z,"@AtraxS16 - iLL take my chill pill when you ppl realize its the dev's fault for making this game server based..not the uploader who is getting this for us to play, if not, at least try it..and the group that are programing the server emulators...nothing to do with the uploader and his bots..."
,wlada89,2013-06-18T02:51Z,"Ok, everyone that doesnt see ""Everything sounds good !!!"" when you press start: Make sure all 3 ports are green (circles). If some ports are brown, try disabling skype, it worked for me"
,RodrS,2013-06-18T02:54Z,"try to put the folder in C:....Delete the error.log, right click on the simcity folder > uncheck the read-only thing to ALL files. Make sure you have all the privilegies. repeat the certificate instalation"
,RodrS,2013-06-18T02:55Z,"to the certificate error:

try to put the folder in C:....Delete the error.log, right click on the simcity folder > uncheck the read-only thing to ALL files. Make sure you have all the privilegies. repeat the certificate instalation "
,gobs91,2013-06-18T03:17Z,"how do i remove the block on origin
it did not work for me and i have purchased games on origin
is there any way to remove the block"
,thwan,2013-06-18T04:13Z,NVM GUYS!!! Start.exe worked fine. it was Norton's fault
,Hubrex,2013-06-18T04:23Z,"Damn this release made me Stif

Thanks lads!"
,LEXX911,2013-06-18T04:27Z,"This tutorial is not complete.

1. Create a folder C:\SIMCITY and copy files from SimCity.2013.NO.DRM.CRACKED.1.5-VULPESZEDRA folder into it
2. Copy files from SimCity DRMLESS Beta Update 1.5 folder and copy and overwrite files in C:\SIMCITY
3. Open hosts file in the EXTRA folder with notepad and select all and copy
4. Go to C:WindowsSystem32Driversetc and open hosts file(make sure to take full control of the file) and paste into it.  save and close
5. go intro EXTRA folder and run Electronic Arts, Inc CA.crt
6. Click on Install Certificate and press Next.
Then pick the Place all certificates in the following store option and press Browse.
7. Select the Trusted Root Certification Authorities option and click OK.
Now press Next and finish. If you get an error select Yes.
8. Now go into EXTRA folder and install OriginSetup_9.1.15.109.exe
9. Now go to C:\SIMCITY and run START.EXE
10. Click Start Server and go to Origin and create any user name and password and login
11. Choose Simcity and let it download/update it
12. If it ask you to restart and you get an error.  Just stop server and log off Origin and Start server and and log into Origin again and play the game
13. Move the Simcity shortcut create by ORIGIN to a folder on desktop.  Create a shortcut for START.EXE on desktop and rename it to SIMCITY"
,Gerden,2013-06-18T04:37Z,"This worked for me!

TO SOLVE THE DUMMY CERTIFICATE ERROR:
1-First make sure your Simcity Folder is Not Read Only
2- Then Start start.exe Then Start Server and it will give you that Error
3-After it does DONT﻿ DO ANYTHING Don't Click Stop server and DON'T close start.exe
4-Go to﻿ Extra folder install Certificate then back to start.exe and click Check﻿ Components
Then it will say everything sounds﻿ good i really hope this helps!"
,thwan,2013-06-18T04:48Z,"-Private server returned an unknown response, Origin will not be able to login in to.
-Private server returned an unknown response, SimCity will not be able to login in to.

How do I fix this?!?!?! PLEASE HEEEEEEEELP"
,Killher,2013-06-18T05:00Z,"No matter what you do, if you're on windows 8, you'll get this :
-Dummy certificate does not seem to be installed
-Not able to reach the private server, Origin will not be able to login in to.
-Not able to reach the private server, SimCity will not be able to login in to.

Windows 8 sucks and so does this ""crack""."
,crazymfer,2013-06-18T05:08Z,everything downloaded and installed fine but once i click play it does nothing...my computer exceeds the requirements..any suggestions??
,LEXX911,2013-06-18T05:08Z,"You people on Windows 8 should trying installing Electronic Arts, Inc CA.crt with Admin. See if that work."
,Jobulani,2013-06-18T05:50Z,"When i click in Start Server i get this error ""Fatal error: Uncaught exception 'PDOException' with message 'SQLSTATE[HY000] [14] unable to open database file' in /www/www/default/libs/mysqli.php:80 Stack trace: #0 /www/www/default/libs/mysqli.php(80): PDO->__construct('sqlite:data.db') #1 /www/start.php(38): SQL->SQL() #2 {main} thrown in /www/www/default/libs/mysqli.php on line 80"""
,benbenhor,2013-06-18T06:38Z,"followed everything @ LEXX911 stated but still cant play..either got ""SimCity (TM) has stopped working"" or ""Invalid license. Reason code = Tampered (0x000A)""..any solutions?"
,b.ugatti,2013-06-18T07:49Z,"If you are running Windows 8 and receive a message stating that port 80 is already ""binded by system"" open task manager and go to Services tab. Stop the ""World Wide Web Publishing Service' aka W3SVC. It worked for me, hope this helps"
,milkover,2013-06-18T10:47Z,"The game works. After hours of playing though, there seems to be a bug that auto quit to the main menu (about 40-50 minutes of playing time), and if you try to resume playing,  it will show an error: ""Unable to load city at this time. Please try again later."" The problem might be related to offline save function. If anyone knows a fix, please help, thank you. This DRMless masterpiece is quite close to perfect. "
,pamtdoh,2013-06-18T11:06Z,"@ benbenhor
also got that error message. i have managed to solve that problem by making the simcity folder located at C:Program FilesOrigin GamesSimCity not read only. after you start the server, try to run the game again. if the problem still persist, press the activate button from start.exe"
