User Type,Username,Date,Text
,Hamster-X,2013-02-17T03:31Z,All previous issues: http://thepiratebay.sx/torrent/7815733/Pathfinder__1-3_%282012%29_%5BDynamite%5D
,Psylent1,2013-02-17T23:47Z,Missing the RPG content at the end of the book.
,Hamster-X,2013-02-18T00:38Z,"True, the 2 versions I found both had it missing, if I find a complete one I'll upload that too. xD"
,Hamster-X,2013-02-18T01:11Z,"Fixed here: http://thepiratebay.sx/torrent/8155187/Pathfinder__4_%28Includes_RPG_pages%29

Hope it helps. :)"
