User Type,Username,Date,Text
,HAYMAN57,2013-04-20T01:58Z,"this looks like a good movie...sorry cant understand need English language is this OK...
pls. No sub's.....thanks"
[V],def35,2013-04-20T04:14Z,"HAYMAN57]
if you search on tpb only A.Gang.Story and then you will find from user> RedBlade engelish subs "
,HAYMAN57,2013-04-20T16:00Z,"maybe am slow :) but is this movie played in just 
English copy only....plus not sure what tpb is very new to site.....if its ok like to have ""easy money"" the same way.....believe me i thank you so much. "
[V],def35,2013-04-20T22:18Z,it is make in France. and also speak France. and there is no English version from
,HAYMAN57,2013-04-21T01:09Z,what about easy money i see that one here you got and English copy...??
[V],def35,2013-04-21T21:12Z,you mean this?> imdb.com/title/tt1291652
,HAYMAN57,2013-04-22T16:08Z,YES!! that one.... am assuming by its out here there is a English copy
[V],def35,2013-04-23T00:37Z,"imdb.com/title/tt1291652 that one is also in english that can you read on that site, at the bottom by language"
,HAYMAN57,2013-04-23T02:06Z,"yes let me have that.....easy money!!
i like this site.... but how do one kno which
downloads are real or fake? don't like spending
time dl-ing and they are fakes.... is there a way to 
tell?"
