User Type,Username,Date,Text
[V],Zen_Bud,2013-01-20T17:05Z,"720p here:
https://thepiratebay.sx/torrent/7305839/Magnolia.1999.720p.Bluray.x264.anoXmous"
,onlyHD,2013-01-20T18:04Z,"yeah, i already got your 720p version of this and i am gonna replace this one over with 720p as i did before for TLOTR, ocean's trio, star war, ben-hur, natural born killers, etc.
and i hope you will also do 1080p versions of the rest of the great movies you have done in 720p like life is beautiful, prestige, lucky number slevin, goodfellas, etc in future.
i should humbly say that i am not pushing you to do them right away, you just go for it if you feel so. :)
finally a huge thanks for this tom cruise flick..!!!  "
,Mr_Heisenberg,2013-01-21T07:44Z,"thanks awesome as usual! a/v 10. I downloaded an older torrent of yours here http://thepiratebay.sx/torrent/7505468/The.Curious.Case.of.Benjamin.Button.2008.1080p.Bluray.x264.anoXm but the audio is way out of sync, i know i can fix with vlc player i am wanting to put this on dvd. Would be awesome if you could upload a better version. Thanks either way, keep up the good work!"
,Linecut,2013-02-19T19:32Z,Grandísima película. De mis favoritas.
,beedog11,2013-04-08T19:00Z,Thanks!
