User Type,Username,Date,Text
,Nats34,2013-06-14T04:50Z,"thx for the amazing uploads, can you see if you have Nationals vs Colorado rockies (13th June) Thx for ur uploads!!!"
[V],Nepotu,2013-06-14T10:06Z,"YW! I know you are a great Nats fan, but the rippers don't up their games, except when they meet teams like Boston, NYY, etc. Sorry, buddy! I'll do my best."
,Nats34,2013-06-14T11:10Z,"ok, I understand, I know you tried your best"
,drdoom6996,2013-06-14T12:27Z,Thanks
,drdoom6996,2013-06-14T12:27Z,Thanks!
