User Type,Username,Date,Text
,karimbaraka,2013-01-13T07:01Z,Thanks
,.Leto.,2013-01-14T07:06Z,"Excellent quality, thanks."
,ManWithAPlanet,2013-02-03T01:47Z,Surprisingly good quality for file size. Surround sound excellent. 
,lkudu57,2013-02-15T06:31Z,"After downloading this movie, I received a letter from my internet provider after Fox tracked my ISP.  Make sure to change your torrent application's security settings before downloading."
,sharktank59,2013-03-11T18:42Z,"Thnx to the uploader! Movie was OK as i expected it to be! I usually watch all the movies at film.maswagg.com because they have HD's but they didn't have this one so im happy to have piratebay :) Good torrent quality - A9 V9,"
