User Type,Username,Date,Text
[V],HobbitWarez,2013-02-01T01:40Z,"Android Applications [01-31-13]

4EXT Recovery Control v2.4.6-ROOTED DEVICES ONLY-AnDrOiD
aCar Pro-Car Management-Mileage v4.2.2-AnDrOiD
aFirewall Call and Message blocker v4.1.1-AnDrOiD
Akinator the Genie v2.0.2-AnDrOiD
Alloy Blue Theme CM10.1 v1.4.4-AnDrOiD
Alloy Light Blue Theme CM10.1 v1.3.3-AnDrOiD
aTorrent PRO v2.0.1.8-AnDrOiD
AutoKiller Memory Optimizer PRO v8.2.1 Patched-AnDrOiD
BeFunky Photo Editor Pro v3.0.2-AnDrOiD
BIRDBIRDBIRD GO Locker Theme v1.10-AnDrOiD
BLN control - Pro v0.18.7-AnDrOiD
Blue Leather CM10 AOKP Theme v2.0.3-Android 4.0 Plus-ROOTED DEVICES ONLY-AnDrOiD
Blue OrbiconS Icon Pack v1-AnDrOiD
BusyBox Pro v9.7.1-AnDrOiD
CM10.1 CM9 Sony XPERIA Z theme v2.0.1-Android 4.0 Plus (Requires CM10 AOKP Rom)-AnDrOiD
Color Splash Effect Pro v1.4.0-AnDrOiD
Crysis 3 Theme v1.2-GO Launcher-GO Locker-AnDrOiD
EerieSynth v1.2 Android App
Electrum Drum Machine-Sampler v4.6.6-AnDrOiD
EVA - Virtual Assistant v2.72-AnDrOiD
Extended Controls v5.7.3-AnDrOiD
Falcon Pro (for Twitter) v1.6.2b build 20-AnDrOiD
File Expert Pro v5.1.0-AnDrOiD
Fingerprint Lock v1.9 Android App
Flightradar24 Pro v3.6.6-AnDrOiD
FolderSync v2.4.6-AnDrOiD
GO Contacts Pro v1.0 build 202-AnDrOiD
GO Launcher EX v3.28 Final-AnDrOiD
GO Power Master Premium (Save Battery) v3.13-AnDrOiD
GO Weather EX Premium v3.5-AnDrOiD
GPP Remote Viewer v1.0.8 build 56 Android App
HD Panorama Plus v2.10-AnDrOiD
HDR Camera plus v2.32-AnDrOiD
Heart service PRO v1.2.7-AnDrOiD
iDisplay v2.4.4-AnDrOiD
iMediaShare v4.51 Android App
IP Cam Viewer Pro v4.7.8 Android App
Jelly Bean Extreme CM10 AOKP v3.0-AnDrOiD
Just Playlists Plus v5.1.0-AnDrOiD
My Playlist Maker PRO v1.0.4-AnDrOiD
MyCalendar PRO v2.63-AnDrOiD
Mystical Life LWP Full v1.2.5-AnDrOiD
New Star Trek GO SMS Pro Theme v1.0-AnDrOiD
Next Launcher 3D v1.16.1-AnDrOiD
Next Launcher Theme Gold v1.1-AnDrOiD
Night Camera Plus v2.10-AnDrOiD
Norton Utilities And Task Killer FULL v2.6.5.313-AnDrOiD
Notification Toggle Premium v2.6.2-AnDrOiD
Ocean GO Locker Theme v1.00-AnDrOiD
Phonendoscope v1.6-AnDrOiD
Port Forwarder Ultimate Pro v2.8-AnDrOiD
PPSSPP Gold v0.6-AnDrOiD
Premium Widgets And Weather v1.3.2-AnDrOiD
Press (Google Reader) v1.1.2-Android 4.0 Plus-AnDrOiD
PrinterShare Mobile Print Premium v7.9.7-AnDrOiD
Pushover v1.5.2-AnDrOiD
Reddit News v6.25 Android App
Remote Web Desktop FULL v5.9.5-AnDrOiD
Root Call Blocker Pro v1.8.3.26-ROOTED DEVICES ONLY-AnDrOiD
SF Launcher Alpha v0.2.6b-Android 4.0 Plus-AnDrOiD
SketchBook Mobile v2.0.2-AnDrOiD
Sleep as Android FULL v20130130-AnDrOiD
Sliding Messaging Pro v3.91-Android 4.0 Plus-AnDrOiD
Smart App Protector(App Lock plus) v5.1.0-AnDrOiD
SMS Backup And Restore Pro v5.97-AnDrOiD
Snap Camera v1.6.0-AnDrOiD
Spirit FM Radio Unlocked vJan31-AnDrOiD
Spreadbet v1.2-AnDrOiD
Stat Tracker Halo 4 Edition v1.0.2-AnDrOiD
SuperSU v1.02 and SuperSU Pro v1.00 ROOTED DEVICES ONLY-AnDrOiD
System Control Pro v1.4.0-ROOTED DEVICES ONLY-AnDrOiD
Titanium Backup Pro 6.0.1 Full-ROOTED DEVICES ONLY-AnDrOiD
Titanium Backup Pro v6.0.1 Patched-ROOTED DEVICES ONLY-AnDrOiD
Trickster MOD Kernel Settings v1.13.533-Android 4.0 Plus-ROOTED DEVICES ONLY-AnDrOiD
Ultimate Guitar Tabs v1.8.6 with Tab Pro and Guitar Tools-AnDrOiD
Valentine Beauty Theme v1.0-AnDrOiD
Vignette v2013.01-AnDrOiD
Weather Live v1.5.1 Android App
Weather Pro Local Forecast Radar v2.0.1-AnDrOiD
Weather Services PRO v2.1pro-AnDrOiD
xFuel v1.0.1-AnDrOiD
X-plore File Manager v3.15-AnDrOiD
ZDbox (All-In-One toolbox) v3.9.264-AnDrOiD"
,dasiey,2013-02-01T05:45Z,Hi hobbit was wondering if you can get this one for me?          ~~ https://play.google.com/store/apps/details?id=com.bigbeard.spiritvoice&feature=more_from_developer#?t=W251bGwsMSwxLDEwMiwiY29tLmJpZ2JlYXJkLnNwaXJpdHZvaWNlIl0. ~~
,MyOrifice,2013-02-01T07:54Z,"Once again, HW, thanks. Great package."
,SmokeShadows,2013-02-01T16:20Z,Yeauh! good stuff like always!
