User Type,Username,Date,Text
,vicmaza,2013-04-10T23:23Z,machas gracias
,vicmaza,2013-04-10T23:30Z,serial para la instalación NG4HW-VH26C-733KW-K6F98-J8CK4
,jacob5800,2013-04-12T01:11Z,it s always the same serial number that is being use here since it came  out so ?????
,vicmaza,2013-04-12T03:44Z,ASÍ ES AMIGO EL SERIAL A SIDO Y SERA EL MISMO ES MENTIRA QUE MICROSOFT PUSO DIFERENTES SERIALES EN SUS DVDs O EN SUS DESCARGAS ALO MEJOR EN EL FUTURO LOS CANBIE  =)
,erickmauricio2000,2013-04-13T20:38Z,es windows de 64 0 32 bits?
,vicmaza,2013-04-14T09:26Z,Amigo es el de 32 bits el de 64 lo encuentras aqui en mi perfil saludos :-) 
