User Type,Username,Date,Text
,0GW0,2013-01-27T11:11Z,I LÖVE U!
,0GW0,2013-01-28T09:32Z,"ok, still love you but, there is this german guy talking in the background all the time. I think its the wrong audiofile, with comments."
,draxs,2013-01-29T07:34Z,Agree with previous comment.Excellent video quality but audio out of sync.Any chance of fix please?And tanx 4 upload of course..
,carliicm,2013-02-07T18:13Z,"Many thanks for this upload... I've been looking for it for ages !!

Could it be possible to uploaded again without comentaries ?? I also agree it's a bit anoying to have that background voice.

Again, Thanks"
,johnatanb,2013-02-10T21:42Z,"Can SOMEONE ELSE please seed that video?

If this user makes new torrent he will do it without sound or with russian language or without video at all."
,TorskenSimmar70,2013-02-16T21:02Z,"This is a bad ripp !
Why is the comentaries audio track joined with the original audio track?
Do you ever check the ripps before uploading them?"
,Pilot1996,2013-02-23T03:59Z,"Hi!

Cant you upload just the sound file without that background voice??

Cheers!"
[T],stevekasian,2013-03-20T04:47Z,"Hey, I have the best advice out of anyone here, aoloffline: Why don't you just go fuck yourself and stop uploading bad half-ass rips, you fucking dolt?"
,Jonney12,2013-05-18T19:34Z,OK  .. Audio  is  not  gr8  but  aoloffline  really a  huge  thanx  for  uploading this  one. Well its  very very rare  to find  some one  who uploads  Piloteye.tv  stuffs.. So  once  again  thankyou  very much for doing it. BTW  would  have been  nice  if  you  could rip it  in  a better  way  and  with the  correct audio files  if  you  have  more   from pilotseye. 
