User Type,Username,Date,Text
[V],HobbitGamez,2013-02-11T07:21Z,"Android Games [02-10-13]

9th Dawn RPG + v1.49 Android Game
Aralon - Sword and Shadow v4.52 + SD DATA Android Game
AREL WARS 2 v1.0.5 (Free Shopping) Android Game
Bag It! v2.8 Android Game
Battle Killer Bismarck 3D v1.0.0 Android Game
BattleFriends at Sea PREMIUM v1.1.0 Android Game
Beat Hazard Ultra v1.7 Android Game
Ben 10 Xenodrome v1.1.3 (Unlimited Money) Android Game
Block Warfare - Zombies v1.0 Android Game
Bridge Constructor Playground v1.1 Android Game
Bridge Constructor v1.4 rev161 Android Game
Canabalt HD v1.2 Android Game
Cartoon Wars - Blade v1.0.0 (free) Android Game
Chess v3.0.1 Android Game
Clear Vision 2 v1.0.2 Android Game
Colosseum Defense v1.0.1 (Free Shopping) Android Game
Crawl 4x4 Pro v1.4 Android Game
Crystal Throne v1.0.7 + SD DATA (free) Android Game
Cut the Rope HD v2.2 Android Game
Dexter the Game 2 v1.08 + SD DATA Android Game
DoubleTake v1.0.6 Android Game
Dragon Frenzy v1.01 Android Game
DragonVillage v2.5.4 (Unlimited Gold & Diamonds) Android Game
Draw a Stickman - EPIC v1.3 Android Game
Era's Adventures 3D v1.1.2 + SD DATA Android Game
Eternal Labyrinth v1.6 Android Game
Fire Pinball v1.0.1 (Unlimited Money) Android Game
Flickitty v1.100 Android Game
Future Ops Online Premium v1.0.79 Android Game
Gold Miner Classic HD v1.2 Android Game
Iron Fist Boxing v4.2.2 + SD DATA Android Game
Mahjong Deluxe 2 v1.0.5 Android Game
METAL SLUG 2 v1.0 + SD DATA Android Game
Monster Shooter - Lost Levels v1.7 Android Game
Naval Clash Admiral Edition v2.4.4 Android Game
NFL Kicker 13 v1.1.5 Android Game
No Gravity v1.8.1 + SD DATA Android Game
NOKOGI Rider v1.06 Android Game
Outfight Gold v1.1.5 Android Game
Pippi's Villa Villekulla v1.10 + SD DATA Android Game
Planet Descent v1.0.5 Android Game
Quizkampen PREMIUM v1.1.1 Android Game
Radiant HD v3.14.3 Android Game
RPG Aeon Avenger - KEMCO v1.1.4 (Unlimited Money) Android Game
RPG Covenant of Solitude v1.0.2g (proper) Android Game
RPG Covenant of Solitude v1.0.2g (Unlimited Money) Android Game
Run Like Hell! Heartbreaker v1.2.3 (Unlimited Heart) Android Game
Save the Puppies Premium v1.2.0 Android Game
Shapes & Sound - TheShapeShooter v1.1 Android Game
Spirit HD v2.2.4 Android Game
Survival Run with Bear Grylls v1.2.4 (Unlimited Gold) Android Game
Syder Arcade HD v1.1 + SD DATA Android Game
The Great Fusion v1.4 Android Game
The Passenger v1.5 Android Game
Top Gear SSR Pro v3.1 + SD DATA Android Game
Traktor Digger v4.00 Android Game
Vector v1.0.0 (full) Android Game
Whack Mania v1.0 Android Game
Where's My Valentine v1.1.0 (free) Android Game
Where's My Water v1.11.0 (Fully Unlocked) Android Game
Where's My Water v1.11.0 Android Game
Wipeout v1.2 Android Game
Wonder Zoo - Animal rescue ! v1.2.3 + SD DATA (Unlimited Peanuts & Coins)
WORD PUZZLE for the SOUL v1.0 Android Game
Wordfeud v2.2.2 Android Game
Zeeek v1.0.1 + SD DATA Android Game"
,ornigod,2013-02-11T13:16Z,thanks for your job
,0TheRich0,2013-02-11T20:28Z,"Please upload gun club 2 ,traffic panic london and stair 
dismount !!! ALL 3 GAMES FULLY UNLOCKED"
,limeyguy33,2013-02-12T04:53Z,@HobbitGamez. Thank you very much
,Keijinx,2013-02-13T09:54Z,"Hey HobbitGamez, first of all thanks for your upload. I wanted to ask you if you knew how to mod .apk files for free shopping?"
,jandolej,2013-02-13T15:27Z,"thanks for all your great uploads..
sadly Naval Clash Admiral Edition know its been pirated, so wont run. "
,WHALEN,2013-02-15T21:11Z,Just want to say thanks Hobbit. Your uploads are amazing. Keep them coming.
,NinjaAndroid123,2013-02-21T07:08Z,"Hobbit, ur the best, keep up the good work!!! :)"
,jspade21,2013-02-22T18:57Z,Please upload Zen Pinball. I'd like to be able to play the othermachines without buying them. Thanks man...you do awesome things... 
,tgger,2013-02-28T03:10Z,"Thanks Hobbit could you please upload ranch rush 2 full, thanks"
,john rallus,2013-03-03T11:19Z,"man, i think you are the best uploader in the android section! big thank you!"
,sannie2013,2013-03-05T18:11Z,do u have Big Business with Unlimited Money and Rule the Kingdom Unlimited Money and diamonds?
,AMF6909,2013-03-09T05:49Z,"Gr8 upload mate, do you have full version of the app below,
CALL RECORDER-- https://play.google.com/store/apps/details?id=com.skvalex.callrecorder&hl=en
"
,ViralT,2013-03-09T11:45Z,"@hobbitgamez can u plz upload ""go power master ultimate ""....."
,ViralT,2013-04-10T15:32Z,"heee can any1 upload ""xperia z he theme for go launcher ex ""paid version......
plzzzz........."
,ads3686,2013-04-21T10:15Z,Can u plz Pirate PUK and The Room for android?
