User Type,Username,Date,Text
[V],HeroMaster,2013-03-24T11:56Z,ENJOY ENJOY Jack the Giant Killer 2013 BDRIP New Movie by RISES!
,emjay24,2013-03-24T13:50Z,Can anyone confirm if this is real or fake please?
,ag_orange,2013-03-24T14:35Z,"It's real but it's not that Jack... You are thinkin' on Jack The Giant Slayer but this is a ""giant killer"" -_-"
,tool75067,2013-03-24T14:45Z,"@emjay24 

Do you see the Green Skull next to the HeroMaster's name?????

Yes its fucking real!!!"
,makes1,2013-03-24T15:26Z,"its the ""ASYLUM"" jack"
,12os,2013-03-24T20:00Z,WTF is this HeroMaster??? Extremezone is still the BEST!!
,ronibob,2013-05-02T10:26Z,@12os Why is extremezone best they all just about come from the same place you nob.
