User Type,Username,Date,Text
,wildpig1234,2013-05-03T05:11Z,"Thanks.  If you can, please get and upload the last season of the revival series.  If you  need donation, i am sure we can all chip in ;)"
,russell887,2013-05-03T15:58Z,I will do my best....I have been already looking for the 89' season and I've got lucky to soon get some of the old original 1966 seasons.They will be soon and I will be sure to keep my eyes peeled for the revival 89' as I would love to have it myself!!!
,wildpig1234,2013-05-04T10:33Z,"If you search mission impossible under  TV show category, there' re multiple hits for the complete 7 seasons of the 60's series..."
,russell887,2013-05-06T04:48Z,"Ahhh, I see what you mean dude...anyway's if I come across the 89 season I will be sure to up it."
,russell887,2013-05-10T05:16Z,Hey wildpig1234 I'm getting the revival 89 of mission Impossible.I'm just waiting for the video store to email me (about a week) and then of course I'll have to recode it.I'll make it one torrent this time to save hassle...cheers bud!! 
