User Type,Username,Date,Text
,xbullsx,2013-02-27T09:46Z,And toorentz delivers again..  Thanks
,xbullsx,2013-02-27T11:38Z,Still downloading... 
,krumusainski,2013-02-27T15:08Z,"NOBODY SEEDS FUCK OFF, 32% WHOLE DAY :/"
,steve221,2013-02-27T16:53Z,"Thanks, can you do a theme collection for Apex launcher as well? "
,toorentz,2013-02-27T20:50Z,"Download them from here:
Nova,ADW,Holo,Go Launcher Theme Collection 

http://thepiratebay.sx/torrent/8200298/Nova_ADW_Holo_Go_Launcher_Theme_Collection"
,smokingaces,2013-03-01T14:35Z,"thnks toorentz.
coiuld you pls get ..
Concept key lime pie HD 7 in 1
tnks"
,chop007,2013-03-02T16:53Z,"Wow awesome stufff, you are my hero, now, using Blur wallpaper in Launcher 3D lets the statusbar stay transparent in cm10.1 etc etc. Thank you friend, you made my day."
,blkat,2013-03-18T17:33Z,Does anyone know where to get the Next Launcher 3D icons?
