Filename,Size,Unit
Next Launcher Theme Leather v1.2.apk,12.61,M
Next Launcher Theme Thunder 3D v1.0.apk,10.31,M
Next Launcher Theme Jelly Bean v1.1.apk,8.42,M
Glow Next Launcher 3D Theme v1.1.apk,7.69,M
Next Launcher Theme iPhone5 v1.0.apk,6.75,M
Next Launcher 3D Luxor Theme 1.2.apk,6.67,M
MIUI Next Launcher 3D Theme v1.1.apk,6.38,M
Next Launcher Theme Carbon HD v3.0.apk,6.07,M
Next Launcher Theme Meego v1.2.apk,4.29,M
Next Launcher Theme Graphite v1.3(Andriod 4.1+).apk,3.75,M
Next Launcher Theme Graphite v1.3(Andriod 2.2+).apk,3.73,M
Next Launcher For Man Theme 3D 1.0.apk,3.14,M
Valentine Next Launcher Theme v1.0.apk,2.51,M
Next Launcher Theme BrushMetal v1.0.apk,2.49,M
Next Launcher Theme Windows 8 v1.0.apk,2.43,M
Next Launcher Theme Silver v1.0(Andriod 4.1+).apk,2.27,M
Next Launcher Theme Silver v1.0(Andriod 2.2+).apk,2.26,M
Next Launcher Electric Theme v1.3.apk,2.21,M
Next Launcher Theme Gray v1.0(Andriod 4.1+).apk,1.96,M
Next Launcher Theme Gray v1.0(Andriod 2.2+).apk,1.95,M
Next Launcher Theme SteampunkR v1.0.apk,1.56,M
Next Launcher Theme Sense v1.0.apk,1.24,M
Next Launcher 3D Black Lime HD v1.0.apk,1.13,M
Next Launcher Theme Cyber Girl v1.0.apk,896.19,K
