User Type,Username,Date,Text
[V],HobbitWarez,2013-01-18T04:31Z,"Android Applications [01-17-13]

Accupedo-Pro Pedometer v2.4.5-AnDrOiD
Apex Launcher Pro v1.4.2 Final Android 4.0 Plus-AnDrOiD
App Protector Pro (App Lock) v2.21-AnDrOiD
Black Infinitum - Inverted v3.3 Android 4.1 Plus (Requires CM10 AOKP Rom)-AnDrOiD
Blue Infinitum - Inverted v3.3 Android 4.1 Plus (Requires CM10 AOKP Rom)-AnDrOiD
Blue Leather CM10 AOKP Theme v1.8-Android 4.1 Plus-AnDrOiD
Clean Widgets v3.05-AnDrOiD
CM10.1 CM9 TouchWiz 5.0 theme v3.4.3 Android 4.0 Plus-AnDrOiD
Cobalt Donate CM9 CM10 Theme v2.6-AnDrOiD
ColorUp Pro - Photo Editor v2.2.0-AnDrOiD
Daily Expense Manager PRO v1.1-AnDrOiD
DarkJelly Theme Chooser v2.9-ROOTED DEVICES ONLY-AnDrOiD
External Keyboard Helper Pro v5.4-AnDrOiD
FACEinHOLE v3.3.7 Android App
Falcon Pro (for Twitter) v1.6-AnDrOiD
Fast Pro for Facebook (Beta) v1.9.8.1-AnDrOiD
FlashLight HD LED Pro v1.44-AnDrOiD
FPse for android v0.11.77-ROOTED DEVICES ONLY-AnDrOiD
Frighty Night Scary Timer v1.1-AnDrOiD
GO Launcher EX Security Edition v3.26.1-AnDrOiD
Minimal MIUI Go Apex Theme v2.8-AnDrOiD
Mobile Counter Pro - 3G, WIFI v2.7 Android App
Nexus Media Importer v4.1.2 Android 4.0 Plus-AnDrOiD
Notification Toggle Premium v2.6-AnDrOiD
PdaNet plus FULL v4.01-AnDrOiD
ProCapture - camera and panorama v1.6.1.2 build 48-AnDrOiD
Puffin Web Browser v2.3.7536 Android App
Qloud Media v3.5.2-AnDrOiD
RadiON v3.0.2 Android App
Slices Pro for Twitter v1.9.3-AnDrOiD
Smart RAM Booster Pro v1.7-AnDrOiD
Supreme MPA v1.3.7-AnDrOiD
Torque - Mazdaspeed 2007-09 v1.6-AnDrOiD
Torque Pro (OBD2 and Car) v1.6.30-AnDrOiD
Touch Control (Nexus 4) v1.0-ROOTED DEVICES ONLY-AnDrOiD
Triangle Theme v1 Apex Nova ADW-AnDrOiD
Tweetings for Twitter v2.14.5-AnDrOiD
Ultimate Rotation Control (Licensed) v4.6.2 Android App
Weather Flow Live Wallpaper v1.80-AnDrOiD
Wiki Encyclopedia pro v2.81-AnDrOiD
Wikipedia Lecturer Pro v2.4.1-AnDrOiD"
,kaozar,2013-01-18T11:57Z,"You are just great! Thanks man, but please, is there any chance for tablet talk app?"
,ScorpioPirate,2013-01-18T14:27Z,"Hi... also a' brilliant upload from you :)

Thanks :)"
,spastik80,2013-01-19T03:05Z,"Greatly appreciate all the work! Any way we could get ""c*ultimate Craigslist Client""?? Thanks in advance!!"
,Crissygail,2013-01-20T06:39Z,"Hi Hobbitwarez was curios if u would do a download of just  A m
Auto for music like Player pro power amp n7 and so on please that would be awesome if u can thanks
 CC.."
