User Type,Username,Date,Text
,str8885,2013-05-09T14:48Z,"Howdy,

What's wrong with the subtitles??? no english?"
,godcast,2013-05-10T01:05Z,this series has gone to shit. creativity is dead all around.
,maxnaz,2013-05-10T13:18Z,"None english Subs, its spanish i think, Whats up k1ng_ruLz?"
,crushz,2013-05-10T18:29Z,yeah subtitles is in another language can you please upload the subtitles only for this episode i dont wanna download the entire episode again
,bishalgrg,2013-05-11T19:12Z,"please k1ng_ruLz partner....
provide me a english subtitle"
