User Type,Username,Date,Text
,punVulc,2013-03-05T19:37Z,"
Is is a mistake copy or does it have 2 parts?"
[H],Azrael,2013-03-05T19:55Z,same file twice...looks like TvTeam meant to put a sample in and put the whole movie in again instead 
,bangtidy,2013-03-05T20:32Z,anyone know the A/V on this
,RNI75,2013-03-05T20:56Z,"they are fakes.
this Hungarian fucked all the time.
we need the English version, not the muck."
,punVulc,2013-03-05T22:17Z,"The sound is good i can even hear ppl in the cinema xD video is decent for cam
 id say A6.5 V7 thank your sir."
,punVulc,2013-03-05T22:18Z,It's english version with hc'd subtittles.
,bangtidy,2013-03-07T22:35Z,thanks @punVulc 
