User Type,Username,Date,Text
,PurpleOlrac,2013-05-02T08:35Z,"Password protected crap with survey to get password 

DONT DOWNLOAD"
,LindaNO,2013-05-03T13:58Z,Password protected shit. Don't waste your time downloading this. 
,khaamat,2013-05-13T01:28Z,"The password is  asd . 
seriously. 
i hate surveys and im pretty sure everyone else hates them too.
so do a favor to humanity and stop with this shit."
,73ch13,2013-05-20T21:04Z,"This is the 32 bit version, if you have a 64bitsystem it wont run."
,Zephmoseki63,2013-06-03T21:40Z,"my email is Zephmoseki@ovi.com

why the download require password to unlock. what is the password to unlock the zip file. please somebody help me please with password. thanks"
