User Type,Username,Date,Text
,JohanHornstull,2013-02-28T16:01Z,"Tack så jättemycket för det här avsnittet!
Den här gången var det inga som helst problem med synkningen.
Glädjande nog är det nu bestämt att det blir en säsong 2. 
Alltså ser jag fram emot fler riktigt bra och spännande avsnitt av en av de bästa serierna för närvarande, snyggt översatt och fixat av dig."
,_skrackvarg_,2013-02-28T16:18Z,"Ja, LOL klippen brukar ju vara bra. Lade inte märke till att ljudet var något efter på förra avsnittet då jag mest är fokuserad på att texten ska överensstämma med ljudet och vara utan stavfel. Men nu är jag mer uppmärksam så förhoppningsvis kommer det inte upp fler osynkade avsnitt."
,JohanHornstull,2013-02-28T17:05Z,"Jag vet hur slitigt det kan vara.
Jag översatte film för sajten Moviecom tills den lades ned under nicket Sir TranslateAlot.
Det var så slitigt/jobbigt/hårslitande/kaffekrävande men jag måste erkänna att jag saknar det. Mycket..."
,georgios71,2013-02-28T17:07Z,Hej. skulle bara fråga när 15 och 16 kommer med swesub????? tack mvh georgios71
,_skrackvarg_,2013-02-28T20:49Z,"@JohanHornstull 
Ja, det tar ju ett par timmar per avsnitt. Har ju dock inte hållit på särskilt länge än, ett halvår bara. Började för att jag tröttnade på att det aldrig kom swesub till True Blood, så tog saken i egna händer. ^^

@georgios71
Förhoppningsvis kommer avsnitt 15 upp imorgon eftermiddag/kväll. Avsnitt 16 kommer förmodligen upp nästa vecka någon gång."
,runcom,2013-03-01T11:38Z,tackar tackar kanon!
,McGuire,2013-03-01T17:27Z,Tackar & bockar för UL!
,ondsvensk1,2013-03-07T20:03Z,Tack som fan.
