Filename,Size,Unit
A Lying Wonder - Pastor Gary.avi,754.99,M
Balls (Sermon) Part 1-Omega Ministries.flv,332.62,M
Balls (Sermon) Part 2-Omega Ministries.flv,561.41,M
Blemished Sacrifices.flv,299.7,M
Contending with Jezebel Spirit - Gary C. Price.flv,35.83,M
Damnable Doctrines of The Matrix Disney World - Gary Price.avi,608.56,M
Info.txt,4.5,K
POtHS - Why We Do What We Do.txt,7.89,K
Shorts/Shocking Message On Prayer Prayerfest by Shane Idleman.flv,66.74,M
Shorts/Strange Face Appears On The Gulf of Mexico Sea Floor.flv,1004.88,K
Shorts/THE ACT OF 1871.flv,65.3,M
Shorts/The American Red Double Cross.avi,51.81,M
Shorts/The Antichrist Maitreya Commercial On CNN _ History Channel.flv,5.43,M
Shorts/The Ignition of Prayer - YouTube.flv,3.25,M
Shorts/The War of Gog and Magog - Israel vs Iran - A Quick Update - YouTube.flv,12.55,M
Shorts/UN Seeking New Global Tax for new global govt.flv,23.23,M
Shorts/Vaccine Fascism Ramping Up Again.flv,29.84,M
Shorts/Week ending 10-14-12.flv,10.71,M
Shorts/When Fallen Angels Strike School Murders Jenni Rivera Mystery Macho Camacho Pentagrams more.mp4,156.51,M
Shorts/Where Are The Men of God.flv,10.26,M
Shorts/Whistleblower who revealed CIA torture sentenced to prison.flv,28.58,M
Shorts/Wretched  A Palestinian Puppet Show.flv,7.75,M
Shorts/Wretched  Safe legal and torturous pt2.flv,7.49,M
Shorts/Your Indoctrination.flv,26.33,M
SlaughterHouse.flv,308,M
THE SIN OF SELF RIGHTEOUSNESS 1-2.webm,92.4,M
THE SIN OF SELF RIGHTEOUSNESS 2-2.webm,91.9,M
Torrent downloaded from Conspiracyhub.com.txt,47,B
Xtras/Martyrs of Today/Concerns grow over fate of Christians in ME - Press TV News - YouTube.flv,9.89,M
Xtras/Martyrs of Today/I Have Decided - IDOP Feature Video.mp4,49.86,M
Xtras/Signs of the Times/10 Predictions for 2013.mp4,72.77,M
"Xtras/Signs of the Times/100,000s  UNBELIEVABLE FISHKILL in Lousiana -- ALL TYPES, EVEN MAMMALS.flv",3.06,M
Xtras/Signs of the Times/1000s of dead birds on Michigan shorelines 1-6-13.mp4,26.83,M
Xtras/Signs of the Times/2 Million Birds fall from sky dead Russian says TEMPLATE_AD.flv,9.65,M
Xtras/Signs of the Times/7000 Buffalo die in Vietnam The Mass animal deaths continues End time news 2011! Dead Buffalo..flv,8.91,M
Xtras/Signs of the Times/ALERT  This Describes The Plan As Predicted Since May 2001 VIRALIZE.flv,16.87,M
Xtras/Signs of the Times/AMAZING UFO Battles Over San Diego Captured.flv,118.25,M
Xtras/Signs of the Times/Animals Playing Dead.mp4,40.1,M
Xtras/Signs of the Times/Attention Your Smartphone Is Watching Everything You Do.flv,29.17,M
Xtras/Signs of the Times/Being Fat Is Officially Illegal In Japan.flv,10.64,M
Xtras/Signs of the Times/BREAKING NEWS  Major Fish Kill In Mississippi.flv,1.88,M
Xtras/Signs of the Times/California Kill  Million floating dead fish fill marina.flv,15.64,M
Xtras/Signs of the Times/Chicken Fed Illegal Drugs Sent to Fast Food Chains.flv,9.41,M
Xtras/Signs of the Times/Copahue volcano eruption alert.avi,5.7,M
Xtras/SIN-ister Clips/Dead Birds and Fish in Ark.flv,16.22,M
Xtras/SIN-ister Clips/DRONE WARFARE HI-TECH WEAPONRY priority in China.mp4,12.36,M
Xtras/SIN-ister Clips/Endtime News Updates 1-2-13.flv,145.41,M
Xtras/SIN-ister Clips/EQs are increasing worldwide.mp4,32.11,M
Xtras/SIN-ister Clips/Fight for a Free _ Open Internet Let Your Voice Be Heard.mp4,84.38,M
Xtras/SIN-ister Clips/Freedom of Information  Abortion Statistics Discussion.flv,22.43,M
Xtras/SIN-ister Clips/Homo Sapiens 1900 - Zimbio.mp4,5.81,M
Xtras/SIN-ister Clips/Illuminati Disaster Preditions _Past_ Present.mp4,125.06,M
Xtras/SIN-ister Clips/Islam in American Public Schools 2001 and Hindu prayer.mp4,25.65,M
Xtras/SIN-ister Clips/LA SINK HOLE_   EQ Tremors OFF THE MAP   Part 1.mp4,95.22,M
Xtras/SIN-ister Clips/LIST OF CURES AGAINST RADIATION.avi,6.13,M
Xtras/SIN-ister Clips/Stop and Hear the Music - one of the nations greatest violinists - would you stop to listen.mp4,7.38,M
Xtras/SIN-ister Clips/Thousands of birds fall from the sky in South America.flv,4.01,M
Xtras/SIN-ister Clips/Why Do All These Uprisings Use The Same Raised Fist Logo - Oh Thats Why.avi,123.05,M
Xtras/The Holy Spirit/Before The Last Depression by David Wilkerson.mp4,4.14,M
Xtras/The Holy Spirit/Chris Tomlin How Great is Our God - Quão Grande é Nosso Deus.flv,16.47,M
Xtras/The Holy Spirit/God of Wonders - Third Day and Caedmons Call2.flv,12.36,M
Xtras/The Holy Spirit/God Will Make a Way ain.flv,11.86,M
Xtras/The Holy Spirit/GODS WONDERFUL PEOPLE Traditional Choruses.mp4,48.97,M
Xtras/The Holy Spirit/He Knows My Name - EXCLUSIVE BONUS Commentary by songwriter Tommy Walker.avi,303.71,M
Xtras/The Holy Spirit/Hidden Message in Genesis WOW (2).flv,8.22,M
Xtras/The Holy Spirit/Hillsong - Mighty to Save 2.flv,23.59,M
Xtras/The Holy Spirit/I Could Sing of Your Love Forever .flv,6.62,M
Xtras/The Holy Spirit/Is moral relativism livable.flv,2.52,M
Xtras/The Holy Spirit/Jotta A-Agnus Dei.flv,25.43,M
Xtras/The Holy Spirit/Living A Life That Glorifies Jesus Christ by Paul Washer2.flv,27.43,M
Xtras/The Holy Spirit/Nascar Boogity False Preacher Joe Nelms EXPOSED.flv,31.27,M
Xtras/The Holy Spirit/Sackcloth Ashes If Tomorrow Never Comes.flv,33.46,M
Xtras/War and Rumors of Wars/Update  Massive Explosion Reported After CIA Drone Targets Indianapolis.flv,25.18,M
Xtras/War and Rumors of Wars/Video Shows Syria Rebels Gun Down Man and Mass Death Pit.flv,2.23,M
