User Type,Username,Date,Text
,SomeBoyFromVillage,2013-01-28T10:03Z,thnx EZ!
,Chryzostomus,2013-01-28T22:36Z,"Thank you so much! Great quality, best download speed - like always :)"
,JustAnotherApprentice,2013-01-29T03:46Z,"Thanks a lot,eztv!"
,lindajack,2013-02-03T00:30Z,"Hank should not have gone to that cheapshit rockstar's place. Now he has gone against his own wishes, and has suffered a loss. He's probably in Judas's garden. Plus he has exposed Karen to that cheapshot. Now he stands to lose a lot all over again. Can't Hank get a grip? Does it always have to be just one more time?"
,itisme2011,2013-02-05T16:04Z,next episode will be on NEXT WEEK
,seednope,2013-02-14T04:10Z,"lindajack:  You DO understand that Hank Moody is a fictional character, right? "
,dodo_dudut,2013-02-23T21:41Z,"Great episode, nice plot so far. Storyline is intelligent and i wouldn't change it even a bit. Quality - A10 V10. I usually watch everything at film.plotar.org	because they always have HD but they don't have tv shows so having TPB for TVshows is great, thnx!"
