User Type,Username,Date,Text
,marvelnerd76,2013-04-23T15:43Z,Wow this a great compilation! Thank you! P.S. I finished reading Underwater Welder. That was a great story. I have even more respect for Lemaire's writing than ever before. Thanks for the scoop!
,marvelnerd76,2013-04-23T15:48Z,Oh yeah thanks for sharing ALF! Loved the show back in the day. 
[V],STFmaryville,2013-04-23T17:23Z,"very glad you liked the underwater welder.
very glad you liked alf.
if there are two better examples to prove you enjoy many different kinds of sequential art, i don't know about 'em!  ;-)"
,ChingaTuu,2013-04-23T21:38Z,"...Excellent but eclectic set there, STFM. Once again, you have my thanks, sir!"
[V],STFmaryville,2013-04-24T00:17Z,you're welcome ChingaTuu. enjoy!
,ggaanneesshhaa,2013-04-24T02:19Z,"I've waited many, many years to be able to read this complete collection. Thank your very much, STFmaryville!"
,stoooopid316,2013-04-24T03:45Z,"There was so much great, exclusive material in this series.  I've got many of the issues, but not all, and am ecstatic to run across this set!  Thank you so much!"
[V],STFmaryville,2013-04-24T15:14Z,"you're both welcome. later this week, a torrent of x-men classic #46-110 to complete your sets!"
,ward09,2013-04-25T06:35Z,"Wow, I've been looking for these for a long time. This is the series that got me into comics in the 80's. I have them all boxed away in storage, and several covers signed by Art Adams. Registered just to say thanks. Thank you, thank you thank you! "
[V],STFmaryville,2013-04-25T13:56Z,you're welcome ward09
[V],STFmaryville,2013-04-29T21:43Z,"Took me a few extra days, but here are the rest of them:  http://thepiratebay.sx/torrent/8423546/"
