User Type,Username,Date,Text
,DumbLuck,2013-02-04T17:02Z,Fuck yeah! Thanks!
,Eugenie64,2013-02-04T17:23Z,"I just noticed your last files are significantly smaller than the first one you posted. It will be quicker to download. Again, all my gratitude for this"
,flibber,2013-02-04T21:15Z,DOES NOT WORK.  BROKEN.  DO NOT WASTE YOUR TIME DOWNLOADING THIS
,himymfan,2013-02-06T01:16Z,"Only one small complaint; five or six Netflix boops and beeps throughout the episode.

Otherwise, great. Thanks so much"
,accerules,2013-04-09T03:21Z,a few glitches (skips and beeps). Otherwise good job
