Filename,Size,Unit
CIRU-HUA/01 Ciru-Hua.mp3,9.5,M
CIRU-HUA/02 El corazón arde en rojo.mp3,11.46,M
CIRU-HUA/03 Cena para dos.mp3,6.21,M
CIRU-HUA/04 Ivi Isi Amua.mp3,9.76,M
CIRU-HUA/05 Girasoles en la ventana.mp3,5.77,M
CIRU-HUA/06 Santa María.mp3,10.44,M
CIRU-HUA/07 Miserika.mp3,7.14,M
CIRU-HUA/08 Febrero.mp3,7.14,M
CIRU-HUA/09 Vis la Nuit.mp3,7.6,M
CIRU-HUA/10 Enloqueciendo por amor.mp3,5.15,M
CIRU-HUA/11 Misdri.mp3,2.91,M
El Secreto en La Musica de Los Angeles Disc 1/01 Ciru-Huá.mp3,9.41,M
El Secreto en La Musica de Los Angeles Disc 1/02 Miseriká.mp3,7.1,M
El Secreto en La Musica de Los Angeles Disc 1/03 A Lolék en Abrl.mp3,8.56,M
El Secreto en La Musica de Los Angeles Disc 1/04 Tsu Si VI Sab San Gabriel.mp3,5.78,M
El Secreto en La Musica de Los Angeles Disc 1/05 La Santa Rosa.mp3,8.46,M
El Secreto en La Musica de Los Angeles Disc 1/06 Dimitir Mein.mp3,4.56,M
El Secreto en La Musica de Los Angeles Disc 1/07 El Corazón Arde en Rojo.mp3,11.46,M
El Secreto en La Musica de Los Angeles Disc 1/08 Cena Para Dos.mp3,6.14,M
El Secreto en La Musica de Los Angeles Disc 1/09 Preludio a Zadkiel.mp3,10.98,M
El Secreto en La Musica de Los Angeles Disc 1/10 Santa María Reina de Los Ángeles.mp3,10.44,M
El Secreto en La Musica de Los Angeles Disc 1/11 Sharatán.mp3,7.14,M
El Secreto en La Musica de Los Angeles Disc 2/01 La Luna de Las Cascadas.mp3,9.96,M
El Secreto en La Musica de Los Angeles Disc 2/02 L' Allegria di Joffiel.mp3,8.06,M
El Secreto en La Musica de Los Angeles Disc 2/03 Misdri.mp3,7.03,M
El Secreto en La Musica de Los Angeles Disc 2/04 Tema de San Rafael.mp3,2.92,M
El Secreto en La Musica de Los Angeles Disc 2/05 Ma'keeley.mp3,10.98,M
El Secreto en La Musica de Los Angeles Disc 2/06 Aleluya.mp3,7.65,M
El Secreto en La Musica de Los Angeles Disc 2/07 Yum-Kin.mp3,10.91,M
El Secreto en La Musica de Los Angeles Disc 2/08 Guardianes Mayas.mp3,8.33,M
El Secreto en La Musica de Los Angeles Disc 2/09 Milangeló.mp3,7.91,M
El Secreto en La Musica de Los Angeles Disc 2/10 Om Nama Shivayá.mp3,9.28,M
El Secreto en La Musica de Los Angeles Disc 2/11 Meditación Angélica.mp3,19.85,M
"Labbra-Rosse/01 Matter Doratta, lluvia de estrellas.mp3",9.12,M
Labbra-Rosse/02 Labbra rosse.mp3,6.39,M
Labbra-Rosse/03 Marcha nupcial del cielo con la tierra.mp3,6.46,M
Labbra-Rosse/04 A lolék en abril (en memoria a Juan Pablo II).mp3,8.7,M
Labbra-Rosse/05 Margherita.mp3,7.41,M
Labbra-Rosse/06 Fuoco d'amore.mp3,7.8,M
Labbra-Rosse/07 Salve justinius.mp3,9.57,M
Labbra-Rosse/08 Tango en rojo.mp3,6.72,M
Labbra-Rosse/09 Sicilia.mp3,6.68,M
Labbra-Rosse/10 1904 en Villarreal.mp3,7.02,M
"Labbra-Rosse/11 Matter Doratta, lluvia de estrellas (instrumental).mp3",9.15,M
Labbra-Rosse/12 Dimitir-mein.mp3,4.73,M
Labbra-Rosse/13 Oui-olé.mp3,10.12,M
Reine du ciel/01 Partition du chocolat.mp3,10.53,M
Reine du ciel/02 Reine du ciel.mp3,9.53,M
Reine du ciel/03 L´Alegria di joffiel.mp3,8.16,M
Reine du ciel/04 Preludio Azadkiel.mp3,11.06,M
Reine du ciel/05 La santa rosa.mp3,8.56,M
Reine du ciel/06 Tema de San Rafael.mp3,7.1,M
Reine du ciel/07 Tsu si vi sab.mp3,5.87,M
Reine du ciel/08 En Andalucía.mp3,4.75,M
Reine du ciel/09 El vals de la noche.mp3,7.07,M
Reine du ciel/10 Café francés.mp3,6.79,M
Reine du ciel/11 La española.mp3,5.13,M
Reine du ciel/12 Haniel.mp3,11.46,M
Reine du ciel/13 Gloria al señor.mp3,5.93,M
Sharatan/01 Dis Moi.mp3,6.97,M
Sharatan/02 Sharatán.mp3,7.23,M
Sharatan/03 Mar de Akilá.mp3,8.67,M
Sharatan/04 La luna de las cascadas.mp3,10.01,M
Sharatan/05 L'amore è bello.mp3,9.98,M
Sharatan/06 Tema de Soumaya.mp3,9.27,M
Sharatan/07 ZAPATILLAS DE CRISTAL.mp3,7.23,M
Sharatan/08 El árbol de los ciruelos.mp3,6.96,M
Sharatan/09 Milangelo.mp3,8,M
Sharatan/10 Magic Time.mp3,7.19,M
Sharatan/11 A Estéfana en Octubre.mp3,8.93,M
Zuhuy Mayae/01. Zuhuy Mayae  ( Vírgen Maya).mp3,2.9,M
Zuhuy Mayae/02. Tak-tuxul  (más allá).mp3,2.7,M
Zuhuy Mayae/03. Ma' kéeléy.mp3,3.31,M
Zuhuy Mayae/04. Ukakil yakunah  (fuego de amor).mp3,2.33,M
Zuhuy Mayae/05. Koolebil xkiik  (la doncella Xquic).mp3,2.55,M
Zuhuy Mayae/06. Aleluya.mp3,2.32,M
Zuhuy Mayae/07. Xurik ma'pa yeleil  (ojos de jade).mp3,2.6,M
Zuhuy Mayae/08. Bayaal úu  (luna creciente de Xpuxá).mp3,2.63,M
Zuhuy Mayae/09. Uakabil Pakalóo  (noche de Angeles).mp3,3,M
"Zuhuy Mayae/10. Unpp'l lol, lol  (una rosa roja).mp3",2.42,M
Zuhuy Mayae/11. Ox kinil hó uinal  (Tres de Mayo).mp3,2.35,M
