User Type,Username,Date,Text
[V],STFmaryville,2013-05-30T13:55Z,"blackcanary, thank you for all your superman uploads. the ""time and time again"" crossover is a favorite i'd pretty much forgotten!

hey do you know if Re-em-Novus is still doing Star Trek from IDW? last one i saw was #18 i believe...?

thanks again for all your uploads."
[V],blackcanary,2013-05-31T01:34Z,"STFmaryville, Re-em is not releasing IDW's Star Trek ongoing series anymore.  I'm waiting for a fixed version of #21 by ManFromOrion to be released before uploading it."
[V],blackcanary,2013-05-31T05:01Z,"Phase 2 of Time and Time Again - Action Comics v1 #663:
https://thepiratebay.se/torrent/8523773"
