User Type,Username,Date,Text
,xMovie_Buffx,2013-02-14T14:50Z,is this NTSC or PAL?
[V],NLUPPER002,2013-02-14T20:31Z,"Sorry forgot to write it, it is PAL"
,xMovie_Buffx,2013-02-14T21:36Z,thanks
,roobbai2,2013-02-15T13:53Z,"Komt de blu-ray werkelijk pas 2 maart uit? Ik dacht dat die ook vandaag uit kwam... Wanneer denk je hem te kunnen uploaden NLUPPER002? 
P.s. bedankt voor al het werk dat je altijd doet, geweldige uploads heb je altijd!"
,Silvelayne,2013-02-27T21:05Z,"hey guys! How can I watch It??? I've already download it, and it came as a several videois in Vob format. I'd appreciate your  quickly answer because I'm interested in watching it  . thanks ;)"
