User Type,Username,Date,Text
,AlanRayan,2013-02-19T07:36Z,"You not saying if the program is free of not !! Does it neet registration or not !!
You just want us to download it then start demanding this n that . Thaat's not fair . just fucking say it black n white why hide behinde the words."
,AlanRayan,2013-02-19T07:38Z,"You not saying if the program is free of not !! Does it neet registration or not !! fully working trial or full version ?? many things arent clear .
You just want us to download it then start demanding this n that . That's not fair . just fucking say it black n white why hide behinde the words."
,toorentz,2013-02-19T09:08Z,"@AlanRayan
you should read the description first.it is a full version.if you don't satisfied then vist the link of playstore giving in the description.

read the description before posting comment...thankyou"
,TheMercO,2013-02-20T12:05Z,thanks man
