User Type,Username,Date,Text
,ThePriestSeto,2013-01-14T06:35Z,Please SEEEEEEEED
,DrkDream,2013-01-16T16:54Z,"This torrents is very well seeded and has been alive for over a year even if the counter doesnt seem accurate. 

I may have just put it on PirateBay not that long ago but the average download speed is 1.5MB/s

Enjoy!!"
,N0v1N0v,2013-04-12T00:18Z,Thanks for the torrent! Perfect quality! So much nostalgia... Keep up the great work! :)
,GreenyAUS,2013-05-08T08:48Z,Average download speed is not 1.5MB/s. It is infact 70KB/s.
