User Type,Username,Date,Text
,Nate8466,2013-04-11T00:58Z,Posted with no seeders? Come on man at least seed your own stuff you idiot.
[V],R0thschild,2013-04-11T02:13Z,"Get your glass and try to see again, blind cocksucker!
Seeders: 101"
,ectoendomezo,2013-04-12T00:21Z,"Yeah..have to get in on this juicy confrontation..

So first..thanks R0thschild..you're the BEST..

Second..this is p0rn so it wouldn't really be that surprising if there were limited seeds...but seed whiners already annoy me..but also..R0thschild is THE premier sharer of this kind of material..looking at my collection the other day I realized its literally 99% R0thschild..all excellent..good screens..green skull..trusted source..aka ""Pro"".

So I take umbrage at anyone giving this UL'er any crap.

And thus endeth my patronizing for the day..although it is heart felt..

Thanks R0thschild..for ALL the great entertainment you provide..I should have done it sooner..oh well..please keep up the great work..it IS appreciated."
