Filename,Size,Unit
The Hunchback of Notre Dame (1996) 1080p DTS-HDMA BD50.nfo,791,B
The Hunchback of Notre Dame (1996) 1080p DTS-HDMA BD50/The Hunchback of Notre Dame (1996) 1080p DTS-HDMA BD50.iso,27.26,G
Torrent Downloaded From ExtraTorrent.com.txt,339,B
Torrent Downloaded from digtorrent.org.txt,178,B
Torrent Downloaded from limetorrent.txt,47,B
Torrent downloaded from AanMeHoelaJa Torrents on BTScene.eu.txt,71,B
Torrent downloaded from AhaShare.com.txt,58,B
Torrent downloaded from KAT.ph.txt,41,B
Torrent downloaded from P2PDL.com.txt,37,B
Torrent downloaded from silvertorrent.org.txt,86,B
Torrent downloaded from thepiratebay.se.txt,50,B
tracked_by_h33t_com.txt,23,B
