User Type,Username,Date,Text
,thaiboxer10,2013-02-26T13:35Z,all these seeders and leechers and no comments 
,tyranite,2013-02-26T14:43Z,"A9
V9
thanks, scene4all"
,Zher4Xx,2013-02-26T18:39Z,i can whatch 10min then it crashes! this torrent will be my third one... is this torrent/movie legit? 
,vampzcore,2013-02-26T19:36Z,thanks!!
,mulukku1,2013-02-26T20:17Z,There will be shit talking here soon.
,yonkers77,2013-02-26T21:05Z,"Video 10

Audio 9

thanks great copy"
,devasko,2013-02-26T22:55Z,Best movie ever! I haven´t actually seen it but I think I can safely deduce that it is from the cover.
,devasko,2013-02-26T23:05Z,Ok I´ve seen it now and I was totally not wrong. I score it 11/10. I mean the ending when that guy dies and the american flag waves in the distance was so awesome. OMG Scott Wiper and Declan O'Brien are the true real heroes.
,CarlZeiss,2013-02-26T23:25Z,look at that terrorist
,garoden75,2013-02-27T04:00Z,"@pjatgv your probably some mutt illegal alien who blows guys for money! Nobody wants to hear your bullshit! If you happen to be a ragheaded towel jockey faggot, then I hope you blow yourself up while your sucking off some Iranian, cuz I know from being in Iraq as a U.S. Marine all Iraqi men are faggots they walk around holdin hands wearing man dresses and wiping their asses with their bare hands. You make me sick you fucking scumbag. Fuck Mohammad he was a lying goatfucker and your all a cult of terrorist faggots, there aren't any virgins waiting for you the Marines fucked em all while we were there and our Honored dead fucked the ones in Heaven so you'll never see a woman virgin as if you'd have one fag. Take a deep breath and blow as hard as you can it might dislodge your head from your ass, but then again your better off that way you piece of shit. "
,garoden75,2013-02-27T04:04Z,"Almost forgot, Thanks for the Up scene4all your ups are usually Good 2 Go. I will rate after DL. 
Thanks"
,5atan,2013-02-27T05:35Z,ill download just to see that Armsel Striker shotgun on the cover tearin' through the Islamists!!!
,antiseed,2013-02-27T06:37Z,"didnt take long for the gun-ho amuricans to start ranting their worthless shit... fucking comment on the movie

looks good thanks to the 2 people that commented..
thanks s4a for the upload, movie looks good too"
,rsilva3,2013-02-27T08:18Z,dum movie
,vincentian,2013-02-27T08:30Z,Anything by WWE or any wrestling companies of a similar nature is gay
,wizonmeth,2013-02-27T09:14Z,AMERICA.... FUCK YEA
,Drasticenigma,2013-02-27T11:43Z,I thought the marines would of at least taught discipline garoden is going off his head. Chill bro
,Drasticenigma,2013-02-27T11:54Z,I thought the US marines would at least teach disclipline garoden is going off his head. Deep breaths bro
,bearman362,2013-02-27T13:36Z,"KILL A COMMIE FOR MOMMIE.HEY PJATGV,IF YOU DON'T LIKE THE U.S.A. ,GO BACK HOME TO YOUR FUCK BUDDIES,  AKA  YOUR CAMELS  "
,azynkron,2013-02-27T18:45Z,"Retarded drooling fucking cancer mongoloid US redneck pieces of shits. Only in a shit country like yours where everyone is brainwashed to do whatever the corporations say can a movie like this see the light of day. You are so fucking dumb, you cretins, so you actually make stupid Europeans look like rocket scientists. Go take a big Mc Donalds burger with a a coke and a fucking ugly US flag and shove it up where the sun never shines, you imbeciles. "
,spex420,2013-02-28T03:41Z,"@azynkron

every country has a mcdonalds so you can go choke on a big mac you fuck i find it funny everyone hates america but when you have the chance to live here as a student w/e its suddenly ""home"" and you stay illegally 
 lets be honest america is the only country that matters and americans are the only people that matter everyone go kills yourselves and make room for more good americans 


AMERICA FUCK YEA"
,MHNZ,2013-02-28T05:02Z,... and welcome to the special Olympics - who even win is still _ _ _ _ _ _ _!!
,oZo_61,2013-02-28T07:01Z,"Hey, pjatgv? Go fuck your dad in the mouth, and pray for a quick death, faggot boy. American is still better than any other place in the whole shit covered Earth. America....Fuck Yeah!
lol. Homo."
,oZo_61,2013-02-28T07:04Z,"Oh, and azynkron ? You can toss pjatgv's salad for him. I think his dad is tired. You two homo boys wish you were Americans. But you're not. You shit covered foreigners. Go get in line and take more American dollars, while you scream how you hate us, pussies. lol. Two homos. Butt buddies."
,GreenBlount,2013-02-28T08:42Z,"The sad truth is,that reality is just like this kind of movies:fake.America will go down like every other sadistic,conquering empire did.Rome,3rd Reich,UdSSR,you name it.Home of the brave?Hardly,when more american soldiers kill themselves,then die on the battlefield.Land of the free?A sick joke,right?"
,Terra_Rising,2013-02-28T13:06Z,"I don't see why everyone get's so angry at the anti-american comments. Through their anger and frustration, they are paying your country the highest compliment. All that anger comes from envy, and a jealous desire to get a chance to live like people do in America. You would feel the same way if you had to live the way they do and had to watch the American lifestyle on your TV screen. It must be frustrating as hell. Take it as a compliment. Be glad it's not you that is living the only life you are going to live in some underdeveloped, crap country. Take the compliment in stride. Only Americans (and Canadians by default) get this privilege simply by being born there."
,murder-onez,2013-03-01T17:08Z,what the fuck is this.. another wrestling star try out for movies?
,luke.daniel,2013-03-02T03:01Z,what the fuck is wrong with the americans lol your country isn't the best and the only one that matters just remember who bailed you out in the world wars while your ass was being kicked 
,luke.daniel,2013-03-02T03:05Z,nobody is jealous of a country that controls its people and has some pathetic solders (not all) that kill kids for fun . some of the comment on here from americans shows how retarded some of you are 
,Amerika72,2013-03-02T05:19Z,"There were two WW's with America, one, was with Japan...........we didn't need help in that one at all...........the other, well, was with Germany, which was NOT our war......if it wasn't for US, europe would be fully German, which IMO, would have been a good thing......say what you will, I don't like America anymore, what it has become, but it's still better then the shit countries all you haters come from, it will only be a matter of time, even the International Bankers that own this world are getting tired of waiting for a New World Order, it's time for WW3, lets just nuke the  whole fucking planet an end human existence.............bunch of dumb fucks, you do realize what started AMERICA? Europeans and  other foreigners you stupid fucks, and what is an american? it's every fucking nationality you stupid fucks, so you saying shit about Americans is actually saying shit about your own people and countries dumb fucks."
,oZo_61,2013-03-02T06:45Z,"You European swine are funny. We kicked you off this continent, then saved your asses twice. Now your ""Euro"" economy is failing. LOL!
LOSERS!"
,mangler58,2013-03-02T09:58Z,"I haven't even seen this movie, but I'm inclined to announce just how pathetic you all are. If we truly were worth our opinions, you all would be a bunch of retarded toad sucking vermin, that know nothing of war, history and this country. Of a certainty, ignorance must be a genetic problem here and stupidity, an incurable disease. I believe the most of you are just like the rest of the world, following some fad or trend and can not think for yourselves and have homosexual tendencies. But, be it unto me to have to tell you, most of the world is consumed by war and poverty and the U.S. is used like a political asylum for anyone trying to find a better life. Stop trying to find fault and make a difference with who you are, than creating more havoc. Not showing how superficial and stupid you are every time you open your mouths and pray you never have to go to war and stop tying to create one. Reality is not a video game, nor is anything accomplished by idiosyncrasy. "
,krille470,2013-03-02T20:17Z,"fucking usa china will massacre all of seattle and all hillbillies with their f-150 and rifles. your country totally gay, crazy people and zero pride or culture"
,saqlain,2013-03-02T23:37Z,"a - v 8/10
m - Gave me diarrhea !!!!! so you can imagine the worst stereotypical movies WWE comes up with!"
,steven4,2013-03-03T03:18Z,thanx rishman...
,7thSense,2013-03-04T06:29Z,"such pathetic idiots that use a movie comment section to debate about countries, get a life"
,AragontheRanger,2013-03-05T06:15Z,"For all those arguing over who is the better nationality I say this: No one is better than anyone, we Americans come from all different nationalities and we all get along decently enough. Yes I will agree with the anti-Americans that the U.S. is spiraling out of control and forgetting why we sought to become free to begin with. However, as a former Army soldier, I will also say that you anti-American pricks are either a.) mad because we Americans can/have beaten your country in a war, or b.) were denied the right to live in the country with the most freedoms.


P.S. I will rate this torrent after download is complete."
,AragontheRanger,2013-03-05T06:33Z,A/V   10/10 using mp on laptop
,bitshlap,2013-03-06T07:47Z,"LoL!! this movie was filmed in Canada!!!

Right here > 49.147000 , -122.390600"
,TD0607,2013-03-07T03:40Z,"Hehehe.
Nice to see the Americans trying so hard to fight back.

Some of you are right, you did help us Europeans with WW2, and I thank you for that.

After WW2, there were some slight ""not so nice"" wars you dragged us into, like Iraq and Afganistan (to mention but a few), so I feel we've payed you back since then.

And I guess there are a lot of countries to your south that really appreciates your help in killing every good guy to be in politics the last 40 years.  At least we know there are some corrupt dictators that would thank you as well (although you probably killed most of them as well).

And the European economic problems, well, I can only say: Thank you USA!  This was NOT started in europe, and if you think so, you're probably one of those brainwashed idiots watching Fox News (if any news at all).  
Ohh, I almost forgot to thank you for having made an enemy of every extreemist out there, so now we have to handle them too...  So yeah, you're right we have so much to thank the USA for.

Just to mention it, I DON'T hate america, I just don't think you are very smart.  The average american seems easily manipulated into thinking whatever FOX or any other Goebbels wannabe manages to throw at them.  Which is a shame, cause you you could probably be a nice people if you hadn't been so paranoid that you had to make enemies all over the place.  Now it's probably too late, and you'll have live with that paranoia until you national dept has reached Pluto, and you suffer a dramatic economic collapse.  Good night and good luck!"
,luke.daniel,2013-03-08T03:24Z,americans are sounding like north koreans on here thinking america is great and everyone's jelous umm well no were not and also america got there fkin ass kicked in ww1 and ww2 so now they murder every country that dont have nukes cus there PUSSIES
,JapesMacF,2013-03-08T07:38Z,"luke.daniel 
The only reason America has been great is because people are (or can be) great. It's the prioritising individuality, or liberty, above our decent instinct for egalitarianism, or equality of outcome (not birth...we all agree on that) via statism, which has resulted in such ""greatness"". For it is it's people that are the greatest resource of a country; infinitely more than any other. This is the American way, that you can move here and become ""American"" in days. What's special about this is what I wrote in my first couple sentences. People are awesome! That is why *the idea of* America, is so loves. We have hope for one another. Great hopes. :)"
,Mau40,2013-03-08T19:17Z,"lollll

the only reason for a country like america is that they use their short comming manhood to hide behind an arsenal of nukes :):)
thats what makes ur country so great "
,save_us_y2j,2013-03-08T20:12Z,"Come On @garoden Why Are You Insulting The Prophet Muhammad ! I Know That ""pjatgv"" Is Stupid And Asshole But It has Nothing To Do With Islam Or anything !"
,save_us_y2j,2013-03-08T20:15Z,Besides The Movie Sounds AWWWESOME ! Oh and One Thing WWE haters Better SUCK d**k !
,save_us_y2j,2013-03-08T20:35Z,America Is One Of The Greatest Countries EVER! unlike IRAN It Doesn't Care About Your Religion Or Anything ! So Who Hates America Better Go And Fuck Him/Her Self ! Understood ? (PS: Muslims ARE NOT Terrorists AT ALL!)
,Jack_Reacher,2013-03-12T04:15Z,"Just to remind some of you anti-American asshats  there are two kinds of people in this world ... Americans and those that want to be Americans.  

Jealousy will rot your brain ..."
,bluedoo0r,2013-03-29T19:49Z,I LIKE HOW YOUS COMPARE US(country) to EUROPE(continent)
,bluedoo0r,2013-03-29T19:50Z,I GUESS THATS THE ONLY WAY YOU CAN COMPARE TO US
