User Type,Username,Date,Text
[V],2010kaiser,2013-02-28T20:44Z,The installer will seem to 'hang' for 30 secs or so when ran. It's not. Just give it time and it'll extract in 1-2 mins.
,ernstgustaf,2013-04-01T23:46Z,Serials does not work.
,davidst92,2013-04-30T22:26Z,"Works at first but then it ask you for a serial when you launch dreamweaver, and it keeps doing this everytime and it says serial invalid.... Soo in essence it doesnt work:("
[V],2010kaiser,2013-05-07T15:51Z,"@ernstgustaf and davidst92

Checked the App. again today 7/05/13 and works 100%. Check your procedure for installing again or watch the install video."
,Mister.9,2013-05-18T14:26Z,"Hi, Kaiser, Would you please tell me where the serials are? I could not find it in your torrent. emmm Waiting for your kind answer. Thanks"
