User Type,Username,Date,Text
,THRobinson,2013-02-24T00:51Z,"Finally!!! Such a great series, been waiting for a good quality rip to come out. :D"
,TrondiReleases,2013-02-24T01:13Z,"Yes, one of my favorites too. Maybe because it reminds me of X-Files, dunno. Anyway, thanks for your comment and enjoy all five seasons of Fringe."
,THRobinson,2013-03-02T04:52Z,"Hoping so, sadly no one seeding seems to have 100%... I'm stuck for all seasons so far. :("
,stathis-77,2013-03-14T12:39Z,Hi friend I can't find Greek Subs for fringe!!! 
,TrondiReleases,2013-03-14T15:29Z,"Hello neighbor! No, sorry but we are not releasing any subtitles... yet. Try and Google them."
