User Type,Username,Date,Text
[T],CoWBoYWWE,2013-04-10T19:47Z,"guys i dont think so i can upload anything now..
i dont have access to my account someone has messed it up ! but will try my best to return"
,matt12343234,2013-04-15T07:54Z,"@CoWBoYWWE can you make a new account and try to upload or something.....really miss your uploads...
i dont have a fast broadband connection...so your torrents were really useful...am sure there must be others like me too missing the small sized torrents :(

anyways thanks for all the work you have done till now :)"
