Filename,Size,Unit
Daybreaker/01 The Bitter End.m4a,5.88,M
Daybreaker/02 Alpha Omega.m4a,7.6,M
Daybreaker/03 These Colours Don't Run.m4a,7.78,M
Daybreaker/04 Daybreak.m4a,6.83,M
"Daybreaker/05 Truth, Be Told.m4a",8.65,M
"Daybreaker/06 Even If You Win, You're Still a Rat.m4a",6.14,M
Daybreaker/07 Outsider Heart.m4a,6.86,M
Daybreaker/08 Behind the Throne.m4a,7.89,M
Daybreaker/09 Devil's Island.m4a,7.99,M
Daybreaker/10 Feather of Lead.m4a,5.59,M
Daybreaker/11 Unbeliever.m4a,8.99,M
Daybreaker/12 Cracks In the Earth.m4a,6.5,M
Daybreaker/13 Rise Against.m4a,7.35,M
Daybreaker/14 Untitled.m4a,6.62,M
Hollow Crown/01 Early Grave.m4a,6.93,M
Hollow Crown/02 Dethroned.m4a,6.04,M
Hollow Crown/03 Numbers Count for Nothing.m4a,7.62,M
Hollow Crown/04 Follow the Water.m4a,7.41,M
Hollow Crown/05 In Elegance.m4a,8.41,M
Hollow Crown/06 We're All Alone.m4a,6.11,M
Hollow Crown/07 Borrowed Time.m4a,4.99,M
Hollow Crown/08 Every Last Breath.m4a,7.01,M
Hollow Crown/09 One of These Days.m4a,5.17,M
Hollow Crown/10 Dead March.m4a,7.65,M
Hollow Crown/11 Left With a Last Minute.m4a,5.87,M
Hollow Crown/12 Hollow Crown.m4a,9.41,M
Hollow Crown/To the Death (2008).m4a,5.05,M
The Here and Now/01 Day In Day Out.m4a,6.48,M
The Here and Now/02 Learn to Live.m4a,8.31,M
"The Here and Now/03 Delete, Rewind.m4a",6.46,M
The Here and Now/04 BTN.m4a,8.07,M
The Here and Now/05 An Open Letter to Myself.m4a,6.71,M
The Here and Now/06 The Blues.m4a,6.82,M
The Here and Now/07 Red Eyes.m4a,8.83,M
The Here and Now/08 Stay Young Forever.m4a,6.35,M
The Here and Now/09 Heartburn.m4a,7.44,M
The Here and Now/10 Year In Year Out_Up and Away.m4a,14.63,M
The Here and Now/11 Day In Day Out (Big Chocolate Remix).m4a,9.21,M
