Filename,Size,Unit
"CD1/01 Serenad, JS 167.mp3",5.16,M
CD1/02 Medan nordanvinden gnyr (While the North Wind Roars).mp3,2.37,M
"CD1/03 Näcken (The Watersprite), JS 138 (Dramatic 'runic sorcery' for soprano, recitation, violin, cello and piano).mp3",6.17,M
"CD1/04 Då världar ännu skapade ej voro (When Worlds Still Uncreated Were),  JS 56 [fragment].mp3",4.48,M
"CD1/05 En visa (A Song), JS 71.mp3",2.68,M
CD1/06 Solen slog himlen röd... (The Sun Reddened the Sky...) [fragment].mp3,2.89,M
"CD1/07 Orgier (Orgies), JS 143.mp3",4.28,M
"CD1/08 Skogrået (The Wood-Nymph), JS 171.mp3",12.11,M
CD1/09 Höstkväll (Autumn Evening) [fragment].mp3,4.35,M
CD1/10 Flickan gick en vintermorgon (The Maiden Went One Winter Morning) [fragment].mp3,1.51,M
CD1/11 Jag kysser dig [och ledsnar] ej (I Kiss You and Weary Not).mp3,1.79,M
CD1/12 Löjet var utan hem (Wit Was Without a Home).mp3,4.48,M
"CD1/13 Likhet (Alikeness), JS 120.mp3",3.07,M
"CD1/14 Den första kyssen (The First Kiss), JS 57.mp3",3.99,M
"CD1/15 Tule, tule kanssani (Come, Come, My Sweetheart), JS 211.mp3",2.39,M
"CD1/16 Seven Runeberg Songs, Op.13 - 1. Under strandens granar (Under The Fir-Trees).mp3",9.75,M
"CD1/17 Seven Runeberg Songs, Op.13 - 2. Kyssens hopp (The Kiss's Hope).mp3",3.98,M
"CD1/18 Seven Runeberg Songs, Op.13 - 3. Hjärtats morgon (The Heart's Morning).mp3",4.64,M
"CD1/19 Seven Runeberg Songs, Op.13 - 4. Våren flyktar hastigt (Spring Flies Speedily).mp3",2.89,M
"CD1/20 Seven Runeberg Songs, Op.13 - 5. Drömmen (The Dream).mp3",3.21,M
"CD1/21 Seven Runeberg Songs, Op.13 - 6. Till Frigga (To Frigga).mp3",7.24,M
"CD1/22 Seven Runeberg Songs, Op.13 - 7. Jägargossen (The Young Huntsman).mp3",5.27,M
"CD1/23 Seven Songs, Op.17 - 1. Se'n har jar ej frågat mera (Since Then I Have Questioned No Further).mp3",4.05,M
"CD1/24 Seven Songs, Op.17 - 2. Son in! (Go to Sleep!).mp3",3.13,M
"CD1/25 Seven Songs, Op.17 - 3. Fågellek (Play to the Birds).mp3",2.84,M
"CD1/26 Seven Songs,Op.17 - 4. Vilse (Astray).mp3",1.69,M
"CD1/27 Seven Songs, Op.17 - 5. En slända (A Dragonfly).mp3",7.81,M
"CD1/28 Seven Songs, Op.17 - 6. Illalle (To Evening).mp3",2.35,M
"CD1/29 Seven Songs, Op.17 - 7. Lastu lainehilla (Driftwood).mp3",2.32,M
"CD1/30 Koskenlaskijan morsiamet (The Rapids-Rider's Brides), Op.33 (arranged by the composer for voice and piano).mp3",21.49,M
"CD2/01 Sången om korsspindels (Fool's Song of the Spider), Op.27 No.4 from the music to Adolf Paul's Play King Christian II (arranged by the composer for voice and piano).mp3",6.52,M
"CD2/02 Segelfarht (Sailing), JS 166.mp3",2.86,M
"CD2/03 Souda, souda, sinisorsa (Swim, Duck, Swim), JS 180.mp3",2.28,M
"CD2/04 Säv, säv, susa (Sigh, Sigh, Sedges) - Andantino in E flat major, JS 42.mp3",4,M
"CD2/05 Six Songs, Op.36 - 1. Svarta rosos (Black Roses).mp3",3.59,M
"CD2/06 Six Songs, Op.36 - 2. Men min fågel märks dock icke (But My Bird is Long in Homing).mp3",4.32,M
"CD2/07 Six Songs,Op.36 - 3. Bollspelet vid Trianon (Tennis at Trianon).mp3",2.6,M
"CD2/08 Six Songs, Op.36 - 4. Säv, säv, susa (Sigh, Sigh, Sedges).mp3",4.7,M
"CD2/09 Six Songs, Op.36 - 5. Marssnön (The March Snow).mp3",2.49,M
"CD2/10 Six Songs, Op.36 - 6. Demanten på marssnön (The Diamond on the March Snow).mp3",3.81,M
"CD2/11 Five Songs, Op.37 - 1. Den första kyssen (The First Kiss).mp3",3.47,M
"CD2/12 Five Songs, Op.37 - 2. Lasse liten (Little Lasse).mp3",3.61,M
"CD2/13 Five Songs, Op.37 - 3. Soluppgång (Sunrise).mp3",4.43,M
"CD2/14 Five Songs, Op.37 - 4. Var det en dröm (Was it a Dream).mp3",3.72,M
"CD2/15 Five Songs, Op.37 - 5. Flickan kom ifrån sin älskings möte (The Tryst).mp3",5.45,M
"CD2/16 Jar ville, jag vore in Indialand (I wish I were in India).mp3",5.17,M
"CD2/17 Five Songs, Op.38 - 1. Höstkväll (Autumn Evening).mp3",8.5,M
"CD2/18 Five Songs, Op.38 - 2. På verandan vid havet (On a Balcony by the Sea).mp3",6.57,M
"CD2/19 Five Songs, Op.38 - 3. I natten (In the Night).mp3",7.09,M
"CD2/20 Five Songs, Op.38 - 4. Harpolekaren och hans son (The Harper and his Son).mp3",6.65,M
"CD2/21 Five Songs, Op.38 - 5. Jag ville, jag vore i Indialand (I wish I were in India).mp3",5.69,M
"CD2/22 Les trois sœurs aveugles (The Three Blind Sisters), JS 147 No.6 [Op.46 No.4] (from the music to M. Mætterlinck's play Pelléas et Mélisande) (arr. by JS. for voice and piano).mp3",6.74,M
"CD2/23 Six Songs, Op.50 - 1. Lenzgesang (Spring Song).mp3",4.45,M
"CD2/24 Six Songs, Op.50 - 2. Sehnsucht (Longing).mp3",3.58,M
"CD2/25 Six Songs, Op.50 - 3. Im Feld ein Mädchen singt (In the Field a Maid Sings).mp3",5.38,M
"CD2/26 Six Songs, Op.50 - 4. Aus banger Brust (From Anxious Heart).mp3",4.33,M
"CD2/27 Six Songs, Op.50 - 5. Der stille Stadt (The Silent City).mp3",4.77,M
"CD2/28 Six Songs, Op.50 - 6. Rosenlied (Song of the Roses).mp3",3.18,M
"CD2/29 Erloschen (Extinguished), JS 73.mp3",5.83,M
"CD3/01 Two Songs, Op.35 - 1. Jubal.mp3",8.07,M
"CD3/02 Two Songs, Op.35 - 2. Teodora.mp3",7.69,M
"CD3/03 Vänskapens blomma (The Flower of Friendship), JS 215.mp3",5.38,M
"CD3/04 Eight Songs, Op.57 - 1. Älven och snigeln (The River and the Snail).mp3",5.13,M
"CD3/05 Eight Songs, Op.57 - 2. En blomma stod vig vägen (A Flower Stood by the Wayside).mp3",3.92,M
"CD3/06 Eight Songs, Op.57 - 3. Kvarnhjulet (The Mill-wheel).mp3",5.27,M
"CD3/07 Eight Songs, Op.57 - 4. Maj (May).mp3",4.82,M
"CD3/08 Eight Songs, Op.57 - 5. Jag är ett träd (I am a Tree).mp3",5.12,M
"CD3/09 Eight Songs, Op.57 - 6. Hertig Magnus (Duke Magnus).mp3",6.04,M
"CD3/10 Eight Songs, Op.57 - 7. Vänskapens blomma (The Flower of Friendship).mp3",4.82,M
"CD3/11 Eight Songs, Op.57 - 8. Näcken (The Watersprite).mp3",4.24,M
"CD3/12 Two Songs from 'Twelft Night', Op.60 (arranged by the composer for voice and piano) - 1. Kom nu hit, död! (Come Away, Death!).mp3",5.97,M
"CD3/13 Two Songs from 'Twelft Night', Op.60 (arranged by the composer for voice and piano) - 2. Hållilå, uti storm och i regn (Hey ho, the Wind and the Rain).mp3",2.03,M
"CD3/14 Eight Songs, Op. 61 - 1. Långsamt som kvällskyn (Slowly as the Evening Sky).mp3",4.01,M
"CD3/15 Eight Songs, Op. 61 - 2. Vattenplask (Lapping Waters).mp3",6.35,M
"CD3/16 Eight Songs, Op. 61 - 3. När jag drömmer (When I Dream).mp3",5.6,M
"CD3/17 Eight Songs, Op. 61 - 4. Romeo.mp3",3.16,M
"CD3/18 Eight Songs, Op. 61 - 5. Romans (Romance).mp3",6.78,M
"CD3/19 Eight Songs, Op. 61 - 6. Dolce far niente.mp3",3.13,M
"CD3/20 Eight Songs, Op. 61 - 7. Fåfäng önskar (Idle Wishes).mp3",5.87,M
"CD3/21 Eight Songs, Op. 61 - 8. Vårtagen (The Spell of Springtide).mp3",3.77,M
"CD3/22 Arioso, Op.3.mp3",7.54,M
"CD3/23 Five Christmas Songs, Op.1 - 1. Nu står jul vid snöig port (Now Christmas Stands at the Snowy Gate).mp3",3.29,M
"CD3/24 Five Christmas Songs, Op.1 - 2. Nu så kommer julen (Now is Christmas Coming).mp3",4.23,M
"CD3/25 Five Christmas Songs, Op.1 - 3. Det mörknar ute (Outside it is Growing Dark).mp3",5.11,M
"CD3/26 Five Christmas Songs, Op.1 - 4. Giv mig ej glans, ej guld, ej prakt (Give me no Splendour, Gold or Pomp).mp3",6.78,M
"CD3/27 Five Christmas Songs, Op.1 - 5. On hanget korkeat, nietokset (High are the Snowdrifts).mp3",4.75,M
"CD4/01 Luonnotar, Op.70 (arranged by the composer for voice and piano).mp3",15.78,M
"CD4/02 Six Songs, Op.72 - 3. Kyssen (The Kiss).mp3",4.42,M
"CD4/03 Six Songs, Op.72 - 4. Kaiutar (The Echo Nymph).mp3",5.86,M
"CD4/04 Six Songs, Op.72 - 5. Der Wanderer und der Bach (The Wanderer and the Brook).mp3",1.55,M
"CD4/05 Six Songs, Op.72 - 6. Hundra vägar (A Hundred Ways).mp3",4.03,M
"CD4/06 Tanken (The Thought), JS 192.mp3",2.9,M
"CD4/07 Six Songs, Op.86 - 1. Vårförnimmelser (The Coming of Spring).mp3",2.3,M
"CD4/08 Six Songs, Op.86 - 2. Längtan heter min arvedel (Longing is my Heritage).mp3",5.8,M
"CD4/09 Six Songs, Op.86 - 3. Dold förening (Hidden Union).mp3",1.72,M
"CD4/10 Six Songs, Op.86 - 4. Och finns det at tanke (And Is There a Thought).mp3",4.09,M
"CD4/11 Six Songs, Op.86 - 5. Sångarlön (The Singer's Reward).mp3",3.29,M
"CD4/12 Six Songs, Op.86 - 6. I systrar, I bröder, I älskande par ! (Ye Sisters, Ye Brothers).mp3",3.97,M
"CD4/13 Six Songs, Op.88 - 1. Blåsippan (The Blue Anemone).mp3",1.4,M
"CD4/14 Six Songs, Op.88 - 2. De bägge rosorna (The Two Roses).mp3",2.22,M
"CD4/15 Six Songs, Op.88 - 3. Vitsippan (The Wood Anemone).mp3",2.33,M
"CD4/16 Six Songs, Op.88 - 4. Sippan (The Anemone).mp3",1.78,M
"CD4/17 Six Songs, Op.88 - 5. Törnet (The Thorn).mp3",3.87,M
"CD4/18 Six Songs, Op.88 - 6. Blommans öde (The Flower's Destiny).mp3",2.71,M
"CD4/19 Six Runeberg Songs, Op.90 - 1. Nordern (The North).mp3",3.85,M
"CD4/20 Six Runeberg Songs, Op.90 - 2. Hennes budskap (Her Message).mp3",2.83,M
"CD4/21 Six Runeberg Songs, Op.90 - 3. Morgonen (The Morning).mp3",4.45,M
"CD4/22 Six Runeberg Songs, Op.90 - 4. Fågelfängarn (The Bird Catcher).mp3",2.72,M
"CD4/23 Six Runeberg Songs, Op.90 - 5. Sommarnatten (Summer Night).mp3",5.13,M
"CD4/24 Six Runeberg Songs, Op.90 - 6. Vem styrde hit din väg (Who Brought You Hither).mp3",5.7,M
CD4/25 Kullervo's Lament from Op.7 (arranged by the composer for voice and piano).mp3,3.48,M
"CD4/26 Mummon syntymäpäivänä (Birthday Song to Grandmother), JS 136.mp3",3.18,M
"CD4/27 Autrefois, Scène pastorale, Op.96b (arranged by the composer for two voice and piano).mp3",9.86,M
"CD4/28 Små flickor (Young Girls), JS 174.mp3",5.91,M
"CD4/29 Narciss (Narcissus), JS 140.mp3",3.37,M
"CD4/30 Siltavahti (The Guardian of the Bridge), JS 170b.mp3",4.5,M
CD4/31 Solitude - The Jewish Girl's Song Op.51 No.2 [JS 48 No.2b] (arranged by the composer for voice and piano from the music to Hjalmar Procopé's play Belshazzar's Feast).mp3,5.26,M
"CD4/32 Hymn to Thaïs, the Unforgettable, JS 97 - Revised version.mp3",4.3,M
"CD5 - Preliminary and alternative versions/01 Serenad, JS 167 - Preliminary version.mp3",5.26,M
"CD5 - Preliminary and alternative versions/02 Seven Runeberg Songs, Op.13. Preliminary version - 2. Kyssens hopp (The Kiss's Hope).mp3",4.28,M
"CD5 - Preliminary and alternative versions/03 Seven Runeberg Songs, Op.13. Preliminary version - 3. Hjärtats morgon (The Heart's Morning).mp3",4.47,M
"CD5 - Preliminary and alternative versions/04 Seven Runeberg Songs, Op.13. Preliminary version - 5. Drömmen (The Dream).mp3",3.79,M
CD5 - Preliminary and alternative versions/05 Kullervos Wehruf (Kullervo's Lament) from Op.7 (arranged by the composer for voice and piano) - First version.mp3,4.09,M
"CD5 - Preliminary and alternative versions/06 Seven Songs, Op.17. Early draft copies - 1. Se'n har jag ej frågat mera (Since Then I Have Questioned No Further).mp3",4.8,M
"CD5 - Preliminary and alternative versions/07 Seven Songs, Op.17. Early draft copies - 6. Illalle (To Evening).mp3",3.36,M
"CD5 - Preliminary and alternative versions/08 Soluppgång (Sunrise), JS 87 - Preliminary version.mp3",4.11,M
"CD5 - Preliminary and alternative versions/09 Judeflickans sång (The Jewish Girl's Song), JS 48 No.2b [Op.51 No.2] (arranged by the composer for voice and piano) - First version.mp3",5.16,M
"CD5 - Preliminary and alternative versions/10 Hundra vägar (A Hundred Ways), Op.72 No.6 - Preliminary version.mp3",4.07,M
"CD5 - Preliminary and alternative versions/11 Teodora, Op.35 No.2 - Preliminary version).mp3",8.4,M
"CD5 - Preliminary and alternative versions/12 Hymn to Thaïs, the Unforgettable, JS 97  - First version.mp3",3.96,M
"CD5 - Preliminary and alternative versions/13 Two Songs from 'Twelfth Night', Op.60. Original version for voice and piano - 1. Kom nu hit, död! (Come Away, Death!).mp3",5.76,M
"CD5 - Preliminary and alternative versions/14 Two Songs from 'Twelfth Night', Op.60. Orig. version for voice and piano - 2. Hållilå, uti storm och i regn (Hey, ho, the Wind and the Rain).mp3",3.96,M
"CD5 - Preliminary and alternative versions/15 Dolce far niente, Op.61 No.6  - Preliminary version.mp3",3.22,M
"CD5 - Preliminary and alternative versions/16 On hanger korkeat, nietokset (High are the Snowdrifts), Op.1 No.5 (arranged by the composer for two voices and piano).mp3",3.98,M
"CD5 - Preliminary and alternative versions/17 Pastorale, extract from 'Autrefois', Op.96b (arranged by the composer for two voices and piano).mp3",5.85,M
Index to the Sibelius Edition.pdf,1.28,M
Jean Sibelius.pdf,496.37,K
The Sibelius Edition - Songs.pdf,74,K
