User Type,Username,Date,Text
,wonderwang,2013-06-21T03:04Z,Just cut your nuts off ........
,Rialta1,2013-06-21T03:46Z,Bunch of BS.
,burt007,2013-06-21T08:10Z,"First of all, sex is not sin."
,romintang,2013-06-22T00:22Z,"Porn cannot be stopped by morality and religions. 

It can only be stopped by universal logical reasonings. 
Such as, ""waste of time"", ""waste of money"", ""there are more useful stuffs for your career to be enjoyed"", ""enjoys positive pasttime"", ""true love"", ""spend precious time together with your kids / family"", and similar. "
