User Type,Username,Date,Text
,maxjasper,2013-02-11T02:11Z,"After many trials, keymaker is unable to activate Mathematica even after installing VC++ 2012."
,maxjasper,2013-02-11T02:51Z,"Ignore my dumb last comment! I had no clue where to find Math ID. After picking up the Math ID from installation window, keygen did it in one trial. Thanks a lot bro...ya r the man!"
,IsItReally,2013-02-14T02:48Z,Do you have v9.0.1 for Linux?
,jad2012x,2013-02-21T07:59Z,wait where do you get the Math ID to produce the activation code?
,hkwt5,2013-03-08T14:30Z,Anybody knows about Mathematica System Modeler craсked? 
,boral2,2013-03-28T06:33Z,Can anyone please provide MathStatica . It is very useful package for mathematical statistics of Mathematica. A lot of thanks in advance.
,mathiasthebold,2013-05-03T08:32Z,Pleased to see the updated version here. Thanks a lot for posting. Much appreciated!
