User Type,Username,Date,Text
,Foisy5,2013-04-01T19:27Z,THANK YOU !!!!!
[V],Nepotu,2013-04-01T20:48Z,"yw, my friend!"
,pete0726,2013-04-01T23:59Z,"Thanks !!! Huge Louisville FAN trying to put together the entire run, no luck finding the NCA&T game or the Colorado St. game."
[V],Nepotu,2013-04-02T01:05Z,"Sorry, it's all I could find."
,citizendonny,2013-04-07T06:34Z,Hopefully you can get both final 4 games and of course  the final championship game. Thank you for getting all the games so far.
