User Type,Username,Date,Text
,eshborn,2013-03-09T23:18Z,"Please seeed Thank you 

and thank you again "
,pierce368,2013-03-10T04:35Z,"thank you very much, i have been trying to upload this and faro x the last week or so but my proxys were acting up. thanks alot!"
,malons7,2013-03-10T08:47Z,Gracias por el GCXO.
,Dmitry_bravo,2013-03-10T13:03Z,Thanks!
,lantonovdelagpe,2013-03-10T15:05Z,You're welcome.
,DJiF,2013-03-10T17:16Z,thank you. a patch is available here: http://www.sim-giants.com/product.asp?prod=4#updates
