Filename,Size,Unit
c848979dtng.jpg,7.98,K
"Tony Carey Blue Highway 10,000 Times 04(1).mp3",4.74,M
Tony Carey Blue Highway Blue Highway 06(1).mp3,5.27,M
Tony Carey Blue Highway Katy Be Mine 08(1).mp3,4.93,M
Tony Carey Blue Highway Like A Rock 09(1).mp3,4.8,M
Tony Carey Blue Highway Live Wire 03(1).mp3,5.43,M
Tony Carey Blue Highway Love Don't Bother Me 07(1).mp3,4.57,M
Tony Carey Blue Highway Out Of Town Women 10(1).mp3,4.32,M
Tony Carey Blue Highway She Moves Like A Dancer 02(1).mp3,4.63,M
Tony Carey Blue Highway Tear Down The Walls 05(1).mp3,4.39,M
Tony Carey Blue Highway We Wanna Live 01(1).mp3,4.96,M
