Filename,Size,Unit
v1.3 epub/01 Amazon Adventure - Willard Price.epub,222.91,K
v1.3 epub/02 South Sea Adventure - Willard Price.epub,272.96,K
v1.3 epub/03 Underwater Adventure - Willard Price.epub,233.33,K
v1.3 epub/04 Volcano Adventure - Willard Price.epub,281.99,K
v1.3 epub/05 Whale Adventure - Willard Price.epub,312.11,K
v1.3 epub/06 African Adventure - Willard Price.epub,172.17,K
v1.3 epub/07 Elephant Adventure - Willard Price.epub,170.46,K
v1.3 epub/08 Safari Adventure - Willard Price.epub,157.83,K
v1.3 epub/09 Lion Adventure - Willard Price.epub,158.37,K
v1.3 epub/10 Gorilla Adventure - Willard Price.epub,163.97,K
v1.3 epub/11 Diving Adventure - Willard Price.epub,283.92,K
v1.3 epub/12 Cannibal Adventure - Willard Price.epub,212.13,K
v1.3 epub/13 Tiger Adventure - Willard Price.epub,347.42,K
v1.3 epub/14 Arctic Adventure - Willard Price.epub,191.71,K
v1.3 txt/01 Amazon Adventure - Willard Price.txt,326.52,K
v1.3 txt/02 South Sea Adventure - Willard Price.txt,285.92,K
v1.3 txt/03 Underwater Adventure - Willard Price.txt,264.03,K
v1.3 txt/04 Volcano Adventure - Willard Price.txt,240.42,K
v1.3 txt/05 Whale Adventure - Willard Price.txt,246.61,K
v1.3 txt/06 African Adventure - Willard Price.txt,248.35,K
v1.3 txt/07 Elephant Adventure - Willard Price.txt,234.85,K
v1.3 txt/08 Safari Adventure - Willard Price.txt,223.24,K
v1.3 txt/09 Lion Adventure - Willard Price.txt,232,K
v1.3 txt/10 Gorilla Adventure - Willard Price.txt,256.26,K
v1.3 txt/11 Diving Adventure - Willard Price.txt,275.68,K
v1.3 txt/12 Cannibal Adventure - Willard Price.txt,280.12,K
v1.3 txt/13 Tiger Adventure - Willard Price.txt,266.63,K
v1.3 txt/14 Arctic Adventure - Willard Price.txt,259.29,K
v1.3 txt/Covers/01 Amazon Adventure - Willard Price.jpg,62.19,K
v1.3 txt/Covers/02 South Sea Adventure - Willard Price.jpg,441.92,K
v1.3 txt/Covers/03 Underwater Adventure - Willard Price.jpg,471.04,K
v1.3 txt/Covers/04 Volcano Adventure - Willard Price.jpg,686.93,K
v1.3 txt/Covers/05 Whale Adventure - Willard Price.jpg,762.68,K
v1.3 txt/Covers/06 African Adventure - Willard Price.jpg,49.77,K
v1.3 txt/Covers/07 Elephant Adventure - Willard Price.jpg,49.5,K
v1.3 txt/Covers/08 Safari Adventure - Willard Price.jpg,41.89,K
v1.3 txt/Covers/09 Lion Adventure - Willard Price.jpg,40.76,K
v1.3 txt/Covers/10 Gorilla Adventure - Willard Price.jpg,32.28,K
v1.3 txt/Covers/11 Diving Adventure - Willard Price.jpg,517.56,K
v1.3 txt/Covers/12 Cannibal Adventure - Willard Price.jpg,71.11,K
v1.3 txt/Covers/13 Tiger Adventure - Willard Price.jpg,736.69,K
v1.3 txt/Covers/14 Arctic Adventure - Willard Price.jpg,59.26,K
Willard Price Readme.txt,2.25,K
