Filename,Size,Unit
seal team 6 the raid on osama bin laden 2012 pal dvdr dd5.1 nl subs/seal team 6 the raid on osama bin laden 2012 pal dvdr dd5.1 nl subs.ISO,5.53,G
seal team 6 the raid on osama bin laden 2012 pal dvdr dd5.1 nl subs/seal team 6 the raid on osama bin laden 2012 pal dvdr dd5.1 nl subs.MDS,8.22,K
seal team 6 the raid on osama bin laden 2012 pal dvdr dd5.1 nl subs.nfo,601,B
Torrent downloaded from AanMeHoelaJa Torrents on BTScene.eu.txt,71,B
Torrent downloaded from AhaShare.com.txt,58,B
Torrent Downloaded from digtorrent.org.txt,184,B
Torrent Downloaded From ExtraTorrent.com.txt,353,B
Torrent downloaded from KAT.ph.txt,41,B
Torrent Downloaded from limetorrent.txt,50,B
Torrent downloaded from P2PDL.com.txt,37,B
Torrent downloaded from silvertorrent.org.txt,86,B
Torrent downloaded from thepiratebay.se.txt,50,B
tracked_by_h33t_com.txt,23,B
