Filename,Size,Unit
ChattChitto RG.nfo,12.04,K
www.ChattChitto.com.nfo,7.9,K
The Flaming Lips - The Terror [ChattChitto RG] Cover.png,104.33,K
The Terror/06 The Flaming Lips - You Are Alone.mp3,9.07,M
"The Terror/07 The Flaming Lips - Butterfly, How Long It Takes To Die.mp3",17.61,M
The Terror/09 The Flaming Lips - Always There In Our Hearts.mp3,10.91,M
The Terror/The Terror.m3u,878,B
The Terror/05 The Flaming Lips - The Terror.mp3,14.99,M
The Terror/08 The Flaming Lips - Turning Violent.mp3,10.2,M
The Terror/03 The Flaming Lips - Try To Explain.mp3,11.88,M
The Terror/04 The Flaming Lips - You Lust.mp3,30.29,M
The Terror/01 The Flaming Lips - Look... The Sun Is Rising.mp3,12.33,M
"The Terror/02 The Flaming Lips - Be Free, A Way.mp3",12.37,M
The Terror Bonus CD/01 The Flaming Lips - Sun Blows Up Today.mp3,7.69,M
The Terror Bonus CD/The Terror Bonus CD.m3u,207,B
The Terror Bonus CD/02 The Flaming Lips - All You Need Is Love.mp3,12.11,M
