User Type,Username,Date,Text
,PyroTheGreat,2013-04-13T09:23Z,"Thanks a lot! This is awesome! I can't wait for the Teamleague matches...hope you'll upload them soon? 
Great matches sooo nice!"
,SC2Superbibi,2013-04-13T13:04Z,I'll upload them if and when I get them :)
,PyroTheGreat,2013-04-14T06:11Z,Can't wait for them! checking every hour :D Life was playing like a god I hear :) 
,SC2Superbibi,2013-04-17T12:55Z,"You can stop hitting F5, just uploaded GSTL matches click on my name to see them."
,SC2Superbibi,2013-04-20T06:33Z,"I encourage anyone to watch the 1st set of the loser's match, the game is sick :)"
