Filename,Size,Unit
Victorious S04E13 Victori-Yes 720p [!MAB!].mp4,928.28,M
Victorious S04E11 The Slap Fight 720p [!MAB!].mkv,768.63,M
Victorious S04E10 Brain Squeezers 720p [!MAB!].mkv,766.66,M
Victorious S04E01 Wanko's Warehouse 720p [!MAB!].mkv,745.26,M
Victorious S04E07 One Thousand Berry Balls 480p [!MAB!].mp4,311.54,M
Victorious S04E04 Three Girls And A Moose [!MAB!].mp4,307.49,M
Victorious S04E05 Cell Block 480p [!MAB!].mp4,281.19,M
Victorious S04E09 The Bad Roommate Tam [!MAB!].avi,278.13,M
Victorious S04E06 Tori Fixes Beck and Jade 480p [!MAB!].mp4,239.67,M
Victorious S04E03 Opposite Date 480p [!MAB!].mp4,238.27,M
Victorious S04E08 Robbie Sells Rex 480p [!MAB!].mp4,226.57,M
Victorious S04E12 Star-Spangled Tori 480p [!MAB!].mp4,216.33,M
Victorious S04E02 The.Hambone King 480p [!MAB!].mkv,188,M
