Filename,Size,Unit
PeakFit Challenge Nutrition Guide/PeakFit Challenge Nutrition Guide Part 1.PDF,1.17,M
PeakFit Challenge Nutrition Guide/PeakFit Challenge Nutrition Guide Part 2.PDF,576.7,K
Michelle Dozois PeakFit Challenge D.01 Intro & Fit Test.avi,400.21,M
Michelle Dozois PeakFit Challenge D.02 Pure Strength 1.avi,620.34,M
Michelle Dozois PeakFit Challenge D.03 Pure Strength 2.avi,620.34,M
Michelle Dozois PeakFit Challenge D.04 Pure Cardio.avi,650.26,M
Michelle Dozois PeakFit Challenge D.05 Cardio Interval Burn.avi,810.47,M
Michelle Dozois PeakFit Challenge D.06 Cardio Strength 1.avi,720.33,M
Michelle Dozois PeakFit Challenge D.07 Cardio Strength 2.avi,700.25,M
Michelle Dozois PeakFit Challenge D.08 Dynamic Flexibility.avi,400.3,M
Michelle Dozois PeakFit Challenge D.09 Core Dynamics.avi,330.21,M
"Michelle Dozois PeakFit Challenge D.10 Anywher, Anytime, No Excuse Workout.avi",540.18,M
PeakFit Challenge Calendar & Fit Test.PDF,393.21,K
