User Type,Username,Date,Text
,ChocolateAddict,2013-02-07T02:12Z,"hi mantesh. can you upload any of these books?

tinyurl DoT com/officebooks"
,Awesone_one,2013-03-17T07:48Z,"Hi MANTESH, thank u for ur work it is much appreciated. Any chance u cud upload ' Bring out the Magic in your Mind' ? By Al koran. Thanks :))"
,Jin6,2013-03-18T05:52Z,"MAntesh, you have helped me to build an incredible digital library. Thanks. I do, however, have a request. 
Could you upload ""The Multi-Orgasmic"" series including the couple's and the woman's version as well?
My email is bl4ckaura@gmail.com

Keep up your crusade to educate people via free knowledge. Thanks a ton, dude!"
