Filename,Size,Unit
"CD1/01 En Saga, Op. 9 (original version).mp3",39.25,M
"CD1/02 Lemminkäinen Suite, Op. 22 - I. Lemminkäinen and the Maidens of the Island (original version).mp3",25.62,M
"CD1/03 Lemminkäinen Suite, Op. 22 - II. Lemminkäinen in Tuonela (1896 version reconstruction).mp3",39.71,M
"CD1/04 Lemminkäinen Suite, Op. 22 - IV. Lemminkäinen's Return (original version).mp3",20.66,M
"CD1/05 Lemminkäinen Suite, Op. 22 - IV. Lemminkäinen's Return (intermediate version).mp3",21.22,M
CD2/01 Improvisation-Spring Song [Op. 16].mp3,16.95,M
"CD2/02 The Wood-Nymph, Op. 15.mp3",38.81,M
"CD2/03 En saga, Op. 9 ( final version).mp3",32.08,M
"CD2/04 Cassazione, Op. 6 (original version).mp3",22.21,M
CD2/05 Musik zu einer Scène (prel. version of Dance-Intermezzo).mp3,9.95,M
CD2/06 Finland Awakes (prel. version of Finlandia).mp3,15.94,M
"CD3/01 Finlandia, Op.26.mp3",15.49,M
"CD3/02 Spring Song, Op.16.mp3",13.87,M
"CD3/03 In Memoriam, Op.59 (final version).mp3",20.42,M
"CD3/04 Lemminkainen Suite, Op.22 -  I. Lemminkainen and The Maidens of the Island (final version).mp3",27.29,M
"CD3/05 Lemminkäinen Suite, Op.22 - II. The Swan of Tuonela (final [only surviving] version).mp3",16.37,M
"CD3/06 Lemminkäinen Suite, Op.22 - III. Lemminkäinen in Tuonela (final version).mp3",31.22,M
"CD3/07 Lemminkäinen Suite, Op.22 - IV. Lemminkäinen's Return (final version).mp3",12.38,M
"CD4/01 Pohjola's Daughter, Op. 49.mp3",23.63,M
"CD4/02 Night Ride and Sunrise, Op. 55.mp3",31.08,M
"CD4/03 The Dryad, Op. 45 No.1.mp3",9.13,M
"CD4/04 Dance Intermezzo, Op. 45 No.2.mp3",4.98,M
"CD4/05 The Bard, Op. 64.mp3",13.21,M
"CD4/06 The Oceanides, Op. 73 (final version).mp3",18.17,M
"CD4/07 Tapiola, Op. 112.mp3",31.78,M
CD5/01 Luonnotar Op.70.mp3,15.75,M
"CD5/02 The Oceanides, Op. 73 (Yale version).mp3",13.56,M
"CD5/03 In memoriam, Op. 59 (original version).mp3",18.69,M
"CD5/04 Cassazione, Op. 6 (final version).mp3",23.29,M
"CD5/05 Scènes historiques I, Op. 25 - I. All'Overtura.mp3",8.48,M
"CD5/06 Scènes historiques I, Op. 25 - II. Scena.mp3",11.22,M
"CD5/07 Scènes historiques I, Op. 25 - III. Festivo.mp3",13.22,M
"CD5/08 Scènes historiques II, Op. 66 - I. La Chasse.mp3",11.87,M
"CD5/09 Scènes historiques II, Op. 66 - II. Love Song.mp3",8.31,M
"CD5/10 Scènes historiques II, Op. 66 - III. At the Draw-Bridge.mp3",12.68,M
Index to the Sibelius Edition.pdf,1.28,M
Jean Sibelius.pdf,496.37,K
The Sibelius Edition - Tone Poems.pdf,47.21,K
