User Type,Username,Date,Text
,skwerrel,2013-03-28T01:17Z,"You are probably sick of hearing this (lol) but I followed you here from demonoid, you do the BEST adventure time and regular show episodes I've ever been able to find.  Thank you kind Internet knight, I salute you sir."
,dwjp90,2013-03-28T02:30Z,"I'm never sick of hearing that!  It helps me keep on doing this, even when I get busy."
,Darkmana,2013-03-28T04:22Z,"Great torrent, thanks. "
,joazim,2013-03-28T12:05Z,What skwerrel said. These epps are what make my week!
,FoodBank,2013-03-28T21:36Z,Don't stop! If you stop then I will have to download from @eztv and his quality can not compare to your's
,flunkedy,2013-04-05T20:36Z,will you going to be uploading the glitch anytime soon? (again i found you here after demonoid and you do do the best rips) 
