User Type,Username,Date,Text
[T],Milleman,2013-04-08T22:13Z,"Tack Carma för denna säsong!
Har följt dig genom åren. Dina uppladdningar har varit av oerhört stort värde och glädje för mig.
Vet inte hur jag kan gpttgöra dig tillbaka bara..."
,78Robban,2013-04-10T21:47Z,Tack för att du lägger upp det okända :) . hoppas på flera avsnitt när det visas igen :).
,flyaddict,2013-04-13T00:25Z,"Tack tack tack - och atter tach. Det du har laddad upp, har givit oss mychet gledje. Vi har sett fram imot dagene du har levert underholdning av beste kvalitet. Och alltid utan reklam og perfect klippad.
Så tusen tusen tach, Carma. Hoppas det kommer något annat i framtiden, som du får lyst til at ladda opp och dela med oss som gilllar dom samma sakarna som dig :)"
,spinfighter,2013-05-18T01:19Z,"Hej carma4 - 
Ett enormt stort tack för allt du valt att dela! Finns det någon möjlighet att få Del 2 av Det Okända Collection? Jag vet att frågan ställts tidigare, men det är bara någon enstaka del i intervallet del 51-80 som fortfarande är aktiv. Det vore fint att få uppleva dessa avsnitt igen! "
