Filename,Size,Unit
La vie est belle - Stephen Jay Gould.epub,8.21,M
Comme les huit doigts de la main - Stephen Jay Gould.epub,4.41,M
Aux racines du temps - Stephen Jay Gould.epub,3.9,M
Les coquillages de Leonard - Stephen Jay Gould.epub,3.8,M
L'Eventail du vivant - Stephen Jay Gould.epub,3.02,M
La Mal-Mesure de l'homme - Stephen Jay Gould.epub,2.83,M
Les quatres antilopes de l'apocalypse - Stephen Jay Gould.epub,2.64,M
"Gould,SJ-Le Sourire du flamant rose.epub",1.78,M
Quand les poules auront des dents - Stephen Jay Gould.epub,1.61,M
"Gould, S.J. - Le pouce du panda.epub",1.16,M
Darwin et les grandes enigmes de la vie - Stephen Jay Gould.epub,786.71,K
Et Dieu dit_ _Que Darwin soit!_ - Stephen Jay Gould.epub,249.28,K
Comment lire un document EPUB.txt,237,B
