User Type,Username,Date,Text
,markos538,2013-06-11T00:37Z,"Please add : THE ABBOTT AND COSTELLO SHOW EXTRAS CD1,CD2 and ABBOTT AND COSTELLO MEET JERRY SEINFELD."
[V],TheExecutive,2013-06-11T05:18Z,"???? I don't have any of those things you listed!

Besides Abbott & Costello never met Jerry Seinfeld,
as they were before his time as well as ours."
[V],TheExecutive,2013-06-11T05:20Z,"Oh, you mean this ""Abbott and Costello Meet Jerry Seinfeld"" -- a TV special retrospective that Seinfeld hosted in the 1990s.  You can probably find that on You Tube."
