User Type,Username,Date,Text
[T],MrUnpopular,2013-03-14T06:41Z,"ROFL, you packed the unpacked avi and the rar's...so people are practically downloading it twice.

Smooth."
,elveljung,2013-03-14T10:02Z,thanks but its really low quality
,lsuguru77,2013-03-14T16:15Z,Yeah quality isnt good. V6/A9
,pirateperson,2013-03-22T06:28Z,A8V5
,Fitchhh,2013-04-19T19:13Z,"Quality is awful.. I dont care if it's free or not, shouldn't be this bad of quality.. Now i'll delete all of the 3rd season i downloaded from you and will get it somewhere else."
