User Type,Username,Date,Text
[V],psspss,2013-04-04T08:31Z,"save the best episode  for last by looks so far

cute chic :)"
[V],psspss,2013-04-04T09:24Z,"best one for last.. interesting photo does look like a face
and yoda lol at first I was looking at the bottom part but then looked at all the smoke.fog and noticed the bottom part is lips and a chin not a small face.. which I saw initially.. the whole
white thing is the face with eyes"
[V],psspss,2013-04-04T09:53Z,my upload speed is only 1/3 for some reason hmm
[V],psspss,2013-04-04T11:26Z,looked like a bad asdl line.. I rebooted router but  a bit too late to seed it faster now.. as 15 or more of you have it now anyhow.. took 1 hour longer .. be good once we get fiber finally no more rain or BS slowing the lines down lol
