User Type,Username,Date,Text
,33wearhilton41,2013-04-29T08:15Z,hell thats quick si u on skates?
,33wearhilton41,2013-04-29T08:45Z,"sorry to harp on but the mole above ella,s right tit has disapeared again!"
,terrenmcconn,2013-04-29T08:54Z,"Boring they may be, but it IS Ella!  Thanks Si.  "
,SiMiHa013,2013-04-29T09:05Z,"@33

Not using anything. If I can get it fast I upped it 

fast. And yeah, it's edited as usual.


Ms SiiMiiHaa"
,MMM-MMM-MMM,2013-04-29T09:40Z,Thank you :)))
,captainkhaos1966,2013-04-29T12:57Z,Thanks for uploading. Can you or anybody get ahold of any May model sets? 5-click used to upload but hasn't uploaded any lately. Where you at 5-click? Once again thanks for uploading
,Nelix192,2013-05-07T16:16Z,Thanx!
