User Type,Username,Date,Text
[T],SCSA420,2013-06-07T05:50Z,"Hey there TNA Impact Wrestling fans Here is the 23rd TNA Impact Wrestling show of 2013 in 720p MP4 format!!! Enjoy the show!!!

TNA Impact Wrestling HDTV 2013-06-06 720p H264 AVCHD-SC-SDH

PLEASE READ THE .nfo FILE THIS WEEK FOR MORE INFORMATION!!!

Please stay connected after your download is finished to help seed this show for people still downloading it and enjoy the show!!! :D"
,Super316,2013-06-07T08:37Z,Thank you and seed people...
,pettyofficershu,2013-06-08T03:24Z,im really not digging these 2GIG files here!! 2 gigs shuldnt look worse than a 989mb one .....shuldnt skip an the audio shuldnt be off by 1.5 seconds   this is the 4th one ive downloaded from different people that's do 2 gig files .......guess ill wait for the 989 one instead....sorry dude
,pettyofficershu,2013-06-08T03:26Z,i'm really not digging these 2GIG files here!! 2 gigs shouldn't look worse than a 989mb one .....shouldn't skip an the audio shouldn't be off by 1.5 seconds   this is the 4th one i've downloaded from different people that's do 2 gig files .......guess ill wait for the 989 one instead....sorry dude
,pettyofficershu,2013-06-08T03:27Z,I'm really not digging these 2GIG files here!! 2 gigs shouldn't look worse than a 989mb one .....shouldn't skip an the audio shouldn't be off by 1.5 seconds   this is the 4th one I've downloaded from different people that do 2 gig files on this episode alone .......guess ill wait for the 720p ''brrip'' 989 one instead....sorry dude
[T],SCSA420,2013-06-08T09:28Z,"NO need to make the same comment 3 times and you need to configure your pc to run 60fps video with K-Lite codec pack and use media player classic that comes with Klite. 

Also I shouldn't have to disconnect from my Privitize VPN client just to leave a comment here. WTF???"
,FICEK9,2013-06-15T16:00Z,THX!!!
,georgeWbushrules,2013-06-16T02:49Z,"Scsa420 you are a rookie. you need to learn how to encode things better. what kind of piece a junk system are you using?
 i only have one thing to say about this POOR QUALITY!"
