User Type,Username,Date,Text
,3dayslater,2013-03-03T07:35Z,"thanks for the upload 
is there a [pal] version of this"
,SteelerJ17,2013-03-03T15:51Z,Thank you very much!
,dudelove420,2013-03-03T20:28Z,Hells Yeah! Thanks so much!
[V],thenoobish,2013-03-05T16:59Z,It is IMARS release. But it is unpacked. Who do you want me to give credit too? What is your problem? Really?
,WillC94,2013-03-06T08:36Z,"thanks man, i downloaded the file but i dont think its safe to play online with. i ran it through ABGX. got a message saying that stealth file is unverified. do you know about the patch @thenoobish ?"
,deric798,2013-03-06T23:07Z,Do you have rf or ntcs/u version..
,riverasq,2013-03-11T00:25Z,"I am new to this, could you provide me with a link for a non modified xbox 360, of how to burn and play game."
,Smallz94,2013-03-11T01:06Z,cant wait until Sniper Ghost warrior release!!!!
