User Type,Username,Date,Text
,TWEETY2455,2013-06-08T03:39Z,"DUDE THIS IS PERFECT HOW DID U DO THAT.?

A=10
V=10"
,notnowplz,2013-06-08T05:19Z,not even close to perfect....still a little out of focus and chinese subs all thru the movie...I mean GEZZZZZZZZZZ...other than that...v-8.......A-7
,tibbyaus,2013-06-08T08:02Z,Outstanding...V10 and A10..keep up the great work
,TWEETY2455,2013-06-08T12:48Z,"Drarbg u keep the great work.
I forgot to thank u,had a great 
night watching this movie thanks to u."
,fuckyourbullshit,2013-06-10T12:49Z,excellent work there. a lot like an old dvd rip. really good quality for such small file.
