Filename,Size,Unit
Avenue Music/05 D.Y.B & Bonus Track (feat. B Skee.mp3,10.73,M
Brand New Bike/13 Swisher Sweet Dreams (feat. Arian.mp3,9.87,M
Brand New Bike/06 Backwards (feat. Tom Pepe & Dawn.mp3,9.38,M
Brand New Bike/07 Littlemanbigcity (feat. Maggie Br.mp3,9.08,M
Brand New Bike/01 Thank You for Tonight (feat. Eliz.mp3,8.98,M
Brand New Bike/03 Hash Muffins (feat. Sky Blaow & R.mp3,8.83,M
"Avenue Music/03 Liquor Store (feat. Ariana Deboo,.mp3",8.8,M
King Lear - Single/01 King Lear.mp3,8.78,M
Brand New Bike/11 The Best Part (feat. Razpy & Moll.mp3,8.72,M
Brand New Bike/05 Gary Payton (feat. B Skeez & Skyl.mp3,8.66,M
Brand New Bike/04 Rude Pussy (feat. John Martin & M.mp3,8.32,M
Avenue Music/06 Goldschlaggers (feat. Ryan Campbe.mp3,8.24,M
Brand New Bike/02 Brand New Bike (feat. Ariana Debo.mp3,7.71,M
Brand New Bike/12 Illegal (feat. Ryan Campbell & Jo.mp3,7.61,M
Brand New Bike/09 My House (feat. Ryan Campbell).mp3,6.54,M
Avenue Music/01 Got Soul (feat. Ariana Deboo).mp3,6.33,M
Brand New Bike/10 Captain Fun (feat. John Martin).mp3,6.01,M
"Avenue Music/02 23rd Avenue (feat. Gabby, B Skeez.mp3",5.9,M
Avenue Music/07 Miss My Friends (feat. Raz & Rile.mp3,5.32,M
Avenue Music/04 Cold (feat. Nacho Picasso & Ryan.mp3,4.77,M
Brand New Bike/08 The Rapper (Interlude).mp3,2.68,M
