User Type,Username,Date,Text
,shallow2,2013-02-16T23:47Z,"And before you ask, no we dont have a smaller size video yet ;)"
,sycomiko,2013-02-17T00:56Z,"lol shallowm but does that mean one may make an appearance 

thanks for your work"
,shallow2,2013-02-17T01:26Z,"I dont know. Which files we find for the Intersect shoots each week is a surprise every time Im afraid. 

We get and upload what we can. This one was rather booring for a 5 gig'er though.."
,sycomiko,2013-02-17T07:19Z,really what a shame i think alisha adams is one of the sexier girls they have had in a while. Woud love to see HT or IR get Ana Foxxx or Sara Luvv though
,Serenifly,2013-02-17T19:21Z,"Can you reseed these please:

http://thepiratebay.sx/torrent/6393956/Cyber_Update_May.2011-------WP-12773_IsisLove_MahinaZaltana
http://thepiratebay.sx/torrent/5474203/Cyber_Update_Mar.2010-------FM-8790__Monica_Santiago
http://thepiratebay.sx/torrent/5440334/Cyber_Update_Mar.2010-------FM-8718-8285-8440-8789

With the latter, it's only 8285 that's missing

Thanks a lot"
,charlie0904,2013-02-21T03:25Z,can you upload a smaller file for this one?
