User Type,Username,Date,Text
,Fliiix,2013-02-06T00:47Z,"Texten är inte korrekt syncad, riktigt drygt :/"
,Rosapanten,2013-02-06T02:43Z,"Texten är hämtad  från Swesub.nu, men vad har hänt?
Undertexten är totalt ur synk och riktigt pinsamt dåligt översatt.
Trodde att Swesub.nu stod för kvalitetstexter?"
[T],314r,2013-02-06T08:57Z,"Jag har kontrollerat flera av synkningarna och alla var felsynkade, det verkar inte gå att synka dem utan att dela upp texterna i småbitar heller.
Sedan står det på de sidor jag hittat att filmen är 107 minuter lång men filmerna som jag har hittat är på 100 minuter (23.976 fr/s). "
,Rosapanten,2013-02-06T15:06Z,"Det skiljer på dvdripen och blurayripen då det har klippts bort flera scener i blurayripen samt att dvdripen kör 25.000000 bildfrekvenser  och undertexen är 23.976215. Inte undra på att det inte stämmer.

Här är två torrenter som är rättsynkad:
http://thepiratebay.sx/torrent/8109387/Upside.Down.2012.SWESUB.Rattsynkad.DVDRip.XviD.AC3-5.1-Robblowe

http://thepiratebay.sx/torrent/8109133/Upside.Down.2012.SWESUB.RETAIL.720p.BluRay.DTS-Robblowe"
[T],314r,2013-02-06T16:59Z,"Tack, för informationen."
,ondsvensk1,2013-02-07T04:18Z,Ja denna är helt ur synk
,loitter,2013-02-24T08:12Z,si ya savia que escribian alo pendejo !
,amirar,2013-02-24T16:36Z,"Quality was good - A9 V9, thnx to the uploader! Movie was OK as i expected it to be! Storyline is intelligent and entertaining and acters were OK! I usually watch all the movies at film.kbc44.com because they have HD's but they didn't have this one so im happy to have piratebay :) Thank you once again uploader for this great share!"
