User Type,Username,Date,Text
[T],SCSA420,2013-06-21T05:45Z,"Hey there TNA Impact Wrestling fans Here is the 25th TNA Impact Wrestling show of 2013 in 720p MP4 format!!! Enjoy the show!!!

TNA Impact Wrestling HDTV 2013-06-20 720p H264 AVCHD-SC-SDH

PLEASE READ THE .nfo FILE THIS WEEK FOR MORE INFORMATION!!!

Please stay connected after your download is finished to help seed this show for people still downloading it and enjoy the show!!! :D"
,LAMBORGHINI39M,2013-06-21T10:33Z,thanks uploader
,bigdaddy1955,2013-06-21T14:32Z,"thanks dude, I will seed to the highest "
