User Type,Username,Date,Text
,MRMKHS1,2013-01-30T06:34Z,Thank You.
,kenibi123,2013-01-30T18:08Z,Are there any subtitles for this? 
,husky4life,2013-02-03T01:21Z,"Minted buddy, reminds me of the cats toenails :D"
,husky4life,2013-02-03T01:22Z,"Minted buddy, reminds me of my cats toenails :D"
,husky4life,2013-02-03T01:23Z,CHEERS I LOVE THIS UTOPIA!!!
,husky4life,2013-02-03T01:24Z,why is the comments so slow?
,husky4life,2013-02-03T01:24Z,Yo is Scott in this one?
,mickleback,2013-02-07T01:36Z,"Thank you EZTV, this show has me hooked!"
