User Type,Username,Date,Text
,kadgam,2013-02-01T03:27Z,"it is not working
not working any key"
,tomswiftx,2013-02-01T18:25Z,"Keys don't work.  Program keeps returning to the ""enter serial"" phase."
,chicken84,2013-02-02T15:18Z,"yes its true that this version dosent work with the keys..just uninstall this version and try the 7.02.0 version by the same uploader Tor Digger..it works perfectly..

link to working version

http://thepiratebay.sx/torrent/8000429/Comfort_Typing_Pro_v7.0.2.0_with_Key_[TorDigger]



thanks again Tor Digger..keep going buddy.."
