User Type,Username,Date,Text
,hvaruelc,2013-02-22T11:07Z,"Mersi.
bravo Steaua !"
[V],Nepotu,2013-02-22T14:01Z,"Cu placere!
Go Steaua!"
,hvaruelc,2013-02-22T15:53Z,nu am vazut descrierea limbii vorbite. daca era  in engleza meciul ...
[V],Nepotu,2013-02-22T17:38Z,"O sa il pun in spaniola, de pe ESPN3.
I'll up a spanish version, courtesy of ESPN3."
[V],Nepotu,2013-02-22T22:06Z,"Sau mai bine in engleza, maine.
Or, better, in english, tomorrow!"
,Edward_PTM,2013-02-23T01:54Z,"Inregistrat de la tv, in romana , nu exista?"
,MCBuneloo,2013-02-24T00:30Z,Salut. Ai reusit sa pui varianta cu comentariul in engleza ?
[V],Nepotu,2013-02-24T02:34Z,"Imi pare rau, dar in romana nu il am. Imediat il pun in engleza, cu comentariul UEFA."
[V],Nepotu,2013-02-24T02:42Z,English version here: http://thepiratebay.sx/torrent/8183274/UEL.2013.16F.2leg.%2821_feb%29.Steaua.v.Ajax.480p.ENG
