Filename,Size,Unit
22 Расстаяла Одесса за кормою (Леонид Утесов).flac,35.02,M
39 Добрая ночь (Леонид Утесов).flac,33.94,M
"26 Нет, не забудет солдат (Леонид Утесов).flac",33.24,M
08 Дунайские волны (Леонид Утесов).flac,32.93,M
"42 Небо голубое (фокстрот,орк. под упр. Леонида Утесова).flac",32.91,M
12 Раскинулось море широко (Леонид Утесов).flac,32.71,M
27 Окраина (Леонид Утесов).flac,32.71,M
23 Демобилизованный (Леонид Утесов).flac,32.5,M
11 Два друга (Леонид Утесов).flac,32.31,M
15 Если любишь - найди (Леонид Утесов).flac,32.23,M
06 У Черного моря (Леонид Утесов).flac,32.2,M
16 Парень кудрявый (Эдит и Леонид Утесовы).flac,32.18,M
36 Партизанская борода (Леонид Утесов).flac,32.07,M
02 Золотые огоньки (Леонид Утесов).flac,31.21,M
28 Днем и ночью (Леонид и Эдит Утесовы).flac,31,M
21 Теплоход (Леонид Утесов).flac,30.96,M
31 Ласточка-касаточка (Леонид Утесов).flac,30.91,M
"43 Наш ритм (фокстрот,орк. под упр. Леонида Утесова).flac",30.68,M
"18 Спи, мое бедное сердце (орк. под упр. Леонида Утесова).flac",30.64,M
24 Раскинулось море (Леонид Утесов).flac,30.63,M
10 Тайна (Леонид Утесов).flac,30.58,M
09 Песня старого извозчика (Леонид Утесов).flac,30.56,M
17 Расстались мы (Эдит Утесова).flac,29.2,M
37 Пожарный (Эдит Утесова).flac,29.01,M
32 Люби меня  (орк. под упр. Леонида Утесова).flac,28.73,M
29 Под звездами балканскими (Леонид Утесов).flac,28.45,M
13 Бальная полька (орк. под упр. Леонида Утесова).flac,27.66,M
"40 Все хорошо, маркиза (Эдит и Леонид Утесовы).flac",27.22,M
33 Искушение  (орк. под упр. Леонида Утесова).flac,27.18,M
07 Разговор (Леонид Утесов).flac,26.86,M
04 Быстрый вальс (орк. под упр. Леонида Утесова).flac,26.78,M
34 Любовная песня (Леонид Утесов).flac,25.56,M
05 Песенка шофера (Леонид Утесов).flac,25.09,M
38 Борода (Эдит и Леонид Утесовы).flac,24.71,M
03 Родные берега (Леонид Утесов).flac,24.62,M
"30 Лейся, песня, на просторе (Леонид Утесов).flac",24.36,M
"19 Ах, Одесса моя! (Леонид Утесов).flac",24.29,M
20 Родимое море (Леонид Утесов).flac,23.86,M
41 Вальс (А. Лазаренко и орк. под упр. Леонида Утесова).flac,23.17,M
25 Моряки (Леонид Утесов).flac,23.08,M
"14 Тем, кто в море (Леонид Утесов).flac",22.62,M
01 Автоболельщик (Леонид Утесов).flac,21.65,M
35 Ленинградские мосты (Леонид Утесов).flac,20.65,M
covers/41 Вальс (А. Лазаренко и орк. под упр. Леонида Утесова).jpg,485.18,K
"covers/26 Нет, не забудет солдат (Леонид Утесов).jpg",393.47,K
covers/32 Люби меня (орк. под упр. Леонида Утесова).jpg,386.92,K
covers/29 Под звездами балканскими (Леонид Утесов).jpg,377.03,K
covers/33 Искушение (орк. под упр. Леонида Утесова).jpg,376.97,K
covers/27 Окраина (Леонид Утесов).jpg,357.92,K
"covers/30 Лейся, песня, на просторе (орк. под упр. Леонида Утесова).jpg",349.11,K
"covers/43 Наш ритм (фокстрот,орк. под упр. Леонида Утесова).jpg",326.44,K
covers/28 Днем и ночью (Леонид и Эдит Утесовы).jpg,322.34,K
covers/22 Расстаяла Одесса за кормою (Леонид Утесов).jpg,316.46,K
covers/31 Ласточка-касаточка (Леонид Утесов).jpg,310.87,K
covers/21 Теплоход (Леонид Утесов).jpg,304.63,K
covers/24 Раскинулось море (Леонид Утесов).jpg,275.16,K
covers/23 Демобилизованный (Леонид Утесов).jpg,274.88,K
covers/36 Партизанская борода (Леонид Утесов).jpg,274.36,K
"covers/42 Небо голубое (фокстрот,орк. под упр. Леонида Утесова).jpg",272.51,K
"Уровень, спектр, АЧХ/40 Спектр.jpg",269.95,K
"Уровень, спектр, АЧХ/30 Спектр.jpg",268.29,K
"Уровень, спектр, АЧХ/01 Спектр.jpg",267.68,K
"Уровень, спектр, АЧХ/10 Спектр.jpg",262.47,K
"Уровень, спектр, АЧХ/20 Спектр.jpg",258.23,K
covers/25 Моряки (Леонид Утесов).jpg,258.01,K
"Уровень, спектр, АЧХ/01 Уровень.jpg",256.92,K
"Уровень, спектр, АЧХ/20 Уровень.jpg",252.63,K
"Уровень, спектр, АЧХ/40 Уровень.jpg",249.85,K
"Уровень, спектр, АЧХ/30 Уровень.jpg",248.09,K
"covers/40 Все хорошо, маркиза (Эдит и Леонид Утесовы).jpg",240.03,K
"Уровень, спектр, АЧХ/10 Уровень.jpg",238.84,K
covers/39 Добрая ночь (Леонид Утесов).jpg,228.32,K
"covers/19 Ах, Одесса моя! (Леонид Утесов).jpg",172.05,K
covers/20 Родимое море (Леонид Утесов).jpg,169.56,K
covers/34 Любовная песня (Леонид Утесов).jpg,141.19,K
covers/35 Ленинградские мосты (Леонид Утесов).jpg,134.59,K
"Уровень, спектр, АЧХ/40 АЧХ.jpg",118.35,K
"Уровень, спектр, АЧХ/01 АЧХ.jpg",117.43,K
"Уровень, спектр, АЧХ/30 АЧХ.jpg",116.77,K
"Уровень, спектр, АЧХ/10 АЧХ.jpg",115.27,K
"Уровень, спектр, АЧХ/20 АЧХ.jpg",110.69,K
covers/01 Автоболельщик (Леонид Утесов).jpg,81.89,K
covers/05 Песенка шофера (Леонид Утесов).jpg,73.98,K
covers/16 Парень кудрявый (Эдит и Леонид Утесовы).jpg,67.65,K
covers/14 Тем  кто в море (Леонид Утесов).jpg,66.48,K
covers/06 У Черного моря (Леонид Утесов).jpg,66.16,K
covers/15 Если любишь - найди (Леонид Утесов).jpg,65.54,K
covers/04 Быстрый вальс.jpg,65.36,K
covers/02 Золотые огоньки (Леонид Утесов).jpg,63.32,K
covers/13 Родные берега (Леонид Утесов).jpg,63.08,K
covers/09 Песня старого извозчика (Леонид Утесов).jpg,62.93,K
covers/10 Тайна (Леонид Утесов).jpg,62.89,K
covers/03 Родные берега (Леонид Утесов).jpg,62.35,K
covers/08 Дунайские волны (Леонид Утесов).jpg,61.82,K
covers/07 Разговор (Леонид Утесов).jpg,61.35,K
covers/11 Два друга (Леонид Утесов).jpg,57.72,K
covers/12 Раскинулось море широко (Леонид Утесов).jpg,55.16,K
"covers/18 Спи, мое бедное сердце (орк. под упр. Леонида Утесова).jpg",54.64,K
covers/17 Расстались мы (Эдит Утесова).jpg,54.55,K
Леонид Утесов.plc,14.85,K
Леонид Утесов.m3u,6.03,K
covers/трэклист.txt,1.66,K
