Filename,Size,Unit
Japanese young cute Hiyonyan shows pussy_(new).flv,119.65,M
Skinny Brunette Teen Anal #227NT_(new).flv,101.55,M
Russian couple 3_(new).flv,88.42,M
Korean web with young teen_(new).flv,56.15,M
Sexy girl plays in the bath_(new).flv,50.04,M
Omegle 20 Year Old Masturbates for me!!_(new).flv,46.26,M
Emo girl masturbation_(new).flv,42.49,M
Omegle webcam teen_(new).flv,30.35,M
Nice video from Russian couple_(new).flv,26.46,M
Self-Recording Teen amateur couple_(new).flv,22.11,M
jbv9_(new).flv,19.03,M
Emo girl giving a blowjob_(new).flv,18.55,M
Ride young couple hidden orgasm_(new).flv,15.72,M
jbv11_(new).flv,11.11,M
II Emo girl gets pussy fisted & stretched_(new).flv,7.6,M
Stunning Omegle Tit Flasher_(new).flv,4.63,M
Sexy Young teen couple fucking_(new).flv,847.55,K
