User Type,Username,Date,Text
[T],SCSA420,2013-04-05T05:04Z,"Hey there TNA Impact Wrestling fans Here is the 14th TNA Impact Wrestling show of 2013 in 720p MP4 format!!! Enjoy the show!!!

TNA Impact Wrestling HDTV 2013-04-04 720p H264 AVCHD-SC-SDH

PLEASE READ THE .nfo FILE THIS WEEK FOR MORE INFORMATION!!!

Please stay connected after your download is finished to help seed this show for people still downloading it and enjoy the show!!! :D"
,Krulag77,2013-04-05T08:12Z,thanx
,LAMBORGHINI39M,2013-04-05T15:52Z,thanks a lot
,HvyMetal,2013-04-05T16:51Z,Thank you!!!
,jinac02,2013-04-05T23:40Z,"Very good quality and very quick upload.
Amazing work every weeks.
Just thank you SCS ;)"
