User Type,Username,Date,Text
,danielsete,2013-04-22T18:25Z,I
,Augustoam,2013-04-24T07:24Z,"Olá ByKozy , gostaria de ser upload do meu site de filmes ?   email para contato    
 extremetorrentdownload@hot.."
,kilzone,2013-05-04T22:33Z,ela é completa com os 22 episodios mesmo? e dublado todos eles?
,kilzone,2013-05-04T23:39Z,ele esta em AVI ou RMVB?
,ByKozy,2013-05-05T00:44Z,"Oi Kilzone, na verdade são 23 episódios, e estão todos ai, são todos dublados e em mp4. "
,ByKozy,2013-05-05T00:45Z,Mais Dúvidas me add: Face /eu.org
,kilzone,2013-05-05T16:15Z,amigo e a qualidade de imagem esta boa? pq todos os lugares q eu vejo tem mais de 9GB os episodios todos...
,ByKozy,2013-05-05T21:46Z,"Kilzone, é em mp4 com taxa de bits reduzida, se você for assistir em uma televisão a imagem do video é a mesma que o original."
,kilzone,2013-05-06T22:32Z,"vlw kra.. realmente pelo tamanho, a qualidade esta ate muito boa.... obrigado pelo otimo trabalho.. estou ajudando a semear tmbm"
,kilzone,2013-05-12T06:17Z,"amigo, vc vai postar a segunda temporada?"
,ByKozy,2013-05-24T03:05Z,"Ainda estou procurando a 2ª temporada, mas em breve estarei postado aqui."
