User Type,Username,Date,Text
,k00bz,2013-02-08T01:28Z,"This movie looks really terrible no info on IMDB or RottenTomatoes. There is a trailer on youtube if you search by ""Jurassic Attack"" I can't post the URL for some reason."
,djdugla,2013-02-08T04:31Z,"more like jurassic shits lol
do what k00bz says check out the super realistic animation dinos on the trailer"
,michaelrwatson,2013-02-08T19:50Z,"WARNING: special effects created by 12-year old on his ipad. Pathetic. Why t f do people waste their time making ""movies"" like this?"
,highlander888,2013-02-10T06:43Z,"Hey thanks for the upload!

It's got that TV Movie of the Week feel!

What stretches my suspension of disbelief is trained soldiers who can snipe enemy guerillas 
at 100 yards, yet can't hit a 10 foot dinosaur at
point blank range! WTF?"
