Filename,Size,Unit
"Chitti Tammudu (1962) Telugu MP3s/Chitti Tammudu (1960) Telugu 00. Title Music and Screen Credits, Pendalya Nageshwara Rao.mp3",2.82,M
"Chitti Tammudu (1962) Telugu MP3s/Chitti Tammudu (1960) Telugu 01. Neevu Nenu Jabili Muvvuramu Unnamuga, P. Susheela, Ghantasala, .mp3",3.01,M
"Chitti Tammudu (1962) Telugu MP3s/Chitti Tammudu (1960) Telugu 02. Adagali Adagali Adigedevaro Telali, P. Susheela, S. Janaki, Arudra, .mp3",2.87,M
"Chitti Tammudu (1962) Telugu MP3s/Chitti Tammudu (1960) Telugu 03. Dikkuleni Vaariki Devude Dikku, P. Susheela, Arudra, Pendalya .mp3",3.1,M
"Chitti Tammudu (1962) Telugu MP3s/Chitti Tammudu (1960) Telugu 04. Maya Bazar Lokam Samiranga, P. Susheela, Arudra, Pendalya .mp3",3.88,M
"Chitti Tammudu (1962) Telugu MP3s/Chitti Tammudu (1960) Telugu 05.Yesko Naa Raja, P. Susheela, Maddali, Arudra, Pendalya Nageshwara Rao.mp3",2.52,M
"Chitti Tammudu (1962) Telugu MP3s/Chitti Tammudu (1960) Telugu 06. Merupu Merisindoyi Mava, P. Susheela, Arudra, Pendalya Nageshwara .mp3",2.77,M
Chitti Tammudu (1962) Telugu - Xvid 2cd - No Subs [DDR].avi,1.37,G
Torrent Downloaded From ExtraTorrent.com.txt,337,B
