Filename,Size,Unit
Tracked by desidhamal.com.txt,243,B
banner.jpg,23.85,K
Videos/Sanjana and Robby Part3.wmv,143.2,M
Videos/Sheetal and Akshay Part1.wmv,136.14,M
Videos/Sheetal and Akshay Part3.wmv,134.57,M
Videos/Sanjana and Robby Part2.wmv,138.89,M
Videos/Sheetal and Akshay Part2.wmv,135.93,M
Videos/Roopa and Akshay Part2.wmv,198.91,M
Videos/Preeti and Feroze part2.wmv,141.07,M
Videos/Roopa and Akshay Part1.wmv,184.08,M
Videos/Sita and Ajay Part1.wmv,151.28,M
Videos/Sanjana and Robby Part1.wmv,136.87,M
Videos/Sita and Ajay Part2.wmv,166.24,M
Videos/Tina and Raju part1.wmv,151.09,M
Videos/Tina and Raju part2.wmv,151.25,M
Videos/Tina and Raju part3.wmv,144.16,M
Videos/Tracked by desidhamal.com.txt,243,B
Videos/Suman and Bunty part2.wmv,146.21,M
Videos/Suman and Bunty part1.wmv,151.03,M
Videos/Sita and Ajay Part3.wmv,160.46,M
Videos/Sonia And Raj Part1.wmv,154.45,M
Videos/Sonia And Raj Part2.wmv,169.12,M
Videos/Preeti and Feroze part1.wmv,149.46,M
Videos/Poonam And Raju Part2.wmv,175.76,M
Videos/Khushi And Raj Part1.wmv,174.52,M
Videos/Khushi and Raj Part2.wmv,174.49,M
Videos/Khushi and Raj Part3.wmv,184.31,M
Videos/Meenakshi and Naveen part1.wmv,161.98,M
Videos/Kashish and Bunty part3.wmv,183.26,M
Videos/Kashish and Bunty part2.wmv,183.9,M
Videos/Honey and Robby part1.wmv,151.37,M
Videos/Honey and Robby part2.wmv,140.28,M
Videos/Kashish and Bunty part1.wmv,181.58,M
Videos/Meenakshi and Naveen part2.wmv,159.78,M
Videos/Naina and Vikki part1.wmv,151.55,M
Videos/Nelo and Feroze part2.wmv,135.24,M
Videos/Nelo and Feroze part3.wmv,131.28,M
Videos/Pinky and Rakesh part1.wmv,151.67,M
Videos/Pinky and Rakesh part2.wmv,142.91,M
Videos/Nelo and Feroze part1.wmv,135.31,M
Videos/Neha and Robby Part2.wmv,199.92,M
Videos/Naina and Vikki part2.wmv,151.73,M
Videos/Naina and Vikki part3.wmv,136.19,M
Videos/Neha and Robby Part1.wmv,188.93,M
Videos/Poonam And Raju Part1.wmv,175.58,M
