User Type,Username,Date,Text
,dethavin,2013-02-12T05:24Z,Hero is it possible to upload the crack itself?
,BluntzNzigzags,2013-02-12T05:27Z,whats the diff between this and your other one??
,Apetone,2013-02-12T05:28Z,Is it cracked?
,mcburf,2013-02-12T05:32Z,Yea please upload a torrent with only the files needed the launch the game.
,GEXterous336,2013-02-12T05:33Z,Anyone know if this includes the crack?
,Apetone,2013-02-12T05:37Z,Thanks :)
,GEXterous336,2013-02-12T05:38Z,"Text file says no crack but last step is ""play the game"".
Confused."
,Machine4578,2013-02-12T05:44Z,the UNLOCKED version he uploaded earlier is useless!!.. this version from FLT works perfect for me :) and has DLC!!
,Apetone,2013-02-12T05:51Z,.
,GEXterous336,2013-02-12T06:38Z,my earlier post: *nothing about crack
,clupas2,2013-02-12T08:37Z,"Works perfect!Just install and play,nothing else.Thx a lot."
,DeanRain,2013-02-12T09:08Z,"seed 4 (192)

Jó arány.."
,Jman2919,2013-02-12T09:24Z,"Thanks for the upload quick download and it works great except for the face the game is awful. Gearbox pulled another duke nukem forever and ruined a beloved series. even with the highest settings on, some games on my iphone have better graphics and polish than this and the game has terrible framerate and lag in the campaign . Just to let people know there going to be completely dissapointed when they play it and I am so glad i didn't pay for this. THis isn't jsut my opinion no review sites have gave this game higher than a 4/10 ."
,michael7998,2013-02-12T09:40Z,thanks!
,Damien_Hexicola,2013-02-12T09:41Z,"it's so sad to see noone wanting to seed, this is a brand nwew game just out and there are over 200 seeders and i'm only connecting to 9 of them, i got a 75mb/s DL speed i coulda had this game DLed and seeding fully in minutes if people would learn to leave the game seeding for others... it's very very sad that people are like this.... "
,dfiantx,2013-02-12T09:51Z,"I didn't try it before downloading the crack from heromaster and copying it as well, I also added it to the firewall to allow no traffic as suggested in other posts. It loaded up just fine all seems well Campaign is working for me. Thanks for the upload HeroMaster!"
,padisah12,2013-02-12T10:53Z,"Youtube HD Gameplay 

xHnMKSt7K9I"
,Rando_q1,2013-02-12T13:15Z,Tnx for upload! that game dose not have directx11??? 
,ZharShadowrage,2013-02-12T13:16Z,It worked perfect for me! :D But I can't play online using Tunngle. It only says that I'm not connected to steam. Is there a way to fix that or do I have to wait for another version of the game to be uploaded? 
,alex123456789123456,2013-02-12T13:18Z,@HeroMaster please upload some repack for us with low bandwith. Thank you.
[T],Knaster,2013-02-12T16:22Z,They only say its bad because of the graphic. They were expecting awesome graphic and boring play like the AvP games.....But this is more in tune with origional game :-) im proud to say i bought it. Everyone that says this game is bad because of the grapic YOU ARE FAGS
,johnyl1,2013-02-12T18:44Z,"Any1 managed to play localy on LAN, the option is there i  just can't connect!!!!!"
,johnyl1,2013-02-12T18:45Z,Any1 managed to play localy on lan???? option is there but i can connect 2 comps together!!!
,Vitez544,2013-02-12T19:12Z,"Game and crack work perfectly. Just unpack, install , put the crack in to the correct folder and play da game."
,eskewei,2013-02-13T01:05Z,"how come everytime i click ""get this torrent"" nothing happens?"
,xXxCdV36xXx,2013-02-13T05:05Z,How do you install?
,tiz2,2013-02-13T12:01Z,"@ Knaster: There's plenty of other reason. Bad AI, lots of bugs, the whole feel is wrong mainly due to the aliens being too easy to kill and not scary at all. If you can't see that, then you sir are the fag. "
,kawaiievil,2013-02-13T12:06Z,"Terrible game, Not even worth pirating IMO."
,Nut1000,2013-02-13T12:30Z,"Anyone have problem with keyboard and mouse not working in game, this one and DS3 are giving me a fit (games run beautiful) but no control - assuming it's hardware/other software related somewhere..."
,GObonzo,2013-02-13T14:30Z,"pretty crappy game. works fine, but very boring."
,atechsavy,2013-02-13T16:51Z,"nice upload but bad and stinky game...I would say this game it is a new mastershit from Gearbox.
Stupidly done, no fcking action, no nothing.."
,josef256,2013-02-13T22:58Z,"you can play multiplayer VIA TUNNGLE (lan) lots of people are actually playin
search for ""Aliens:_Colonial_Marines tunngle"" for more information"
,Dimmis80,2013-02-14T08:33Z,Thanks a lot pal HeroMaster much oblige dude.I will test the game and i hope that its not so bad like the most of the people says..
,Dimmis80,2013-02-14T08:34Z,Btw thanks FLT to.:-)))
,Furious1964,2013-02-17T18:52Z,How do you change the player name?
,kevdrgn,2013-02-22T21:51Z,Nut1000 Im having the same problem. cant use my 360 controller ether.
,kevdrgn,2013-02-22T21:53Z,having the same problem Nut1000 cant get my 360 controller to work ether.
