User Type,Username,Date,Text
,lukaz214,2013-04-18T10:21Z,"Hi

How's download speed ?"
,thewojtek,2013-04-18T15:08Z,"Hi, you are new to Torrents? Why the fuck repeat other peoples torrents that seed well?"
,FastForwarder,2013-04-18T15:14Z,"Who the fuck cares about speeds and learn to search dumb ass. This is a dupe again - http://thepiratebay.sx/torrent/8312867/Grid_MACOSX-MONEY_[Mac]

The older torrent is super fast compared to this loser's crap speeds."
,Kaien213,2013-04-18T15:45Z,Maan... At least you could've changed description -_-
,lukaz214,2013-04-18T16:10Z,FastForwarder (moron) do not see the diffrence is about half the size of that
