User Type,Username,Date,Text
,andreTPF,2013-05-02T19:26Z,"Imagem aqui: http://i.imgur.com/zxqq66P.jpg
Ocorreu algum erro no TPB e a imagem acabou não indo! "
[T],210gustavo,2013-05-03T00:19Z,"nao precisava postar este de novo, o tofushoyu(pioneiro em blu rays reduzidos) ja havia postado...

http://thepiratebay.sx/torrent/6076609/A_Lenda_dos_GuardiA_A_es_%282010%29_720p_Dublado_pt-BR

vlw..."
,andreTPF,2013-05-03T05:18Z,"Eh Gustavo, nem prestei atenção, ainda dei uma pesquisada no TPB antes mas num achei nada! Mals ae!"
[T],210gustavo,2013-05-03T16:54Z,"nao nao tudo bem kkkk, o seu deve estar com mais qualidade devido ao tamanho do arquivo final, pegou de quem o video?? vlw e continue assim amigo, está fazendo um otimo trabalho..."
,andreTPF,2013-05-03T18:30Z,"Nem lembro de quem eu peguei, tem tempo já que ele tava pronto aqui, mas acho que foi do YIFY mesmo!"
