User Type,Username,Date,Text
,seanjohn18887,2013-04-07T09:07Z,"Thank you, Thank you for posting an update for southie rules.

Hopefully, you will be able to find the rest of the series for us. But, in the mean time, keep on doing what you are doing.

Thanks again. "
[V],verovenlo,2013-04-07T15:45Z,listen my friend dont ya think they wouldnt be uploaded already if i had the 2 missing episodes
,seanjohn18887,2013-04-08T10:45Z,"Thank you for the response. I appreciate the fact that you gave me an answer. 

That's all I really wanted.

Thanks anyway."
