User Type,Username,Date,Text
,xxSetxx,2013-05-22T21:58Z,many thanks!
,MaximilianKohler,2013-05-23T06:32Z,"Will you be uploading the 5th/6th placement matches? http://wiki.teamliquid.net/starcraft2/2013_WCS_Season_1_Korea_GSL/Code_S

They were played on the same day as the code A matches in this torrent.
http://www.gomtv.net/schedule/index.gom?year=2013&month=5&date=16&leagueid=0"
,SC2Superbibi,2013-05-23T17:57Z,"I don't know if these will be released. If they are, I'll upload them so wait & see :)"
