Filename,Size,Unit
Coast to Coast AM - 27 Dec 2012 UFOs & Scientific Mysteries.2hr26m.xvid.avi,163.79,M
Coast to Coast AM - 4 Jan 2013 - Montana UFOs_Open Lines Chat.2hr30m.xvid.avi,149.19,M
Lee_Speigels_Top_UFO_Stories_of_2012_-SpecialEpisode_OpenmindsTV_SpacingOut_Ep35.36min.xvid.avi,294.09,M
MUFON_IS_2012_The Kingman UFO Crashes Have Been Found_ Harry Drew_Jan2013Release.2hr.xvid.avi,897.63,M
UFO Sightings From The Land Down Under_(Aus)_ Billy_UFO Hunter_Jan2013_4min.xvid .avi,31.34,M
UFO_or_Ghosts_Alien Sighting - A Colorado Story (Compilation)_Jan2013_11min.xvid.avi,88.26,M
