Filename,Size,Unit
Time Team S20E12 The Time Team Guide to Experimental Archaeology.avi,488.83,M
Time Team S20E09 The Lost Castle of Dundrum.avi,448.37,M
Time Team S20E07 Horseshoe Hall.avi,395.44,M
Time Team S20E01 The Forgotten Gunners of WWI.avi,395.34,M
Time Team S20E03 A Capital Hill.avi,394.56,M
Time Team S20E02 Brancaster.avi,394.42,M
Time Team S20E06 Lost Mines of Lakeland.avi,394.24,M
Time Team S20E10 Wolsey's Lost Palace.avi,388.1,M
Time Team S20E04 Henham's Lost Mansions.avi,385.99,M
Time Team S20E08 Mystery of the Thames-side Villa.avi,385.96,M
Time Team S20E13 Twenty Years of Time Team.avi,383.44,M
Time Team S20E05 Warriors.avi,383.32,M
Time Team S20E11 An Englishman's Castle.avi,382.48,M
