User Type,Username,Date,Text
,likepend1,2013-05-14T14:46Z,come on guys :) seed! seems that nobody whats to share his bandwidth anymore :/ torrent is nothing without seeding! i hope you people understand this!
,likepend1,2013-05-14T14:47Z,"and yeah i almost forgot, thx Nepotu for the great work! :)"
,TWEETY2455,2013-05-14T15:53Z,"Doesn't matter if u r a nba fan or not,what another great game.And thank again my man Nepotu. *_*"
[V],Nepotu,2013-05-14T17:09Z,"You're all welcome, guyz!"
,vidwyz,2013-05-14T23:00Z,"Thanks!

Please seed everyone! Pretty slow."
