User Type,Username,Date,Text
[V],QborT,2013-06-09T00:29Z,Should have put this in the HD section.
,Koribi,2013-06-09T01:01Z,"Yeah, I know. I uploaded it before I watched it. So I was a tad' unsure of the quality. So yeah, it won't happen next time."
,Vakabraxas,2013-06-09T04:26Z,"Awesome stuff, will seed till next episode it out."
,JDIGAMOUS,2013-06-10T09:19Z,the size should have gave away that this is 1080p which is why i downloaded it
[V],QborT,2013-06-14T03:35Z,"JDIGAMOUS, you are mistaken this is 720p.  Only [HorribleSubs] does a 1080p of this show."
