User Type,Username,Date,Text
,spikecwb,2013-02-10T03:37Z,fuck you and your spam douche bag. take your trite lame ass piece of shit site elsewhere fuqtard.
,spikecwb,2013-02-10T04:17Z,"SRT - Simply releases toppers? In MOST cases. Not in this one. Has hardcoded chinese subtitles, and then these guys overwrote the top of those with hardcoded dutch subs. 

What a waste.  Would have been nice to let us know this.

IN this case, SRT = Simply released trash.

Thanks anyway!"
,fe.aa,2013-03-03T15:49Z,"spikecwb, you ungrateful prick"
,CeAxayacatl,2013-03-05T00:15Z,Can anyone upload this with spanish subtitles? Haha Thank you : )
