User Type,Username,Date,Text
,1of4kind,2013-02-02T19:01Z,Thanks ;)
,profpeen,2013-02-02T23:45Z,"Audio is not working in my media player, in vlc it works but this is not a normal standard rip because all other shows work ok in media player."
,h0ser604,2013-02-02T23:52Z,It must feel nice to upstage the other release groups. You're the only one with this episode posted. Thanks.
,AlyH,2013-02-03T01:17Z,thanks! been waiting for this!!!
,storm2012,2013-02-03T10:34Z,"1st Auction Hunters now this, Shoreleases is showing them up. Thanks mate."
,ChiliBeef,2013-02-04T01:14Z,No audio in Windows Media Player.  Works in VLC.
,Hellius666,2013-02-04T05:24Z,AC3 inside MP4? How did you do that :) I wanna know too :)
,Eddiehjjjfcfjfc,2013-02-07T21:30Z,Thanks but wish you'd go with the same audio everyone else is using with MP4s because this won't play on Xbox 360.
