User Type,Username,Date,Text
,poutoufjouhe,2013-02-01T17:05Z,"Thanks SnakEye
Request FTX: EU EGSG Stapleford Airfield"
,Niceify,2013-02-02T08:54Z,"Love your work.

Have been downloading your FSX addons since i know piratebay.Thank you so much.

May i req: carenado sr22 cirrus  2013"
,ROBOXILL,2013-02-02T16:30Z,"I am unsure what to do with the Register.fsc file.
Where do I put it?"
,Niceify,2013-02-02T17:42Z,"ROBOXILL:

Flightsim commander 9.2 installed folder just drag and drop and it will be registered "
,ROBOXILL,2013-02-02T19:19Z,"Thanks for the help Niceify.
And another great upload SnakEye; keep them coming."
,pirzonz,2013-02-05T09:59Z,Thanks SnakEye for your contribution! :) You're the best when it comes to FSX stuff.
