User Type,Username,Date,Text
,gwapitonorf,2013-03-30T04:19Z,working on Lenovo A1107 THanks :)
,mushrox,2013-03-30T11:35Z,Unlimited Money cheat doesn't seem to work.
,mushrox,2013-03-30T11:43Z,"The directory is slightly different, at least on my galaxy note."
,mushrox,2013-03-30T11:51Z,"Actual directory has an ""s"" on the end of ""file"".  Just FYI."
,thepiratebayaashish,2013-04-22T10:05Z,Works fine! Not sure about the unlimited coins though! DAmn.I'm relieved..was stuck on stage 8 of Temple run2 for ages :D Seeding!
,thepiratebayaashish,2013-04-22T11:44Z,"Duh..this spin off id boring..Y-A-W-N. Reverted back to Temple Run 2 :D 

Thanks for upload"
,crosstoxic,2013-06-06T10:45Z,"it works fine for me., im using cherrymobile S100 also the UnliGOLD.. 
for those who want to know how I do it, just reboot my phone then I go to ""Android/data"" then right there I see a new folder named this way ""com.disney.TempleRunOz.goo"", then i copy the ""android_settings.oz"" and ""stats.sav"" from the previous folder going to the new one, then run the game and FUCKYEA., you must have 727380001 gold and diamond! "
