User Type,Username,Date,Text
,Nightwing1945,2013-03-05T22:26Z,"Awesome, thank you very much (and no, I didn't even think to check out the MTCDC, complete mindderp on my part).  Thanks."
,darthmung,2013-03-05T22:31Z,"tHIS IS GREAT, THANKS"
[V],STFmaryville,2013-03-05T22:59Z,"you're both welcome. this is a great old title. #17 is a favorite of mine, with huntress coming to earth-1 and meeting bats, robin, batgirl, for the first time -- and drawn by aparo!"
,malger,2013-03-05T23:49Z,Thank you!
,Mothra67,2013-03-06T07:25Z,"Always loved these, especially when they did the reprints from the silver and golden age in them  Thanks so much!

STFmaryville, any chance you can upload the Neal Adams run on Batman and or Detective comics?  Those were so the best!"
[V],STFmaryville,2013-03-06T07:56Z,"you're welcome malger and Mothra67.

Mothra67, i can do that -- i'd like to d/l that set for myself anyway. however at the moment i'm grabbing impact comics, faust and putting together more graphic novels."
