User Type,Username,Date,Text
,Jewsrus,2013-04-23T09:15Z,How do you turn it to english?
,mattchoi365,2013-06-04T16:04Z,how do you make it english!!!?
,mattchoi365,2013-06-04T16:20Z,"oh shit i found out how to make it english.

 go to the Bin32 folder and then locate to skidrow.ini. double click it, run with notepad if you have to and change the language to russian. hope it helped."
,mattchoi365,2013-06-04T16:21Z,"TO MAKE IT ENGLISH
-------------------------
Go to the Bin32 folder and find SKIDROW.ini. Then just change the language to english. Hope this helped."
