User Type,Username,Date,Text
,Lawry1494,2013-03-27T06:32Z,Please leave comments about the quality of this release!!!
,wolverinex01,2013-03-27T09:25Z,"careful...might be fake torrent...i downloaded this movie from AMX torrent once and it turned out fake, asking me to install a load of stuff...when i came back to piratebay, the torrent had been removed...just saying be careful of what u r downloading !!!"
,izitox,2013-03-27T11:28Z,"Subs Eng : http://subscene.com/subtitles/django-unchained/english/707663
Subs Eng Hi : http://subscene.com/subtitles/django-unchained/english/707662"
,shaaani,2013-03-27T18:09Z,"good effort keep it up, very watchable print in small size :) and no fake"
