User Type,Username,Date,Text
,EnemyDrone,2013-05-12T12:50Z,"Will comment after dl if this is TS or same CAM floating around. If someone dl's first please comment on quality. Thanks, happy pirating!"
,forloop,2013-05-12T18:22Z,"I registered just to say to you all, this is not TS Xvid, it's just another cam with some kind of Chinese logo on it. 

V = 8 (more than watchable)
A = 6 (sounds like they are talking through can or something like that, very irritating)"
,KevinCostner,2013-05-12T20:09Z,"This is not a TS, it's cam audio and it's out of sync as well.  Video quality is good, hopefully someone will come up with a nice audio track and re-sync it."
