Filename,Size,Unit
Come to the Water.mp3,6.8,M
God's Great Dance Floor.mp3,6.5,M
Once and For All.mp3,5.57,M
The Death of Death.mp3,5.32,M
I Saw the Light [I'll Fly Away].mp3,5.28,M
In Christ Alone [Newsboys Version].mp3,5.08,M
Burning in my Soul.mp3,5.05,M
Whom Shall I Fear [God of Angel Armies].mp3,5.04,M
Only Jesus.mp3,4.85,M
Don't Want to Waste my Life.mp3,4.39,M
Background.mp3,4.36,M
It's a New Day [Let It Shine].mp3,4.12,M
Shout [Let Justice Roll].mp3,3.61,M
artwork.png,9.02,K
