User Type,Username,Date,Text
,KingPumpkinX,2013-03-27T18:33Z,"Thanks a lot for this, been waiting for it for awhile now!"
,BndtKng,2013-03-28T04:57Z,"What, KingPumpkin, like a whole 24 hours? lol"
,audited,2013-03-28T06:34Z,I'll try and be faster next time ;)
,MrRussellLuther,2013-03-28T22:29Z,"Thanks for the upload! Had to edit it a bit, to have the right titles and what not! Other than that flawless upload."
,dodgyboy43,2013-03-30T06:18Z,"ty so much for this! this game has incredible sound design, the OST is perfect"
,N4o7A,2013-03-31T00:47Z,"HOT DIGGITY! Been listening to the music on youtube, thanks a bunch @audited"
,bulva6,2013-03-31T09:11Z,THX!!!!
