User Type,Username,Date,Text
,FEarBG,2013-05-23T15:27Z,"This is from and for RELOADED!

You can simply look at the ""steam_rld.ini"" file. ""rld"" stand for RELOADED. .."
,BluntzNzigzags,2013-05-23T17:41Z,whats new in the update?
,IcemanSR,2013-05-24T02:53Z,"http://store.steampowered.com/news/10685/
info on update
and Thank you for it!"
,IcemanSR,2013-05-24T02:58Z,"...............
this is a FAKE update...
fake update..it doesnt contain any changes..and even exe is identical to original reloaded exes no changes what so ever"
,IcemanSR,2013-05-24T03:09Z,"ok..those steam files do make some changes..it unlocks ""veteran pack costume"" and it boost loading screen of game a bit,exe's ,i dont know whats with sounds tho"
,IcemanSR,2013-05-24T03:20Z,"ok..those steam files do make some changes..it unlocks ""veteran pack costume"" and it boost loading screen of game a bit,exe's ,i dont know whats with sounds tho
it isnt the ""update"" update but an update of a crack from original release"
