Filename,Size,Unit
"Do Roti 1957 M3s/Do Roti (1957) 01. Title Song .. Sunlo Ji Sunlo Pate Ki Baat.. Roti Bin, Shankar Dasgupta, Suman Kalyanpur, Barabankvi, Roshan.mp3",4.03,M
"Do Roti 1957 M3s/Do Roti (1957) 02. Kaale Badariya Maare Nazariya, Lata Mangeshkar, Khumar Barabankvi, Roshan.mp3",3.3,M
Do Roti 1957 M3s/Do Roti (1957) 03. Teri Krush Ke-1.mp3,2.84,M
"Do Roti 1957 M3s/Do Roti (1957) 04. Teri Krush Ke-2, Johnny Walker.mp3",724.89,K
"Do Roti 1957 M3s/Do Roti (1957) 05. Gham Ki Huyi Haar, Lata Mangeshkar, Khumar Barabankvi, Roshan.mp3",3.51,M
"Do Roti 1957 M3s/Do Roti (1957) 06. Badi Pyari Kahani Hai, Lata Mangeshkar, Mohammed Rafi, Khumar Barabankvi, Roshan.mp3",2.74,M
"Do Roti 1957 M3s/Do Roti (1957) 07. Ghir Se Barse Yeh Ghatayein Toh, Geeta Dutt, Mohammed Rafi, Khumar Barabankvi, Roshan.mp3",2.74,M
"Do Roti 1957 M3s/Do Roti (1957) 08. Sunlo Ji Sunlo Pate Ki Baat.. Roti Bin Jeevan Hai, Shankar Dasgupta, Suman Kalyanpur, Khumar Barabankvi, Roshan.mp3",1.3,M
Do Roti (1957) Xvid 2cd - No Subs [DDR].avi,1.37,G
Torrent Downloaded From ExtraTorrent.com.txt,337,B
