User Type,Username,Date,Text
,Samsung04,2013-01-26T01:23Z,"VLC media player es el mejor reproductor.

Características

Simple, rápido y potente reproductor multimedia.

Reproduce todo: Archivos, Discos, webcams, dispositivos y arroyos.

Reproduce la mayoría de los codecs sin paquetes de codecs necesarios:
MPEG-2, DivX, H.264, MKV, WebM, WMV, MP3 ...

Se ejecuta en todas las plataformas: Windows, Linux, Mac OS X, Unix ...

Completamente gratis, software espía 0, 0 anuncios y no de seguimiento del usuario.

Se puede realizar la conversión de los medios de comunicación y de transmisión.

http://www.videolan.org/vlc/"
,Samsung04,2013-01-26T01:34Z,"todos los episodios de one piece sub spanish clic aqui: 

http://thepiratebay.sx/user/josepmr/"
,jose1907,2013-02-06T20:16Z,"esta muerta en un 72.7%, no esta terminada de subir.... :("
