Filename,Size,Unit
ASH - Let me Show You Love (ASH & AVicii Hype Machine Mix).mp3,8.71,M
Avicii ft Lana Del Rey - Dance in the Water.mp3,7.26,M
Avicii ft Aloe Blacc - Wake Me Up.mp3,7,M
Avicii - ID.mp3,6.93,M
Avicii ft Dan Tyminski - Brother-Sister.mp3,6.67,M
Avicii ft Salem Al Fakir - Someone Like You.mp3,5.7,M
Avicii ft Linnea Henriksson - Hope there's someone.mp3,5.48,M
Avicii ft Aloe Blacc & Mac Davis - Black & Blue.mp3,5.46,M
Avicii ft Audra Mae - ID2.mp3,5.39,M
Avicii ft Audra Mae - Addicted to You.mp3,4.13,M
