User Type,Username,Date,Text
,Wagzy69,2013-03-10T02:41Z,Thanks to the 5 seeders. Getting about 400-500 kb/s. Should be done in 3 hours then ill seed for a day or so :)
,iBen95111,2013-03-10T02:50Z,"Seeding at full speed for you guys.
Enjoy"
,eca2792,2013-03-10T03:39Z,"394 kB/s i got 3 hours left, as soon as it's done i'll seed for an entire day :)"
,johnkdbell,2013-03-10T03:47Z,"@Wildzide

The game was definitely not Spore. I got the game (Leaked) 3 days before it was released right here on the Pirate Bay. It never had always on DRM, though it did have an online community where you could download creatures and stuff that those who didn't register the game couldn't get.

I think you are mixing up Darkspore with Spore. Though, "
,jonoking,2013-03-10T04:07Z,SEEED PLEASSEEEE
,barabusignasius,2013-03-10T05:08Z,"@coreva   Yes I have one, post your phone number so I can call you get your info :)"
,Kyzaca,2013-03-10T08:06Z,"@coreva Wow, don't do that."
,MCNexus,2013-03-10T08:22Z,Watch the skidrow site for updates
,MCNexus,2013-03-10T08:23Z,Watch the skidrow site for updates.....
,mlmariss,2013-03-10T08:46Z,"1d 10hrs seeded, 6.10GB uploaded, avg. upload speed 51KB/s, best I could do and here You go! 16+ seeders with 100% downloaded game!

We are still waiting for crack! :)"
,galandras12,2013-03-10T09:50Z,"Does not work.
:(
El van cseszve..."
,Stavros0141,2013-03-10T10:05Z,I heared that Skidrow and Reloaded workingon this crack be patient it is difficult to crack it if you want it go buy it or wait for the crack.The only way to get it  sooner is to hope EA to make an offline patch
,bladexdsl,2013-03-10T10:32Z,don't buy this don't support EA colossal fuk up of a DRM you can't even play it their servers always crash! wait for a crack than you can stick it up their ass!
,EA-Agent,2013-03-10T11:26Z,"listen to me!
no one can crack this kind o drm, I mean online-server drm,
so the best way to play this game is to buy this game, no other ways.
If you like this game, don't be a pirate."
,barabusignasius,2013-03-10T11:28Z,@gutendo22   I will do it cheaper.  message me and Ill tell you where to send the money order.
,EA-Agent,2013-03-10T11:29Z,"listen to me!
no one can crack this kind o drm, I mean online-server drm,
so the best way to play this game is to buy this game, no other ways.
If you like this game, don't be a pirate."
,barabusignasius,2013-03-10T11:33Z,"Hey everyone, skidrow is my buddy he's sitting right here next to me as I type this (he's waving).  He says if you all donate $5 to pirate bay he will get the crack out quicker.  It's a tax deduction so you'll get it back. :)"
,eca2792,2013-03-10T11:48Z,Seeding! =)
,Neowarex,2013-03-10T11:51Z,"I am uploading from my server full speed to help out got a ratio of 19.116 atm and uploaded 72.6 gb. 

I hope we get a crack soon, thanks to everyone who is working on it!"
,barabusignasius,2013-03-10T12:04Z,"Holy crap!!   Guess what?!!  I took out my cpu, cleaned it and reseated it and now it works!!  Im not kidding!!"
,EA-Agent,2013-03-10T12:07Z,"Diablo 3 used online-server drm, nobody can crack it,
You pirates must know crackers have their limits.
Now simcity uses the same drm, of course nobody can crack it either.
Play this game with honor, and be a man of honesty."
,xpolska,2013-03-10T12:10Z,Anyone have a potential ETA on crack?
,chuvaksimpson,2013-03-10T12:22Z,how to play?
,klingen91,2013-03-10T12:38Z,"Does skidrow have a ""REAL "" website?"
,Krathar,2013-03-10T12:44Z,"@EA-Agent: That's what they said with Ass Creed 2. Oh it's uncrackable! And they made a server emulator. Yes, it's hard to emulate everything and it probably might just exhaust crackers to the point of abandoning the project, but it's doable. Most of all, I will never, ever buy anything from a company that puts singleplayer content online. And anyone who does buy those kind of games lacks any kind of self-respect and is setting himself up to be a bitch of the gaming companies - just a puppet without any opinions or will that'll buy anything like a good little slave. I will not have my gaming experienced fucked with because some company decided to add inane DRM."
,eca2792,2013-03-10T12:51Z,Does anyone have a working serial though? 
,jstowe,2013-03-10T13:24Z,"@Krather I couldn't agree you with you more, anyway downloading this right now 60% done will seed for a bit once done."
,snickers77,2013-03-10T14:55Z,"EA-Ange just leave dude, no one gives a flying fuck about you"
,Dexric,2013-03-10T16:31Z,"hey your new crack is taking forever to come out-
MY BRAND WHYYYYYY!"
,Josh544,2013-03-10T17:36Z,"Thanks so much, I'll comment if it works"
,excluse,2013-03-10T18:36Z,"@EA-Agent

Anything can be cracked, i've seen these drm's turned into online emulators, lots of times, so if you may, keep the bullshit to yourself."
,Dexric,2013-03-10T18:41Z,.
,noland29,2013-03-10T19:38Z,How do I install it?!
,Suldar,2013-03-10T20:04Z,"@EA-Agent: Your claims of it being uncrackable remind me a lot of Blu-ray and HD-DVD... look what happened to them. 
Comparing this to D3 is fruitless, at least Blizzard was giving D3 away to WoW customers, and they at least honored their refunds that they promised. EA is giving away Origin bans to people requesting refunds :P"
,Plansnake,2013-03-10T21:19Z,"NEVER buy this game wait for a crack, and i promise someone is going to crack this :)"
,Dexric,2013-03-10T22:54Z,Anyone know if that FLT one is legit?
,o2gulo,2013-03-10T23:52Z,"No, I don't think the FLT one is legit. Not sure though. A lot of fakes have been popping out."
,Dexric,2013-03-10T23:55Z,","
,Wagzy69,2013-03-11T01:58Z,"For anyone who can't wait for a crack but doesn't want to pay full price or this game, Check this out 
http://www.kotaku.com.au/2013/03/this-is-how-you-can-pick-up-a-copy-of-simcity-for-27-australian/"
,Apprivoise,2013-03-11T03:18Z,the flt was a fake it ask you to do a survey its been taken down
,laks311,2013-03-11T13:42Z,I cant stand this shit i buying game and when i buy game i post crack for all people 
,klampflm,2013-03-11T18:04Z,"@laks311: please, go ahead!"
,IronicParticle,2013-03-11T18:53Z,Don't listen to MenForYou... it's a survey.
,laks311,2013-03-11T21:15Z,my friend give me this link and tell me it works but link wont post how to post fuckink link to crack
,laks311,2013-03-11T21:25Z,someone reportme it works i plant to buy this game tomorow
,Solaria14,2013-03-11T22:05Z,No crack yet.  Just keep waiting.
,bladexdsl,2013-03-12T05:10Z,"2km x 2km cities what the fuck were they smoking?! this isn't simcity it's sim neighborhood!
cities XL is better than this
yet another game franchise fucked by EA

that's red alert, the sims and now simcity they have TOTALLY FUCKED!!!!!!!!"
,barabusignasius,2013-03-12T08:56Z,@bladexdsl   wtf are you talking about?   You really think it EA's decision as to how big cities can be?   EA is publisher not game developer.  If you're going to be a hater at least know what you're hating dip shit :)
,keostorn,2013-03-12T13:02Z,Stop spaming fith fake cracks 
,bilaljai,2013-03-12T15:55Z,is this the real deal or olso a fake
,conradoele,2013-03-12T21:58Z,Como cuernos instalo el juego?! Me quiero volver chango!!
,Overlord1928,2013-03-12T22:32Z,"As if EA didn't already look bad enough here is evidence that they were bull******* us about the impossibility of offline play and pretty much proves that the game could and most likely will be cracked.

http://www.rockpapershotgun.com/2013/03/12/simcity-server-not-necessary/"
,Ironb0und,2013-03-13T19:35Z,"@barabusignasius Of course it's EA. EA always control what the developers do, way too much. If it was up to Maxis, it would've been like Simcity 4, just up-to-date and no DRM shit. EA never let the developers have the freedom they should have."
,TheEmperorSRB,2013-03-14T19:47Z,"They finally did it. Someone made a offline version of the game. Here is the proff video:

/watch?feature=player_embedded&v=Bmce9oIxJag"
,abaasy,2013-03-15T00:24Z,"Support this project, we all hate EA: http://www.kickstarter.com/projects/1584821767/civitas-plan-develop-and-manage-the-city-of-your-d"
,jpweb72,2013-03-15T20:46Z,fucking spanner stop already
,bladexdsl,2013-03-16T07:58Z,"don't download anything from that mega,fuck, ultra tard bot cunt!"
,X33s,2013-03-16T11:23Z,Did this version still need Origin?
,bladexdsl,2013-03-16T12:01Z,@ miskololz 100 % fake now fuck off you queer cunt!
,nostress1993,2013-03-17T00:50Z,"Não consegui instalar, alguém ajuda? Clico em Touchup e Cleanup e nada acontece... 

(Can you help me to install it? I clicked in Touchup and Cleanup, but nothing happen)"
,Dexric,2013-03-17T13:57Z,The wait continues
,Dexric,2013-03-28T01:21Z,COMMENTS!
,weltall2,2013-03-30T10:44Z,"How many torrents of the same useless SimCity, without crack, will appear on here?"
,odaic,2013-03-31T17:04Z,survey
,odaic,2013-03-31T17:06Z,It's a survey.
