User Type,Username,Date,Text
,mlmariss,2013-03-08T22:11Z,"INFO from SkidrowCrack page, where I downloaded:
SIMCITY DIGITAL DELUXE EDITION-FULL-SC
Release name: SimCity.Digital.Deluxe.Edition-FULL
Size: 3.79 GB (4,079,422,242 bytes)"
,hollisb,2013-03-08T22:26Z,fake
,hulmenaio,2013-03-08T22:28Z,Slow speed oO
,Verl1290,2013-03-08T22:29Z,SkidrowCrack is not skidrows page pretty sure skidrow games is if u notice simcity isnt on the one i mentoned
,klingen91,2013-03-08T22:30Z,Skidrow page is 8 gb
,uran1001,2013-03-08T22:31Z,"ty for sharing mate, since downloading via those bshit links that skidrow gaved is pain in the arse. ur a mini hero :D cant wait for crack RAWR"
,mido009,2013-03-08T22:31Z,i already downloaded it from there
,Verl1290,2013-03-08T22:32Z,..
,halffinger,2013-03-08T22:35Z,"it must have been really hard to get all the .rar I got pissed off trying to get them and I couldn't,hope to see a crack soon."
,wayoff333,2013-03-08T22:38Z,"Can't install it, connects to origin servers"
,DarthTauri,2013-03-08T22:41Z,"You know, without a crack this is quite useless to the torrenting community... what i have heard about the game it may be impossible to crack."
,sld445,2013-03-08T22:41Z,looks like this is not going to be cracked maybe ill try to buy the first pc game in my life!
,cedricberube,2013-03-08T22:41Z,"so, this is the new simcity and we have to wait for the crack."
,Don_Bianco,2013-03-08T22:48Z,"This file is the correct size that it is on Skidrow's website. Its probably legit, but there's no crack yet. We might have to wait a few weeks or even months for it to be cracked."
,klingen91,2013-03-08T22:50Z,Its the same fake 
,klingen91,2013-03-08T22:52Z,Tomorrow i gonna buy it. Have fun to wait for it
,iBen95111,2013-03-08T22:55Z,Now all that has to happen is for us to get past 1%
,beLIEver8,2013-03-08T23:02Z,Skidrow has a crack up now. It's just damn near impossible to get around the spammy surveys. Guess we'll have to wait until a legit crack comes out.
,LiquidQC,2013-03-08T23:06Z,"No there probably won't be a crack for this because its an online game but there will be private servers sooner or later, just like how there where private servers for Diablo 3 and The War Z."
,Don_Bianco,2013-03-08T23:07Z,Anyone give it a shot yet?
,klingen91,2013-03-08T23:10Z,Download this for what? No crack
,Don_Bianco,2013-03-08T23:15Z,"So what if there's no crack, if this is legit, it'll save you time once there is a crack. I'm not going to buy this game until the server problems are solved, right now it's a waste of 60$"
,Cainn23,2013-03-08T23:15Z,"Maybe it will be cracked, maybe it won't. The important thing is to not purchase this game. If you do, you are supporting EA and all future games requiring an online connection to play. Even single player. Speak with your wallets."
,Dexric,2013-03-08T23:17Z,"@beLIEver8
So there's no reason the LIE in your name is capped?"
,Don_Bianco,2013-03-08T23:18Z,What the hell is going on with the comments on this site the past few days.
,MhaveNN,2013-03-08T23:19Z,"Reply to: Can't install it, connects to origin servers.
You can install it, but you can't play it because it will connect to origin servers hence there's no crack yet and this game is ONLINE only. No clue why but they didn't add a single player which sucks."
,PixelatedMadness,2013-03-08T23:26Z,"@klingen91. For what you say? Well old chap, that is simple, you can download this right now and then apply a crack once released.

Also, for all you imbeciles, this is quite simply a mirror of a legit game, it does not contain any crack and without a serial-number you can forget trying to even launch this."
,klingen91,2013-03-08T23:27Z,60 dollar? On Sweden the procent is 35dollar
,klingen91,2013-03-08T23:31Z,Yeeah sit and wait for you fucking crack stupid
,Don_Bianco,2013-03-08T23:33Z,@klingen91 dude why are you so hostile to people.....
,Kamadas,2013-03-08T23:35Z,because he's the stupid?
,sososo93,2013-03-08T23:39Z,"@hollisb
fuke not fake !!"
,klingen91,2013-03-08T23:42Z,No but its so boring with all those fake shit. Sorry
,Yamamoto1,2013-03-09T00:00Z,"@klingen91 

Download it and wait for crack you retarded fagot"
,godziothc,2013-03-09T00:01Z,"im really tired of everyone saying ""skidrows site"", i mean every torrent there is a comment like that, there is always another comment explaining that scene groups DO NOT use websites of any sort to distribute their work, NEVER...but i probably just wasted 2 minutes of my time anyway"
,bigdrago,2013-03-09T00:22Z,So.... is this real or just another fake?
,Dj0x,2013-03-09T00:24Z,"They need keygen ? If yes , anyone can give it please !"
,Don_Bianco,2013-03-09T00:33Z,"It's real, there's just no crack/private server yet so its unplayable. Still worth the download though, so when the crack does become available, you'll just have to get that instead of a big file. If this were fake, like all the others, it would have been removed awhile ago :)"
,Don_Bianco,2013-03-09T01:05Z,Hate that people leech but don't seed....
,wayoff333,2013-03-09T01:06Z,Thanks for the awesome reply @don_bianco :)
,mordin999,2013-03-09T01:17Z,"Its probably legit, but still a waste of time. Simcity is DRM online only game, like Diablo3 and people still waiting for it be cracked..."
,veselinve,2013-03-09T02:00Z,put the crack on the simcity folder
,CMAY96,2013-03-09T02:18Z,why does pirate bay keep deleting simcity torrents
,Kamadas,2013-03-09T02:21Z,You can always make a new one and make my day
,Deeh1901,2013-03-09T02:34Z,"Gonna download this and test the bypass, not sure if its fake"
,Kamadas,2013-03-09T02:36Z,you shouldnt...
,Deeh1901,2013-03-09T02:38Z,"Cool, the download just doesn't start."
,folkman87,2013-03-09T02:45Z,we need seed with more than 6.1%. anyone?
,folkman87,2013-03-09T02:49Z,this link to the crak is unavailable
,folkman87,2013-03-09T02:54Z,the second one is working. sorry.
,csillesa,2013-03-09T02:59Z,"Actually got to download the bypass, but am having trouble getting the modified .par file, damned hosting site won't let me download it even if I went though with their so called 'survey'.  Sad."
,klingen91,2013-03-09T03:05Z,stop trying to start the game you have to wait for crack....if its coming any crack at all
,lucassouza1996,2013-03-09T03:07Z,"I started the download 10 minutes ago, 6,5 % of the game was download (254 MB), that give me a average of 423 kbps of download speed, I think it's very good :)"
,Don_Bianco,2013-03-09T03:18Z,"The amount of seeders keep going down, but the leechers keep going up. You guys are stupid, if you only leech, you'll never finish the download."
,NZ-Wanderer,2013-03-09T03:40Z,"Why the hell make us jump through hoops to get that small file? - half the time those ""do a survey and we give you the file"" never work.
Can't people actually be nice any more."
,Don_Bianco,2013-03-09T03:46Z,"@NZ-Wanderer the one i clicked didnt ask me to do a survey? It was a 120 second wait, then it downloaded in browser right away."
,magimat,2013-03-09T03:46Z,anyone can confimr that this bypass actually works? sound like a fake to me.. but who knows!
,NZ-Wanderer,2013-03-09T03:53Z,"Yea, don't bother trying to get that bypass file, even tho you may get to complete one of the things they want you to do the damn site doesn't unlock the file..
So DON""T even try, its just a waste of your time..
If I mamage to find it elsewhere I will upload it to a FREE site that doesn't require you to do all kinds of shit, but I cannot find it so far."
,NZ-Wanderer,2013-03-09T03:55Z,"@Don_Bianco sorry to say but I got redirectd to a page which requires me to do one of 4 things (install junk) to get the page unlocked which contains the file..
If you have the file, can't you just upload it to a file sharing site? :) or give it to one of us to share around :)"
,Don_Bianco,2013-03-09T03:56Z,"@Nz-wanderer dude, i used this one, there was no survey, and my anti virus didnt flag it. http://bayfiles.com/file/IYo3/T3jVIy/simcity_origin_bypass.zip"
,doctornickau,2013-03-09T04:00Z,http://bayfiles.com/file/IYdJ/qDu9Hu/simcity_origin_bypass.zip is a fake. Anything with surveys and some simcity torrents have been total rubbish. 
,NZ-Wanderer,2013-03-09T04:00Z,"Yup, I got that file easy enuff, BUT you try running that EXE dile inside the file, it opens the program, BUT then tells you you have to go on the internet to download another file (par one) that's when you get taken to pages which require you to do stuff :("
,Don_Bianco,2013-03-09T04:02Z,"Ohhhh shit okay, I see what you mean now."
,mikedongs,2013-03-09T04:04Z,"Guys, if you ever see a ""crack download"" link pointing to bayfiles.com *DO NOT FOLLOW IT*

They arent real, ever. It's just another bullshit site that tries to trick you into downloading other bullshit and install adware all over your machine. (in this case, bayfiles tries to trick you into installing iLivid, which is a useless download manager that shows you ads all day long, as if there aren't enough ads in the world already.)

And if  you go to ANY site claiming you must complete a survey before downloading something *JUST LEAVE* because NONE of them are legit. Also, if you look, they all say ""if it doesn't download after completing a survey, just take another survey and it should go.""

That means it's fucking fake. Let me repeat for the slow people: *NOT ONE DOWNLOAD-FOR-A-SURVEY WEBSITE IS LEGIT*!!!"
,NZ-Wanderer,2013-03-09T04:07Z,Soo unfortunately it looks like everyone here is back at square one waiting for Skidrow to give us the proper files :) 
,Don_Bianco,2013-03-09T04:08Z,"Well no, this is a real game download, we just can't play it till it's cracked :)"
,Kyzaca,2013-03-09T04:25Z,Fuck my life.
,britton27,2013-03-09T04:42Z,"This is great that some one posted the game finally (it was out on the 5th on another site) but there is no point in downloading it. Why? 

Because chances are since it uses online activation this ""retail"" copy will not work with any released crack. This one's not going to be as simple as copy and paste some hacked EXE file. 

IF it is ever cracked, an entirely new installer system will have to be created in order to bypass the Origin software that forces you to use it to activate the game. Think about that before you jump the gun and waste your download/upload bandwidth on this torrent. 

This game will have similar protection like Diablo III and to date there is no crack or hack to simulate the online mode 100%. 

-two cents"
,040147,2013-03-09T04:43Z,hold on guys im actually working on a crack i think im going to be done by 1:45 am if everything goes well ... and im not lying .. u can believe what u want
,Don_Bianco,2013-03-09T04:44Z,"Bah i've got 250 combined per month, so a ~4 gig file isn't a huge loss."
,Kamadas,2013-03-09T05:08Z,"what does this ppl get by posting this survey shit around? dunno whats more retarded, the ppl that makes it or..."
,nghurani,2013-03-09T05:26Z,"hey if you have a crack your working on, cool.  I'd love it if you posted it on here"
,SAxCoco,2013-03-09T05:30Z,@britton27  Diablo III have private servers mate :D
,mikedongs,2013-03-09T05:43Z,"040147: uh, yeah okay. so have you reverse engineered the entire SC5 server protocol now? have you written not only a crack, but also a program that causes the required gameplay elements to occur that normally are handled by the EA servers?

mmm. 1:45am eh? yeah right dude, good fucking luck. doesn't sound like you know what you're doing if you think you can do it that fast."
,shotgecko,2013-03-09T05:53Z,"Guys, seeing as people who have actually purchased the game can't even play it, it's going to be a while until pirates can. Don't just download things thinking you're one step closer. If you want it that badly, just buy it. "
,040147,2013-03-09T06:10Z,mikedongs/ not really ive been working on it for days ... yes it its hard to do and im not working alone ... at least theres some people trying to do something here ... u dont have to be rude  and i said if everything goes well we could actually have a crack ... we are hoping for the best so we can all finally play this game
,040147,2013-03-09T06:12Z,its really hard to do but not impossible
,Machine4578,2013-03-09T06:15Z,the only way there will ever be a crack for this game is if EA decides to make an offline patch.. similar to what Ubisoft just did for HAWX2..
,mman360,2013-03-09T07:30Z,"@040147

I hope you speak of truth. Will need to redownload or just download the crack.

@Machine4578

This is not the first time EA fucked us in the ass with bs online crap... "
,MadRevolver,2013-03-09T07:43Z,If there will not be offline mode from EA I think I will start a java emulation project like was for Lineage 2. It will good for my programming training.
,MadRevolver,2013-03-09T07:44Z,it will be good*
,Kamadas,2013-03-09T07:50Z,pls more fakes Im getting bored.
,mlmariss,2013-03-09T08:22Z,"1. There is no uncrackable game, like with Ubisoft, where it was connected to servers..it just took a bit more time and new solutions to find..

2. Yes, my upload speed sucks and still i'm gona leave it so You can get it. As soon as more of You will have 100% game, speed goes up.

3. If it's usable or useless - we will know only when some work-around solutions will come out.
I'll better have the Game before crack comes out.

4. I don't recommend to buy this game. Check official forums, there are a LOT of cries and complains in there..MANY of them claimed that this is the waste of money.. I'm just warning You..

5. If You don't want - I'm not forcing You to download it :) I'm just another source for the *.rar'ed version that is on internet.

Proudly Pirate from the Bay for Years"
,040147,2013-03-09T08:33Z,"Machine4578: 

im being serious here..... i mean, skidrow is working on it too .. go to his page! theres a lot of ppl trying to crack this game ... everyone wants to be THEE one who cracked simcity .... it would be like the first man on the moon kinda thingy .... btw its going to take some more time ... EA did fucked all of us up the ass this time... but theres always a way pal"
,johnkdbell,2013-03-09T08:41Z,"What the fuck is going on? There is almost 900 Leechers and 12 Seeders! Come on guys, SEED!"
,hollisb,2013-03-09T09:04Z,"um, skidrow doesnt have a site."
,MadRevolver,2013-03-09T09:04Z,noone cares to race who will crack it first. Is a matter of hobby and learning new stuff.
,alex990504,2013-03-09T10:21Z,"Good luck to anyone who is trying to crack this game.Anyway,50 euros is fucking expensive.
040147:Is this game different from HAWX 2 ?Nobody ever made a crack for it.Simcity might be even harder to crack.But,I think you might make it:)You will become one of The Pirate Bay's hero."
,boky90,2013-03-09T10:25Z,"For those of you who say that games that originally require an Internet connection in order to be played, and thus cannot be cracked... you're wrong. There were tons of games that required the Internet connection and were still cracked by either notifying the player that his/her connection should be disabled (so the game doesn't connect to the servers) or by simply disabling the internet connectivity requirement in the game (where the game notifies that it cannot connect, even though your internet connection is on).
It CAN be cracked, it's just a matter of when. IT guy here."
,MadRevolver,2013-03-09T10:33Z,Diablo 3.
,leftpirateboat,2013-03-09T10:35Z,"THERE IS NO SKIDROW SITE, OR RELOADED SITE OR WHATEVER, THOSE ARE JUST SITES MADE BY INDIANS, FULL WITH SPAM"
,KarellenX,2013-03-09T11:09Z,"WTF? SimCity 5 from MonsterRing13 just disappeared from TPB... 

magnet:?xt=urn:btih:ab325dd65eb0cd466f2996e7c14ef90d4b72788f&dn=SimCity+5-RELOADED&tr=udp%3A%2F%2Ftracker.openbittorrent.com%3A80&tr=udp%3A%2F%2Ftracker.publicbt.com%3A80&tr=udp%3A%2F%2Ftracker.istole.it%3A6969&tr=udp%3A%2F%2Ftracker.ccc.de%3A80"
,TomanPCM,2013-03-09T11:22Z,SimCity 5 from MonsterRing13 WAS FAKE!!!!!
,k4m1k4z3_pt,2013-03-09T11:24Z,"I just want to say that I agree with Machine4578 and britton27. This on-line only game content parts has proven to be the safest way for greedy game companies to have their games crack-proof. Had to be the greedier one's, E.A. and Ubisoft. Only when the cost of maintaining the game servers is too high in relation to the number of players actually playing the game will they release the offline patch. Still, i really apreciate the effort of all the ppl trying to crack the heck out of this."
,jpweb72,2013-03-09T11:25Z,"KarellenX it was another fake  dont download it i screw up my firewwal due to a beta that was posted and then removed
 is not going to be soon that we seen i working crack"
,uran1001,2013-03-09T11:27Z,"Skidrow don't have a site.They(Skidrow, razor1911, reloaded etc.)  are very secretive so if they had a site it won't be 
a difficult job to track them down. These skidrowcrack , skidrowgames are just a site that 
have no relation with skidrow."
,jpweb72,2013-03-09T11:30Z,"just to let pleople know 
the guys that bought this game are not happy no saved when we want and other things too 
i bought diablo 3 and it was a ripoff the game sucks 
i was thyinkingt in buying this one but do to EA being to gredy i wont buy it
this game will not be city simulation that we all want"
,TheGamg,2013-03-09T11:44Z,Is this real?Do i download or wait for crack?
,TheGamg,2013-03-09T11:49Z,Do i download this or wait for crack?
,TheGamg,2013-03-09T11:50Z,Sorry for dubble post :/
,BrownCan,2013-03-09T12:13Z,"Guys, if this game ever gets cracked, that'll mean pretty much any other game that EA pops out with will be much easier to crack ( if the game will require internet to play )."
,bigdrago,2013-03-09T12:17Z,Since it haven't been removed yet I guess it's real?
,Machine4578,2013-03-09T12:18Z,"@040147

there is NO SKIDROW WEBPAGE!!!! NOOB!!!! and anyone saying they are working on a crack on those fake sites is full of it!!!

@mlmariss
the ONLY reason we have a playable HAWX2 is because Ubisoft released an offline patch otherwise that game would still be uncraked!!!!"
,IkaroBR,2013-03-09T12:21Z,"it is real, but haven't crack."
,bigdrago,2013-03-09T12:41Z,5 kB/s :/
,bigdrago,2013-03-09T12:49Z,"Machine4578:

It's because HAWX 2 wasn't a big game as SimCity! Noone cared to crack it :)"
,SSJASON,2013-03-09T13:24Z,The crack is gonna take forever due to online all the time DRM.
,uran1001,2013-03-09T13:50Z,"ofcourse this is fake, this is downloaded fro mso called skidrow site, which isnt genuine, jsut some cunts made site with thsoe survey downloading bullshit. obviously this is fake not even waisiting my time"
,Serenifly,2013-03-09T13:57Z,"The online requirement isn't really the problem here. Starcraft II for example has an offline mode that only disables achievements. But SimCity saves its games online. Even if you can remove the connection requirement, there will be no way to save the game."
,mati99,2013-03-09T13:59Z,"Fuck EA, simcity have to small towns, dont have underground  subway, dont have collision-free path roads and others cuz those things was just cuted out to make anothe 40$ dlc. 

The game is fucking boring after 1h of playin u dont know how to fix smth cuz u dont have capabilities.
For example trafic. If is it too big u will do nothing with it cuz ur town is 
1. too small
2. u dont have any more types of roads that will help u 
3.This 1 road to enter city is made by fucking genius!

This game is not epic like simcity 3000 or simcity 4. 

And im not w8in for the crack because this game is fucking shit."
,kopparr,2013-03-09T14:01Z,plzz seed
,bozo5573,2013-03-09T14:39Z,"Does anyone knows how much the game really costs, on the http://www.simcity.com/en_US/buy
say 59.99$ and when i press buy it says 59,99€?
That's a big difference,"
,zero1zero,2013-03-09T15:02Z,"This game is getting shit on for having one of the worst launches for a new game. It's basically broken and unplayable. I wouldn't even download it, much less buy this crap. It IS from EA after all."
,jedimindtriks,2013-03-09T15:07Z,"set proxy to india.

buy the game for 28$  (1500 rupies or w/e the fucking brownies use)

Btw. the game is awful."
,gumertag,2013-03-09T15:36Z,http://thepiratebay.sx/torrent/8122263/Cities_XL_Platinum_MULTI7_Steam-Rip_CRACKED-RG_GameWorks
,Kamadas,2013-03-09T16:25Z,now WTF has Cities XL have to do with this ffs
,klingen91,2013-03-09T17:24Z,What do you people think about how long it can take to make a crack to this game?
,Wazzaper,2013-03-09T17:28Z,I wonder when will they crack it...
,Kamadas,2013-03-09T17:33Z,wonder if...
,Overlord1928,2013-03-09T17:44Z,"They probably will, can't remember the game, but a while back either EA or Ubisoft released another pretty intense always-online game and Skidrow eventually cracked it, but it took them between 1-2 months to do it. I have no problem waiting, clearly this is one of those cases where a pirated version will be better then the actual retail game."
,eduazy,2013-03-09T17:55Z,can you merge all files into one .rar?
,DeMoOL,2013-03-09T18:23Z,"OMG!!! 21/2071 leechers,  thanks seeders!"
,Dexric,2013-03-09T18:25Z,Any news on a crack yet?
,klingen91,2013-03-09T18:44Z,what is this?http://tholman.com/playable-simcity-2013/
,for4piracy,2013-03-09T18:50Z,"$70 for the ""deluxe"" edition!!! and probably more than $50 for the DLC's. Hope the crack is out soon"
,klingen91,2013-03-09T19:10Z,reloaded has been up for a while now is it real??
,xpolska,2013-03-09T19:32Z,Hey guys does anyone know if this crack is legit? I am still downloading the game --> diabloiiiserver.com/secured/VB/SC-2013-CR.zip
,klingen91,2013-03-09T19:32Z,does this have virus. my virus program detect virus in exe file
,barabusignasius,2013-03-09T19:39Z,"It's utterly shocking how many stoopid people there are here.  If they're like 12 year old's it's excusable but if that's the case they should shut up, watch, listen and learn."
,mlmariss,2013-03-09T20:01Z,"I'm seeding, it's 79% of second next downloader, be patient! Got very low upload speed, but it's gona increase when another downloader will get full download. 
Game is from other source - not my credit, I'm only intermediary. 

Waiting for crack. I'm sure this game is not worth buying.. :) Keep calm and be patient."
,iBen95111,2013-03-09T20:15Z,"Thanks mlmariss.
Will be seeding at full speed for 48 hours to let other people get 100%.
How fast is your upload?"
,Opteron82,2013-03-09T20:23Z,"Do you guys know what are you talking about...Can be cracked like any other game...

LOL

1. Game saves cities on EA Servers not on your computer.
2. The glasbox engine is on EA Servers and the game cant run without GBE.

So Crack? Maybe. NEXT YEAR!"
,CMAY96,2013-03-09T20:30Z,your better of to go to future shop break open the game pack and take a pic of the serial code then use that then wait for a crack
,Wazzaper,2013-03-09T21:07Z,Lol...It will be cracked skidrow cracked games like this before.
,Wildzide,2013-03-09T21:19Z,"@Overlord1928
Yes, that game was Spore, it was always DMR but they managed to crack it."
,gumertag,2013-03-09T21:27Z,"""Kamadas en 2013-03-09 16:25 CET:
now WTF has Cities XL have to do with this ffs""

since simcity still does not work and after reading the comments that say probably not crack prompt output and apparently the game is bad, if not stupid to have animations like a dinosaur destroying buildings, I thought it appropriate to share the link of a torrent in the pirate bay about Cities XL, an excellent game that currently works.

... sorry for writing this text in English if it contains grammatical errors, I used the google translator."
,Opteron82,2013-03-09T21:34Z,"@Wazzaper

The problem is that there is no game like this.

GBE works and runs simcity on EA servers...so basicly to make a crack you have to get GlasBox engine wich is not implented in the game and only exists on servers ;) Simple as that.

I have the game and only downflaw is the size of cities...servers are running now almost smoothly...EA have some more work to do but besides that the game is good ;) i like it"
,Opteron82,2013-03-09T21:39Z,"@gumertag

Well Cities XL has a problem on using multiple cores. Cities XL is a solid game but can never be compared with SC.

Why so many users dont like SC is because of servers and not the game itself. As EA was so stupid that they never saw a mass going online for a game we have waited 10 years.

The game itself is fantastic and playing it in multiplayer with other people just makes it more fun.

I'm playing it like crazy...since the download (7th in Europe) i havent stoped ;)"
,klingen91,2013-03-09T21:50Z,Opteron82 can not say it better
,gumertag,2013-03-09T22:00Z,"ok Opteron82, just tried to provide an alternative to the current delay in crack simcity, since Cities XL also serves to build cities ... basically is for new users who did not know either and, until a crack simcity work, have something to play ... cites xl :D"
,gumertag,2013-03-09T22:02Z,Cities XL* ;)
,rplix,2013-03-09T22:50Z,"Went from 1.3mb/s to 1kb/s

:("
,klingen91,2013-03-10T00:01Z,Angielawrens: Did the world go under 2012? Do the bear shit in the Woods?
,Supericy,2013-03-10T00:28Z,"@Opteron82

The only thing simulated on the server is region stuff. 90% of the game is still on the client, and afaik, the region ""simulations"" are very lightweight.

I heard from a random source (someone on reddit) that skidrow predicts a crack within a week."
,klingen91,2013-03-10T00:30Z,I really hope so :)
,TildoT-Baggins,2013-03-10T01:34Z,"at 99.5%, once done I will seed the shit out of it for you guys!!"
,veselinve,2013-03-10T01:51Z,what is the product code to activate on origin
,kalbwedel,2013-03-10T01:51Z,One of the 5 seeders
,barabusignasius,2013-03-10T02:03Z,I'm more hpin for Bioshock Infinite.  The first Bioshock took ages to crack and the second one was never properly cracked.  I hope this one can be done.
