Filename,Size,Unit
CD/Safe as Milk/19 Korn Ring Finger [-].mp3,17.02,M
CD/Safe as Milk/18 Trust Us (Take 9) [-].mp3,16.87,M
CD/Safe as Milk/14 On Tomorrow [-][Instrumental].mp3,15.89,M
CD/Safe as Milk/15 Big Black Baby Shoes [-][Instrumental].mp3,11.08,M
CD/Safe as Milk/13 Safe as Milk [-][Take 5].mp3,9.67,M
CD/Safe as Milk/12 Autumn's Child.mp3,9.24,M
CD/Safe as Milk/16 Flower Pot [-].mp3,8.99,M
CD/Safe as Milk/05 I'm Glad.mp3,8.06,M
CD/Safe as Milk/09 Plastic Factory.mp3,7.19,M
CD/Safe as Milk/06 Electricity.mp3,7.15,M
CD/Safe as Milk/08 Abba Zaba.mp3,6.27,M
CD/Safe as Milk/17 Dirty Blue Gene [-][Instrumental].mp3,6.24,M
CD/Safe as Milk/02 Zig Zag Wanderer.mp3,6.1,M
CD/Safe as Milk/03 Call on Me.mp3,5.99,M
CD/Safe as Milk/04 Dropout Boogie.mp3,5.8,M
CD/Safe as Milk/07 Yellow Brick Road.mp3,5.66,M
CD/Safe as Milk/11 Grown So Ugly.mp3,5.62,M
CD/Safe as Milk/01 Sure Nuff 'N' Yes I Do.mp3,5.17,M
CD/Safe as Milk/10 Where There's a Woman.mp3,4.94,M
Artwork/Photo.jpg,815.67,K
Artwork/Back.jpg,787.83,K
Artwork/Front.jpg,543.04,K
Artwork/Credits.jpg,429.02,K
