User Type,Username,Date,Text
,ferklunkt,2013-02-25T08:47Z,"Anyone know if this is dubbed into Spanish? Thanks

¿Saben si esto es doblado en español? Gracias"
,gullu20,2013-02-25T09:23Z,Anyone is the Audio English or Spanish?
,sppcc6803,2013-02-25T14:36Z,"A los que preguntan si esta doblado al castellano, si lo está"
,FeKuLa,2013-02-25T18:35Z,Muchas gracias por ripear TODA la noche de los Oscars de Canal+ y a una calidad impresionante. 
,puding666,2013-02-25T20:55Z,OMFG please READ the Title of your webpage: SPANISH. How could be in english?
,PiratesWay,2013-02-25T22:11Z,"@ puding666: Poor babes. Breath in, breath out, very slow. Everything is okay, no need to worry. It in fact is a valid question because many names of torrent that has 'Swedish' in it only has Swedish subtitles. So some people did wonder.

However in this file the Oscars are completely in Spanish. It starts with a TV-host from Spain and also the Oscars itself are being dubbed - so no subtitles. Too bad for those who want the English version, I guess we'll have to wait a little bit longer until that one is online :)"
,trademarkos,2013-02-27T21:22Z,Muchas gracias por subirlo!! Lo dejo compartiendo una vez descargado.
,beaxches,2013-03-03T22:38Z,Agradecer que se suba toda la gala y sus 5 gigas pero el 80% se ve pixelado y no merece la pena descargarlo ya que te acabas por desesperar que con cada cambio de cámara se pixele toda la pantalla.
