User Type,Username,Date,Text
,xorXpto,2013-01-23T14:25Z,Thanks dohduhdah for this new TTC Course!
,JVLIVS,2013-01-23T18:21Z,"Thanks, dohduhdah! Seems awesome! Hopefully the first course to talk about ""lucid dreaming"". :D"
,10121984,2013-01-24T00:10Z,"Thank you so much for this!

If you find the rest of The Everyday Gourmet series, please let us know."
[V],dohduhdah,2013-01-24T03:00Z,"""TTC Video - The Everyday Gourmet Making Healthy Food Taste Great"" is in the pipeline, so it should be added to tpb soon if everything goes ok."
,BadConscience,2013-01-25T06:48Z,"dohduhdah, 

I'm not religious at all, but if I were you would be a kind of godsend to me.
Thank you so much for all this!
You've no idea how much it's helped me."
,sturdrum,2013-01-27T21:23Z,Many thanks! Any chance of getting the PDF guidebook for this course?
,addad2011,2013-05-13T19:52Z,Thanks dohduhdah 
