Filename,Size,Unit
Samples/PK Samples/How Are Religions Made.pdf,138.07,K
Samples/PK Samples/Strike on the Hell.pdf,188.72,K
Samples/PK Samples/The Mystery of the Second Coming.pdf,148.93,K
Samples/PK Samples/The Origin of Hellish Indications.pdf,99.46,K
Samples/Pekelni lide/Jak se lovi dusicky (seriozni).pdf,202.28,K
Samples/Pekelni lide/Komentar ke clankum.pdf,370.82,K
Samples/Pekelni lide/O lidske slabosti a Svatych Bytostech.pdf,153.41,K
Samples/Pekelni lide/O loveni vyvolenych.pdf,206.92,K
Samples/Reminder of Hell/Sample from TV Series Navstevnici.flv,1.82,M
Samples/Reminder of Hell/Sample from movie Sex and Lucia.flv,2,M
Samples/Reminder of Hell/Sample from movie Volkodav.flv,4.01,M
Samples/Reminder of Hell/Samples from TV Series Kung Fu.flv,4.61,M
Hellish People.pdf,134.5,K
