Filename,Size,Unit
Reggie Watts live at Afro Punk Fest (1080p).mp4,455.48,M
Reggie Watts performing 7x7 Advertising Week (720p).mp4,157.04,M
REGGIE WATTS live at POYKPAC (720p).mp4,137.79,M
"Reggie Watts live in Copenhagen, Denmark at the Bremen Theater (Jan 27, 2012) [1080p].mp4",127.03,M
Reggie Watts performs live on Totally Biased (1080p).mp4,110.27,M
Reggie Watts performing live at House of Yes (720p).mp4,76.17,M
Reggie Watts live Performance - Mescaline - Part 2 of 3.mp4,64.25,M
Reggie Watts freestyle rocks out with a band Live.mp4,59.72,M
Reggie Watts live Performance - Banshee & Fuck Shit Stack - Part 3 of 3.mp4,47.2,M
Reggie Watts Performing Live (18 July 2010).mp4,41.2,M
REGGIE WATTS live - Iphone Skills (720p).mp4,38.61,M
Reggie Watts live Performance - Muffins - Part 1 of 3.mp4,21.24,M
Reggie Watts live in Surry Hills.mp4,16.68,M
Reggie Watts live in Gloria Köln.mp4,16.32,M
Reggie Watts live at the Slipper Room.mp4,11.26,M
