User Type,Username,Date,Text
,Hamster-X,2013-01-17T02:03Z,"Hmm, first I'm hearing of this comic, is it any good?

Regardless, THANKS! xD +1"
[V],STFmaryville,2013-01-17T02:14Z,"I have only read the first trade paperback, and it was good. Nothing world-changing and probably boring for some people.

The story I read was basically a boy-meets-girl story for Gen Y people. My wife loves it. Its publication is a little sporadic -- 15 issues in 2 years."
,Hamster-X,2013-01-17T03:32Z,"Cool, I'll grab the available ones and check it out. Thanks!"
