User Type,Username,Date,Text
[V],STFmaryville,2013-02-18T15:30Z,"i always liked this character. one of the earliest back issues i owned was justice league #135 i believe, with the fawcett heroes thrown into a league/jsa story. that's a great memory. then later jerry ordway brought him back in the power of shazam series, too. good comics. thanks Mothra67"
,Mothra67,2013-02-18T16:36Z,"Thanks, I will keep them coming!"
,Mothra67,2013-02-19T10:25Z,0 seeders and 87 leechers???  WTF come on people we're better than this!  get some seeds for this it's a small torrent!  ;P
,Synthesist,2013-02-20T11:29Z,Anyone getting errors when opening #1 ?
,Synthesist,2013-02-20T11:59Z,Issue 1 is corrupt and the second half of issue five is missing.  Just saying.
,Mothra67,2013-02-20T16:43Z,I will take care of it!  Thanks for letting me know!
,Mothra67,2013-02-20T16:58Z,"DO NOT DOWNLOAD THIS i WILL BE UPLOADING IT AGAIN WITH THE REPAIRED FILES IN 10 SECONDS!  IN FACT HERE'S THE LINK!

http://thepiratebay.sx/torrent/8168683/Ibis_The_Invincible_%28Fawcett_Comics%29_Golden_Age_Repaired_files_"
