User Type,Username,Date,Text
,hedi31,2013-03-10T13:13Z,anyone knows if it run ok ?
,Shorouk,2013-03-11T00:44Z,"I'm downloading it, I'll tell you !

Are the packs the Live 9 suite packs ?"
,jaguar13x,2013-03-12T13:13Z,this looks like old packs from previous versions.
,hedi31,2013-03-12T15:20Z,yes this is the old version
,piratebay_pete,2013-03-16T00:40Z,"Will these ""old versions"" work for 9?"
,hedi31,2013-03-18T13:24Z,piratebay_pete : NO
,DeLtA_Sn1p3r,2013-03-19T02:33Z,"http://thepiratebay.sx/torrent/8258789/Ableton_Live_9_Live_Packs___Max_6_For_x32__amp_amp__x64_DeLtA_Sn1p3r

new link for the ableton live 9 I didn't know if these would work but new ones do "
,Magic4you,2013-03-20T18:37Z,Up and Running with Ableton Live 9 - anyone?
