User Type,Username,Date,Text
,naglimund,2013-01-27T18:11Z,Excellent! Thank you very much. I totally love Leo...
,k_fahrer,2013-01-28T14:25Z,thank you!
,Zippetta,2013-02-18T03:34Z,Woohoo
,k_fahrer,2013-03-15T05:39Z,"hi data9724, thanks again for the upload, those are really wonderful books. I was wondering if there's any possibility of uploading new episodes? Anyway, thanks again, your uploads are really great."
[T],data9724,2013-03-16T22:18Z,"Well, when Cinebook publishes the next issues, I will scan and upload them eventually, but hard to upload what is not published yet .)"
