User Type,Username,Date,Text
,elhugonunez999,2013-02-06T22:23Z,exelente aporte pitufo180 sigue asi esperare con ansias la vercion extendida gracias!!!
,elhugonunez999,2013-02-06T22:24Z,igual me la bajo ya! :)
[T],pitufo180,2013-02-06T23:18Z,I'm uploading :-) !!!
,nuevo951,2013-02-11T14:16Z,genio!!!!!!!!!!!!!!! cuando puedas carga Las dos torres....gracias por tus aporte
,oxma8,2013-02-23T15:32Z,"Gracias, se agradece!!, vamos a bajar las 3 partes... haber que tal me va!!"
,lawnder,2013-03-23T22:02Z,"gracias tio, seedeare para la pelicula cuando tenga abierto utorrent"
