User Type,Username,Date,Text
,nitrojunkie007,2013-02-09T19:56Z,Thank you so much...
,lffoar,2013-02-10T02:26Z,Works a treat win 7x64bit. Many thanks to uploader
,Fuzzy_NJ,2013-02-10T05:57Z,Props to UL...worked like a chizzarm! Thanks
[T],BySenzati,2013-02-10T08:15Z,"Fixed Crack:

https://anonfiles.com//file/111a2de0770112edf969c228dd538c24"
,brianxxx,2013-02-10T17:28Z,Thanks for up and thanks for the fix!!!!!!!
,LeaHavoc,2013-04-12T04:00Z,"Excellent torrent, thank you so much! "
,bmidnight72,2013-04-12T18:34Z,Awesome Thanks!!
