Filename,Size,Unit
The Essential Charlie Daniels Band/01 The Devil Went Down To Georgia.mp3,8.28,M
The Essential Charlie Daniels Band/02 Long Haired Country Boy.mp3,9.27,M
The Essential Charlie Daniels Band/03 Wichita Jail.mp3,6.44,M
The Essential Charlie Daniels Band/04 Uneasy Rider.mp3,12.19,M
The Essential Charlie Daniels Band/05 Mississippi.mp3,7.31,M
The Essential Charlie Daniels Band/06 Trudy.mp3,11.06,M
The Essential Charlie Daniels Band/07 Boogie Woogie Fiddle Country Blues.mp3,7.92,M
The Essential Charlie Daniels Band/08 Texas.mp3,6.98,M
The Essential Charlie Daniels Band/09 Simple Man.mp3,7.8,M
The Essential Charlie Daniels Band/10 In America.mp3,7.66,M
The Essential Charlie Daniels Band/11 Still In Saigon.mp3,8.91,M
The Essential Charlie Daniels Band/12 The Legend Of Wooley Swamp.mp3,9.83,M
The Essential Charlie Daniels Band/13 Drinkin' My Baby Goodbye.mp3,8.46,M
The Essential Charlie Daniels Band/14 The South's Gonna Do It Again.mp3,9.08,M
The Essential Charlie Daniels Band/The Essential Charlie Daniels Band.jpg,17.74,K
