User Type,Username,Date,Text
,LkwdSpider,2013-02-12T07:08Z,well since it took me more than 2 hours to get this...I'll seed all night and tomorrow. Thnx leechers.
,melw1211,2013-02-12T12:08Z,Always the best eztv. ThankU
,pilot234,2013-02-15T00:06Z,"Russel09 - FUCK YOU, YOU SPAMMING BASTARD. TAKE YOUR STUPID LINKS AND GO RUN HEAD FIRST INTO ONCOMING TRAFFIC!"
,pirate450,2013-02-23T22:11Z,"Great episode, nice plot so far. Storyline is intelligent and i wouldn't change it even a bit. Quality - A10 V10. I usually watch everything at film.plotar.org	because they always have HD but they don't have tv shows so having TPB for TVshows is great, thnx!"
,stefdec,2013-04-09T05:43Z,"FAKE, episode 3"
,House_Ordos,2013-04-28T07:41Z,"IS real episode 4, fuck that guy stefdec"
