User Type,Username,Date,Text
[V],totomas1,2013-05-11T09:11Z,"Ooops, probably uploaded in the wrong category."
,ALLANshindi,2013-05-11T09:52Z,"Sorry, i tried to delete the file and upload again, but i can't delete the file :/"
,ALLANshindi,2013-05-11T09:53Z,"Do you know how to delete? I tried to click on the ""X"" but nothing happens..."
,ALLANshindi,2013-05-11T09:58Z,Someone can help?
[V],totomas1,2013-05-11T12:36Z,It's not that easy to delete a torrent. Just stop seeding and write a comment with the link to the new torrent (if you post a new in the correct category).
