Filename,Size,Unit
American Tragedy Redux/03 Apologize (Buffalo Bill's Die Young Remix).mp3,17.47,M
American Tragedy Redux/01 Levitate (Digital Dog Club Mix).mp3,16.62,M
American Tragedy Redux/02 Comin' In Hot (Wideboys Club Mix).mp3,13.29,M
Swan Songs/12 The Diary.mp3,10.57,M
American Tragedy Redux/08 Le Deux (Dr. Eargasm Remix).mp3,10.45,M
American Tragedy Redux/07 I Don't Wanna Die (Borgore Remix).mp3,10.3,M
Swan Songs/01 Undead.mp3,10.18,M
American Tragedy Redux/09 Lights Out (The Juggernaut Vs. Obsidian Remix).mp3,10.13,M
"Swan Songs/09 This Love, This Hate.mp3",9.12,M
American Tragedy Redux/04 My Town (Andrew W.K. Remix).mp3,8.75,M
Swan Songs/08 Black Dahlia.mp3,8.67,M
American Tragedy/06 Hear Me Now.mp3,8.6,M
American Tragedy/03 Comin In Hot.mp3,8.53,M
Swan Songs/18 The Natives.mp3,8.42,M
Swan Songs/11 City.mp3,8.23,M
Swan Songs/03 Everywhere I Go.mp3,8.1,M
American Tragedy Redux/10 Been To Hell...and Back! (KMFDM Remix).mp3,8.05,M
American Tragedy/01 Been To Hell.mp3,8,M
Swan Songs/07 Bottle And A Gun.mp3,7.79,M
Swan Songs/10 California.mp3,7.58,M
Swan Songs/04 No Other Place.mp3,7.57,M
Swan Songs/06 Young.mp3,7.56,M
Swan Songs/02 Sell Your Soul.mp3,7.47,M
Others/Hollywood Undead - Christmas Time in Hollywood.mp3,7.4,M
American Tragedy Redux/05 Coming Back Down (Beatnick & K-Salaam Remix).mp3,7.38,M
Swan Songs/17 The Loss.mp3,7.35,M
Swan Songs/14 Paradise Lost.mp3,7.34,M
American Tragedy/10 Coming Back Down.mp3,7.33,M
Desperate Measures/08 Undead (live).mp3,7.3,M
American Tragedy Redux/06 Hear Me Now (Jonathan Davis Remix).mp3,7.27,M
Swan Songs/13 Pimpin'.mp3,7.21,M
Swan Songs/05 No 5.mp3,7.13,M
Swan Songs/16 Knife Called Lust.mp3,6.88,M
Swan Songs/15 Pain.mp3,6.18,M
Desperate Measures/14 City (Live).mp3,5.56,M
Desperate Measures/11 Black Dahlia (live).mp3,5.43,M
Desperate Measures/12 Everywhere I Go (live).mp3,4.96,M
Desperate Measures/10 California (live).mp3,4.89,M
American Tragedy/15 Mother Murder.mp3,4.89,M
Desperate Measures/09 Sell Your Soul (live).mp3,4.88,M
American Tragedy/13 Pour Me.mp3,4.88,M
Desperate Measures/13 No. 5 (live).mp3,4.83,M
Desperate Measures/06 El Urgencia.mp3,4.81,M
American Tragedy/18 SCAVA.mp3,4.8,M
American Tragedy/05 I Dont Wanna Die.mp3,4.73,M
American Tragedy/20 Comin` In Hot (Instrumental).mp3,4.72,M
American Tragedy/19 Street Dreams.mp3,4.7,M
American Tragedy/07 Gangsta Sexy.mp3,4.65,M
Desperate Measures/07 Everywhere I Go (Castle Renholder Remix).mp3,4.5,M
Desperate Measures/02 Tear It Up.mp3,4.47,M
American Tragedy/09 Lights Out.mp3,4.4,M
Desperate Measures/03 Shout At The Devil (Motley Crue Cover).mp3,4.35,M
American Tragedy/17 Le Deux.mp3,4.33,M
American Tragedy/04 My Town.mp3,4.31,M
Notes From The Underground/11 Outside.mp3,4.25,M
American Tragedy/02 Apologize.mp3,4.25,M
American Tragedy/08 Glory.mp3,4.15,M
Notes From The Underground/05 We Are.mp3,4.15,M
Notes From The Underground/16 We Are (J-Dog & Killtron Remix).mp3,4.14,M
American Tragedy/21 Apologize  (Instrumental).mp3,4.12,M
American Tragedy/16 Lump Your Head.mp3,4.1,M
Desperate Measures/01 Dove And Grenade.mp3,4.02,M
American Tragedy/14 Tendencies.mp3,3.99,M
American Tragedy/12 Levitate.mp3,3.99,M
Others/Hollywood Undead - Paradise Lost (Live).mp3,3.98,M
American Tragedy/11 Bullet.mp3,3.93,M
Notes From The Underground/09 Believe.mp3,3.82,M
Others/Hollywood Undead - City (Instrumental).mp3,3.81,M
Desperate Measures/04 Immigrant Song (Led Zepplin Cover).mp3,3.8,M
Notes From The Underground/04 Lion.mp3,3.55,M
Notes From The Underground/15 New Day.mp3,3.45,M
Notes From The Underground/02 From The Ground.mp3,3.37,M
Notes From The Underground/01 Dead Bite.mp3,3.33,M
Notes From The Underground/07 Rain.mp3,3.33,M
Desperate Measures/05 Bad Town (Operation Ivy Cover).mp3,3.32,M
Notes From The Underground/13 One More Bottle.mp3,3.31,M
Notes From The Underground/10 Up in Smoke.mp3,3.31,M
Notes From The Underground/19 Dead Bite v2.mp3,3.3,M
Others/Hollywood Undead - City (Live).mp3,3.21,M
Others/Hollywood Undead - Scene For Dummies.mp3,3.17,M
Others/Hollywood Undead - Bottle and a Gun (Live).mp3,3.12,M
Others/Hollywood Undead - Turn Off The Lights.mp3,3.11,M
Notes From The Underground/12 Medicine.mp3,3.11,M
Notes From The Underground/18 I Am.mp3,3.07,M
Others/Hollywood Undead - Young (Live).mp3,3.06,M
Others/Hollywood Undead - No Other Place (Live).mp3,3.02,M
Others/Hollywood Undead - Dead in Ditches.mp3,2.97,M
Notes From The Underground/14 Delish.mp3,2.84,M
Notes From The Underground/17 Another Way Out (Griffin Boice Remix).mp3,2.8,M
Others/Hollywood Undead - The Kids.mp3,2.76,M
Notes From The Underground/08 Kill Everyone.mp3,2.59,M
Notes From The Underground/03 Another Way Out.mp3,2.53,M
Others/Hollywood Undead - Circles.mp3,2.44,M
Others/Hollywood Undead - Bitches.mp3,2.41,M
Notes From The Underground/06 Pigskin.mp3,2.41,M
We Are Lyrics.jpg,1.6,M
Masks!/hu-j3t.jpg,435.65,K
Masks!/hu-jdog.jpg,368.56,K
Masks!/hu-charliescene.jpg,356.39,K
Masks!/hu-dakurlzz.jpg,344.49,K
Masks!/hu-funnyman.jpg,333.07,K
Masks!/hu-danny.jpg,329.33,K
