User Type,Username,Date,Text
,oudi1988,2013-03-28T21:01Z,thank you man you are the best .......this cfw is spoof or no spoof 
,oudi1988,2013-03-28T23:22Z,there is a 4.40 cfw by sgk team and this is another one by rogero which is the best plese i need your advise Mno74
,oudi1988,2013-03-28T23:27Z,whech is the best sgk 4.40 or rogero 4.40 i need advise please
,shark1543,2013-03-29T04:02Z,Rogero is always the best I am also using....Thanks Rogero
,veghmark97,2013-03-31T20:06Z,Anybody who's already tested it? Maybe on Ultra Slim?
