Filename,Size,Unit
Lesbians with huge dildos posing - Home Porn Bay_(new).mp4,126.65,M
So pretty japanese brunette wife make an amazing homemade sex fun video - Home Porn Bay_(new).mp4,116.22,M
Gorgeous busty girl rammed with no mercy - Home Porn Bay_(new).mp4,99.51,M
Loveliness puertorrican brunette girlfriend preffer black cocks than white cocks - Home Porn Bay_(new).mp4,89.45,M
Pretty brunette milf wife make a hot sex fun with husband when parents leave - Home Porn Bay_(new).mp4,84.44,M
Machine fucking is what I love - Home Porn Bay_(new).mp4,81.17,M
Lusty blonde girl gagging with pleasure - Home Porn Bay_(new).mp4,77.89,M
Man juice all over her breasts - Home Porn Bay_(new).mp4,77.53,M
"So pretty brunette gilrlfriend suck cock then a great fucking session,enjoy - Home Porn Bay_(new).mp4",74.92,M
So pretty painted redhair girlfriend make awezone sex fun video when parents out - Home Porn Bay_(new).mp4,73.6,M
Sofa sex is what I like - Home Porn Bay_(new).mp4,67.3,M
Hot teen will make you happy too - Home Porn Bay_(new).mp4,66.79,M
Opening mouth wide for a dick - Home Porn Bay_(new).mp4,63.69,M
Horny Teenagers Girls! - Home Porn Bay_(new).mp4,61.09,M
Hard penis deep down her throat - Home Porn Bay_(new).mp4,53.94,M
hidden camera doggie style fuck and cum swallow - Home Porn Bay_(new).mp4,52.94,M
Pov blowjob video with hot - Home Porn Bay_(new).mp4,46.56,M
I am home alone and horny - Home Porn Bay_(new).mp4,45.12,M
So pretty pierced short haired brunette girlfriend make a hell of a blowjob - Home Porn Bay_(new).mp4,43.66,M
innocent teen sucks - Home Porn Bay_(new).mp4,42.31,M
Here are my massive breasts - Home Porn Bay_(new).mp4,42.04,M
"So pretty blonde wife suck cock and gets fuck in both holes sunday night,damn! - Home Porn Bay_(new).mp4",39.48,M
Hot ass girl riding a hard pecker - Home Porn Bay_(new).mp4,34.33,M
Teenie knows - Home Porn Bay_(new).mp4,32.69,M
"Pretty painted blonde girlfriend make a hot webcam stripping fun video,enjoy - Home Porn Bay_(new).mp4",32.56,M
Toying My Cunt In All Positions - Home Porn Bay_(new).mp4,31.42,M
Here is my hairy bush - Home Porn Bay_(new).mp4,29.46,M
Fat lucky guy - Home Porn Bay_(new).mp4,29.06,M
russian fucking in the kitchen - Home Porn Bay_(new).mp4,28.49,M
The lost condom! - Home Porn Bay_(new).mp4,26.63,M
My webcam fans are 100% horny - Home Porn Bay_(new).mp4,25.81,M
"Pretty brunette girlfriend is fuck hard missionary style when parents leave,damn - Home Porn Bay_(new).mp4",23.41,M
Make me cum - Home Porn Bay_(new).mp4,23.23,M
"So pretty brunette girlfriend is fuck hard by his lusty black dude in home,enjoy - Home Porn Bay_(new).mp4",16.62,M
Magic wand going up my ass - Home Porn Bay_(new).mp4,13.02,M
I love her Asian melons - Home Porn Bay_(new).mp4,8.96,M
