User Type,Username,Date,Text
,Ironb0und,2013-01-09T15:26Z,Thanx!
,carluss,2013-01-09T16:47Z,msm jogo Max Anarchy_Reigns JPN_RF_XBOX360 lançado em 07/12 esta é versão americana.obrigado
,Assassinprofessor,2013-01-10T12:40Z,is there any difference between this version and the japanese one?
,Requiem0724,2013-01-13T04:38Z,@assassinprofessor - as far as i know the japanese version has more bugs in game than this. still downloading now so dont have a concrete answer yet.
,abdul86,2013-01-14T04:12Z,"The first 12 sectors of topology data are blank!
In the meantime,
There is no verified rip of Xex CRC F70E082D in the online database
Failed to find a verified ini file for this Xex
AutoFix Failed, Stealth is still unverified"
,manolizer,2013-01-16T02:11Z,"anyone knows if this works? please tell me, I really wanna try this game"
,showersw23,2013-01-20T03:48Z,Hey can anyone put family game night 1-4 please would be awesome
,showersw23,2013-01-20T03:49Z,Hey can anyone put family game night 1-4 please would be awesome thanks.
