Filename,Size,Unit
Aryan Awakening/01 Aryan Warrior.mp3,2.43,M
Aryan Awakening/02 Living Nightmare.mp3,3.16,M
Aryan Awakening/03 Dumb Boy.mp3,2.22,M
Aryan Awakening/04 Be Thou My Vision.mp3,3.21,M
Aryan Awakening/05 From The Ashes.mp3,1.7,M
Aryan Awakening/06 Free Christian People.mp3,3.52,M
Aryan Awakening/07 Reflection.mp3,2.52,M
Aryan Awakening/08 Fairytale Love.mp3,3.1,M
Aryan Awakening/09 Wake Up.mp3,2.32,M
Aryan Awakening/10 Eternal Conflict.mp3,4.45,M
Aryan Awakening/Aryan Awakening.jpg,16.67,K
Standing Our Ground/01 Freedom Call.mp3,1.44,M
Standing Our Ground/02 Racial Suicide.mp3,2.31,M
Standing Our Ground/03 Aryan Blue Heart.mp3,6.86,M
Standing Our Ground/04 Final Straw.mp3,2.57,M
Standing Our Ground/05 Warrior For Life.mp3,3.05,M
Standing Our Ground/06 Tears For My People.mp3,2.36,M
Standing Our Ground/07 Temporary Blindness.mp3,5.1,M
Standing Our Ground/08 Alien Flood.mp3,3.81,M
Standing Our Ground/09 Broken Hearted.mp3,1.81,M
Standing Our Ground/10 Propagandized America.mp3,2.88,M
Standing Our Ground/11 Stand Up.mp3,2.09,M
Standing Our Ground/Standing Our Ground.jpg,33.95,K
