Filename,Size,Unit
Freddy Heineken (2013) MiniSerie Eng NL Subs PAL DVDR-NLU002 Disc1/Freddy Heineken (2013) MiniSerie Eng NL Subs PAL DVDR-NLU002 Disc1.iso,3.75,G
Freddy Heineken (2013) MiniSerie Eng NL Subs PAL DVDR-NLU002 Disc2/Freddy Heineken (2013) MiniSerie Eng NL Subs PAL DVDR-NLU002 Disc2.iso,3.73,G
Freddy Heineken (2013) MiniSerie Eng NL Subs PAL DVDR-NLU002.nfo,1.08,K
Torrent downloaded from AanMeHoelaJa Torrents on BTScene.eu.txt,71,B
Torrent downloaded from AhaShare.com.txt,58,B
Torrent Downloaded From BTScene.eu.txt,45,B
Torrent Downloaded from digtorrent.org.txt,184,B
Torrent Downloaded From ExtraTorrent.com.txt,353,B
Torrent downloaded from KAT.ph.txt,41,B
Torrent Downloaded from limetorrent.txt,50,B
Torrent downloaded from P2PDL.com.txt,37,B
Torrent downloaded from silvertorrent.org.txt,86,B
Torrent downloaded from thepiratebay.se.txt,50,B
tracked_by_h33t_com.txt,23,B
