User Type,Username,Date,Text
,arildus,2013-06-16T23:32Z,Thanx:)
,Psynaut00,2013-06-17T06:40Z,"Budget: $750,000"
,altaiir,2013-06-17T11:49Z,"I'm definitely gonna watch this considering how retarded the trailer looks, haha."
,Phatfish,2013-06-17T17:57Z,"Oh, I thought it was a documentary first..."
,Kabaliq,2013-06-18T00:19Z,"By the people, for the people - especially (but not necessarily) Texans. To quote another recent movie, ""I will not be subjected to criminal abuse!"""
,ruffnek84,2013-06-18T01:11Z,Kabaliq go kill yourself. Nobody would notice....
,fiberfreddie,2013-06-18T04:49Z,Don't waste your time or bandwidth on this crap. Avoid like the plague.
,WinterTorrents,2013-06-18T09:23Z,"Good torrent but absolutely horrible movie, worst acting I've seen in a long time :/"
