User Type,Username,Date,Text
,TPBGurl,2013-02-11T17:45Z,"For those that might be confused, this is the UK version which is on Season 5. US version is only on season 2 ep 5 tonight."
,rickruin,2013-02-23T07:39Z,"Is this the original UK show or the shitty American Syfy channel show?
Maybe you should put that in the damn text of your shitty post? like saying: 

Being.Human.UK.S05E02.RELASEGROUPSUCKS


Because you know they are into season 4 of the USA one so hey maybe it will help in the future?"
