User Type,Username,Date,Text
,hashtagnwo,2013-03-01T18:48Z,"A film detailing the final hours and crucifixion of Jesus Christ.  Director mel gibson, drama, 127mins, score 7.0/10 from 131,611 votes, jim caviezel as jesus, monica belluci as magdalan, A depiction of the last twelve hours in the life of Jesus of Nazareth, on the day of his crucifixion in Jerusalem. The story opens in the Garden of Olives where Jesus has gone to pray after the Last Supper. Betrayed by Judas Iscariot, the controversial Jesus--who has performed 'miracles' and has publicly announced that he is 'the Son of God'--is arrested and taken back within the city walls of Jerusalem. There, the leaders of the Pharisees confront him with accusations of blasphemy; subsequently, his trial results with the leaders condemning him to his death. Jesus is brought before Pontius Pilate, the Roman Governor of Palestine, for his sentencing. Pilate listens to the accusations leveled at Jesus by the Pharisees. Realizing that his own decision will cause him to become embroiled in a political conflict, Pilate defers to King Herod in deciding the matter of how to persecute Jesus. However, Herod returns Jesus to Pilate who, in turn, gives the crowd a choice between which prisoner ,Country:USA Language:Aramaic | Latin | Hebrew Release Date:25 February 2004 (USA) ,Also Known As:The Passion ,Filming Locations:Basilicata, Italy,Budget:$30,000,000 (estimated) ,Production Co:Icon Productions ,Runtime:127 min | 120 min (cut) ,
Everyone please seed or reseed this it says just 31 seed,(im never having a go at the uploader ! ) if u find any file with low seeds & you still have the file please reseed (start sharing the file again from utorrent /bittorent etc) torrent sites may not be around for ever so always help out. If a files taking over a week to get leave a comment so we know a file may not complete..copy url link & ask for a ressed on suprbay forum ! , If you find a file lacking useful details like imdb.com  info & a films score out of 10  /tvrage.com & score or wikipedia info please google it then copy & paste it into a comment to help every1 else out , ive more than done my share of helping now its your turn, and always report viruses or fakes to the suprbay forum thanks, ps dont forget the faster you seed uploading the faster your files download so set upload speed to unlimited in Utorrent etc ,we must get more people to help out , theres too many hit & runners who never comment or add links etc :( "
,martinvincent,2013-03-30T05:29Z,"excellent, thanks for the upload."
,SamcsP,2013-04-01T13:34Z,"Ow thanks!!! For the first time I saw a package included subtitles so full, especially por-BR! 
Great job... Very nice!!!"
,uniakeru,2013-04-05T00:58Z,"@vze2mp9g
try Any Video Converter... you can find a good one on here i use it all the time and its actually ranked pretty high among the converter programs..:)"
,joegi50,2013-04-15T23:12Z,Thank you ZenBud..
,dsoumelr,2013-05-11T10:04Z,"thnx a lot fr the upload 
its awesome print n nice wrk done coz many of teh subtitles"
