User Type,Username,Date,Text
[V],V3nom,2013-01-28T16:05Z,Seed & Enjoy!
,vita_dude,2013-01-28T18:12Z,A YO MAN this movie right here is just hella fuckin dumb and retarded as FUCK i mean ADAM SANDLER is not even fuckin funny in this movie he just dumb as HELL in this movie...i only watch half of this movie i just delete this damn crappy ass movie....so take my advice do not download this retarded ass lame movie....PEACE
[V],simon200,2013-01-29T16:17Z,"vita_dude are you retarded?
Is this really how you say thank you
Cheers V3nom "
,sammydemo669,2013-03-08T20:00Z,"vita dude. save your stupid opinions for someone who cares. comments are for sound quality, picture quality, speed of download, etc. dont start cursing the guy because he worked to upload a movie and you didnt like it. at least you didnt pay, right? retard.  thanx v3nom i use a lot of you ups. a7xfoREVer"
