User Type,Username,Date,Text
,punk999,2013-05-11T18:46Z,Thanks. all the other ones were not working and were asking for permission but this one worked out :)
,lub094,2013-05-14T14:40Z,It didn't work for me ;
,sugar1982,2013-05-14T21:36Z,"BEWARE!!!! This is a MODDED VERSION.....it caused ""invalid start mode archive filename"" error on startup on my system.....also, was difficult to uninstall, left lot of junk that i had to remove manually from my system.

Is there anyone else who encountered this error ????"
,jhenry27,2013-05-15T07:06Z,"""invalid start mode archive filename"" i cant uninstall it. zz. also it always pops up when I do g.chrome integration. useless"
,arslanistic,2013-05-27T12:11Z,not working for me either :(
