Filename,Size,Unit
One Bad Son/01 She's On Fire.mp3,5.41,M
One Bad Son/02 London Kills.mp3,4.54,M
One Bad Son/03 Rustbucket.mp3,5.04,M
One Bad Son/04 It Ain't Right.mp3,5.23,M
One Bad Son/05 Scarecrows.mp3,6,M
One Bad Son/06 True Grit.mp3,4.25,M
One Bad Son/07 Moneytrain.mp3,5.24,M
One Bad Son/08 Lie Awake.mp3,4.91,M
One Bad Son/09 I'm Still Here.mp3,6.05,M
One Bad Son/10 El Camino.mp3,7.42,M
One Bad Son/11 Retribution Blues.mp3,5.37,M
Orange City/01 Gringo.mp3,6.47,M
Orange City/02 The Matterhorn.mp3,5.04,M
Orange City/03 Crooked Mic Stand.mp3,4.86,M
Orange City/04 Brooklyn.mp3,7.44,M
Orange City/05 Winterman.mp3,6.88,M
Orange City/06 8 Eye.mp3,6.39,M
Orange City/07 Sun_Fire.mp3,7.03,M
Orange City/08 Breckenridge.mp3,5.63,M
Orange City/09 Blinder.mp3,5.9,M
Orange City/10 Orange City.mp3,5.86,M
This Aggression Will Not Stand/01 Hayseed.mp3,6.5,M
This Aggression Will Not Stand/02 Force Majeure.mp3,7.12,M
This Aggression Will Not Stand/03 Alive in Texas.mp3,6.62,M
This Aggression Will Not Stand/04 Stillwater.mp3,7.98,M
This Aggression Will Not Stand/05 Hang Your Head.mp3,5.47,M
This Aggression Will Not Stand/06 Into the Light.mp3,6.43,M
This Aggression Will Not Stand/07 Firehorse.mp3,6.46,M
This Aggression Will Not Stand/08 Helltown.mp3,6.16,M
This Aggression Will Not Stand/09 Sleepy Hollow.mp3,6.87,M
This Aggression Will Not Stand/10 Other's Song.mp3,7.69,M
This Aggression Will Not Stand/11 Last Days.mp3,7.89,M
