Filename,Size,Unit
@...IMPORTANT & HELPFUL Note On DOWNLOADING TORRENTS...@.txt,3.06,K
Cloudy with a Chance of Meatballs 2009 3D 720p RC Anaglyph the7oker.mkv,1020.62,M
Cloudy with a Chance of Meatballs 2009 3D 720p RC Anaglyph the7oker.nfo,11.13,K
Cloudy with a Chance of Meatballs 2009 3D 720p RC Anaglyph the7oker.srt,77.44,K
Sample of Cloudy with a Chance of Meatballs 2009 3D 720p RC Anaglyph the7oker.mkv,11.13,M
Xtras/Torrent Downloaded from 1337x.org.txt,33,B
Xtras/Torrent downloaded from AhaShare.com.txt,59,B
Xtras/Torrent Downloaded From ExtraTorrent.com.txt,40,B
Xtras/Torrent Downloaded from kat.ph.txt,30,B
Xtras/Torrent Downloaded from thepiratebay.org.txt,40,B
