User Type,Username,Date,Text
,Fazhoul2,2013-04-18T12:25Z,You wouldn't happen to have issue #4 would you. I can't find it on TPB.
[V],STFmaryville,2013-04-18T14:41Z,"they are all in the new 52 torrents, #4 was in this one: http://thepiratebay.sx/torrent/8056288/"
,PebbleSkin,2013-04-18T19:30Z,why i no can read? (sad face)
[V],STFmaryville,2013-04-18T20:19Z,"if you're in the u.s., i'd say public schools."
,PebbleSkin,2013-04-18T21:09Z,"funny, now maybe an idea that will do me some good if you don't mind going to the trouble"
[V],STFmaryville,2013-04-19T02:59Z,what program are you using to open the .cbr file?
[V],STFmaryville,2013-04-19T05:29Z,"well anyway, if you're using comicrack, try using cdisplayex instead. that often solves a problem."
,pagan72,2013-04-24T00:45Z,"Great torrent as always,  would you know where to get Knights of the Dinner Table by chance?"
