User Type,Username,Date,Text
,wetbeak,2013-03-11T03:50Z,"thank you, hopefully one of these has the darrow cover."
,riverchase,2013-03-11T04:04Z,thanks for this. just a question I can't rate anymore. I want to help all the uploaders to get their skulls
,riverchase,2013-03-11T04:06Z,do you have volume 5 of the wildcats series. I see the first four but not the fifth?
[V],blackcanary,2013-03-11T04:55Z,"wetbeak, this set didn't include the Darrow cover, but this Hit-Girl #1-4 cover pack does:
http://thepiratebay.sx/torrent/8241956/Hit-Girl_1-4_Variant_Cover_Pack_(2012)_(ScanDog_ArtNet)"
[V],blackcanary,2013-03-11T05:10Z,"riverchase, the rate torrents (+/-) feature was removed a little while ago.  You can find WildC.A.T.S. v5 in this torrent:
http://thepiratebay.sx/torrent/6874943/"
,riverchase,2013-03-11T19:00Z,thanks you are always so helpful
,AeroFem,2013-03-22T01:39Z,Thank you soooo much! 
