User Type,Username,Date,Text
,joppshr,2013-01-26T14:40Z,"what does it mean new??? Explain, working or not?"
,akonsharon9,2013-01-26T15:54Z,Work  fixes
,BlackStorm4,2013-01-26T16:17Z,Same discription same crack from Skidrow why did u upload these crap. Seem's like u want our attention u could talk to a doctor
,joppshr,2013-01-26T17:10Z,"@akonsharon9

I really don't understand, why the hell are you uploading something which is already uploaded 100 times, AND IT doesen't work??

What is wrong with you?"
,akonsharon9,2013-01-26T17:54Z,"joppshr @

It works great "
,sodoma13,2013-01-26T20:06Z,does it work anybody
,drdoodoo,2013-01-26T20:13Z,"@akonsharon9 
You do realize that Skidrow was unable/failed to crack this, and their initial release didn't work beyond a certain date."
,corey81uk,2013-01-26T20:29Z,"WTF you moron!! it doesn't work - this is the same skidrow's previous release
you packed it and you're looking for what?"
,amKE,2013-01-28T10:37Z,"is it working or not.
NOTWORKING I THINK BUT don't know"
,powermanic,2013-01-28T14:36Z,akonsharon9 plaease answer.The game crash or not?Because the skidrow game crash a few days after the start.
,akonsharon9,2013-01-28T17:44Z,powermanic @ not crash   Work well
,milan4231,2013-01-28T20:33Z,Je li radi ovo sranje!!!
,powermanic,2013-01-28T21:52Z,Please seed we are all at 23.6%
,strawhat0gunner,2013-01-28T23:04Z,"guys plz. c'mon skidrow couldn't crack this game and u think this guy has done it?
i don't give a shit its obviously thats fake. dont spend your time "
,traxones,2013-01-29T11:47Z,download and the game crashes FAKE!!!
,traxones,2013-01-29T11:48Z,the game crashes FAKE!
[V],Wanderer,2013-01-29T14:35Z,I have brought this under the attention of the mods noone has done anything about this yet. i woulnt download this. 
,UniX..,2013-01-29T15:03Z,did someone actually download this so he cen tell us if it's fake or not. i know its probably fake but...
,sodoma13,2013-01-29T17:23Z,where are you skidrow where is crack why why
,Banghal,2013-01-29T19:53Z,"It's fake, of course. Just read comments above. Soon to be removed from the list, that's for sure."
,BlackStorm4,2013-01-29T23:58Z,Don't bother with this shit. Just tell the guy who upload it to kill himself he try to get a skul I hope u never take it 
,joppshr,2013-02-01T13:18Z,"Why the staff didn't remove this? as it is obvious that akonsharon9 is laying ON PURPOSE, and not just one time but 3-4 times in this upload.

who knows what is in this upload hidden and people are installing it on their computers.

He should be banned permanently by IP address and mac address, and this torrent removed, as people are foolish enough and still downloading.

THIS IS FAKE DON'T DOWNLOAD."
,sodoma13,2013-02-09T00:33Z,where is real crack wheereee
,Raggeman666,2013-02-09T15:08Z,"Here you can find the new update and new crack. I hope it works 
fullmanager"
,Raggeman666,2013-02-09T15:10Z,Search Fullmanager on google for new update and crack
,jim13pao1966,2013-02-10T21:06Z,fake!!! everything if you have the new update and the crack fix upload it and stop joking this people with surveys all we need it's a working torrrent..
,helenek,2013-02-10T21:13Z,"Piss off Raggeman666.
Just leads to yet another survey. "
,Typhoon2000,2013-02-11T11:05Z,This upload doesn't work. It's actually the SKIDROW release which is broken. The uploader is a faggot and a retard.
,BlackStorm4,2013-02-13T18:19Z,"why don't u from pirate bay get down this fucking torrent and sent the bastard to the hell
die bastard now"
,danutzco,2013-02-17T15:10Z,To crash? Or not to crash? Lets see :)
