User Type,Username,Date,Text
,ahell85,2013-03-22T06:06Z,"hey fellas, thanks again!

can i get a re-up of whippedass 6715 with cherry torn and claire adams?"
,Axrtssen,2013-03-22T12:34Z,"Do you guys have something from chastitybabes.com? It would be amazing to have those clips. 
Keep up the good work!!"
[V],merzedes,2013-03-22T17:15Z,"ahell85@  Reseeding Wmv Only here now 

http://thepiratebay.sx/torrent/5034554/Cyber_Update_Jul_2009------WA-6715__Cherry_Torn-Claire_Adams

Cheers  :-)"
,legalizado,2013-03-22T17:17Z,Thanks merzedes and shallow2!! You're amazing!!
[V],merzedes,2013-03-22T17:38Z,Axrtssen@  I think we allredy upload from so many site so we cant upload from more... but you never no...   stay tuned   Cheers  :-)
,riefer404,2013-03-22T20:53Z,"Hey I was wondering if you can seed http://thepiratebay.sx/torrent/6835124/Kink.com_The_upperfloor17067_-_Dylan__Derrick_Pierce__Maestro_.
I will seed it for a long time if you can."
[V],merzedes,2013-03-22T21:55Z,riefer4042 Sorry i Dont have it any more :-) Cheers
,ahell85,2013-03-25T05:38Z,"hey merzedes, no one seems to be seeding that torrent i requested... been sitting on it for a few days."
