User Type,Username,Date,Text
,11770,2013-02-02T02:07Z,"this i actually know works as i have it installed already, sorry about my other torrent. btw if you hate the controls just use xpadder:
http://thepiratebay.sx/torrent/5517609/Xpadder_5.7"
,11770,2013-02-07T05:14Z,don't be afraid to ask if you have any questions regarding setup
,bh123456789,2013-02-08T11:19Z,Thanks for the upload i've followed your instructions  all seems fine. cant wait to play it!! will seed
,Team_Alice,2013-02-24T05:18Z,"well im tryin to follow directions but stuck on step one lol. when i hit the exe it bring up a screen with some install options, no option for next, so i hit install and it just closes out "
,Team_Alice,2013-02-24T08:35Z,"ok forget last comment, was the wrong exe. however now with the right exe, i open and nothing happens. I've tried everything i can think of, could use some help"
,Team_Alice,2013-02-27T20:41Z,well i figured it out. thanks SO much for the help.
