User Type,Username,Date,Text
[V],HobbitWarez,2013-01-10T00:29Z,"Android Applications [01-09-13]

AppZorter for TouchWiz v2.1.2 SAMSUNG devices ONLY-AnDrOiD
Battery Alarm v1.1-AnDrOiD
BIG Full Screen Caller ID Pro v2.2.7-AnDrOiD
Blowball v1.1 LWP-AnDrOiD
Calendar Pad Pro v2.1.9-AnDrOiD
CM10 AOKP Theme Sense 4 v2.5-AnDrOiD
DJ Studio FULL v4.3.5-AnDrOiD
Extended Controls v5.7.2-AnDrOiD
Extension for small app v1.0.1-Android 4.0 Plus-AnDrOiD
Fast Burst Camera v4.0.7-AnDrOiD
Faux123 Kernel Enhancement Pro 0.9.51-Android 4.0-ROOTED DEVICES ONLY-AnDrOiD
Glow Draw Pro v2.0-AnDrOiD
GO Launcher EX v3.26 beta3-AnDrOiD
GO Launcher EX v3.26 Final-AnDrOiD
HD Clock Widgets Premium v1.8p-AnDrOiD
IMplus Pro v6.4.5-AnDrOiD
Janetter Pro for Twitter v1.4.2-AnDrOiD
MuseScore Player v1.1-AnDrOiD
NEO.emu v1.5.6-AnDrOiD
Notification Toggle Premium v2.5.8-AnDrOiD
Notification Weather Pro v0.7.0 Android 4.1 Plus-AnDrOiD
Package Buddy Pro v3.0.14-AnDrOiD
Paranoid Android Preferences v1.0-Android 4.1-ROOTED DEVICES ONLY-AnDrOiD
PicsPlay Pro v3.0-AnDrOiD
PocketCloud Remote Desktop Pro v1.3.216-AnDrOiD
Pose Tool 3D v6.8.28-AnDrOiD
Quick Setting Manager - Plus v2.0-AnDrOiD
Resume Builder Pro v1.32-AnDrOiD
Ringo Pro Text And Call Alerts v1.4.12-AnDrOiD
ShadowAlice (Down...) v1.1 LWP -AnDrOiD
Shot Control v2.6.7-AnDrOiD
Startup Manager (Full Version) v4.3-AnDrOiD
Stock Market Trading Simulator v1.0-AnDrOiD
Sweetys Home v1.0 LWP-AnDrOiD"
[V],blaze69,2013-01-10T04:52Z,"Thanks Once again,, been watching a While Now and Gotta Tell u ,,BEST > Keep em coming abd Thanks Alot,. >Seeding<"
,steve221,2013-01-10T05:33Z,"Hi, I just got an android phone and i want to say thanks for your uploads. You really make the android experience a whole lot better."
,SmokeShadows,2013-01-11T03:38Z,"I must agree with steve, you made me absolutely love my android phone, i just got one for the first time and i gotta hand it to you, you have a great selection of items for us who cant afford all this app-goodness!!"
,wasifmehmood,2013-01-11T20:37Z,nice share dude
