User Type,Username,Date,Text
[V],psspss,2013-02-04T04:43Z,"you may also want to cut the new episode guide from header and paste over the info.txt
I initially provided "
[V],psspss,2013-02-04T04:43Z,"you may also want to cut the new episode guide from header and paste over the info.txt
I initially provided"
[V],psspss,2013-02-04T06:07Z,"very interesting story.. expands on the other episode that talked briefly about it.. 

havent heard the full story of this before.. finally

something new on ufos/aliens

no doubt ancient aliens will have a episode next on it LOL"
[V],psspss,2013-02-04T06:46Z,"and NO i dont have the missing 2 episodes

the re-airs stopped in favour of the new season episodes"
