User Type,Username,Date,Text
,pythonista99,2013-04-25T08:03Z,Yeah - like we need more bombs ... :-(
,haruvatu,2013-04-25T08:39Z,"Well interesting books. 
As a bibliophile something that I would read.
But it could be that this is kind of Honeypot which tracks IP addresses who try to DL this kind of books.
Which would give infor to interested parties where future potential ""terrorist"" or idiots are located."
,ZoPunde,2013-04-25T17:41Z,"Uploaded by the FBI.
Nice try."
,nwetskin,2013-04-26T19:19Z,Well everyone who reads this is not a terrorist. If it were so easy to identify and segregate folks with such maniac tendencies the world would have been a much better and safer place already.
