User Type,Username,Date,Text
,uggenabben,2013-02-18T22:27Z,"Thanks, but this does not seem to contain scandinavia..."
,ingarl,2013-02-19T00:07Z,"Does not contain Nordic countries, but it can be downloaded from within the app for free. Just go to 'shop'. "
,ScorpioPirate,2013-02-19T02:06Z,"@ingarl :)

Yes... I have forgotten to write that in the header :)

Scandinavia can be downloaded for free from the apk itself :)"
,camos1999,2013-02-19T09:33Z,Can I request an upload of LIVESTRONG.COM - Calorie Tracker 3.0.9 ipa please. Thank you in advance! 
,uggenabben,2013-02-19T19:49Z,"OK, great! I have not installed it yet, only looked into the file..."
,bocca1908,2013-04-06T09:35Z,"how can I move file from pc to phone (this file) ?
is it first from pc to itunes ,  than from itunes to phone? :) it's my first iphone"
