User Type,Username,Date,Text
,daniel_dudau,2013-03-03T21:05Z,to Kenpachoer : fuck you forever for comments!!!!!!!!!! link fake....
,grasshopper62,2013-03-04T00:54Z,Whats with the spamers
,DreaD151,2013-03-06T18:50Z,They have gotten worse it seams like a few months ago  they just started with a wave of bullshit some of them are even fake rating the torrents and then spammin i believe in the midst of some of these assholes hides a rat in the spam pile if you get my drift.....(MPAA) its odd that they have increased to almost every new torrent and are puttin out fake torrents to every movie released? but software or games or other torrents seem to be untouched its only the movies .........ohhh btw given the copy thats out each day it gets better but the copy everone works with is kinda average....v6A4 thanks TvTeam for all the hard work you all do! 
,terrapin2012,2013-03-16T13:18Z,"just hack the MPAA and fry their cookie, lol"
,terrapin2012,2013-03-16T13:19Z,hollywood/mpaa can suck my balls
,my_dixie_normous,2013-03-23T10:53Z,"Listen I gotta be honest.....the guy ranting may seem like an ungrateful, hate monger of an idiot with half a brain and little tact...but they have a point. On other sites this torrent has been uploaded with screenshots and more info. "
