User Type,Username,Date,Text
,fettfan_1330,2013-05-13T06:02Z,could you possibly get The Bamboo Sword: And Other Samurai Tales by Shuhei Fujisawa & Gavin Frew i would be eternally grateful but if not thanks for your other great torrents! :)
,CrowZero,2013-05-13T14:06Z,"Hope you haven't forgotten about my request.
Anything by Kenzaburo Oe 

http://thepiratebay.sx/torrent/8359945/Roger_Ebert__film_critic_-_12_books_%28various_formats%29"
[T],pharmakate,2013-05-13T17:39Z,"@fettfan - Sorry, no sign of this author; I'll keep an eye out for him though.

@CrowZero - Yeah, I did forget, but it's up now. Enjoy."
,fettfan_1330,2013-05-13T20:24Z,thanks for the effort! much appreciated!
