User Type,Username,Date,Text
,RalffDicksi,2013-04-11T06:46Z,"Vlew ae parcero, otima qualidade de video e audio!"
,Bruno.R15,2013-04-22T08:03Z,"Valeeeu
Abraço."
,rob1461,2013-05-07T20:20Z,"Valeu aí RalffDicksi e Bruno.R15, mas esse torrent ele não está com os episódios todos dublados, eu vim ver depois que postei, mas obrigado de qualquer forma!!!"
,rob1461,2013-05-13T00:19Z,"Corrigindo meu comentário, o torrent ta bom, tem alguns episódios que o áudio português muda para o inglês mas são apenas alguns segundos, todos os episódios estão com ótima qualidade!!!"
