Filename,Size,Unit
Cover Up in Oklahoma.avi,1.38,G
Xtras/Signs of the Times/Endtime News Updates 1-13-13.avi,507.62,M
PBS_Frontline_TopSecretAmerica.avi,374.37,M
Xtras/The Holy Spirit/YO ME RINDO A TI - I surrender All.mp4,181.54,M
Xtras/SIN-ister Clips/Mt. Vesuvius worlds most dangerous volcano.avi,156.45,M
Xtras/The Holy Spirit/Mercyme - You Are I Am2.mp4,136.56,M
Xtras/The Holy Spirit/Why was Christmas banned in America until 1820 - Unwrapping Christmas.flv,122.39,M
Xtras/SIN-ister Clips/Ron Wyatt Death Bed Confess Re-affirms Ark of The Covenant - hidden until Sunday Law.avi,120.03,M
Xtras/The Holy Spirit/The Temple Mount Dillemma.flv,116.13,M
Xtras/SIN-ister Clips/Plans To Depopulate The Earth 80% For Future Mans Survival..avi,111.83,M
Xtras/Signs of the Times/Broken Foundation_ US power grid nations biggest danger.avi,95.32,M
Shorts/Broken Foundation_ US power grid nations biggest danger.avi,95.32,M
Shorts/Crime Stats Piers Morgan MSM Won't Discuss - 2013 Gun Control Debate.mp4,90.99,M
Xtras/The Holy Spirit/The Last 12 Shepherds of Israel- Prophecies that Converge Together upon 2012.flv,90.8,M
Shorts/Wide Awake  Sinkhole is only a symptom RadChick w Charlie McGrath 10-5-12.flv,85.8,M
Xtras/Signs of the Times/Hidden Hunger_ Kids in UK rely on food banks.avi,84.13,M
Shorts/The Quiet Coup Of America That No One Noticed Or Stood Up Against.avi,71.35,M
Xtras/SIN-ister Clips/UFO  Strange Triangle Lights spotted over Detroit and all over America 1-11-12.avi,59.41,M
Xtras/The Holy Spirit/PERSECUTION SONG.flv,54.77,M
Xtras/The Holy Spirit/The Sower and The Wor.flv,54,M
Shorts/Watch online who supplies Syrian rebels with arms.flv,51.92,M
Xtras/SIN-ister Clips/Obama Gun Control_ Drs Should Ask About Guns in Homes 1-16-13.avi,49.54,M
Shorts/Susan Lindauer - CIA Whistleblower.flv,47.58,M
Xtras/The Holy Spirit/The signs of the last days Dec 6 11.flv,46.97,M
Xtras/Signs of the Times/Latest EQ Report_ Jan. 14_ 2013.avi,45.49,M
Xtras/SIN-ister Clips/Psychiatry  Man Redefined.flv,42.3,M
Shorts/Torture Obamney Predictions.flv,40.32,M
Shorts/US New England EQ - Earth Cracking Up along Indo-Australian Plate.flv,39.2,M
Shorts/Texas Students Forced to Wear RFID Tags.flv,38.93,M
Xtras/The Holy Spirit/Truth (3).flv,36.49,M
Xtras/SIN-ister Clips/Over 75 Power Poles Burst into Flames In Central Texas.mp4,34.24,M
Xtras/SIN-ister Clips/making marriage last.avi,32.28,M
Shorts/Ben Swann REALITY CHECK for Piers Morgan Gun Stats.mp4,31.99,M
Xtras/Signs of the Times/Asteroid Impact Predicted_.avi,30.96,M
Shorts/US Preparing For Alien Invasion.flv,26.85,M
Xtras/SIN-ister Clips/Private Corp to watch you realtime from cable boxes.avi,26.41,M
Xtras/SIN-ister Clips/Mysterious Domes In Siberia - Radioactive UFO Weapons.avi,25.65,M
Xtras/SIN-ister Clips/Wake Up Citizens The New World Order is Coming.mp4,25.06,M
Shorts/Unschooling  Home learning the future of US education.flv,24.51,M
Shorts/Flashing beams Update - Jan. 9_ 2013.mp4,23.86,M
Shorts/Beaten Sodomized CIA found guilty of torture by European Court.flv,23.36,M
Xtras/War and Rumors of Wars/Egypt Coptic Christians decry new constitution.mp4,23.36,M
Shorts/Texas Weather Modification in Progress on ABC News - Oct 2012.flv,23.29,M
Xtras/Signs of the Times/7.7 Mag EQ in Southeastern Alaska.avi,21.69,M
Shorts/Federal Court Rules in Favor of RFID at TX School.avi,21.6,M
Xtras/Signs of the Times/A Letter No One Would Hope to Read by Jerry Tyson.avi,20.97,M
Shorts/Federal Gun Act is coming from Obama says Walmart.avi,20.17,M
Xtras/Signs of the Times/Federal Gun Act is coming from Obama says Walmart.avi,20.17,M
Shorts/UFO Researchers die under mysterious circumstances.flv,19.97,M
Xtras/The Holy Spirit/Wretched  Your problem is.flv,19.43,M
Xtras/War and Rumors of Wars/Egypt The Fierce King and Muslim Brotherhood vote Shariah Law into Constitution 12-26-12.mp4,17.08,M
Xtras/SIN-ister Clips/REAL AMAZING UFO'S OF 2013.flv,16.31,M
Shorts/UN Considers Imposing Global Taxes For NWO.flv,15.29,M
Xtras/Signs of the Times/ALIEN Hybrid Or Star-child Discovered In China.flv,14.8,M
Xtras/Signs of the Times/Daniel Timeline door is closing Goshen - Post Glacial Rebound Effect - Melt.flv,14.5,M
Shorts/The Real War on Women by Carol Rushton.flv,13.22,M
Xtras/The Holy Spirit/Phil Wickham - At Your Name  Lyrics.flv,12.53,M
Shorts/The Human Avatar Programs by NASA  DARPA.flv,12.32,M
Xtras/Martyrs of Today/They are flooding us on purpose Thepowerhour.flv,12.21,M
Shorts/Reality Check_ Reduce violent crime by issuing more concealed carry permits..mp4,11.74,M
Shorts/Wretched  Joseph Smith married women who were married.flv,11.56,M
Shorts/USGS Shutting of Important Info - 5.6 Mag EQ  EASTERN MEDITERRANEAN SEA.flv,11,M
Xtras/Signs of the Times/Big Brother Dog Teaches Puppy to Go Downstairs.mp4,10.16,M
Xtras/Signs of the Times/French AIRFORCE steps up MILITARY ACTION against ISLAMIST FIGHTERS in Mali.avi,9.66,M
Shorts/Texas Using Toilet To Tap Water.flv,9.64,M
Shorts/What Is Truth - A video response to Luke Rudkowskis Bday Wish.flv,9.33,M
Xtras/The Holy Spirit/Stellar Kart - Something Holy.flv,8.52,M
Xtras/SIN-ister Clips/Neuroprosthetics_ aka alien implants going to mainstream science culture.flv,8.46,M
Xtras/Martyrs of Today/What is it costing you to be a Christian TODAY.flv,8.25,M
Xtras/The Holy Spirit/Our God Reigns by Delirious.flv,8.2,M
Xtras/Signs of the Times/Internet Activist Reddit co founder found Dead   Aaron Swartz of DemandProgress Org.mp4,7.91,M
Xtras/War and Rumors of Wars/CA Homeowner Shoots and Kills Armed Home Invader_ Wounds 2 Others as Children Have Sleepover.mp4,7.71,M
Shorts/TSA to install molecular body scanners.flv,7.47,M
Xtras/SIN-ister Clips/Newtown 7th Grader Starts Movement To Rid America Of Violent Video Games.mp4,7.36,M
Xtras/Signs of the Times/FAU Professor Calls Connecticut School Massacre A Hoax.flv,6.55,M
Shorts/Underwater Drones Warfare Against IRAN.flv,5.9,M
Xtras/The Holy Spirit/This is your Life by Switchfoot.flv,5.56,M
Pics/PBS_Frontline_TopSecretAmerica.jpg,21.61,K
Pics/images1.jpg,10.89,K
Pics/images4.jpg,9.91,K
POtHS - Why We Do What We Do.txt,7.89,K
Pics/images2.jpg,6.91,K
Info.txt,4.38,K
Pics/images.jpg,3.21,K
Pics/images3.jpg,2.68,K
Torrent downloaded from Conspiracyhub.com.txt,47,B
