User Type,Username,Date,Text
,majmi,2013-04-17T20:18Z,"Thanks a lot...... plz do ""midnight's children"", bluray is out:

http://www.blu-ray.com/movies/Midnights-Children-Blu-ray/67537/#RegionCoding

Source:
Midnights.Children.2012.720p.BluRay.DTS.x264-PublicHD"
,Raiyan14,2013-04-17T20:55Z,Thank You very much. I have quit downloading from YIFY. Now you are my best uploader. Do you take any requests?
,izitox,2013-04-17T21:29Z,"Subs Eng : http://subscene.com/subtitles/jack-reacher/english/717514
Subs Eng Hi : http://subscene.com/subtitles/jack-reacher/english/717513"
,nhughes5,2013-04-17T21:52Z,"A10/V10 Very nice HD rip.  Normally I download YIFY rips but yours seems to be as good but in a smaller file size even. (I downloaded both to compare)
Don't know how you work your magic but keep it up! Thank you!"
,tingya,2013-04-18T07:09Z,"Love ur Quality But i hAv a small request I hav to use utorrent to download ur torrent so can u please create ur torrent using utorrent 2.2 but not using higher than 2.2 version 
""It is a problem caused by utorrent 2.2 or higher as u use 3.3 its torrent creating algo restricts the use of torrent for utorrent ipv6 teredo clients only Many other software use different ipv6 algorithm to download torrent My isp block ipv6 torrenting  as i can get caught using utorrent for downloading so i request u to use 2.2 version to create torrent""
Cheers :p"
,M5T,2013-04-18T09:37Z,"Thank you for this! :D
Can you upload the special edition of Brad Paisley's Wheelhouse? It comes with 3 bonus tracks! Thank you! :D"
,toxicity9,2013-04-19T08:13Z,thnx...!!!
,BrenZBoy,2013-04-25T07:58Z,"GUYS, PLEASE SEED... IT'S TAKING AGES FOR ME TO DOWNLOAD..."
,JSoul,2013-05-16T20:51Z,"I am seed right now, but I am having an issue playing the video. When I try to play it all that happens is a black screen in WMP and wil not play. Please help."
[V],varuttee,2013-05-25T10:23Z,"Encoded using revolutionary 10bit encoding, which enables us to provide you more crispier 
and sharper images at small sizes, just make sure you follow our instructions without a fault.
Recommend to you to use latest version of VLC player. Install K-Lite Codec Pack or shark007 codecs
in case of any kind of problem in playback (For non-VLC Media Player users). Alternatively, install
Core AVC codecs, the fastest decoder that there is coupled with Community Center Codec Pack and play
on Windows Media Player Classic."
