User Type,Username,Date,Text
,kieta,2013-04-12T23:30Z,"any comment , is it safe ? , does it works?"
,platypus2,2013-04-13T23:01Z,"Works, using it now"
,tptgho,2013-04-19T16:55Z,can anyone post stardock modernmix crack.plz help.
,DABaRReTT,2013-04-23T23:17Z,Works perfectly. +++ :] Thankyou!
,jitenful911,2013-04-24T09:42Z,"i'm new to windows 8 and I can't get this to work, can anymore write a more better step by step how to get this working

thank you"
,nsj7762,2013-05-04T19:41Z,I ran MalwareBytes on it. Something sketchy came up.. a bug. Dont know if its a virus or what but i deleted it. Make sure you run a scan on it before you install it.
,nsj7762,2013-05-04T19:41Z,I ran MalwareBytes on it. Something sketchy came up.. a bug. Don't know if its a virus or what but i deleted it. Make sure you run a scan on it before you install it.
,nsj7762,2013-05-04T19:42Z,I dont know why these comments are posting but here I go again. Run MalwareBytes or some virus protection software on the file. Mine came up with a bug and I deleted it. 
