User Type,Username,Date,Text
,StopMEPlz,2013-02-01T07:13Z,Hope you guys like this. 
,StopMEPlz,2013-02-02T05:48Z,Update on the details of the Game. I was mistaken.. this is the PAL (Europe) version. But still is in 100% English. 
,ManaRuben,2013-02-04T00:09Z,UNDUB version here http://thepiratebay.sx/torrent/7446105/Final_Fantasy_XIII-2_UNDUB_PS3
,godofwar25,2013-04-11T14:58Z,Please seed i will seed for a while once completed!!!!!!
,godofwar25,2013-04-12T00:28Z,FUcking leechers!!!!!upping at 0.1 kb/s PLEASE SEED!!!!!!!!!
