User Type,Username,Date,Text
[S],soda,2013-02-26T02:28Z,"Sorry, gave you Trusted status by mistake.  I didn't notice the spam pdf's in your torrents.  

Luckily for you I've just revoked the skull but, if you continue with the spam, you will be banned."
,ore-sabre,2013-03-01T17:28Z,"mod soda can you explain me wat spam you talking about please?
so i can delete it from my tors.
thx"
[S],soda,2013-03-02T05:56Z,"The stuff about how people can allegedly make money.  IIRC it was the scriptreseller-.eu.pdf file.
"
,ore-sabre,2013-03-02T15:34Z,"thx soda,
i have deleted that file ."
