User Type,Username,Date,Text
,Ojhasala,2013-04-07T13:07Z,Nice Work :)
,Ojhasala,2013-04-07T13:08Z,Please keep uploading these seasons I wanna download them only from you
,DubKingdom,2013-04-08T09:29Z,I'm still seeding. About to be uploading a few more shows I picked up today currently ripping them.
,DubKingdom,2013-04-09T02:50Z,If your going to download. Seed to the point where your ratio is at least 1.0% equal to that of which you downloaded. Keep getting you people up to having a min of 10 other seeders before I stop seeding to dump more bandwidth into the newer torrents and you guys all stop seeding.
,zeromegaman,2013-04-28T00:02Z,Thank.
