User Type,Username,Date,Text
,bonethugnharmony,2013-02-24T16:17Z,"FORGET CRACK AND BULLSHIT PEOPLE....GET THE 

nosTEAM COPY. IT INSTALLS AND IS BROKEN DOWN INTO OPEN ONLY PART ONE AND PART 2,3,&4 INSTALL AUTOMATICALLY. INSTALL AND PLAY. NO CRACK NO BULLSHIT.  FIND IT HERE ON THE PIRATE BAY, 
ITS FRESH UPLOAD FROM YESTERDAY AND IT IS THE LEGIT nosTEAM COPY.

Crysis 3 PC full game EN-CZ-DE-ES-FR-IT-PL-RU-TR ^^nosTEAM^^


TRUSTED      nosTEAM.....IT IS OUT !!!!!!! STOP FUCKING WITH BOGUS CRACKS AND FAKE UPLOADS. YOU GUYS ARE CRASHING BECAUSE IT IS A SELF EXECUTABLE. YOU RESOVE THIS BY INSTALLING THE FUCKING GAME, THE WAY IT WAS CREATED.    PEACE   bonethug."
,BAEast,2013-03-08T06:38Z,"Nice job spamming, asshat. This isn't even the game, this is the soundtrack. Why are you advertising nosTEAM here?"
,jtjh,2013-03-13T06:52Z,"Wait. So .mp3 files from the Crysis 3 soundtrack are also game files? No fucking way bonethugnharmony. 

God you're a fucking idiot. Next time you are gonna to go loser on a comment section, make sure you have the RIGHT one first! "
