User Type,Username,Date,Text
,Ahlat,2013-02-06T16:25Z,"Thank you, greatly appreciate this."
[V],STFmaryville,2013-02-06T17:28Z,thanks GunningHawk90! adam kubert's art is stellar as always
,iCondemned_88,2013-02-06T17:56Z,Thank you!
,dwm015,2013-02-09T05:11Z,"**REQUEST**
I didnt know where else to put this. I am looking for the files for Fantastic Four: Books of Doom. If anyone will email me a link or the files themselves, I would GREATLY appreciate it. Have been searching high and low and cant find anything! Thank you in advance!"
,c0mrade98,2013-02-10T16:05Z,Hello Daniel Martinez of Sam Houston State University. Perhaps in the future you will reconsider utilizing your e-mail address from a state-funded Texas public university in order to solicit and/or acquire illegal files.
