User Type,Username,Date,Text
,shauwy1978,2013-03-04T17:52Z,"wait skidrow come!
http://orlydb.com/s/games"
,itakmaszraka,2013-03-05T00:07Z,"i get ""tomb raider stopped working"" after starting the .exe, tried this crack, tried 3dm, tried skidrow"
,Seedicle,2013-03-05T02:35Z,Please Seed. Pretty Pleeeeeasse..
,Seedicle,2013-03-05T03:45Z,Just so everyone knows if you set your upload speed to unlimited you will have a faster download speed. 
,Seedicle,2013-03-06T04:20Z,Is there a reason after I get the bag for what ever his face is there is a wolf that that jumps out and grabs my leg and then I am suppose to mash left and right when ever time i do that and the wolf just kills me. Is this somthing to do with the torrent or am i doing something wrong...
