User Type,Username,Date,Text
,shabbamanuk,2013-02-13T04:24Z,slick...thanks
,Happy_In_Kaohsiung,2013-02-13T07:10Z,"Thank you so much,really miss the champions league here.Will you be putting the other games up?"
[T],Demonoid4Ever,2013-02-13T07:47Z,"@Happy_In_Kaohsiung - I'll upload the Celtic - Juventus game a little later, and hopefully some other upcoming games."
,kopend,2013-02-14T00:30Z,how do u record the gamess 
[T],Demonoid4Ever,2013-02-14T01:13Z,"@kopend I don't do the actual recording, just uploading and giving credit to the capper."
,shabbamanuk,2013-02-26T23:43Z,awesome game
