User Type,Username,Date,Text
,zIPopulo,2013-06-11T15:18Z,"if you guys/girls want to trust this person, go for it. but the website in the description works 100% and your UDID will be registered in about 15 seconds after purchase.  however the site is down at the moment due to the large traffic from yesterday."
,ljohanl,2013-06-12T16:14Z,"Works like a charm. But don't pay for UDID.
Search for"" How To Install NEW iOS 7 (FREE) Without A Dev Account Or UDID"" on youtube"
,rickard.carry,2013-06-12T18:28Z,"This torrent is really good. Just connect your device, click restore in iTunes and choose the file. 

Awsome! "
,MrGoats,2013-06-13T17:51Z,"PayPal what you can afford to rickmelaragni@gmail.com 
Put your UDID in the notes. 
Activation in seconds!
If you want to have your iOS 7 to not be deactivated by apple I suggest you have a developer active it."
,Dynazamb,2013-06-14T21:49Z,"I have many slots available and am activating UDIDs for 5 USD via paypal. Paypal email is Monkeygamer3213@gmail.com please put your UDID in the note with payment. I also accept Bitcoin or Litecoin for a discounted price, email me if you would like to pay with BTC or LTC."
,MrGoats,2013-06-15T23:32Z,"ACTIVATING UDIDs!
PayPal what you can afford to rickmelaragni@gmail.com"
,Dynazamb,2013-06-16T07:47Z,"super fast I have many slots available and am activating UDIDs for 5 USD via paypal. Paypal email is Monkeygamer3213@gmail.com please put your UDID in the note with payment. I also accept Bitcoin or Litecoin for a discounted price, email me if you would like to pay with BTC or LTC."
