Filename,Size,Unit
A Better Land/01 A Better Land.mp3,9.09,M
A Better Land/02 You Are Not Forgotten.mp3,8.35,M
A Better Land/03 Into Glory They Ride.mp3,6.29,M
"A Better Land/04 Our Land, Not Your Land.mp3",6.22,M
A Better Land/05 Mr. Down On His Luck.mp3,6.22,M
A Better Land/06 Justice For Daniel Faulkner.mp3,6.03,M
A Better Land/07 Only The Strong Survive.mp3,5.77,M
A Better Land/08 Forever Your Honor Is True.mp3,6.52,M
A Better Land/09 Carolina - The Local State Sovereignity Song.mp3,4.76,M
A Better Land/10 Traitortown USA.mp3,2.64,M
A Better Land/11 Just Can't Last One More Day.mp3,6.06,M
A Better Land/12 Keep You Alive.mp3,17.22,M
A Better Land/Better Dead Than Red - A Better Land.jpg,38.72,K
Better Dead Than Red/01 The Battle Rages On.mp3,11.72,M
Better Dead Than Red/02 I Told You So.mp3,6.38,M
Better Dead Than Red/03 Who We Are.mp3,7.21,M
Better Dead Than Red/04 The New Authority.mp3,11.2,M
Better Dead Than Red/05 When The Worlds Collide.mp3,9.35,M
Better Dead Than Red/06 Generic Pub Song.mp3,8.48,M
Better Dead Than Red/07 Street Soldiers.mp3,12.36,M
Better Dead Than Red/08 This Is Catching Up With Me.mp3,8,M
Better Dead Than Red/09 Ultra Terror.mp3,5.28,M
Better Dead Than Red/10 Battle Call.mp3,5.58,M
Better Dead Than Red/11 Punk Rock Fantasy.mp3,4,M
Better Dead Than Red/12 Violence In Our Minds.mp3,7.37,M
Better Dead Than Red/13 Commie Killer.mp3,3.15,M
Better Dead Than Red/14 Traitor.mp3,4.36,M
Better Dead Than Red/15 On The Front Line For America.mp3,6.48,M
Better Dead Than Red/16 Written Word.mp3,1.89,M
Better Dead Than Red/17 Columbine.mp3,2.12,M
Better Dead Than Red/18 Just Can't Last One More Day.mp3,8.21,M
Better Dead Than Red/19 Mr. Down On His Luck.mp3,7.18,M
Better Dead Than Red/20 Tomorrow Is Always Too Late.mp3,10.38,M
Better Dead Than Red/Better Dead Than Red.jpg,21.89,K
Front Line/01 Traitor Town USA.mp3,2.63,M
Front Line/02 Just Can't Last One More Day.mp3,5.35,M
Front Line/03 Beat Down.mp3,3.3,M
Front Line/04 Columbine.mp3,1.81,M
Front Line/05 Battle Call.mp3,4.32,M
Front Line/06 Written Word.mp3,1.89,M
Front Line/07 On The Front Line.mp3,4.28,M
Front Line/08 Traitor.mp3,3.68,M
Front Line/09 Punk Rock Fantasy.mp3,3.32,M
Front Line/10 Night Fall.mp3,3.39,M
Front Line/11 GCC.mp3,3.97,M
Front Line/12 American War Machine.mp3,4.92,M
Front Line/13 Sign Of The Times.mp3,2.62,M
Front Line/14 Commie Killer.mp3,2.6,M
Front Line/15 Day Break.mp3,3.06,M
Front Line/16 Dooms Day.mp3,2.56,M
Front Line/17 Mr. Down On His Luck.mp3,5.41,M
Front Line/18 Into Glory They Ride.mp3,6.32,M
Front Line/Better Dead Than Red-Frontline.jpg,33.2,K
Marx Was Wrong/01 We're Back.mp3,6.33,M
Marx Was Wrong/02 We Ain't No Feel Good Band.mp3,7.48,M
Marx Was Wrong/03 Ultra Terror.mp3,5.16,M
Marx Was Wrong/04 Drink To Remember.mp3,9.22,M
Marx Was Wrong/05 Marx Was Wrong.mp3,5.8,M
Marx Was Wrong/06 Can't Believe.mp3,6.54,M
Marx Was Wrong/07 Loser Skins.mp3,4.53,M
Marx Was Wrong/08 Who's Got The Power-.mp3,6.35,M
Marx Was Wrong/09 Always Too Late.mp3,6.41,M
Marx Was Wrong/10 Tomorrow Is Ours.mp3,9.2,M
Marx Was Wrong/11 The Sound Of Rebellion.mp3,7.98,M
Marx Was Wrong/12 Better Dead Than Red.mp3,4.73,M
Marx Was Wrong/13 American Radio.mp3,8.2,M
Marx Was Wrong/14 Sword Of The West.mp3,8.9,M
Marx Was Wrong/15 Code Of Honor.mp3,6.96,M
Marx Was Wrong/16 Deep Six'd.mp3,5.5,M
Marx Was Wrong/17 Wrong Or Right.mp3,7.92,M
Marx Was Wrong/18 Lionheart.mp3,8,M
Marx Was Wrong/Better dead than red - Marx was wrong (1).jpg,350.43,K
Marx Was Wrong/Better dead than red - Marx was wrong - back.jpg,418.45,K
Marx Was Wrong/Better dead than red - Marx was wrong - disc.jpg,954.01,K
Marx Was Wrong/Better dead than red - Marx was wrong - front.jpg,226.69,K
Marx Was Wrong/Better dead than red - Marx was wrong.jpg,222.48,K
RAC Warriors/01 RAC Warrior.mp3,8.73,M
RAC Warriors/02 Smash The Reds.mp3,8.79,M
RAC Warriors/03 For Those Who Fight And Die.mp3,9.31,M
RAC Warriors/04 Carry Your Banners.mp3,8.42,M
RAC Warriors/05 Drinking Song.mp3,10.57,M
RAC Warriors/06 Wrong Or Right 07.mp3,8.25,M
RAC Warriors/07 Stealth.mp3,6.7,M
RAC Warriors/08 Kick 'Em In The Head.mp3,6.43,M
RAC Warriors/09 A Better Land.mp3,7.04,M
RAC Warriors/10 It's Gonna Work Itself Out.mp3,8.59,M
RAC Warriors/11 Terrorist With A Guitar.mp3,8.3,M
RAC Warriors/RAC Warriors-back.JPG,1.13,M
RAC Warriors/RAC Warriors-front.JPG,286.94,K
RAC Warriors/RAC Warriors.JPG,254,K
Smash The Reds/01 Crusader.mp3,3.34,M
Smash The Reds/02 Who We Are.mp3,2.59,M
Smash The Reds/03 Fire In Their Eyes.mp3,3.73,M
Smash The Reds/04 Ruins Of Camelot.mp3,1.48,M
Smash The Reds/05 American Radio.mp3,3.14,M
Smash The Reds/06 The Watchmen.mp3,2.89,M
Smash The Reds/07 Time.mp3,2.53,M
Smash The Reds/08 We Are The Boys (live).mp3,1.49,M
Smash The Reds/09 Ruins Of Camelot (live).mp3,1.39,M
Smash The Reds/10 Antisocial (live).mp3,1.48,M
Smash The Reds/11 Beat On The Brat (live).mp3,1.99,M
Smash The Reds/12 American Dream.mp3,2.19,M
Smash The Reds/13 Out For Blood (demo).mp3,2.05,M
Smash The Reds/14 Written Word (demo).mp3,1.04,M
Smash The Reds/15 Hectic City (demo).mp3,2.03,M
Smash The Reds/16 Commie Killer.mp3,1.07,M
Smash The Reds/17 Traitor.mp3,1.5,M
Smash The Reds/18 On The Front Line For America.mp3,1.74,M
Smash The Reds/19 Written Word.mp3,891.5,K
Smash The Reds/20 Columbine.mp3,770.96,K
Smash The Reds/21 I Just Can't Last One More Day.mp3,2.72,M
Smash The Reds/22 Mr. Down On His Luck.mp3,2.19,M
Smash The Reds/23 Days Of Pain.mp3,2.26,M
Smash The Reds/24 SPQR.mp3,5.32,M
Smash The Reds/25 The Hourglass.mp3,5.29,M
Smash The Reds/Better Dead Than Red - Smash The Reds.JPG,51.77,K
The World Needs A Hero/01 Hold The Line.mp3,5.52,M
The World Needs A Hero/02 I Stand Accused.mp3,5.01,M
The World Needs A Hero/03 1916.mp3,6.26,M
The World Needs A Hero/04 The World Needs A Hero.mp3,4.71,M
The World Needs A Hero/05 Just Can't Last One More Day (2002 Mix).mp3,5.6,M
The World Needs A Hero/06 Fire In Their Eyes.mp3,7.65,M
The World Needs A Hero/07 Our Hearts Belong To Our Land.mp3,3.05,M
The World Needs A Hero/08 We've Got Our Pride.mp3,4.89,M
The World Needs A Hero/09 Understand Your Man.mp3,4.4,M
The World Needs A Hero/10 Ruins Of Camelot.mp3,3.73,M
The World Needs A Hero/11 Hectic City.mp3,4.42,M
The World Needs A Hero/12 In Defense Of Our Home.mp3,5.61,M
The World Needs A Hero/13 This Is Catching Up With Me.mp3,6.33,M
The World Needs A Hero/14 The Watchmen (Vangaurd Mix).mp3,7.25,M
The World Needs A Hero/15 The Heart That Never Lies.mp3,6.3,M
The World Needs A Hero/16 Never Surrender.mp3,3.53,M
The World Needs A Hero/17 Our Hearts Belong To Our Flag (bonus).mp3,5.27,M
The World Needs A Hero/Better dead than red - The world needs a hero (1).jpg,1.09,M
The World Needs A Hero/Better dead than red - The world needs a hero (2).jpg,1.12,M
The World Needs A Hero/Better dead than red - The world needs a hero (3).jpg,1.08,M
The World Needs A Hero/Better dead than red - The world needs a hero (4).jpg,1.04,M
The World Needs A Hero/Better dead than red - The world needs a hero (5).jpg,1.03,M
The World Needs A Hero/Better dead than red - The world needs a hero (6).jpg,1.05,M
The World Needs A Hero/Better dead than red - The world needs a hero (7).jpg,1.06,M
The World Needs A Hero/Better dead than red - The world needs a hero (9).jpg,555.39,K
The World Needs A Hero/Better dead than red - The world needs a hero-back.jpg,1.51,M
The World Needs A Hero/Better dead than red - The world needs a hero-disc.jpg,1.12,M
The World Needs A Hero/Better dead than red - The world needs a hero-front.jpg,1.42,M
The World Needs A Hero/Better dead than red - The world needs a hero.jpg,1.09,M
