User Type,Username,Date,Text
,geiszer,2013-03-09T04:12Z,Don't forget to seed :D
,Phrozenjib,2013-03-14T10:23Z,Guess people forgot to seed lol
,Stavros0141,2013-03-20T17:39Z,seedddddddddddddddddddddddddd
,vena51187,2013-03-21T16:41Z,I can not get it to download!!!
,Okamikaze,2013-03-24T00:03Z,Nobody is going to seed... this has been stuck at 0 seed level for several days
,OmgItsMee,2013-06-05T21:57Z,I'm just glad that you actually uploaded this as a separate item instead of packing it all together with hundreds of store items that I don't want! Thank you for that!
,OmgItsMee,2013-06-05T22:01Z,"Oh, speaking of how happy it makes me that you did this separate, is there anyway you could do more things from the sims 3 store in separates?"
