User Type,Username,Date,Text
,Pratz89,2013-05-16T08:16Z,"Is this worked?? No one comments in this torrent.
Actualy i had a pscs5 extend, and its worked fine. After few month suddenly itz become trial. Then i uninstall it to reinstall. Bt i cnt install. It said that you required internet connetion or phone number to activate it.
So can i use this setup? Or it will occur the same prob? Plz help me."
,Pratz89,2013-05-16T08:22Z,"I have 32 bit win7, and i changed the host file. What should i do? Should i bring back the default host file? And change it again?
I am confused.
Plz help me k3r1g4nn"
