User Type,Username,Date,Text
[T],210gustavo,2013-03-16T21:49Z,"aewww, obrigado amigo, vc voltou,vlw"
[T],jhon-tdo,2013-03-18T00:44Z,"@210gustavo
fala ae meu brother ... eu to meio sem tempo!
mais to sempre de olho nos teus posts ;)
abraços"
,AlanGDS,2013-03-18T16:51Z,"Oi. Como faço para adicionar audio em português nos filmes só em inglês e que programa você usa, pois fiz uma experiência com um filme no ''MKVMERGE'' e adicionei em português, mas mesmo assim o filme continuou em inglês, mesmo colocando em português. Aguardo resposta"
[T],210gustavo,2013-03-19T00:01Z,"ahh, muito obrigado amigo, continue postando, nao pare...abraço"
,kilzone,2013-03-20T04:59Z,"amigo, vc nao tem ideia de postar o american pie o reencontro?"
[T],jhon-tdo,2013-05-28T04:04Z,"# kilzone 

Pow amigao ja assisti eee nao tenho mais no pc! Mals ae! XD"
