User Type,Username,Date,Text
,B-manSwe,2013-06-08T20:12Z,This is like an episode of the series Vampire Diaries...huh ??
,B-manSwe,2013-06-09T00:21Z,Men är det bara jag som märkt att denna torrent inte alls är Hangover III??
[T],Little_Devil,2013-06-09T08:13Z,"@B-manSwe 
det är nog bara för dig det strulat faktiskt.
för ett bra tag sen så händet ngt liknande. an laddade ner ngt helt annat än vad man trodde. troligtvis ngt knas bara :)"
,B-manSwe,2013-06-09T22:20Z,"skumt, jag provar igen då, vill verkligen se denna...
thanx "
,B-manSwe,2013-06-09T22:21Z,"skumt, jag provar igen då, vill verkligen se denna
thanx"
,B-manSwe,2013-06-09T22:22Z,hm sen kan man undra varför mina kommentarer dubbelpostas med..udda...
[T],Little_Devil,2013-06-09T22:43Z,prova magnetlänken magnet:?xt=urn:btih:53B7FAE58A2800779C6C9A43FC6CDC061A96D828&dn=hangover+part+iii+2013+swesub+webrip+xvid+ac3+little+devil&tr=udp%3A%2F%2Ftracker.openbittorrent.com%3A80%2Fannounce&tr=udp%3A%2F%2Fopen.demonii.com%3A1337
[T],Little_Devil,2013-06-09T22:44Z,alternativ googla torrentnamnet: Hangover.Part.III.2013.SWESUB.WEBRip.XviD.AC3-little_devil    så hittar du andra idor som torrenten finns på. lycka till 
