User Type,Username,Date,Text
,dascorpion88,2013-03-27T04:51Z,Is this shit even real? Why an FLV?
,rhyno33,2013-03-27T04:57Z,this one seems a little suspect.
,FallingSky,2013-03-27T05:10Z,"Yeah its real, but really shitty video quality."
,Strajow,2013-03-27T05:19Z,I do not upload fakes. Ever! 
,CaptainEvil83,2013-03-27T05:29Z,"from the bit i have downloaded it looks pretty darn good quality! I hope its a full episode, maybe flv files are just small...."
,Strajow,2013-03-27T05:36Z,..
,dascorpion88,2013-03-27T05:53Z,right but you will upload FLVs with SHIT quality video
,donrake,2013-03-27T06:01Z,It's real.  Not the greatest quality but you can't expect more more from a file this size.  Thanks for the upload!
,Strajow,2013-03-27T06:05Z,damn i cant see the comments wtf lol?
,Strajow,2013-03-27T06:07Z,"dascorpion.., there is an mp4 HDTV version on here. I upload this for the ones whom cbf waiting. ead and upload one torrent before running that mouth. please :)"
,Bakaat,2013-03-27T06:30Z,Real deal. Good enough quality to watch when you want to watch it as early as possible. Thanks Strajow!
,Strajow,2013-03-27T07:36Z,no problem bakaat!
,SOALIPZ,2013-03-27T11:06Z,+1   thanks man...
