User Type,Username,Date,Text
,coruna70,2013-04-26T23:31Z,El torrent tiene el Expansión y no Marca. Podrías arreglarlo?
[V],furtaperas,2013-04-27T08:07Z,el torrent es del marca    
,caranflo,2013-05-01T10:28Z,"Muchas gracias por compartir furtaperas. Pero como dice coruna70, el torrent corresponde a 'Expansión' del 25abril. ¿Habría forma de que pudieras subirlo de nuevo?. Saludos."
,caranflo,2013-05-01T10:32Z,"Parece que pusiste el de marca en el torrent de expansión.
Aquí tienen, por si alguien lo busca:
http://thepiratebay.sx/torrent/8409453/Diario_Expansion_25-4-2013"
