Filename,Size,Unit
Interview Vernon and Amy KDWN Feb 1984 Tape 2_S2.mp3,42.57,M
How To Feel Really Good Forever _S2.mp3,42.53,M
How to Learn From A New Experience _S1.mp3,42.16,M
Let Your Secret Searchlight Reveal Treasures _S1.mp3,42.02,M
How To Find The Key In The Dark _S2.mp3,41.99,M
How To Live Your Own Life_S2.mp3,41.98,M
Interview Vernon and Amy KDWN Feb 1984 Tape 2_S1.mp3,41.89,M
Interview Vernon and Amy KDWN Feb 1984 Tape 1_S1.mp3,41.87,M
Let These Truths Attract Self-Healing W-3_S2.mp3,41.71,M
Interview - A Revealing Interview With Vernon Howard _S1.mp3,41.67,M
How To Turn Off Sinister Voices _S1.mp3,41.61,M
Learn To Hear The True Music _S1.mp3,41.54,M
Let Your Secret Searchlight Reveal Treasures _S2.mp3,41.53,M
How To Feel Really Good Forever _S1.mp3,41.53,M
How To Set Yourself Free_S2.mp3,41.41,M
Interview - A Revealing Interview With Vernon Howard _S2.mp3,41.37,M
Life's Greatest Pleasure_S1.mp3,41.27,M
How To Find The Key In The Dark _S1.mp3,41.26,M
Intelligence Is The Absence Of Me _S2.mp3,41.25,M
Intelligence Is The Absence Of Me _S1.mp3,41.2,M
Let This Thunder Of Truth Awaken You_S2.mp3,41.16,M
How To Study Human Evil_S1.mp3,41.14,M
Let The Mad World Stay Mad_S1.mp3,41.14,M
Lose Helplessness And Find Real Power_S1.mp3,41.08,M
Life's Greatest Pleasure_S2.mp3,41.05,M
Journey To A New World _S2.mp3,41.03,M
Keys To Self-Transformation_S2.mp3,40.99,M
Keys To Self-Transformation_S1.mp3,40.98,M
How To Study Human Evil_S2.mp3,40.98,M
How To Escape Mental Prison _S1.mp3,40.98,M
How To Escape Mental Prison _S2.mp3,40.9,M
Let The Life In Truth Be Your Life_S2.mp3,40.81,M
How To Turn Off Sinister Voices _S2.mp3,40.79,M
Live From Your Own Cosmic Maturity_S2.mp3,40.78,M
Let The Life In Truth Be Your Life_S1.mp3,40.76,M
Let Higher Thought Make Decisions For You _S1.mp3,40.75,M
Let Esoteric Truths Work For You_S1.mp3,40.74,M
Let This Thunder Of Truth Awaken You_S1.mp3,40.71,M
Inner Light Is All That Matters _S2.mp3,40.63,M
Live From The Spirit Of Truth _S2.mp3,40.58,M
How To Set Yourself Free_S1.mp3,40.55,M
I Don't Want To Be Afraid _S1.mp3,40.54,M
Let The Light Fight 12-2.mp3,40.39,M
How To Stop Being A Nervous Wreck _S2.mp3,40.31,M
How To Turn The Lights On And See _S2.mp3,40.26,M
Make Room For Truth _S2.mp3,40.09,M
Interview Vernon and Amy KDWN Feb 1984 Tape 1_S2.mp3,40.04,M
Live From The Spirit Of Truth _S1.mp3,40.01,M
Make Room For Truth _S1.mp3,40,M
How To Meet The Unexpected_S1.mp3,39.99,M
Lights That End Frights _S2.mp3,39.97,M
Live From Your Own Cosmic Maturity_S1.mp3,39.94,M
Let Truth Be Your Strength_S2.mp3,39.91,M
How To Rise Above Yourself _S2.mp3,39.86,M
Let Go!_S1.mp3,39.78,M
Let Truth Be Your Strength_S1.mp3,39.76,M
How To Turn Problems Into Gold _S1.mp3,39.73,M
How To Turn The Lights On And See _S1.mp3,39.58,M
How To Rise Above Yourself _S1.mp3,39.56,M
Journey To A New World _S1.mp3,39.52,M
How To Live Your Own Life_S1.mp3,39.49,M
How To Turn Problems Into Gold _S2.mp3,39.45,M
Interview - A Powerful Interview With Vernon Howard _S2.mp3,39.43,M
Let These Truths Attract Self-Healing W-3_S1.mp3,39.41,M
Let These Facts Carry You Forward _S1.mp3,39.41,M
Inner Light Is All That Matters _S1.mp3,39.14,M
Let These Facts Carry You Forward _S2.mp3,39.07,M
Lights That End Frights _S1.mp3,39.03,M
Let Go!_S2.mp3,38.86,M
Let A Higher Spirit Guide You _S2.mp3,38.83,M
Interview - A Powerful Interview With Vernon Howard _S1.mp3,38.7,M
Let A Higher Spirit Guide You _S1.mp3,38.49,M
How To Win True Inner Control _S2.mp3,38.48,M
How To Escape The Human Jungle _S1.mp3,38.04,M
How To Stop Being A Nervous Wreck _S1.mp3,37.64,M
How To Escape The Human Jungle _S2.mp3,37.52,M
"Interview - No Vernon - Tom B, Jean Gar Reno KOH Radio.mp3",37.41,M
How To Live Without Self Concern _S1.mp3,37.25,M
How To Win True Inner Control _S1.mp3,35.57,M
Interview KNUU 970 Vernon and Ellen D 01-27-82_S1.mp3,35.52,M
How To Live Without Self Concern _S2.mp3,35.42,M
Learn To Hear The True Music _S2.mp3,35.22,M
I Don't Want To Be Afraid _S2.mp3,34.72,M
Interview Vernon and Amy 1983 Insight Program.mp3,34.03,M
Let Higher Thought Make Decisions For You _S2.mp3,33.76,M
Lasting Relief From Burdensome Duties _S1.mp3,33.54,M
Lasting Relief From Burdensome Duties _S2.mp3,31.31,M
How To Meet The Unexpected_S2.mp3,31,M
How to Learn From A New Experience _S2.mp3,30.81,M
Lose Helplessness And Find Real Power_S2.mp3,30.51,M
Interview Vernon Howard and Stella K.mp3,28.14,M
Interview Dick Maurice 05-02-80 Fri_S1 .mp3,25.12,M
How To Sail Smooth Seas_S1.mp3,24.32,M
Let The Mad World Stay Mad_S2.mp3,22.79,M
Interview Dick Maurice 05-02-80 Fri_S2.mp3,17.18,M
Interview KNUU 970 Vernon and Ellen D 01-27-82_S2.mp3,14.84,M
Let Esoteric Truths Work For You_S2.mp3,13.6,M
How To Sail Smooth Seas_S2.mp3,10.42,M
