User Type,Username,Date,Text
,ErnieMcCracken,2013-05-27T20:51Z,Awesome! Thanks eztv. Much appreciated!
,kiasta,2013-05-28T16:32Z,Hmmm these don't seem to be on your website. Is this torrent legit?
,ra3,2013-05-28T18:03Z,"hey ez, any way to get these in 720 mp4?"
,toussen,2013-05-29T04:34Z,"A: 8
V: 6"
,mrkwar,2013-05-29T21:14Z,Just FYI there are some watermarks during some scenes. It's not too obnoxious but I thought I'd let people know. Otherwise the quality is great.
,mrkwar,2013-05-29T21:31Z,"lol ignore my previous comment about the watermark. i made a huge mistake. it's supposed to be there.

http://www.buzzfeed.com/hunterschwarz/there-a-showstealer-pro-trial-version-watermark-all-over-arr"
