User Type,Username,Date,Text
[V],Snowhiter,2013-04-21T16:28Z,Sorry no avi this time. All older programs no longer work as PC has died. Borrowed a laptop to get this up for you...
,peilass,2013-04-21T16:36Z,mp4 is fine for me Snowhiter -- and your efforts to keep total strangers happy is very much appreciated.
,peilass,2013-04-21T17:10Z,"Is there any chance that you will upload The Politician's Husband, which is on BBC2 on Thursday? Hate to be demanding, but on my side of the pond we are so starved for good TV so ...."
,MRMKHS1,2013-04-22T10:12Z,Maraming Salamat Sa Inyo. Napaka Kasiya Siya.
[V],Snowhiter,2013-04-22T19:05Z,@MRMKHS1 Salamat para sa iyong patuloy na suporta ginoo ;)
,vivapirata,2013-05-17T21:50Z,First time seeing Arne Dahl and Sebastian thanks to you Snowhiter. All respect for your time and sharing.
