User Type,Username,Date,Text
,altabari,2013-01-20T20:18Z,Seed plzzz 
,altabari,2013-01-21T21:22Z,"@erik_cantona
Seed the file please =("
,erik_cantona,2013-02-03T17:08Z,"After a few hours I will let them go, but keep in mind that I'll be online for two days."
,erik_cantona,2013-02-04T08:57Z,Link to new torrent: http://thepiratebay.sx/torrent/8100829/Juventus_all_goals_season_2011-12_in_HD
,altabari,2013-02-09T16:26Z,"@erik_cantona
Please dude seed the file for only 3 days !
Let me just download it !
You are that file owner, so come on !"
