Filename,Size,Unit
Torrent downloaded from P2PDL.com.txt,37,B
Torrent downloaded from KAT.ph.txt,41,B
Torrent downloaded from silvertorrent.org.txt,86,B
Torrent downloaded from thepiratebay.se.txt,50,B
tracked_by_h33t_com.txt,23,B
Torrent downloaded from AhaShare.com.txt,58,B
Torrent downloaded from AanMeHoelaJa Torrents on BTScene.eu.txt,71,B
Torrent Downloaded From ExtraTorrent.com.txt,339,B
Escape from Planet Earth (2013) 1080p BD25 2D+3D DTS-HDMA.nfo,745,B
Torrent Downloaded from digtorrent.org.txt,178,B
Torrent Downloaded from limetorrent.txt,47,B
Escape from Planet Earth (2013) 1080p BD25 2D+3D DTS-HDMA/Escape from Planet Earth (2013) 1080p BD25 2D+3D DTS-HDMA.iso,22.69,G
