User Type,Username,Date,Text
,orginal76,2013-03-12T23:25Z,"Hello. Sir, can you give us a new Zaxwerks plugins for After Effects. Thank you."
,lopulchre,2013-03-13T07:29Z,"Tested and working on Windows 7 Ultimate x64, currently seeding.  Thanks for the upload, Ching_Liu and as always, thanks to XForce for quality releases."
,IconDevco,2013-03-19T04:33Z,64x aw fuck come on!
,ncc1864,2013-04-23T16:13Z,"When I run keygen.exe, I get an error message: 'Cannot retrieve MAC address.'"
,Derethior,2013-05-03T16:43Z,Any chance for 32 bit version?
,FranJS12,2013-06-04T01:49Z,Hi. Does it work with Rhinoceros 5?
