User Type,Username,Date,Text
,sppcc6803,2013-05-19T02:26Z,"Creo que me he pasado subiendo el previo y el post en el torrent...

Que la gente va por el 86%"
[V],Nepotu,2013-05-19T02:37Z,"No. Yo creo que has hecho un muy buen trabajo, sppcc6803. Es un poquito grande, es verdad, pero completo, y para quien quiere, hay otras versiones cortas por aqui. Muchisimas gracias por tu gran aporte. Eres un crack."
,shabbamanuk,2013-05-19T23:23Z,"great up..please help seed the brentford game,thanks.

http://thepiratebay.sx/torrent/8491134/League_One_PlayOff_Final_-_Brentford_vs_Yeovil_Town_19.05.2013"
