Filename,Size,Unit
Build a church.odt,24.08,K
important bible codes  glazerson.avi,449.63,M
Israel braces for attack_ Planet X returns_ Maps of future submerged world.avi,205.73,M
JESUS IN BIBLE CODES glazerson.avi,30.73,M
Marriage Supper.pdf,609.98,K
Mashiach in Repentance in bible code Glazerson.avi,183.3,M
May 4 2013 David Hocking - Who Is The Messiah of Israel - end times news update 4-14-13.avi,295.51,M
Meteor in Russia in 5773 in bible code Glazerson.avi,19.44,M
Michael Shermer Decodes the Bible Code.avi,26.13,M
Names Bible Code Illustrated_ Adam to Jesus (10 min).avi,137.97,M
Names Bible Code_ Adam to Jesus (4 min.).avi,28.69,M
NEW BIBLE CODES 2012 - Parts I - II.avi,9.78,K
North Korea threatens missile launch in March 2013_ prophecies_ Bible Code.avi,20.67,M
Nth Korea's KIM JONG bible codes.avi,9.78,K
Obama in bible codes glazerson.avi,112.78,M
OBAMA IS THE ANTICHRIST IN BIBLE CODES BOOK OF DANIEL KJV.avi,101.86,M
Pope Francis in the King James version English Bible Code.avi,7.92,M
President Obama and the Economy in the King James version Bible Code.avi,14.8,M
President Obama_ Second Time' found in Bible Code! John 3 2013.avi,13.39,M
Prophecy in the News_ The Bible Codes Part 2.avi,405.77,M
Prophecy in the News_ The Bible Codes.avi,11.27,M
Rapture - best evidence in the Bible Codes.avi,212.45,M
Secrets of Bible Code Revealed P1.avi,316.85,M
Something Big Coming - Bible Code - NASA - Illuminati.avi,172.7,M
The Atomic Threat of North Korea in bible code Glazerson.avi,15.69,M
The Bible Code Explained - Film 1 - Part 1.avi,38.58,M
The Bible Code Explained - Film 1 - Part 2.avi,38.74,M
The Bible Code Explained - Film 1 - Part 3.avi,39.24,M
The Bible Code Explained - Film 1 - Part 4.avi,38.14,M
The Bible Code Explained - Film 1 - Part 5.avi,24.52,M
The Doctors' strike in Israel in Bible Code 1 Glazerson.avi,178.87,M
The Hebrew Language and Bible Codes - Chuck Missler.avi,199.82,M
The Infinity Bible Code - Second talk given to the Prophesy Club by Al Neal pt.1.avi,334.47,M
The King James version Bible Code and the 2012 U.S. Election_ will President Obama or Romney win_.avi,29.83,M
The State  of Israel  in Bible Code.avi,194.83,M
The Terror Attack in Boston in bible code Glazerson.avi,8.32,M
The Third Temple in the bible codes.avi,74.03,M
the year 2012 in bible codes.avi,6.58,M
The Year 5773 the End in bible code Glazerson.avi,18.96,M
Torah Code 2012.avi,79.5,M
Torrent downloaded from Conspiracyhub.com.txt,47,B
Unlocking The Bible Codes.avi,42.79,M
Will Israel Strike Iran_ Armageddon_ Bible Code.avi,83.65,M
