Filename,Size,Unit
Word of Faith Teachers - Origins_ Errors of Their Teaching 2012.avi,2.27,G
Church of Tares_ Purpose Driven_ Seeker Sensitive_ Church Growth _ New World Order.avi,1.68,G
Xtras/The Holy Spirit/Abigail Miller Sings Scripture KJV.flv,776.31,M
Xtras/SIN-ister Clips/NAZI Checkpoint guards KICK in car door.avi,593.99,M
Xtras/Signs of the Times/6_16_11 Radiation Test Bereford_ S Dakota - 77.0 CPM.avi,367.41,M
HYPOCRITES.avi,302.51,M
How You Can Know You are Saved.avi,239.18,M
The Word of God - Dr Adrian Rogers.avi,230.14,M
Jack Schaap's Fall and The Cult Legacy of Jack Hyles.avi,187.4,M
How to stand for Christianity in College.avi,184.63,M
Xtras/Signs of the Times/Aaron was killed by the govt - Robert Swartz on his sons death.avi,168.1,M
Xtras/The Holy Spirit/Legalism Debunked.flv,148.03,M
Xtras/The Holy Spirit/Paul Washer_ Sunday Schools that create false converts..avi,144.34,M
"Shorts/Ecumenism, False Shepherds and Doctrines of Devils.flv",140.25,M
The Hard Line.avi,138.19,M
The Road to Rome - Jesuits and Mysticism Experience-Based Religion.avi,131.23,M
Xtras/War and Rumors of Wars/Endtime News Updates 1-10-13.flv,120.34,M
Shorts/EPHESIANS 6_12 - UNDENIABLE PROOF.flv,120.07,M
Xtras/The Holy Spirit/Gary Rea- How Beautiful .avi,111.37,M
Xtras/The Holy Spirit/LOVE - 10 Ways To Love.mp4,101.4,M
Shorts/Pastor Arnold Murray Refuted and Exposed - Beware of Shepherds Chapel.avi,100.02,M
"Shorts - False Doctrine, Evil Spirits/Bob Larson  The Exorcism of Brandon and the Spirit of Death.flv",90.34,M
Xtras/Signs of the Times/Dr Royal Raymond Rife Story - The  Portrait of a Genius.avi,87.97,M
Xtras/SIN-ister Clips/Police take Newborn after Mother Refuses Hep B Vaccination.avi,86.81,M
Church Taboo Pt1  False Fire In Church.avi,76.75,M
Church Taboo Pt2  Slain In Spirit Church Catchers.avi,76.69,M
Xtras/The Holy Spirit/CRISTO EN TODA LA BIBLIA - Jesus In Every Book of the Bible.mp4,76.56,M
Xtras/SIN-ister Clips/The Quiet Coup Of America That No One Noticed Or Stood Up Against.avi,71.35,M
Shorts/A Warning to Gods Remnant People and the SDA Church.avi,57.07,M
Xtras/The Holy Spirit/Sackcloth AshesYOM KIPPUR GATES of HEAVENclosed DRAGON casts down The STARS.flv,57.04,M
Xtras/War and Rumors of Wars/Mind Control HAARP mind control used in Iraq.flv,52.99,M
Shorts/For every Christian_ Book of Jude.mp4,52.41,M
Xtras/SIN-ister Clips/Psychiatry  Hidden Influence.flv,48.81,M
Church Taboo Pt3  New Age Modern Church Ektasis Worship.avi,47.83,M
Xtras/Signs of the Times/Facebook Purges Pro-Gun Accounts 12_27_2012.mp4,46.14,M
Shorts/WWIII Will Come to America.flv,44.27,M
"Shorts - False Doctrine, Evil Spirits/The Tactics of Fake Faith Healers Exposed  Must see.flv",43.88,M
Shorts/Microchips Embedded Into Medications - The Big Brother Pill.flv,42.23,M
Shorts/Prescription Drugs Are Responsible For About 75% Of Drug Related Deaths Senator Manchin.flv,38.72,M
Shorts/Wretched  Joseph Prince Doesnt Get It.flv,38.02,M
Xtras/SIN-ister Clips/Pinks Preview_ Strange Sounds_ Sinkholes.avi,36.87,M
Xtras/Signs of the Times/Brain Cell Death _ Magnetic-Field_ Induced DNA Strand Breaks in Brain Cells of the Rat.avi,36.37,M
"Shorts - False Doctrine, Evil Spirits/New HQ Nicki Minaj REPTILIAN DEMON EYES - OTHER ILLUMINATI MUSIC PUPPETS.mp4",35.91,M
Xtras/Signs of the Times/How to Kill_ Control Christians behind the scenes from Ripple Effect.avi,35.88,M
Xtras/The Holy Spirit/Responding to Jesus.flv,34.94,M
Xtras/Signs of the Times/Concerned Citizens uncovers Sewage Sludge policy.mp4,34.49,M
Shorts/Stuff They Dont Want You to Know - Pilgrims Society.flv,31.9,M
Shorts/Messiah's Temple - Mormon or Jewish.flv,30.8,M
Shorts/Sackcloth Ashes As it was in the days of Lot  SODOM GOMORRAH OBAMNATION.flv,29.16,M
Shorts/NDAA Unconstitutional  Federal Judge Bans Obama from indefinitely detaining Americans.flv,28.92,M
"Shorts - False Doctrine, Evil Spirits/Abortion  What Does The Bible Really Say  (Truth #9).flv",27.93,M
Xtras/SIN-ister Clips/New EQ swarms reported at Hierro_ Canary Islands.avi,24.61,M
Xtras/Signs of the Times/Federal Court Rules in Favor of RFID at TX School.avi,21.6,M
Xtras/SIN-ister Clips/RADIATION UPDATE_ Jan. 2_ 2013.avi,19.45,M
Xtras/Signs of the Times/Health Benefits of Aloe Vera.avi,19.13,M
Shorts/Merk Scientist Dr M Hilleman Admitts SV40 AIDS and Cancer in Vaccines.webm,19.01,M
Xtras/The Holy Spirit/Cece Winans- Holy Spirit Come Fill This Place.flv,18.93,M
Xtras/SIN-ister Clips/live together.avi,18.64,M
Xtras/Signs of the Times/Fountains of the Great Deep - Hydroplate Theory - Dr Walt Brown.flv,18.44,M
Shorts/BT Daily  2500 Years of History Foretold - Bible Prophecy   You - Part 11.flv,17.64,M
Xtras/Signs of the Times/1000s of Bluebottle JELLYFISH on Oreti Beach.mp4,17.08,M
Shorts/Scientists Late to Recognize Human and Giant Mammal Coexistence.flv,16.8,M
"Shorts - False Doctrine, Evil Spirits/Oprah Winfrey Host to Antichrist.flv",16.42,M
Shorts/Declassified Docs Reveal Genocide by Aerosols Chemtrails.flv,15.15,M
Xtras/SIN-ister Clips/Man Captures Video Of Strange Explosion In Sky CBS Sacramento 12_30_12.avi,14.91,M
Xtras/The Holy Spirit/Chris Tomlin - Holy is the Lord with lyrics.flv,14.4,M
Xtras/The Holy Spirit/Hillsong - Thank You - Instrumental lyrics.flv,14.11,M
Xtras/The Holy Spirit/Chris Rice - Great is Thy Faithfulness.flv,13.95,M
Xtras/The Holy Spirit/Louie Giglio - Tell Everyone.flv,13.71,M
Shorts/Science Proves Teaching Abstinence Works.flv,13.41,M
Xtras/Signs of the Times/At least 55 KILLED in TWIN BLASTS at Damascus intel compound_ TERRORISTS BLAMED REPORT.mp4,11.9,M
Shorts/Solve this Mystery - changing the mindsets for future events.flv,11.35,M
Shorts/BT Daily  Hope Beyond Abortion.flv,11.31,M
Xtras/War and Rumors of Wars/Police Officer Bodyslams 15 Year Old Girl Outside Club.flv,10.93,M
Shorts/BREAKING - Sheriff Joe Promises a JULY 17th SCORCHER ON Obamas Eligibility.flv,10.48,M
Shorts/Wretched  Christian Doubt vs Defection.flv,10.44,M
Shorts/WorldsLastChancedotcom Response Video 1.flv,10.42,M
Shorts/Wretched  Big Gulps vs Baby Girls - YouTube.flv,10.2,M
Xtras/The Holy Spirit/In Christ Alone - Newsboys.flv,10.17,M
Xtras/SIN-ister Clips/Rebels Dismiss Calls for Peace Talks.flv,10.14,M
Xtras/SIN-ister Clips/Outer Space Looks Like Neurons In A Brain.mp4,10.03,M
Xtras/Signs of the Times/American Planes Spray Plague Infected Fleas   Medicine in 1950 Korean War.flv,9.8,M
Xtras/Martyrs of Today/The world was not worthy of them.mp4,9.54,M
Shorts/Wretched  Carrie Underwood Preaches.flv,8.42,M
Xtras/Signs of the Times/Is This A Base On The Moon.flv,8.3,M
Xtras/SIN-ister Clips/NUCLEAR UPDATE_ Jan. 14_ 2013.avi,7.4,M
Xtras/SIN-ister Clips/Mysterious Booms Rock Arizona.mp4,6.47,M
Shorts/Laying Down Our Weapons - YouTube.flv,6.35,M
Shorts/Wretched  The Atheist Double Standard.flv,6.12,M
"Shorts - False Doctrine, Evil Spirits/Mega Church Pastor  Jim Swilley FORCED Out The Closet by Ex-WIfe.flv",6.07,M
Shorts/Scientists Urge People To Be Prepared For Alien Contact.flv,5.89,M
Xtras/SIN-ister Clips/UFO_ Rio_ Brasil - Why so many UFO sightings in S Amer.avi,5.02,M
Xtras/Martyrs of Today/Underground Food Aid.flv,2.56,M
"Shorts - False Doctrine, Evil Spirits/Pat Robertson Prays to Satan.flv",413.56,K
Info.txt,7.91,K
POtHS - Why We Do What We Do.txt,7.89,K
Torrent downloaded from Conspiracyhub.com.txt,47,B
