User Type,Username,Date,Text
[V],murphy78,2013-03-17T06:00Z,"If anyone wants to install both Office 2013 and Office 2010, you need to use the KMS Server Service from MTK and the script in the link I have in the description for activation. AutoKMS and the default activate option in MTK does not support more than one Office install.

It WILL activate more than one Office, but you have to call all the right activation commands. The script covers it."
,FRID@,2013-03-22T00:29Z,Can i install language pack and still been update to mar2013? THX :D
,slimkhalil,2013-03-22T13:20Z,can u upload 2007 proplus?
,joegi50,2013-03-28T17:43Z,We are just small people with little knowledge. Thanks to professional murphy78 and Pirate Bay to make our lives easier every day.
