User Type,Username,Date,Text
[V],Acesn8s,2013-02-15T07:46Z,"2 channel audio mates encoder fucked up and no way 2 edit torrents here, enjoy anyway :)"
,tyranite,2013-02-15T12:59Z,"A9
V9
thanks, Acesn8s"
,-Rawa-,2013-02-15T18:01Z,Horrible movie i shut it off after 20 min of bad acting and horrible video effects.
,Listed,2013-02-15T18:27Z,storyline?? any evaluation? thanks!
,mcrackin1,2013-02-15T19:29Z,Making movies about WWII this horrible is a disgrace to the soldiers that fought in it.
,michaelmotes,2013-02-15T22:09Z,"Le trailer on rotten tomatoes didn't seem that bad:
http://www.rottentomatoes.com/m/company_of_heroes_2013/trailers/"
,omfgigod,2013-02-15T22:39Z,"tom sizemore and vinnie jones? and then people are suprised when it turns out to be shit? haha thats the most bizarre thing, that people thought it would be good hahha"
,filestok,2013-02-16T01:26Z,This is again movie where 1 americano/russian=50-100 germans...Terrible BS.
,Si-klops,2013-02-16T01:30Z,That asian school girl banner ad makes any of these movies look good
,piratewithalongpenis,2013-02-16T10:06Z,Most ppl don't see adds cuzz they use add blocker
,Suba23,2013-02-16T11:36Z,exactly :) no ads for the next 50 years
,one_out_of_onebillion,2013-02-16T19:37Z,horrible movie
,coulter2,2013-02-16T20:23Z,Yeah I block the asian schoolgirl adds using an extension i found in the chrome webstore
,PS2viciado,2013-02-16T22:48Z,"A9
V9
M7

Great action movie, 80% of the time all you see are germans getting shot, no big room for talks.
The film is indeed based on the game company of heroes(it says in the credits) but doesnt loook any like it. The special effects sometimes can also be kinda meh.

Overall Not a bad movie, if you like action/war movies, this definitely is worth your time."
,neolectric,2013-02-17T06:55Z,"Jesus Conrad, tie your fucking laces!"
,Nonfaith,2013-02-17T08:26Z,If I see one more bag of fuckin' dirt...
,Teslatoon,2013-02-17T09:46Z,Another dumb-shit yank self take on how they like to kill people and blow things up. Soldiers AREN'T hero's. Anyone who kills another person isn't a hero you fucktard yanks. A firefighter is a hero. A paramedic is a hero. Soldiers are nasty cunts who would eat their own young as soon as look at them.
,spzombie,2013-02-17T10:31Z,"Terrible movie, nothing good i can say about it. But thx Acesn8s for you upload, your work is appreciated."
,Phatfish,2013-02-17T12:11Z,"Oh, this is up here on nr.2. I see the top 100 system is working like magic again. DERP"
,Zipitgood2,2013-02-17T15:42Z,Does anyone have the subs for the German parts?
,lanebob13,2013-02-17T15:59Z,PS2viciado is correct in every way. Nice to see a real war movie instead of make up stuff like zero dark thirty
,Judas101,2013-02-17T19:15Z,"This movie was Horrible, I mean bad, worst then bad... inaccurate video game based garbage."
,MailerDaemon0,2013-02-17T23:20Z,"@Teslatoon:

Do you really beleive the shit that comes out of your mouth or do you like saying shit for the sake of saying shit?? 

Said by Teslatoon above - ""Soldiers AREN'T hero's. Anyone who kills another person isn't a hero you fucktard yanks. A firefighter is a hero. A paramedic is a hero. Soldiers are nasty cunts who would eat their own young as soon as look at them"". 

I would guess that since you so carefully left police and law enforcement personnel out of your shortsighted comparison that you would be ok if a Cop shot someone dead that was about to kill you or a loved one.... Glass house meet stone.

The only ""nasty cunt"" that I see posting here is YOU, because for you supposedly coming from an 'enlightened' country like the UK, you sure have one of the most inbred, bigoted and just downright IGNORANT sense of things that I've EVER seen.

People like you make me wonder why soldiers have to potentially sacrifice their lives for your meaningless freedoms and liberties....?

I would LOVE to see you get drafted. I would join happily just to get the opportunity to put a bullet in your head to end the inbreeding...

""Honestly Lt. I dont know HOW he got in my line of fire.... oops, my bad. No keep the medal, its ok, just doing my duty to end mental retardation"".. What? a promotion?? well.. if you insist.... :D :D :D "
,Psythus,2013-02-18T00:15Z,"@MailerDaemon0 

Shut your fucking mouth."
,Psythus,2013-02-18T00:22Z,That was aimed at the wrong person.... sry dude.
,Phatfish,2013-02-18T00:32Z,"@ MailerDaemon0 & Teslatoon:

Get a room for fuck sake... I know you both crave some homo cuddle and anal  mclovin but please do it in private."
,MailerDaemon0,2013-02-18T00:50Z,"@Psythus:

Awwwww poor baby. It seems like I struck a nerve.  I'm sensing a trend here are you from the UK as well??

Anyway, truth hurt's doesn't it.

Oh, I *almost* forgot what with being surrounded by so many mential geniuses....

V:9
A:9
M:5 - Its not the best nor the worst movie out there. 

Its hard to find fault with something when you go in to it with extremey low expectations to begin with.."
,MailerDaemon0,2013-02-18T02:17Z,"""Psythus at 2013-02-18 00:22 CET: 

That was aimed at the wrong person.... sry dude."" 

Ok. Then I retract what I said earlier to you if your comments were not directed at me..."
,Teslatoon,2013-02-18T03:00Z,"@MailerDaemon0

Nice rant buddy.

You got trolled so hard my sides are splitting with the sheer jot of it! BAAHAHAHAHAA 

People like you are too shortsighted to see the forest for the troll...

Btw im not even from the UK you bum licking idiot"
,MailerDaemon0,2013-02-18T03:42Z,"@ Teslatoon

LOL!! Is that all you got? You just prove me right the more you open your mouth..

If you're gonna trash talk someone while wearing your mothers dirty underware you jerked off in to 7 or 8 times and looking at Goatse Pr0n, at least do the person you are talking about the courtesy of using complete sentences and correct grammer will ya?"
,rayzoredge,2013-02-18T05:37Z,thnx
,blazing420,2013-02-18T06:00Z,The.Twilight.Saga.Breaking.Dawn.Part.2.INTERNAL.2012.DVDRip.XviD 
,trobz08,2013-02-18T06:04Z,"@Teslatoon you Sir are wrong.  Firefighters(les-be-honest) are not heros, just to fat or too big of a pussy to be a military member.  Being a member of the greatest military in the world, we have more discipline and professionalism than most any other organization in the world.  We also aren't all infantry grunts, the military has more diversity and technical knowledge than you know.  I have more education and technical knowledge than you could hope to learn in a lifetime.  So to stoop to your ignorant level, we dont eat our own, but I would be glad to eat yours.  Please go fuck yourself you stupid twat."
,PirateHD,2013-02-18T07:36Z,"@trobz08, quoting Henry Kissinger ""Military men are dumb, stupid animals to be used as pawns for foreign policy.” Being in the military doesn't make you anymore of a man or any more intelligent than a firefighter, & neither title makes you a hero. But in the line of duty you can prove yourself and you safe someones life, whether it be on the front lines or from a burning building, then maybe you can being considered a hero. Being in the Military really means the Governemnt owns your ass, your are property of the US, firefighters don't really have that concern.. "
,abcjoyride,2013-02-18T07:58Z, @ you trobz08. How come you managed to learn more than anyone else in a life time in your short short years. 
,Sabrieldrian,2013-02-18T08:01Z,"The courage of a human being making the choice that has no right answer, with a compassionate heart is what makes a hero. Not a job, a title or the piece of land they're were born upon. 

P.S. Movie was awful. Nice quality though."
,trobz08,2013-02-18T08:45Z,"@PirateHD Way to quote something from a man who never had military service.  Also that quote is 37 years old.  i suppose the military hasnt adapted to todays cultural and technological growth hmm?  I may have a contract but the government doesn't own me.  There are dozens of options to end your service without dieing or going to the brig and leaving with a dishonorable.  Failure to adapt, DOS rollbacks, medical, voluntary early seperation so research before you say that.  Every MOS earns you college credits that satisfy a degree except for the basic liberal arts courses.  The military per capita has more personnel with higher education or the pursuit thereof than the civilian workforce.  Seeing as in order to promote higher learning is encouraged and sometimes required in order to do so.  So you are right, the Sergeants to my left and right and even lower ranking with their Bachelors and Masters degrees are ""stupid animals.""  "
,W105N4,2013-02-18T08:55Z,"Tiger on the cover, T34s in the film. All elements of the film are like that.
Waste of time."
,TERMSOFAGREEMENT,2013-02-18T11:49Z,"Scanned clean
V-10
A-10"
,blazer68,2013-02-18T13:39Z,"The cast is great actors from Saving private Ryan and Band of brothers but the movie is horrible the cgi is horrible explosions are so obviously fake that you can't help but laugh every time a bomb or grenade goes off the video quality is a 10 but the movie as a  whole only gets 2/10, avoid !!!!!!!"
,gtreds,2013-02-18T17:37Z,search the whole web for english subtitles but found non.... Anybody??????????
,Funk606,2013-02-19T00:33Z,"@trobz08 Yea ""Being a member of the greatest military in the world"", you should have lerned the lesson Even Alexander the Great, and the Russian lerned, and that your mighty military is lerning now = Stay the fuck out of Afghanistan, you came..u killed alot of people, but the Taliban just camping in Pakistan, and like when the last Russian tank left Afghanistan, the same will happen when the last US plane is leaving Afghanistan, the Taliban will walk in a nice and easy pace from Pakistan and back into Afghanistan, and take control with the Country, that even at the point where u had most troops there, u could at no point say there was control or safe zones,and all the time the ""oh so mighty US military"" been there, they pumped out just as much, if not more heroin = 90% + of the worlds production, i mean if u so mighty and your tech so good, why the fuck could u not win a war in a 3 world country like Afghanistan? Or even stop em from produce of heroin & hash? U need to go back to school, evry damm word out of your mouth is pure propaganda, i dont think u can think one single thought 4 your self, i in no way say what happend on 9/11 was ok, but it just go to show, that no matter how high tech and no matter how many weapons US stockpiling, all it takes is a few box cutters in the wrong hands, and the oh so mighty, yea..we all saw it on TV...the good old saying, the bigger they r,the harder they will fall! So keep saluting, and keep your brain in the ""numb"" state..so u dont c wtf is going on around u! US seem to b the one and only country that cant seem to lern the universal truth, Violence breeds violence!! US got 90 guns for evry 100 people = world record,at the same time, they are 4,5% of the worlds population, but at the same time they got 25% of all the inmates in the world! U got more inmates than China, not per. person, just in general, your country of 300mil. people got more inmates than hole of chine with 1.3billiard people, stop for a sec, and think about those numbers, if your brain can process em, and c that there is something total wrong when ""The Land Of The Free"" got more inmates than all of China, the country that alone got about 20% of the worlds population! How come US with only 4,5% got more inmates?!? I mean u got all those guns, and it seem your solution to problems is to join the army, damm i hope they soon get to a point where they can grow a brain in a tank, and implant in the US army troops, else its lucky most of there shit is ""fire and forget"" lol"
,xboxmodman7369,2013-02-19T07:38Z,"@funk606
Go suck your camels balls you fucking towel head! The BIG problem is our ""sand nigger"" president! If he wasn't related to you mother fuckers we might have a real fight and drop the bomb on your ass! Obama deserves to have his ass deported back to Kenya where the fucking dickhead is from and banned from the USA for life! He is the one who will bring the US down with 4 more years of his bullshit lies! He is a worthless fuck who won the election with 99.9% of nigger's voting for him just because he is a nigger! I hope you niggers pay close attention to what is happening because he doesn't give a fuck about you. You will soon have no medicaid, medicare, food stamps or Obama cell phone! Remember that you niggers voted for him to run America for the next 4 years and I feel sorry for you poor fuckers. The rich will stay rich and the poor will have less than they had 4 years ago. LMFAO"
,Jaymark_prs,2013-02-19T13:56Z,"A/ 9 V/9 

Overall, it's not a bad movie. The few familiar faces make it worth while to watch. Ya gotta love anything with a nazi bad guy! Come on! Woot Woot! 

This is jay, and I approve this message! :P"
,libertaswv,2013-02-19T22:20Z,"Sincere apologies to all for the inane ramblings of my ignorant countryman, ""trobz08""

Please remember that we have our fair share of morons like every other country on earth.

Dunning-Kruger... Confirmation bias... All the usual suspects.

Smart enough to articulate the spoon-fed propaganda in (mostly) complete sentences, but too limited to see beneath the thin veneer of same. He has his frame, and he'll cling to it for dear life all of his remaining days.

In order for a serf to happily accept his lot in life (even to the point of passionately defending those responsible), he has to believe the entire story.... all of it... y'pull on one string, and the narrative unravels. That's why people like him never venture beyond the sanitized, censored, woefully incomplete version of the 'history' of his country that the wealthy have fine-tuned over the last few generations. There's so much that cannot be made to fit the frame, you just have to omit it. 

I digress. The guy genuinely believes the nonsense that he's been taught is true. It's nearly impossible for people like this to hop over to the reality based side of the fence. It's not just a national mythology, the whole lie is tied into his love for his family (even if he educated himself, a rejection of the lie would be tantamount to a rejection of his parents/grandparents, etc), and supports the biases and prejudices his family instilled in him from birth (all of which serve the same narrative, and are the work product of the last umpteen generations of the wealthy class) 

There are tens of millions of this guy. Happy serfs. And enlisted serfs? A robber baron's best friend. The ol' imperialist vanguard. They secure resources for the wealthy class in exchange for pennies and a misty-eyed elevation of their social standing in the eyes of fellow serfs. 

You're not going to change his mind. He HAS to believe the bullshit he's talking. HAS to. I'm all for correcting the record when one can, but don't expect him to ever accept or understand his own exploitation, or his part in the exploitation of others. Opposition to horseshit like his should always include a little pity, imo. Many of these all-day suckers would be great people of their lives had taken place within a system that encouraged something other than self-interest, lies, thievery, aggression, and pettiness.  

Oppose the stupid fucker, but try to remember he's a victim too. 

As for 'xboxmodman7369', well...  stupid is stupid, and there ain't no fixin' that.

-------------------------

Sincere thanks to Acesn8s and all seeders and leechers - Much appreciated. Will seed to at least 20."
,puppyluv,2013-02-19T22:41Z,"When are they going to make one with a happy ending? You know, where the Germans win, and America becomes all white, Jewless, and prosperous-clean-drug and crime free. Dreams of MY father. "
,ACidMaN82,2013-02-20T00:00Z,Get lost puppyluv.
,MailerDaemon0,2013-02-20T04:08Z,"@xboxmodman7369: You sure you dont have this movie confused with Django Unchained?

I ask because outside of your nonsensical rant above, Django Unchained is the only other place I've recently seen the word 'nigger' used with so much passion.....and so many times in a single paragraph..

@Puppyluv: Aint gonna happen, the time for that has long come and gone..
"
,ziffel323,2013-02-21T00:06Z,Thank you all for the entertainment. Haven't seen this much juvenile idiocy since I was in grade school.
,stinki,2013-02-22T23:02Z,"not all americans are stupid pieces of shit like this xboxmodman, who, as a fellow american, i'd like to tell to go fuck himself to death. piece of SHIT. head full of total SHIT, and so proud of it. disgusting.

it's natural for the whole world to hate america at this point. for a brief period, america had a true humanitarian high-ground, but that's long, long, long gone and barely a flash in the pan to begin with. we get our dirty hands involved in everything.

as an outsider it is natural to base your conceptions on your limited knowledge...i'm a documentary nerd, and when i watch something like ""the death of yugoslavia"", it makes it hard not to have negative feelings about serbians. knowing what israel does to palestineans, it makes it hard not to write off israeli's as inhuman monsters. but it's not true. people are not monolithic.

some americans actually care about how we fuck up the entire world. 

obama is probably the best president the u.s. has had since FDR, but he's still not as forward thinking as i feel this country soon will be. the cocky imperialist american attitude is so tired and stupid. 

its not totally evident to outsiders yet, or even to the usa itself, but i think there's a swelling feeling of shame and humility in the USA (that stuff republicans insist we should never feel -- fuck them). romney wrote a fucking ""book"" called ""no apologies"", what a child. a lot of americans know damn well we owe quite a few people and countries apologies.






"
,Kaenthas,2013-03-01T16:51Z,"For your own good and health dont watch this.
But seriously, this movie is by far the worst war film i've ever watched..."
,injun_mojo,2013-03-02T10:07Z,"a9
v9

m----holy crap. the saddest thing is this is prolly the best movie I've seen in weeks. and id be generous in giving this a 3 :("
,HalfBlind,2013-03-14T06:34Z,"""Company.Of.Heroes.2013.BDRiP.AC3-5.1.XviD-AXED""
""Channel(s): 2 channels""
NOTE this torrent is 2.0 stereo audio, not 5.1 as the title make u think. In a few short parts they speak German, text/sub NOT includeded in this torrent for that."
,NapalmZ,2013-03-15T09:22Z,"a hero is a personal thing. it has nothing to do with employment. 

military is a bad and dangerous job with no hazard pay. for that i respect those who join ANY military and even more for ones who fight for freedom without pay. those who badmouth such people should be drafted and put on the front lines.

no, the amarican military is not anywhere close to the best military in the world. there are better quality of soldiers in many 3rd world countries. we have technology(maybe 5th or worse), numbers(korea and china each have us beat by at least 10:1), and quality of soldier(1v1 in standard combat of standard soldier{no sf} most of asia, israel, canada{yes, they would kick the crap out of an american}, and probably a dozen others have america beat).

so what does america have? politics and the international bank of china.

the war in the middle east is based in the same principal as was attempted be both the english and the russians before, a forward staging point for war and oil monopolization... yes, the more bases we have overseas the more of an ability to both invade and conquer. 

sad to say but korea and most of the middle east see this truth but the idiots of the world are blind. 

not to sound as a supporter of ""terrorists"" but the koran actually states that a muslim must kill it's oppressor. so their religion requires them to kill us so long as we continue to oppress them. if we backed off and made a public apology in the name of allah they would not be allowed to kill us.(doing so would not only damn them, but also make cause for internal punishment)

russia lost and so will america. peace will only come when they unite to drive out the common enemy. foreigners and jews. 



so, let's just sit back and enjoy a crappy movie."
,NapalmZ,2013-03-15T09:51Z,"@stink

i almost agreed with you, until you dissed republicans and supported obama. 

dems and repubs are the exact same, their differences are a farce to keep one side blaming the other for america's problems. you seem intelligent so i will let you in on a secret, the only change obama brought in the fastest debt hike in us history in the shortest time except for the great depression. that and a good tan so he could win the black vote. romney, obama, both clintons, kerry, both bushes, and every other schmuck that has ran or tried to run this country for the last 75 years has done nothing but fuck up, lie, and cheat. 

look at your choices:

republicans want to give you more practical freedoms while taking away rights based on religious principals because god knows what's best for you(god made adam then eve then the m4). 

democrats want to take away practical freedoms because they know what's best for you while giving you government handouts and promoting some kind of socialism(everyone is equal so long as they are not rich).

both sides promote baby killing while using it as a weapon to attack the other(automatic guns and abortions). there is no difference, neither santa's twin(god) nor another man(president) should be allowed to control me. 

of coarse im a nihilist and an atheist. 

i dont give a shit what you do or what you buy. you should be allowed to distill spirits, grow pot, own 50 ak47's with 100rd drum mags, and be a proud parent at your sons gay marriage. but neither dems nor repubs will let us do as we want. "
,StrayBulletx,2013-03-26T22:27Z,Cinavia protected. Won't play through on PS3.
,Ronye,2013-03-30T01:24Z,"Who the HELL did the research here?? good movie,but some shit r completley wrong.
F.ex. first encounter...germans didnt have russian su100(the tankdestroyer) on the west front,or brittish centurion mk1(the tanks in the tankcompany).
Desent movie,but FFS! moviemakers,do some research!"
