User Type,Username,Date,Text
,fjadde,2013-01-26T14:14Z,Grymt Mannen!! Keep up the good work..
,winiwini,2013-01-26T15:35Z,"Tackar, ja det är tur att jag började gräva i dom gamla VHS'erna. Det gömmer sig en hel del där."
,fjadde,2013-01-26T16:39Z,"Absolut,Det är en musikskatt du har.Det kommer förmodligen  aldrig att sändas i repris igen.
Tack igen!!"
,fjadde,2013-01-26T20:55Z,Tjena! om du har tid skulle det vara kanon om du kunde göra en DVD med Cornelis den i vitabergsparken som är AVI fil.Den funkar i mediaplayer men när jag bränner ut det på dvd-skiva så är det ljud men ingen bild.
