Filename,Size,Unit
"cd3/03 Rosalita (Come Out Tonight) (Live In Oakland, Ca 21-10-1984).flac",101.22,M
"cd2/12 Growin' Up (Live In Oakland, Ca 21-10-1984).flac",74.32,M
"cd3/04 Jungleland (Live In Oakland, Ca 21-10-1984).flac",72.48,M
"cd1/11 Glory Days (Live In Oakland, Ca 21-10-1984).flac",68.79,M
"cd1/12 The Promised Land (Live In Oakland, Ca 21-10-1984).flac",62.18,M
"cd3/13 Do You Love Me  - Twist & Shout (Live In Oakland, Ca 21-10-1984).flac",53.32,M
"cd2/07 Cadillac Ranch (Live In Oakland, Ca 21-10-1984).flac",49.88,M
"cd2/03 Thunder Road (Live In Oakland, Ca 21-10-1984).flac",48.98,M
"cd3/02 Racing In The Street (Live In Oakland, Ca 21-10-1984).flac",48.83,M
"cd3/11 Travelin' Band - Devil With A Blue Dress On (Live In Oakland, Ca 21-10-1984).flac",44.29,M
"cd2/01 Point Blank (Live In Oakland, Ca 21-10-1984).flac",43.5,M
"cd1/03 Out In The Street (Live In Oakland, Ca 21-10-1984).flac",43.04,M
"cd1/09 Prove It All Night (Live In Oakland, Ca 21-10-1984).flac",42.08,M
"cd1/13 My Hometown (Live In Oakland, Ca 21-10-1984).flac",41.56,M
"cd2/05 Dancing In The Dark (Live In Oakland, Ca 21-10-1984).flac",41.4,M
"cd1/06 Reason To Believe (Live In Oakland, Ca 21-10-1984).flac",40.01,M
"cd2/02 Badlands (Live In Oakland, Ca 21-10-1984).flac",39.34,M
"cd1/04 Atlantic City (Live In Oakland, Ca 21-10-1984).flac",38.45,M
"cd1/01 Born In The U.S.A. (Live In Oakland, Ca 21-10-1984).flac",36.62,M
"cd2/04 Cover Me (Live In Oakland, Ca 21-10-1984).flac",36.19,M
"cd1/10 Darlington County (Live In Oakland, Ca 21-10-1984).flac",35.92,M
"cd3/06 Born To Run (Live In Oakland, Ca 21-10-1984).flac",34.94,M
"cd3/12 Twist & Shout (Live In Oakland, Ca 21-10-1984).flac",33.62,M
"cd1/05 Johnny 99 (Live In Oakland, Ca 21-10-1984).flac",33.15,M
"cd3/01 Bobby Jean (Live In Oakland, Ca 21-10-1984).flac",30.88,M
"cd2/11 Pink Cadillac (Live In Oakland, Ca 21-10-1984).flac",30.66,M
"cd2/06 Hungry Heart (Live In Oakland, Ca 21-10-1984).flac",30.39,M
"cd2/08 Downbound Train (Live In Oakland, Ca 21-10-1984).flac",27.9,M
"cd1/08 State Trooper (Live In Oakland, Ca 21-10-1984).flac",26.03,M
"cd2/10 Story Garden Of Eden (Live In Oakland, Ca 21-10-1984).flac",25.89,M
"cd1/02 Who'll Stop The Rain (Live In Oakland, Ca 21-10-1984).flac",24.57,M
"cd3/05 Follow That Dream (Live In Oakland, Ca 21-10-1984).flac",22.95,M
"cd1/07 Mansion On The Hill (Live In Oakland, Ca 21-10-1984).flac",20.25,M
"cd2/09 I'm On Fire (Live In Oakland, Ca 21-10-1984).flac",19.79,M
"cd3/07 Devil With A Blue Dress On (Live In Oakland, Ca 21-10-1984).flac",10.73,M
"cd3/09 C C Rider (Live In Oakland, Ca 21-10-1984).flac",8.94,M
"cd3/08 Good Golly Miss Molly (Live In Oakland, Ca 21-10-1984).flac",4.65,M
"cd3/10 Jenny Take A Ride (Live In Oakland, Ca 21-10-1984).flac",3.74,M
_artwork_1980_19841021_back.jpg,626.96,K
_artwork_1980_19841021_front.jpg,465.33,K
