Filename,Size,Unit
Shorts/Population and Genetics -  Genesis Wk_ Ep 20_ S 2.avi,1.49,G
Alien Intrusion_ UFOs and the Evolution Connection.avi,1.24,G
UFO Encounters Alien Beings.avi,872.54,M
Greg Bishop - Project Beta.avi,746.61,M
Secret UFO NASA Transmissions.avi,634.33,M
Ex-Satanist_ Illuminati Member Exposes UFO Alien Deception.avi,357.1,M
Aliens Closer Than We Think.avi,192.07,M
Xtras/SIN-ister Clips/UFO Sightings Compilation Video - Weird Weekend  2012.avi,180.77,M
Xtras/SIN-ister Clips/the starchild skull is alien_ newest DNA results 3-6-12.avi,156.89,M
Shorts/My rant to the truth movement.wmv,140.42,M
Shorts/Illuminati Disaster Preditions _Past_ Present.mp4,125.06,M
Shorts/Huge Pillars Of Light Near Town Of Palotina Brazil 12-17-12.flv,118.25,M
ALIEN AGENDA - Guest Aaron Judkins.avi,89.66,M
Xtras/The Holy Spirit/The Hal Lindsey Report - GODs Chosen People - ISRAEL .flv,74.62,M
Xtras/Signs of the Times/Aint Got Time For That.flv,73.66,M
Shorts/Bob Larson_ Exorcism of a Voodoo Spirit.avi,70.88,M
Shorts/Bill Hicks_ George Carlin_ The Big Electron - Whom do you serve.avi,57.22,M
Shorts/Alien Agendas.flv,56.14,M
Shorts/Sheilaaliens UFO Compilation 2010 - 2012 - Tucson AZ.mp4,53.84,M
Shorts/Robot Restaurant in Harbin - North East China.avi,49.89,M
Shorts/Strange Daytime UFO - Tucson AZ - 2012.mp4,48.74,M
Xtras/SIN-ister Clips/Wretched Have a Hobby Lobby Christmas.mp4,47.67,M
Xtras/SIN-ister Clips/Vatican Deception As in the Days of Noah PT3.avi,47.32,M
Shorts/Rockstars of Scientism - Part 1 - Brian Cox_s Orwellian Conclusion.flv,46.06,M
Shorts/ALEX JONES MOCKS JESUS CHRIST WITH FRIENDS.avi,44.58,M
Xtras/SIN-ister Clips/The Media LIES Occupy Dallas NO Arrests PROOF.flv,42.02,M
Xtras/War and Rumors of Wars/Reduce Violent Crime by Issuing More Concealed Carry Permits.mp4,38.4,M
Xtras/The Holy Spirit/The Distorted Mirror - Fisher of Men.flv,37.25,M
Xtras/The Holy Spirit/The Meaning And Purpose Of The Rapture Event.flv,37.12,M
Xtras/Signs of the Times/Gulf Oil Spill - Biloxi Dome.flv,36.99,M
Xtras/Signs of the Times/FUKUSHIMA UPDATE  10-5-12.flv,36.45,M
Shorts/Brain Cell Death _ Magnetic-Field_ Induced DNA Strand Breaks in Brain Cells of the Rat.avi,36.37,M
Xtras/Signs of the Times/Debunk This - NWO.flv,33.16,M
Shorts/Fukushima Japan authorized to sell beef products seaweed etc in UK 10-22-12.flv,31.81,M
Xtras/SIN-ister Clips/IN THE BEGINNING.avi,31.43,M
Xtras/The Holy Spirit/I can only imagine 2.flv,28.22,M
Xtras/The Holy Spirit/Casting Crowns - East to West.flv,26.66,M
Xtras/SIN-ister Clips/THE NEED.avi,26.56,M
Xtras/SIN-ister Clips/Torture Tape Rage  Thousands protest Georgian prison horror.flv,25.17,M
Shorts/Wake Up Citizens The New World Order is Coming.mp4,25.06,M
Xtras/The Holy Spirit/Thats My King Dr SM Lockridge - OFFICIAL2.flv,24.81,M
Xtras/SIN-ister Clips/What is Repentance  A Biblical Definition - YouTube.mp4,24.15,M
Xtras/SIN-ister Clips/UN Seeking New Global Tax for new global govt.flv,23.23,M
Xtras/Signs of the Times/Is Mars the govt behind the nuclear industry.flv,22.59,M
Xtras/War and Rumors of Wars/Reminder Must watch - Kitty Werthmann Interview-History repeat itself.mp4,22.43,M
Xtras/Signs of the Times/Hamas Wont Let Foreign Nationals Exit Gaza 11-17-12.avi,21.88,M
Xtras/The Holy Spirit/Holy God - Brian Doerksen .flv,19.66,M
Xtras/The Holy Spirit/The Crucifixion A Medical Perspective.flv,19.13,M
Xtras/Signs of the Times/Drought Hitting Home - Mississippi River Closing.flv,19.13,M
Xtras/Signs of the Times/live together.avi,18.64,M
Xtras/Martyrs of Today/Stand Up For Christ.mp4,18.58,M
Xtras/SIN-ister Clips/Arab Spring_.flv,18.16,M
Shorts/The UFO Is Still Theree By The Sun.flv,17.79,M
Xtras/Signs of the Times/The Coming Economic Implosion Is a Set-Up.flv,17.12,M
Xtras/SIN-ister Clips/William Copper - Excerpt from the Mystery Babylon Series.flv,16.88,M
Xtras/Martyrs of Today/The Great Suffering Of The Underground Church In North Korea.flv,15.92,M
Shorts/The Nazis Found Atlantis With All Its Evil Technological Booty.flv,15.57,M
Xtras/Signs of the Times/HUMAN HYBRIDS JUST AS THE DAYS OF NOAH - MAINSTREAM.mp4,15.27,M
Shorts/UFO seen over Denver CO Skies on local News 11-9-12.flv,15.25,M
Xtras/The Holy Spirit/The Current Economic Situation by David Wilkerson.flv,14.71,M
Shorts/NASA  600 Mysteries in the Night Sky - Oct 2011.flv,14.17,M
Xtras/The Holy Spirit/Hillsong - Oceans Will Part.flv,13.5,M
Xtras/Signs of the Times/Generic Lipitor Drugs Contain Glass Particles.flv,12.95,M
Xtras/SIN-ister Clips/The Mark of the Beast.flv,12.2,M
Xtras/The Holy Spirit/Jeremy Camp - I Still Believe.flv,12.12,M
Xtras/War and Rumors of Wars/POLICE STATE - Cops Arrest Man For Being Naked In His Own House.flv,12.12,M
Shorts/Rubber Vagina Mushroom Mystery - Town Baffled Over Old Used Fleshlike Plant In Woods.flv,11.98,M
Shorts/Multiple Strange UFOs Above Fukushima.flv,11.73,M
Shorts/ILLUMINATI The Blue Beam Project Top Secret 1.flv,11.11,M
Xtras/The Holy Spirit/Indescribable Chris Tomlin .flv,10.86,M
Shorts/UFO Over Kentucky   Flying Into A Volcano In Mexico.flv,10.25,M
Shorts/NASA   Alien Spacecraft   Moon Ruins.flv,10.17,M
Xtras/SIN-ister Clips/Video  Freak tornadoes tear across Poland.flv,9.74,M
Xtras/The Holy Spirit/Holy holy holy.flv,8.32,M
Shorts/Image of the Beast Technology   2Pac Returns Hologram CNN 4-16-12.flv,7.02,M
Shorts/Hologram Tour Guide Wows Travelers.flv,6.55,M
Shorts/Vision  Full Armor Required The evil day approaches  are you ready.flv,5.57,M
Shorts/Mars Photos.flv,4.26,M
Xtras/Signs of the Times/Bill Clinton admits Sec of State Hillary Clinton talks to the Dead 10-23-12.flv,4.18,M
Xtras/Signs of the Times/Before The Last Depression by David Wilkerson.mp4,4.14,M
Xtras/Signs of the Times/Canadian cop tases kid in face.flv,3.47,M
Xtras/The Holy Spirit/The Three Angels Messages The Second Angel.flv,3.43,M
Alien Intrusion2.jpg,80.47,K
Alien Intrusion1jpg.jpg,47.82,K
POtHS - Why We Do What We Do.txt,7.89,K
Info.txt,6.14,K
Torrent downloaded from Conspiracyhub.com.txt,47,B
