User Type,Username,Date,Text
[V],HeroMaster,2013-03-18T18:07Z,Skidrow did what we throught they will do hahahahhahaha. Still the same they could do that more faster next time.
,SuperFulcrum,2013-03-18T18:09Z,is SimCity gonna come out in next month or two or should i just quit expecting it and it is uncrackable
,SuperFulcrum,2013-03-18T22:33Z,"yea thx for response,i started less expecting it because extremezones torrent was:

Balldenn ok, i'm glad i will release it on 2015 :d

...so yes thx again,lets hope it will come out soon as possible"
