User Type,Username,Date,Text
,Ziggy2by2,2013-04-11T16:58Z,Latest version to date :)
,stalks,2013-04-11T19:23Z,I'm not surprised to see these on here. I don't see any reason to spend $250+ for these guides.
,stalks,2013-04-11T19:36Z,"These guides are modified to add advertisements for other websites into the Options page.

Whilst that in itself isn't really a bad thing, I get paranoid as to what else may have been changed."
,Ziggy2by2,2013-04-14T16:48Z,where do you see advertisments?
,stalks,2013-04-14T20:58Z,These marked areas don't exist in the official guide: http://i.imgur.com/QXnKLVY.png
