Filename,Size,Unit
De Marathon (2012) X264 HE-AAC DVDRip-NLU002/De Marathon (2012) X264 HE-AAC DVDRip-NLU002.mp4,1.37,G
De Marathon (2012) X264 HE-AAC DVDRip-NLU002/De Marathon (2012) X264 HE-AAC DVDRip-NLU002.sub,10.11,M
De Marathon (2012) X264 HE-AAC DVDRip-NLU002/De Marathon (2012) X264 HE-AAC DVDRip-NLU002.idx,107.25,K
De Marathon (2012) PAL DD5.1 Eng NL Subs DVDR-NLU002.nfo,4.97,K
Torrent Downloaded From ExtraTorrent.com.txt,353,B
Torrent Downloaded from digtorrent.org.txt,184,B
Torrent downloaded from silvertorrent.org.txt,86,B
Torrent downloaded from AanMeHoelaJa Torrents on BTScene.eu.txt,71,B
Torrent downloaded from AhaShare.com.txt,58,B
Torrent Downloaded from limetorrent.txt,50,B
Torrent downloaded from thepiratebay.se.txt,50,B
Torrent Downloaded From BTScene.eu.txt,45,B
Torrent downloaded from KAT.ph.txt,41,B
Torrent downloaded from P2PDL.com.txt,37,B
tracked_by_h33t_com.txt,23,B
