User Type,Username,Date,Text
,js99912,2013-03-29T02:02Z,"Quick update already here:
http://thepiratebay.sx/torrent/8313168"
,js99912,2013-03-29T02:23Z,"mod, kill this plz..  thank you
-JS"
,js99912,2013-03-29T04:53Z,"To reset google play, use ES file explorr, go UP to root folder, clcik the data folder, click the system folder.

Hold down the left click on accounts.db, choose delete.

Restart BlueStart by right-clicking the sytem tray icon, and choose restart.

Open GMAIL, add your google account!

Enjoy!
-JS"
