Filename,Size,Unit
Northern Star/04 I Turn To You.m4a,41.4,M
Northern Star/11 Closer.m4a,40.8,M
Northern Star/07 Why.m4a,36.67,M
Northern Star/06 Never Be The Same Again.m4a,36.01,M
Northern Star/02 Northern Star.m4a,34.43,M
Reason/01 Here It Comes Again.m4a,34.14,M
This Time/03 Protected.m4a,33.2,M
Northern Star/12 Feel The Sun.m4a,32.88,M
The Sea/09 The Sea.m4a,32.79,M
Northern Star/14 I Turn To You (Hex Hector Radio M.m4a,32.65,M
"Reason/12 Yeh, Yeh, Yeh.m4a",31.7,M
This Time/10 Immune.m4a,31.31,M
Beautiful Intentions/12 You'll Get Yours.m4a,31.1,M
Northern Star/13 Never Be The Same Again (Single M.m4a,30.84,M
Reason/10 Home.m4a,30.8,M
The Sea/03 Get Out Of Here.m4a,30.53,M
The Sea/08 All About You.m4a,30.33,M
The Sea/07 Drown.m4a,30.32,M
Northern Star/05 If That Were Me.m4a,30.02,M
Beautiful Intentions/10 Here And Now.m4a,29.96,M
The Sea/11 One By One.m4a,29.92,M
The Sea/02 Burn.m4a,29.83,M
Beautiful Intentions/08 Don't Need This.m4a,29.82,M
Beautiful Intentions/03 Better Alone.m4a,29.62,M
Beautiful Intentions/01 Beautiful Intentions.m4a,29.46,M
Beautiful Intentions/13 First Day Of My Life.m4a,28.62,M
Reason/04 On The Horizon.m4a,28.57,M
Northern Star/03 Goin' Down.m4a,27.88,M
This Time/07 Your Mistake.m4a,27.64,M
Reason/05 Positively Somewhere.m4a,27.49,M
The Sea/10 Beautiful Mind.m4a,27.34,M
Northern Star/09 Ga Ga.m4a,27.11,M
The Sea/01 Think About It.m4a,27.09,M
Beautiful Intentions/07 Good Girl.m4a,26.88,M
Beautiful Intentions/04 Last Night On Earth.m4a,26.62,M
This Time/01 Understand.m4a,26.55,M
This Time/12 Out Of Time.m4a,26.22,M
Reason/11 Let's Love.m4a,26.2,M
This Time/06 Forever Again.m4a,26.09,M
Reason/03 Lose Myself In You.m4a,26.03,M
Northern Star/01 Go!.m4a,25.97,M
Reason/02 Reason.m4a,25.92,M
The Sea/05 Stupid Game.m4a,25.74,M
The Sea/12 Rock Me.m4a,25.64,M
This Time/11 May Your Heart.m4a,25.59,M
Beautiful Intentions/05 You Will See.m4a,25.57,M
The Sea/04 Weak.m4a,25.31,M
Reason/09 Water.m4a,25.07,M
Reason/06 Melt.m4a,25.05,M
Reason/08 Soul Boy.m4a,25.05,M
Beautiful Intentions/02 Next Best Superstar.m4a,24.81,M
Beautiful Intentions/06 Never Say Never.m4a,24.63,M
This Time/04 This Time.m4a,24.46,M
Northern Star/10 Be The One.m4a,24.21,M
This Time/09 Don't Let Me Go (feat. Adam Argyl.m4a,24.13,M
Reason/07 Do I.m4a,23.96,M
The Sea/06 Let There Be Love.m4a,23.86,M
This Time/13 I Want Candy.m4a,23.7,M
This Time/05 Carolyna.m4a,23.41,M
Beautiful Intentions/11 Take Your Pleasure.m4a,23.21,M
Beautiful Intentions/09 Little Piece Of Me.m4a,22.93,M
This Time/08 The Moment You Believe.m4a,22.75,M
This Time/02 What If I Stay.m4a,17.64,M
Northern Star/08 Suddenly Monday.m4a,16.77,M
