User Type,Username,Date,Text
,TheBoyWhoLived,2013-03-25T04:07Z,"OMG! WHY DID CARL HAD TO DIE?

*Try not to cry. Lie down. Crie a lot*"
,thorkis420,2013-03-25T04:15Z,"BS locked video, have to do surveys to maybe watch, take his green skull away for doin this shit!"
,ghostinthesystem,2013-03-25T04:28Z,fake or legit?
,kevbap,2013-03-25T04:28Z,good work as ever ettv..thanks bud.
,JayHorror,2013-03-25T04:35Z,Thanks for the spoiler The boy who should die.
,drag,2013-03-25T04:39Z,*SPOLER ALERT* DO NOT READ COMMENTS... some ass munch may have just spoiled something for me. Uploader please delete his comment.
,ronmann,2013-03-25T04:54Z,"Legit as always ignore the ra-tard ettv ftw 
btw Beth is fiiiinnnneee
"
,beemer2012,2013-03-25T04:54Z,Some good changes from the comic books.
,ram0nd0,2013-03-25T04:55Z,"Legit. 
So many liars ... carl doesnt die, the video isnt locked."
,Supnigga,2013-03-25T04:57Z,wow gay carl died
,ronmann,2013-03-25T04:57Z,"Regarding spoilers in the comments, they are always just BS, trolls who haven't even watched yet."
,trixrabbit13,2013-03-25T04:59Z,OMG! WHY DID CARL HAD TO DIE?   TheBoyWhoLived ... if you really just left that spoiler  you truly are a worthless piece of shit
,trixrabbit13,2013-03-25T05:00Z,OMG THEY ALL DIE IN THIS EP !!  A ZOMBIE FALLS ON A NUKE AND IT EXPLODES KILLING EVERYONE !!  WHY DID THEY ALL HAVE TO DIE !!  =*(
,trixrabbit13,2013-03-25T05:06Z,omg they all die in this Ep !! A zombie slaps its dick on nuke and it explodes killing them all .. WHY!!!
,trixrabbit13,2013-03-25T05:20Z,omg carl dies when the video becomes password locked and then all the posters that make fake spoilers unleash super buttsex aids all over the planet making super gay people that make fake ass posts on TPB ... WHY!!!
,trixrabbit13,2013-03-25T05:24Z,wow Supnigga is gay
,IIIGhostXIII,2013-03-25T05:25Z,"Thanks Ettv 
good work .....

but Carl OMG"
,IIIGhostXIII,2013-03-25T05:26Z,"Thanks Ettv 
good work .....

but Carl OMG."
,fytchx,2013-03-25T05:27Z,I'm stuck on connecting to peers :(
,psstboo,2013-03-25T05:29Z,"NO ONE LISTEN TO TheBoyWhoLived!
he's a troll ive seen this comment copyed and pasted on last weeks episode and the one before that. he's not spoiling anything, just being a duche."
,Dunbar4189,2013-03-25T05:30Z,yeah thanks ahole for giving info for the people who havent seen it who show's dumb ass people like you these kind of websites 
[V],rr-ne,2013-03-25T05:34Z,uploaders cant delete comments
,kattgamble,2013-03-25T05:46Z,"nothing worse than having the ending spoiled, but I have downloaded a lot from ettv and appreciate you.  You have been great, thank you a million times for the great job you do."
,trixrabbit13,2013-03-25T05:51Z,love how everyone jumps on the trend band wagon  ...  prob all  lil suburban white kids that are gangstas to.. worthless fucktards 
,stijr,2013-03-25T06:43Z,PLEASE UPLOAD SMALL SIZED FILES OF THIS EPISODE. THANKS 
,EFCFrost,2013-03-25T10:42Z,Carl doesn't die. Theboywholived wrote the exact same comment last week. It's just some retard trying to get a rise out of you and it seems to be working
,lizardomanson,2013-03-25T12:18Z,Too many dumbshit retards writing fakes reviews or endings. They should be banned from the net. To waste time doing such thing you may have pure shit in the brain instead of neurons.
,titica12,2013-03-25T17:05Z,EU QUERO DAR O CÚ !
,Frankenhedgie,2013-03-25T17:56Z,"Best thing is, just don't feed the trolls.  After all, if you ban them they've gotten the attention they crave and they're back for more the next day under a new id."
,sah2186,2013-03-26T23:56Z,Whoever the fuck is who uploaded the password protected shit should get aids and cancer. The only ones who password protect files are assholes. FUCK ETTV
,sah2186,2013-03-26T23:57Z,At least put the fact that it is password protected in the description you dumb piece of shit.
,sah2186,2013-03-26T23:58Z,Remove the green skull from this retard's name. FUCK HIM.
