User Type,Username,Date,Text
,Mr_Heisenberg,2013-02-01T21:49Z,http://www.imdb.com/title/tt2053425/?ref_=sr_1
,Amafule10,2013-02-01T22:46Z,"thanks. so many movies, so little time"
,ButchCoolidge666,2013-02-02T11:06Z,subtitles?
,lmsff,2013-02-02T13:31Z,"Obrigado pelo upload, EZ.
Sempre a melhor qualidade."
,nadianaz,2013-02-03T04:18Z,"these subs work great http://v2.subscene.com/forums/p/249326/737625.aspx#737625 :)

thanks ez!"
,pirate_share_the_love,2013-02-15T04:37Z,Thanks for this upload and thank you nadianaz for the subtitle recommendation. 
,hevehitta,2013-03-16T06:53Z,Terrible subtitles you suck just like the rest!
,noisyland,2013-03-20T12:54Z,Thanks. new sub file at http://subscene.com/subtitles/de-rouille-et-dos/english/691468
,BitchPhD,2013-04-01T21:51Z,No subtitles.  Great.
,elen81,2013-04-24T22:17Z,picture quality not good enough
