User Type,Username,Date,Text
,VisciusK,2013-04-29T15:49Z,Esto es español latino o Castellano (españa)
[T],inakivigo,2013-05-01T13:47Z,"Es Español de España
Cuando es Latino, ya pongo Latino"
[T],inakivigo,2013-05-01T13:50Z,"Ejemplo: la peli de ""La caperucita roja 2""


http://thepiratebay.sx/torrent/8402139/La_caperucita_roja_2%5B3D-SBS%5D%5Blatino%5D%5Binaki%5D"
,ChoPraTs,2013-05-21T22:42Z,"Gracias inakivigo. No sé si estás al corriente pero, lamentablemente, hay muchas televisiones que no reproducen correctamente los vídeos en 3D si éstos tienen una resolución de 720x400 o inferior. Y resulta que la mayoría de los que has compartido creo que tienen esa resolución precisamente... Es una lástima. Hay otros que has compartido, que tienen una resolución de 852x480 o superior y se ven estupendamente. Si algún día vuelves a resubirlos, estaría genial que fuese en esta resolución, al ser más alta creo que es suficiente para todas las TV y además tiene la ventaja de que los archivos ocupan bastante menos espacio en el disco duro que si fuesen en HD (1080p o 720p). En cualquier caso, gracias."
