User Type,Username,Date,Text
,GyclopeN,2013-06-15T17:06Z,peite mou an to painete kanonika...!
,kostikas11,2013-06-15T18:51Z,εγω το παιρνω κανονικα χαχαχα ΕΚΑΝΑ ΠΡΩΤΟΣ σχολιο πριν τον PHDIKOYLAS ΕΤΣΙΙΙΙΙΙΙΙΙΙΙΙΙΙΙΙΙΙΙΙΙΙΙΙΙΙΙΙΙΙΙ ΧΑΧΑΧΑΧΑΧΑ
,katrinapapi,2013-06-15T20:11Z,ola o.k.....xerei kaneis an tha anevei suleiman neo epeisodio???to 92?
,adabali,2013-06-16T00:25Z,"Ρε παιδιά, πού είναι ο Πηδίκουλας; Έπαθε τίποτα απ' το πολύ πήδημα;"
,adabali,2013-06-16T00:47Z,"IF YOU WATCH TURKISH SERIALS, MAY YOUR VCR BURNS. YOU SHOULD DEMONSTRATE WITH SULEIMAN IN ISTANBUL, PISS AND SHIT INTO TURKISH TOILETS AND EAT KEBAP INSTEAD OF GREEK MOUSAKA"
,GyclopeN,2013-06-16T01:47Z,"EDAKSEI EXW PETHANEI STO GELIO ADABALI,XAXAXAXAXAXAXXXAXAXAXAXXAXAXA"
,GyclopeN,2013-06-16T01:51Z,"h alhtheia einai oti me tis malakies pou grafoun ypethesa mhpws ekeino to mnm ths media htan alhthino, gi'auto to anevasa ws anonymous

edaksei twra tha koimhthw hsuxos....Krima kai htheLa sxolio PHDHKOULIARIKO GIA NA KLEISW AUTO TO SAVVATOVRADO..XAAAXAAXAX KALHNYXTA PAIDIA
tA XAIRETISMATA MOU STH MAROULINO..!
PEITE THS OTI KSEMEINA PALI APO NEKTAR.!"
,GyclopeN,2013-06-16T01:52Z,ADABALI TO OTHOMAN SEX KSEXASES NTROPH..!
,katrinapapi,2013-06-16T11:43Z,!!!!!
,rita88,2013-06-16T13:32Z,ευχαριστουμεεεεεεεεεεεεεεεεεε!!!!!
,PHDIKOULAS,2013-06-16T14:26Z,IF YOU LIKE TURKISH SERIES THEN YOU SHOULD HAVE STAYED WITH TURKEY TURKISH BROTHERS.SOON GREECE WILL BE TURKEY AGAIN AND WE MAKE YOU OTOMAN SEX 
,emirates-a380,2013-06-16T19:17Z,you were worried about phdikoulas here she is with the same moto...
,PHDIKOULAS,2013-06-16T21:36Z,"@emirates-a380


SON WHILE I WAS FUCKIN YOUR MOM SHE ASKED IF YOU DID YOUR HOMEWORK,GO DO YOUR HOMEWORK SON"
,Antono3,2013-06-17T13:05Z,O MALAKAS O PIDIKOYLAS TO @ + TO ONOMA TO PHRE APO EMENA O KARIOLIS!!!
,PHDIKOULAS,2013-06-17T13:14Z,"@Antono3 

TURKISH TURK YOU ARE MAD NIGGA SUCK MA DICK"
,emirates-a380,2013-06-17T14:04Z,@phdikouls did you enjoyed last night my lady because you were screaming and crying and to stop fucking you. i thought you were already knew the job of prostitution but you were amateur and you hurt when i rape your pussy and your tight ass. i hope today you will enjoy it because i will!!!
,maroulino7,2013-06-17T18:10Z,"GyclopeN adika to anevases os anonymous poios tha ta valei me theous??? polu pineis omws k tha tsakwthoume olo sou teleionei pia ayto to nektar! xaxaxaxaxaxxaxaxax 
a, kai na min ksexasw to pio simantiko se eyxaristwwwwwwww pou ta anevazeissssssssssss makiaaaaaaaaaaaaaa"
