Filename,Size,Unit
Om Nama Shivay MP3s/Bhajalay Shiv Shankar Abhilashi - Om Nama Shivay - Anup Jalota.mp3,6.86,M
Om Nama Shivay MP3s/Bolo Bolo Sab Mil Bolo Om Nama Shivay - Anup Jalota.mp3,3.86,M
Om Nama Shivay MP3s/Damaru Ka Roop Main Dharoon- Om Nama Shivay - Anup Jalota.mp3,6.25,M
Om Nama Shivay MP3s/Hey Shiv Shankar Nataraj - Om Nama Shivay - Anup Jalota.mp3,7.86,M
Om Nama Shivay MP3s/Jai Shiva Shankar Jai Shiva Shankar - Om Nama Shivay - Anup Jalota.mp3,5.28,M
Om Nama Shivay MP3s/Neelakant Mahadeva  - Om Nama Shivay - Anup Jalota.mp3,5.05,M
Om Nama Shivay MP3s/Shiva Ka Naam - Om Nama Shivay - Anup Jalota.mp3,4.91,M
Om Nama Shivay MP3s/Tum Shankar Bol - Om Nama Shivay - Anup Jalota.mp3,5.01,M
Om Nama Shivay _ Xvid 1cd _ Devotional Songs by Anup Jalota [DDR].avi,699.41,M
