User Type,Username,Date,Text
,prebenzz,2013-01-22T23:22Z,Ska det vara så svårt att välja en NORMAL storlek? Finns liksom inte så många att välja mellan. 700mb 1400mb 2100mb
[T],Little_Devil,2013-01-25T08:33Z,Ska det va så svårt att inte klaga och bara ladda ner och hålla käften?! Ett litet tack kanske vore på sin plats istället? Trevlig helg!! =)
,whooooo,2013-01-27T19:52Z,"Tack Little_Devil!! Du gör ett kanonjobb! :) Otacksamt med folk som bara gnäller och inte kan göra något själva! 
Men är rätt säker på att de flesta uppskattar ditt jobba lika mycket som mig!! Tack än en gång, ha det fint! :)"
,riccogrosse,2013-02-18T20:02Z,Thanks! Good quality!!
