Filename,Size,Unit
Those Whom The Gods Detest/05 4th Arra Of Dagon.m4a,63.93,M
Those Whom The Gods Detest/04 Those Whom The Gods Detest.m4a,61.11,M
Those Whom The Gods Detest/01 Kafir !.m4a,53.71,M
Those Whom The Gods Detest/08 Kem Khefa Kheshef.m4a,50.71,M
Those Whom The Gods Detest/10 Iskander D'hul Karnon.m4a,50.25,M
Those Whom The Gods Detest/03 Utterances Of The Crawling Dead.m4a,41.36,M
Those Whom The Gods Detest/09 The Eye Of Ra.m4a,39.96,M
Those Whom The Gods Detest/02 Hittite Dung Incantation.m4a,30.27,M
Those Whom The Gods Detest/06 Permitting The Noble Dead To Desc.m4a,27.5,M
Those Whom The Gods Detest/07 Yezd Desert Ghul Ritual In The Ab.m4a,15.33,M
