Filename,Size,Unit
CD1/01 Girls Just Want to Have Fun.m4a,7.84,M
CD1/02 Time After Time.m4a,7.81,M
CD1/03 True Colors.m4a,7.47,M
CD1/04 I Drove All Night.m4a,8.35,M
CD1/05 She Bop.m4a,7.41,M
CD1/06 Iko Iko.m4a,4.55,M
CD1/07 When You Were Mine.m4a,9.77,M
CD1/08 Change of Heart.m4a,8.64,M
CD1/09 All Through the Night.m4a,8.88,M
CD1/10 What's Going On.m4a,7.65,M
CD1/11 The World Is Stone.m4a,8.46,M
CD1/12 Maybe He'll Know.m4a,8.69,M
CD1/13 Hat Full of Stars.m4a,8.76,M
CD1/14 Who Let In the Rain.m4a,9.17,M
CD1/15 Money Changes Everything.m4a,9.63,M
CD1/16 Sisters of Avalon.m4a,8.58,M
CD1/17 Unhook the Stars.m4a,7.86,M
CD1/18 The Goonies 'R' Good Enough.m4a,7.2,M
CD2/01 Calm Inside the Storm.m4a,7.85,M
CD2/02 Lies.m4a,7.39,M
CD2/03 Boy Blue.m4a,9.14,M
CD2/04 Someone Like Me.m4a,8.09,M
CD2/05 The Faraway Nearby.m4a,6.13,M
CD2/06 Primitive.m4a,7.62,M
CD2/07 My First Night Without You.m4a,6.15,M
CD2/08 Like a Cat.m4a,6.87,M
CD2/09 Heading West.m4a,7.79,M
CD2/10 Unconditional Love.m4a,7.85,M
CD2/11 Dancing With a Stranger.m4a,8.37,M
CD2/12 I Don't Want to Be Your Friend.m4a,8.64,M
CD2/13 Kindred Spirit.m4a,2.86,M
CD2/14 Hole In My Heart.m4a,7.9,M
CD2/15 That's What I Think.m4a,8.53,M
CD2/16 Sally's Pigeons.m4a,7.58,M
CD2/17 Dear John.m4a,7.36,M
CD2/18 You Don't Know.m4a,10.01,M
Poster.jpg,32.24,K
