Filename,Size,Unit
Abducted-The Carlina White Story(2012).avi,1.23,G
Belangrijke info/Het NLtoppers Team..pdf,342.77,K
Belangrijke info/NLtoppers zoekt Vertalers en Releasers.jpg,272.08,K
Belangrijke info/Scriptreseller.eu.docx,171.92,K
Belangrijke info/NLtoppers voorstellen.docx,61.5,K
Belangrijke info/Scriptreseller-Yakomo.eu.pdf,52.85,K
Belangrijke info/Nltoppers flyer.jpg,44.97,K
Belangrijke info/Thumbs.db,35.5,K
Belangrijke info/d'ont hit and run.gif,17.7,K
Abducted The Carlina White Story.jpg,17.37,K
Abducted-The Carlina White Story(2012)DVDRip NL subs[Divx]NLtoppers.txt,1.37,K
Wij zijn op zoek naar jou!.txt,927,B
Torrent Downloaded from limetorrent.txt,50,B
Torrent Downloaded From h33t.com.txt,39,B
