User Type,Username,Date,Text
,dop082000,2013-03-04T04:07Z,FYCK U
,Minty_Winty,2013-03-04T04:10Z,"dop, that was uncalled for!  This is a Season 1 up you dolt.  Look at mikes profile, he's obviously trying to become a decent uploader.

That said,I already have season 1, thanks anyway."
,SOPASUX,2013-03-04T04:12Z,"Is there any reason for posting this torrent tonight, aside from being a total butthole who wants to make people waste their time downloading a repeat when they were wanting the latest episode that is?"
,degu2012,2013-03-04T04:15Z,lol
[V],asupergeek,2013-03-04T08:04Z,"SOPASUX don't be a douche bag READ it says SEASON 1.

He seems to upload full seasons, which is great when you're missing a whole season.

Thanks mike953100"
,bravo95,2013-03-28T16:24Z,Thanks Mike!
[V],CrilleKex,2013-05-03T12:32Z,Thanks a lot! Great stuff!!
