User Type,Username,Date,Text
[T],SCSA420,2013-06-01T05:07Z,"Here is the 22nd WWE Friday Night Smackdown of 2013 in 720p HD MP4 enjoy the Smackdown show wrestling fans!!!

WWE Friday Night Smackdown HDTV 2013-05-31 720p AVCHD-SC-SDH

PLEASE READ THE .nfo FILE THIS WEEK!!!

Please stay connected after your download is finished to help seed this show for people still downloading it and enjoy the show!!! :D"
,mrnow76,2013-06-01T06:58Z,The last torrent I downloaded of yours was out of sync. 
[T],SCSA420,2013-06-01T12:08Z,NOT here it wasn't READ the .nfo file for help.
,SomeAnonGuy,2013-06-02T12:48Z,Awesome Dude.. Im Your #1 Fan appreciate it !!
