User Type,Username,Date,Text
,Tejas57,2013-05-26T11:09Z,thanks man. i really apprecite making these avalable. 
,pd313,2013-05-26T11:24Z,Thank you very very much!!!
,KatSucks,2013-05-26T19:39Z,"As always, thanks.  On the seedbox for a few days."
,Ziggy2by2,2013-05-28T00:01Z,What exactly is a seedbox and hows it work?
,KatSucks,2013-05-29T21:37Z,Seedbox: https://en.wikipedia.org/wiki/Seedbox
,KnightSkull,2013-06-07T00:13Z,"So I loaded it into addon folder and the steps run correctly, but the arrow is going crazy. It says that my destination is 1437 yds away at all times. 
Any suggestions or help would be appriciated!!! "
,KnightSkull,2013-06-07T00:15Z,"So I loaded it into addon folder and the steps run correctly, but the arrow is going crazy. "
,Ziggy2by2,2013-06-08T17:32Z,"Remove it, and try again"
