Filename,Size,Unit
Pluto vs Puzzle (first round).avi,15.87,M
Lil G vs Morris.avi,13.2,M
Pluto vs Lil G.avi,12.37,M
Mounir vs Gassama.avi,11.98,M
Skarabe vs Lil G (first round).avi,11.73,M
Mounir vs Morris.avi,10.45,M
Mounir vs Just Do It.avi,10.03,M
Fever vs Just Do It (first round).avi,9.89,M
Morris vs Boot2z (first round).avi,9.74,M
Mounir vs Miniboj (first round).avi,9.48,M
Gassama vs Quensley (first round).avi,9.4,M
Yaman vs Monkey (first round).avi,9.35,M
Justdoit vs Mennoh.avi,7.95,M
Morris vs Monkey.avi,7.95,M
Mennoh vs Redfoot (first round).avi,7.39,M
