User Type,Username,Date,Text
[T],SCSA420,2013-05-10T04:56Z,"Hey there TNA Impact Wrestling fans Here is the 19th TNA Impact Wrestling show of 2013 in 720p MP4 format!!! Enjoy the show!!!

TNA Impact Wrestling HDTV 2013-05-09 720p H264 AVCHD-SC-SDH

PLEASE READ THE .nfo FILE THIS WEEK FOR MORE INFORMATION!!!

Please stay connected after your download is finished to help seed this show for people still downloading it and enjoy the show!!! :D"
,GWARmnger,2013-05-10T05:55Z,Thank you very much.
,LAMBORGHINI39M,2013-05-10T13:53Z,thanks a lot
,HvyMetal,2013-05-11T16:54Z,Thank you!!! :)
,ABYSMAL_X,2013-05-13T08:19Z,"hey, WWE SLAM May 11 episode? where is it?"
