User Type,Username,Date,Text
[V],STFmaryville,2013-03-07T19:24Z,thanks for sharing eespi
,eespi,2013-03-08T05:23Z,"Thank you, STFmaryville for sharing so many awesome comics!  By the by, big fan of Mouse Guard.  I just got 'Mouse Guard, The Black Axe' from you.  Could you point me in the direction of issues of Mouse Guard, Fall 1152?  I only have the first one.  Thanks again!"
,eespi,2013-03-08T05:25Z,"STFmaryville, oops, sorry, I just realized I had them, but saved elsewhere!"
,rhmelis,2013-04-04T13:32Z,Thanks for collecting and uploading!
,Xitlali543,2013-04-06T03:34Z,Hey I am having trouble viewing these. I have a mac and have been looking for this forever
,eespi,2013-05-18T06:01Z,"Um, ok?"
