User Type,Username,Date,Text
,lqwwssd,2013-05-08T15:19Z,crash after i installed the crack!? anyone got the same problem as well?
,chop007,2013-05-08T18:46Z,Don't start app before you insert the crack.
,treedude,2013-05-08T19:01Z,it closes automatically after applying the crack
,reyasl,2013-05-13T15:58Z,"same problem program its automatly close, on win8 "
,reyasl,2013-05-15T10:37Z,"found a fix! it works for me hope will work for every1, after you have copy the crack/if you have avast right click on gameboost.exe then click /Run in sandbox/ and voila no crash, select maximum boost, don't 4get to select your settings type, after optimize now need a manual restart, hope it helped xD ^^  plz confirm if worked"
