User Type,Username,Date,Text
,uncleroy,2013-01-19T22:15Z,Thank you again Ms Fenmore
,leasine,2013-01-21T04:12Z,Thanks for that Ms Fenmore! 
,AMF2013,2013-01-21T16:20Z,Thank you.
,disneydreams,2013-01-21T18:43Z,thanks
,shellales,2013-01-23T02:43Z,"Thank you from Australia, Ms Fenmore"
,hawkesk57,2013-01-23T03:02Z,"Thank you for the shows and the notes!!! from Jomtien, Thailand . . ."
,Fan_of_Claudia_z,2013-01-23T06:16Z,"Hi MsF. Is that Wed your time? In which case it'll be Thursday Aussie time. Darn, it's Wednesday afternoon now (4.15pm) as I type. Withdrawal is becoming unmanagable."
