User Type,Username,Date,Text
,kilzone,2013-05-24T21:23Z,"gustavo, axei o filme do homem de ferro 3 q por incrivel q pareça esta com uma qualidade muito boa.. axei melhor ate q alguns dvdrips q vi por ai... Eu coloquei 3 ""pedacinhos"" do filme para vc ver a qualidade.. depois c vc kiser t passo o torrent.. clica no link q vo t passa...

https://drive.google.com/folderview?id=0B3GXBDXVdVH5ano5eEtqR1RjX2c&usp=sharing"
[T],210gustavo,2013-05-24T23:49Z,"pois éh néh, o audio parece bom mesmo, a imagem tbm nao está ruim, que torrent que é esse ??"
[T],derew,2013-05-25T00:21Z,"@kilzone , @210gustavo

mt estranho, creio q deve ter vazado algo do arquivo do cinema!"
,kilzone,2013-05-25T00:57Z,"o q eu baixei foi esse aqui: 

http://thepiratebay.sx/torrent/8500820/Iron.Man.3.2013.HDSCR.ULTRA.EDiTiON.720p.x264.LiNE.Hive-CM8

Eu nunca baixo esses filmes q estao no cinema pq geralmente tem qualidade sofrivel.. mas esse axei q esta ate bom demais...."
[T],210gustavo,2013-05-25T01:11Z,"é, mas levemente da pra perceber que é de cinema, mas o audio é bom"
,kilzone,2013-05-25T04:58Z,"pois eh.. justamente por ser de cinema q me surpreendi com a qualidade de A/V... Andei pesquisando.. dizem q esses arquivos xxSCR, sao versoes q os estudios mandam para os analistas e criticos avaliarem o filme... E quando o arquivo tem LINE no final significa q o audio foi retirado de outra fonte... Dai conclui q o filme em si, provavelmente foi destinado a algum pais do continente asiatico, e os gringos axaram um audio em ingles com boa qualidade, e sincronizaram com o video... Isso q falei, é só no axismo, mesmo.."
[T],210gustavo,2013-05-25T05:33Z,"Sim sim, deve ser algo assim mesmo, mas vamos esperar pelos blu rays originais néh?? kkk, vlw brother."
