User Type,Username,Date,Text
,quattro20v,2013-03-21T22:52Z,Nice 1
,rgregb,2013-03-24T11:47Z,"Thanks for the upload...
I've sorta become ubsessed with the show and have all of season 3 to watch when I finish season 2 (thanks for ALL of them), I'd like to upload a complete season 3 pack if it's ok with you and I can figure out how to do a ""collection"" as one unit..."
,cnit79,2013-03-25T08:30Z,"How come noone seems to have picked up on the fact that thursdays mkr wasnt uploaded? Or is it just me?
Just wondering...."
,wi_,2013-03-27T11:09Z,Thanks. Please continue uploading :) we dont get this show here 
,geomau,2013-03-31T20:27Z,TY BIGFISH5 when is episode 31/32 due to air is it a mid season break and again TY.
,DngnRdr,2013-04-01T12:06Z,"MKR currently airs 3 days a week and 31 airs tonight (1 April).

Monday is the public challenge
Tuesday is kitchen HQ challenge and cook-off
Wednesday is sudden death elimination.
"
