User Type,Username,Date,Text
,km11,2013-04-28T21:18Z,"THERES SOME DRIVERS I ADDED MULTIMEDIA DRIVERS,LAN DRIVERS,WLAN DRIVERS,CPU DRIVERS,AND SOME VIDEO DRIVERS.."
,km11,2013-04-28T22:03Z,"PLEASE WAIT FOR THE SEEDS...CAUSE I'M STILL SEEDING..IT'S 6.5%


SO PLEASE WAIT AFETR 2 DAYS ...THEN DOWNLAD IT..."
,markjohnson05,2013-05-07T16:47Z,good job brother
,km11,2013-05-09T10:49Z,sorry i just quit seeding because it's not work for upgrade installation..
,km11,2013-05-09T10:50Z,sorry i just quit seeding because it's not work for upgrade installation..wait i'm gonna make a new one..
