Filename,Size,Unit
Stand Up Guys (2012) NTSC DVDR DD5.1 Eng Spa NL Subs/Stand Up Guys (2012) NTSC DVDR DD5.1 Eng Spa NL Subs.iso,4.37,G
Stand Up Guys (2012) NTSC DVDR DD5.1 Eng Spa NL Subs.nfo,742,B
Torrent downloaded from AanMeHoelaJa Torrents on BTScene.eu.txt,71,B
Torrent downloaded from AhaShare.com.txt,58,B
Torrent Downloaded from digtorrent.org.txt,184,B
Torrent Downloaded From ExtraTorrent.com.txt,353,B
Torrent downloaded from KAT.ph.txt,41,B
Torrent Downloaded from limetorrent.txt,50,B
Torrent downloaded from P2PDL.com.txt,37,B
Torrent downloaded from silvertorrent.org.txt,86,B
Torrent downloaded from thepiratebay.se.txt,50,B
tracked_by_h33t_com.txt,23,B
