User Type,Username,Date,Text
[V],steevo-be-thy-name,2013-01-31T21:08Z,"I love party hardcore , just wish it was all in one part and not 3 or 4 parts every time . 

Thanks for the up ."
,Pear_shaped,2013-02-01T10:26Z,Do you have Party Hardcore Vol. 5? (July 2006) http://www.partyhardcore.com/dvd/details/23 Thanks.
,zipomatic,2013-02-01T17:11Z,"@Pear_shaped 

I do indeed have vol 5. I'll upload it sometime in the near future."
,jasar123,2013-02-02T23:57Z,"Does anyone find resolution 1080p of this part?

I searched 2 days on torrents and forums and i can't find it.

Does anyone have more success ?

thanks"
