User Type,Username,Date,Text
,niarlttep,2013-04-08T00:20Z,"Thanks you very much.
If you can have some other books about Mathematica I'll be very pleased.

Hi !"
,sgenius,2013-04-08T01:43Z,"I have four other books on Mathematica, I'll upload them and put a link here when it's ready..."
,sgenius,2013-04-08T02:04Z,"http://thepiratebay.sx/torrent/8352637

Four more Mathematica Books"
,sgenius,2013-04-08T02:05Z,"Not sure the other comment made it...
thepiratebay.sx/torrent/8352637"
,sgenius,2013-04-08T02:08Z,"Not many newer books on Mathematica, even checking Amazon..."
