User Type,Username,Date,Text
,bobtheduck2011,2013-02-15T00:01Z,"Shouldn't have bothered. The RAR file has another RAR inside that is password protected and requires the user to go to a site and take a survey and has that annoying (potentially dangerous) can't navigate away from this page without clicking something message. 

No, Thanks. 

What a waste of time. "
,dmortem,2013-03-23T12:22Z,"Annoying password protection. The passwort for the second .rar-file is ""help""."
,grapsta,2013-04-14T10:44Z,damn...wish I had of read the comments. password protected..what a waste
,furiataurina,2013-04-16T10:58Z,"I can confirm that the password ""help"" works on 2nd rar. Video's seem to work okay."
