User Type,Username,Date,Text
,DRAKE-2,2013-02-12T18:16Z,"hola, 
92 seeders y 713 leechers  este dia, ¡y ni un puto comentario!
Con lo que cuesta pararse un momento aunque sea solo para escribir ""hola y gracias.""
la verdad es que este track es uno de los mejor frecuentado que conozco, pero hay que ver la jeta que tiene la gente...
Asi que amigo Furtaperas, gracias por todos (tus aportes) y todos (los que les disfrutan)
¡Un +++ para ti!"
,chili0929,2013-02-12T20:41Z,"gracias de mi tambien ,la verda que furtaperas sube  un monton de peliculas gracias otra ves"
[V],furtaperas,2013-02-12T23:44Z,"gracias a los dos  por comentar  la verdad 
estoy aconstumbrado a ke no digan nada 
y eso ke es gratis el escribir  ..no se gastan las 
megas de la linea  ...pero en fin  "
,Toperharrier,2013-02-14T00:49Z,"Muchas gracias por el aporte furtaperas.

No te molestes porque nadie comente, es bastante comun creo en todos los torrents, si miras alguno de YIFY o eztv siempre tienen como 10k+ entre seeders y leechers y apenas pasan de 1 pagina de comentarios en la mayoria de aportes.

Cada vez es mas rapido todo, y mas ahora que incluso puedes añadirl torrents mediante el magnet sin nisiquiera salir de la busqueda."
,FERDi65,2013-02-14T08:23Z,No comment!
,marcoarguelloblum,2013-04-14T18:03Z,"por favor, podrian subir esta pelicula  en español latino, gracias"
