User Type,Username,Date,Text
,fiveofseven,2013-02-07T14:34Z,"It says there is an upgrade. If I was to upgrade, will it remain registered?"
,Halloweenpsycho,2013-02-07T15:09Z,No it will unregister..how ever i am releasing the upgrade shortly with in the next half hour :)
,fiveofseven,2013-02-07T15:57Z,"I just need a better converter, to avi, mkv and/or mp4 with ac3 option (perhaps DTS too). What I have now could be better & no ac3 (AVS Programs). I tried using this to test convert a movie from a DVD and it's kind of a pain. What program of your options, that are being shared, would you recommend?"
,Halloweenpsycho,2013-02-07T16:13Z,"well as for my portable version it may be a bit..i got a lot going on at home atm..so..give another trusted or vip dvdfabs a try :) or you can use my dvd fab 9.2.2.5 if you like :)
Catch you all after while//"
,MoviesR101,2013-03-01T03:17Z,"O.k., I have been using Dvdfab for many years, but I don't understand how to use the new ones? Are you supposed to connect to the internet? With one old ones you never did? I am more fimilar with version 8 interface! Can someone help me?"
