User Type,Username,Date,Text
,dwm015,2013-04-19T03:39Z,You are awesome! I really appreciate it!
[V],STFmaryville,2013-04-19T04:11Z,"all credit to the scanner, in this case Zone!"
[V],STFmaryville,2013-04-19T04:30Z,Here's a better quality (than the Scanbro release) of Superior Spidey 8  http://thepiratebay.sx/torrent/8388320
,marvelnerd76,2013-04-19T20:56Z,Thanks for all the great stuff this week. Loved your 40 graphic Novel pack. You are the best!
[V],STFmaryville,2013-04-19T23:22Z,"yeah i found some good stuff for that one! don't skip over THE UNDERWATER WELDER, it's wonderful. thanks for saying thanks, my friend."
