User Type,Username,Date,Text
,Ualaa,2013-03-03T17:00Z,"Amazing collection, thank you.
It is missing Savage Species."
,Vynel,2013-03-04T01:40Z,Thank you for drawing our attention to this. We will rectify it shortly
,Hellrazor236,2013-04-12T08:33Z,It's also missing the Fiend Folio and Faiths of Eberron.
,Hellrazor236,2013-04-12T08:35Z,"Oh, and Faiths and Pantheons, too."
,Pennyfarthing,2013-04-24T14:36Z,"Thanks for the upload, lots of ref material and good quality :-)"
,punkhell,2013-05-07T02:12Z,"Tnx so much :D 
this books are awesome."
