User Type,Username,Date,Text
,kissfan1,2013-02-11T11:11Z,"Thank you for the reading order !!
Can't wait for your Before Watchman torrent!!"
,321loh,2013-02-12T09:44Z,great
,yaronlp1,2013-02-12T16:12Z,That's sure set things right. thanks!
,jon2d2,2013-02-12T22:45Z,"Thanks guys. Appreciate it.

I forgot to include Red Hood & The Outlaws #08 on the contents list up there ^ It is definitely in the pack though in its proper place.

Also, I forgot to add. If anyone has any ideas for complicated crossovers that I could tackle that ARE NOT already available. Let me know."
,darkphinix,2013-02-24T11:20Z,Great upload!
,Triscar,2013-05-06T20:03Z,Thank you soooo much.
