User Type,Username,Date,Text
,JustAnotherApprentice,2013-04-25T03:40Z,"Oh,man...thank you so much!!!!
Please keep uploading those games in mp4."
,TheItalianJob,2013-04-25T03:45Z,"Thanks for the upload D4E. 

My sister was asking about you the other day. I played it cool - said you were a busy guy. I know how you roll."
,BigPoppaCherry,2013-04-25T03:47Z,"I know this just went up not even an hour ago, but please seed more. Im uploading only this and Im uploading at 300 kb/s and downloading at 3.2 kb/s. Be generous people."
,BigPoppaCherry,2013-04-25T03:49Z,"Also, thank you for the upload. Could never catch UEFA games in the past and you get em all plus the europa league and the EPL. Got your downloads bookmarked. Keep up the good work please, I know I sure as hell appreciate it."
[T],nmee,2013-04-25T04:18Z,thx!!!
[T],Demonoid4Ever,2013-04-25T05:10Z,"Hey Guyz, you're all welcome. 
@BigPoppaCherry My upload ratio is already at 1.5 after 2 hours, but unfortunately it still not fully seeded, as I see the connected peers are at about 85% available. "
,BigPoppaCherry,2013-04-25T05:39Z,"Yeah, I checked too, its bout 93% now. I wasnt thinking about it, got too excited about watching some good quality football/soccer, haha."
