User Type,Username,Date,Text
,upsdave,2013-06-14T03:54Z,"New season, Enjoy!"
,diggersd,2013-06-14T05:40Z,"nice one, keep up the good work please . i will be watching from thailand :)"
,webmonk42,2013-06-14T13:12Z,"can someone reupload in a smaller file size please?

i'm a data limited dork & it's a long season."
,Aimless29,2013-06-14T15:12Z,Thank you from Canada!
,webmonk42,2013-06-14T20:09Z,more fat gay people picking each other's buttholes for cash
,KingFunks,2013-06-15T23:00Z,Big thanks. Great upload.
,BBfan,2013-06-16T04:21Z,Thank-you very much!
,nigz,2013-06-16T19:18Z,thanks
