User Type,Username,Date,Text
,FERDi65,2013-02-02T13:53Z,Hoy el periódico El Pais no está ¿Por?.
,FERDi65,2013-02-02T14:14Z,...Ya lo subo yo ;)
[V],furtaperas,2013-02-02T15:26Z,"lo han puesto muy tarde    casi a las 13.30 

vale subilo tu  pasame el enlace   del torrent 
para bajarmelo yo  "
[V],furtaperas,2013-02-02T15:50Z,"lo vas a subir o no ??????

estoy esperando   "
,FERDi65,2013-02-02T16:47Z,No me deja. Súbelo tu.
[V],furtaperas,2013-02-02T17:01Z,"veo  ke te has  ofrecido a subir el periodico  
pero  veo ke no lo subes  pues nada.......
ya subiras mañana tu  todos los periodicos  
yo no subo  ni uno mas ......
has preguntado por el pais  que no estaba no por ??
ya parece una obligacion el subirlo......
lo dicho como es gratis  ....mañana  te ocupas tu
de subir los  periodicos ...........saludos 
NO SUBO LOS PERIODICOS  AKI  JAMAS "
,FERDi65,2013-02-03T00:11Z,"A ver, furtaperas, que creo que se te ha ido la olla un poco. Si he preguntado por el Pais, es por la que ha montado hoy con la noticia que han sacado. Me he ofrecido subirla pero no me dejaba subirla (y lo he intentado varias veces). Y eso es lo que ha pasado. He reconocido varias veces tu esfuerzo por subir todo lo que has subido y en ningún momento he pretendido que fuera una obligación tuya el hacerlo. Faltaría más. 
Pero no la tomes conmigo, que he intentado ayudar.
Un saludo y cálmate, anda."
[V],furtaperas,2013-02-03T10:30Z,"a ver   no  te contesto mas
tu pusistes esto 
Hoy el periódico El Pais no está ¿Por?. 

es obligacion  ??  subirlo  ....yo creo ke no  
ni por la informacion ke ponga  ni na  
yo tengo una vida  .... yo a partir de las  12 de la mañana  no subo ningun periodico  

si lo publican  despues  no es culpa mia yo subo 
lo ke publican  ..faltaria mas  

y si  ti quieres subirlos  adelante  por mi parte 
no hay ningun problema menos curro para mi 
si no te deja subirlo sera por algo ke no haces bien  ...no  lo se  ......me da igual   

tu sabes de donde bajar los  periodicos no  ??
pues si sacan el periodico a las 14.00  horas 
lo puedes subir tu  con toda trankilidad  
los  demas usuarios te lo agradeceran 

saludos   
"
,torront,2013-02-03T12:32Z,"Ahí, ahí, vosotros con vuestras chiquilladas....No me extraña nada de como está el patio en España."
[V],furtaperas,2013-02-03T13:07Z,"torront ...puedes subir tu la  prensa si quieres
mucho criticar  muchas chiquilladas   

pero no veo la prensa  por ningun lado 

vuelvo a repetir    es  gratis para todos    

si es gratis para todos  cualquiera  lo puede subir no ????"
,Hesiodo,2013-02-06T17:31Z,Que pena... furtaperas te sigo animando a que cuando puedas y te apetezca sigas compartiendo! No sabes cuanto agradezco tu trabajo diario! Gracias!!
