Filename,Size,Unit
Lord of Darkness/Lord of Darkness - Elizabeth Hoyt.epub,706.6,K
Lord of Darkness/Lord of Darkness - Elizabeth Hoyt.jpg,422.6,K
Lord of Darkness/Lord of Darkness - Elizabeth Hoyt.opf,4.33,K
Downloaded and Tracked/Torrent Download From SilverTorrent.org.txt,89,B
Downloaded and Tracked/Facebook And Twitter.txt,75,B
Downloaded and Tracked/Torrent Downloaded From ExtraTorrent.com.txt,46,B
Downloaded and Tracked/Torrent downloaded from P2PDL.com.txt,33,B
Downloaded and Tracked/Torrent downloaded from Kat.ph.txt,30,B
Downloaded and Tracked/STPicz.com Free Image Hosting.txt,29,B
