User Type,Username,Date,Text
,HE-HAW,2013-02-12T19:57Z,don't click the bullshit link above phishing website...!...
,EnnaShestomir,2013-02-13T11:00Z,"thanks for soundtrack, bu where can we find movie?
thanks above for link 
but it is broken on my side
 nevermind, 
i did some tweaking and found hd copy in english at http://ifoundfilm.ca.tf 
and it works with ps3"
,boogie3123,2013-02-13T19:59Z,FAKE FAKE FAKE !!! DO NOT DOWNLOAD
,boogie3123,2013-02-13T20:48Z,I WAS GONNA POST ON A DIFERENT TORRENT BUT IT WAS ALREADY DELETED ! SRY !! NOT FAKE 
,pneuma11,2013-02-14T21:20Z,is this fake he has a pink skull....? I doubt pinks skulls would be posting fake shit but who knows??? anyone confirm
