User Type,Username,Date,Text
,Shark011,2013-03-14T00:14Z,"TY for your incredible work for the comic community! Would you happen to have War heroes by Mark Millar and could you please upload it?
"
[V],STFmaryville,2013-03-14T00:25Z,"you're welcome Shark011. you know they never finished that, right?"
[V],STFmaryville,2013-03-14T02:08Z,"well anyway, here ya go:  http://thepiratebay.sx/torrent/8254370/"
,Shark011,2013-03-14T21:27Z,"As earlier stated, TY!!!"
[V],STFmaryville,2013-03-14T22:04Z,you're welcome
