User Type,Username,Date,Text
,luvinlyf,2013-02-12T00:09Z,"thanks for this upload.
I always look for files that are uploaded by you.
Im trying to learn Swedish and it really helped me a lot. 
Is it possible for you to upload The Triangle from 2005 with Swedish subtitles as well? 
It would really be great if you can. 

thanks again and looking forward to more movies from you :) "
[V],haggebull,2013-02-12T20:24Z,"You can find it here...
http://thepiratebay.sx/torrent/8135326/The.Triangle.2005.SWESUB.DVDRip.XviD.AC3-Haggebulle"
