Filename,Size,Unit
A Wild & Crazy Guy/01 I'm Feelin' It (Album Version).m4a,5.22,M
A Wild & Crazy Guy/02 Philosophy_Religion_College_Langu.m4a,9.77,M
A Wild & Crazy Guy/03 Creativey In Action_I'm In The Mo.m4a,2.29,M
A Wild & Crazy Guy/04 A Wild And Crazy Guy (Album Versi.m4a,6.62,M
A Wild & Crazy Guy/05 A Charitable Kind of Guy (Album V.m4a,1.55,M
A Wild & Crazy Guy/06 An Expose (Album Version).m4a,2.75,M
A Wild & Crazy Guy/07 Cat Handcuffs (Album Version).m4a,1.6,M
A Wild & Crazy Guy/08 You Naive Americans (Album Versio.m4a,1.89,M
A Wild & Crazy Guy/09 My Real Name (Album Version).m4a,2.24,M
A Wild & Crazy Guy/10 King Tut (Album Version).m4a,3.44,M
Comedy Is Not Pretty/01 Born To Be Wild (Album Version).m4a,5.5,M
Comedy Is Not Pretty/02 The All Being (Album Version).m4a,1.3,M
Comedy Is Not Pretty/03 McDonald's_ Men's Underwear (Albu.m4a,3.01,M
Comedy Is Not Pretty/04 Drop Thumb Medley (Album Version).m4a,2.04,M
Comedy Is Not Pretty/05 Googlephonics (Album Version).m4a,2.93,M
Comedy Is Not Pretty/06 Hostages (Album Version).m4a,1.15,M
Comedy Is Not Pretty/07 Cruel Shoes (From The Book _Cruel.m4a,2.14,M
Comedy Is Not Pretty/08 Comedy Is Not Pretty (Album Versi.m4a,3.22,M
Comedy Is Not Pretty/09 How To Meet A Girl (Album Version.m4a,3.56,M
Comedy Is Not Pretty/10 Rubberhead (Album Version).m4a,911.31,K
Comedy Is Not Pretty/11 Jackie O. And Farrah F. (Album Ve.m4a,3.45,M
Comedy Is Not Pretty/12 You Can Be A Millionaire (Album V.m4a,2.76,M
Let's Get Small/01 Ramblin Man _ Theme From Ramblin'.m4a,2.1,M
Let's Get Small/02 Vegas (LP Version).m4a,3.6,M
Let's Get Small/03 Let's Get Small (LP Version).m4a,14.71,M
Let's Get Small/04 Smoking (LP Version).m4a,2.06,M
Let's Get Small/05 One Way To Leave Your Lover (LP V.m4a,1.49,M
Let's Get Small/06 Mad At My Mother.m4a,889.21,K
Let's Get Small/07 Excuse Me.m4a,2.88,M
Let's Get Small/08 Grandmother's Song (LP Version).m4a,3.4,M
Let's Get Small/09 Funny Comedy Gags (LP Version).m4a,2.93,M
Let's Get Small/10 Closing (LP Version).m4a,1.95,M
Rare Bird Alert/01 Rare Bird Alert.m4a,5.17,M
Rare Bird Alert/02 Yellow-Backed Fly.m4a,6.36,M
Rare Bird Alert/03 Best Love.m4a,8.27,M
Rare Bird Alert/04 Northern Island.m4a,5.26,M
"Rare Bird Alert/05 Go Away, Stop, Turn Around, Come.m4a",6.88,M
Rare Bird Alert/06 Jubilation Day.m4a,6.34,M
Rare Bird Alert/07 More Bad Weather On The Way.m4a,7.08,M
Rare Bird Alert/08 You.m4a,7.11,M
Rare Bird Alert/09 The Great Remember (For Nancy).m4a,5.95,M
Rare Bird Alert/10 Women Like To Slow Dance.m4a,4.25,M
Rare Bird Alert/11 Hide Behind A Rock.m4a,3.92,M
Rare Bird Alert/12 Atheists Don't Have No Songs.m4a,7.35,M
Rare Bird Alert/13 King Tut.m4a,6.11,M
The Crow_ New Songs for the Five-String/01 Daddy Played the Banjo.m4a,3.01,M
The Crow_ New Songs for the Five-String/02 Pitkin County Turnaround.m4a,2.22,M
The Crow_ New Songs for the Five-String/03 Hoedown at Alice's.m4a,2.91,M
The Crow_ New Songs for the Five-String/04 Late for School.m4a,3.42,M
The Crow_ New Songs for the Five-String/05 Tin Roof.m4a,2.08,M
The Crow_ New Songs for the Five-String/06 Words Unspoken.m4a,2.62,M
The Crow_ New Songs for the Five-String/07 Pretty Flowers.m4a,2.43,M
The Crow_ New Songs for the Five-String/08 Wally on the Run.m4a,1.47,M
The Crow_ New Songs for the Five-String/09 Freddie's Lilt.m4a,2.65,M
The Crow_ New Songs for the Five-String/10 Saga of the Old West.m4a,3.08,M
The Crow_ New Songs for the Five-String/11 Clawhammer Medley.m4a,2,M
The Crow_ New Songs for the Five-String/12 Calico Train.m4a,4.35,M
The Crow_ New Songs for the Five-String/13 Banana Banjo.m4a,2.05,M
The Crow_ New Songs for the Five-String/14 Blue River Waltz.m4a,2.08,M
The Crow_ New Songs for the Five-String/15 The Crow.m4a,3.08,M
The Crow_ New Songs for the Five-String/16 Calico Train [Instrumental].m4a,2.87,M
