User Type,Username,Date,Text
,Jinserv,2013-05-23T07:14Z,"Error in description:  

Voices: Hebrew
Subs: English hardcoded"
,billbomb,2013-05-23T08:56Z,"It's french version just like this one
https://thepiratebay.sx/torrent/8245612/The_gatekeepers_-_Documentaire_ARTE_-_5_mars_2013"
,mbonaci,2013-05-23T21:01Z,So no English subs?
,zenicaone,2013-05-24T17:48Z,"mbonaci

based on what I downloaded so far (71,5%) 

YES it is same FRENCH version 
NO HARDCODED ENGLISH subs "
,azulato,2013-05-25T20:53Z,"True, NO English subs. Pitty. It's been around for a while but I just cannot find one in English. Any hints, folks?"
,HaVoC_850,2013-05-31T03:23Z,should be up in the next 2 months when it plays on Israeli TV in short clips but with extra content.
,MC26,2013-05-31T06:55Z,I would think it will come to DVD soon.  So close.  Seems no one can Eng sub this yet.
