User Type,Username,Date,Text
,tingya,2013-04-19T08:44Z,"""Bad Torrent "" Error Does not work wit ipv6 kademlia pls use utorrent 2.2 http://www.filehippo.com/download_utorrent/9859/ to create torrent it's a request as i'm a big fan of high 10p encode of ur's"
,M5T,2013-04-19T09:30Z,"Thanks for this :D 
Could you upload Brad Paisley's ""Wheelhouse Special Edition?"" 
Much appreciated if you could. "
,tankey14,2013-05-03T21:33Z,don't listen to the first guy this torrent works :p thanks btw I had been waiting for it to drop 
