User Type,Username,Date,Text
,brianxxx,2013-03-15T13:19Z,"Thanks for all you do!

Not trying to troll or flame but where did this guy come from? 
http://thepiratebay.sx/user/Drarbg/
And exactly how did he get a pink skull so fast? Is he legit? And why hasn't CHKM8TE been given a pink skull by now?!"
,brianxxx,2013-03-15T13:24Z,"PS - just for the record...about 2 days ago he had no skull at all. Came out of nowhere. That is why I find it suspicious. Again, not trying to cause trouble."
[V],chkm8te,2013-03-16T00:33Z,the green skull is higher ranked then the pink skull
,sourmold,2013-03-16T01:00Z,I've noticed that too iffy??? :O
,sourmold,2013-03-16T01:01Z,@chkm8te can you post that new Claire's 2nd Glory Hole Visit up today???
,brianxxx,2013-03-16T17:28Z,"Sorry, my goof, I always thought pink was the highest rank. Blue then Pink then Green...got it! lol

OK>..cool and good to know you have VIP rank as you richly deserve it!"
