User Type,Username,Date,Text
,gawriandreas,2013-06-21T18:12Z,"I had some difficulties in starting the upload, but now it`s started"
,gawriandreas,2013-06-21T19:05Z,check my other torrents
,lapis22,2013-06-21T19:12Z,Does Kent realize that according to his beliefs he'll go to hell for all of these lies he spreds?
,gawriandreas,2013-06-21T20:41Z,Talking of misspellings
,lapis22,2013-06-22T05:22Z,great come back retard lol.   sry man but i cant let hovinds or any other creationist bullshit slide. i can say whatever i want here regaurdless of how much youd like to stop me. so suck it :)
,lapis22,2013-06-22T20:14Z,glad to see almost no one wants this nonsense :)
