User Type,Username,Date,Text
[T],derew,2013-03-22T10:42Z,"vlw holyshit.. hahaha.. cara eu paguei 50 reais na epoca nesse filme original! pena q se perdeu.. tinha toda a colecao disney pixar.. se puder postar pra gente filmes como nemo, os incriveis, vida de inseto, enfim, a galera vai gostar.. e sao da disney tb rsrs"
,HolyCream,2013-03-22T11:37Z,"Vou postar bastantes animações Disney :)

Eu ia enviar ""Procurando Nemo YIFY"", tava tudo pronto, mas ai dei uma ultima conferida e o vídeo ta pecando muito =(

Vou fazer o encode novamente, deve ficar pronto na segunda."
,tofushoyu,2013-03-23T03:50Z,"Filmaço da Pixar!
Muito obrigado, HolyCream!"
,lDagasl,2013-03-23T05:56Z,"Cara, já baixei todos, deixei no pc por um bom tempo até acumular outros downloads, aí tive que retirar mesmo. Ótimo trabalho que tem feito, sem falar que as animações da Disney são perfeitas na maior parte, te agradeço MUITO! Teria como postar:
- A Espada Era A Lei
Animação antiga pra caramba, mas perfeita. =)"
