User Type,Username,Date,Text
,link5a,2013-04-21T01:49Z,thanx!
,ScubaSteve5678,2013-04-21T02:25Z,"Thanks a bunch ill seed for 2 weeks as i do with all you movies I DL 
Any chance you could do all the seasons of breaking bad or Sons on Anarchy TV show? if so ill help  seed those ones forever for you "
,Hambosas,2013-04-21T04:31Z,I can't really do tv shows because if I download them they'll take forever to download and not to mention uploading. I can only upload at 80kb/s so its pretty bad. I have watched Breaking Bad all the way and its an amazing show but i really couldn't. 
,Alasdairsmyth,2013-05-03T18:55Z,"Hi, I have a few requests :)
The dark knight rises
The hobbit
Silver linings play book
Life of pi
Thanks so much for your uploads! They are of such an amazing standard!"
,Hambosas,2013-05-10T07:31Z,"So I guess I'm done uploading for a while or ever. I just can't do it with my slow ass internet, takes several days just to get 1 movie seeded so unless I get faster internet with 1mb+ upload speed then there is no way. I love doing this and I do hope I can come back some day."
,icarlos2011,2013-05-16T20:20Z,"hambosas, you can put warm bodies itunes 720p with subtitles in English only. Thank you."
