User Type,Username,Date,Text
,Kalkusa,2013-03-31T05:12Z,"Works perfectly, just I disliked like that it didn't let me choose the install location. Besides that easy peasy. "
,toker300,2013-04-19T13:04Z,"Hey thanks for your torrents...the vice city runs well...but when i click this i get an error the program did not install properly..

any tips?"
,heil34,2013-04-30T12:45Z,@Kalkusa i cant find the install location. help??
,heil34,2013-04-30T12:46Z,cant find the install location... i need it for the mods!!
,barrymore,2013-05-01T16:17Z,"The torrent is located in C -> Program File -> Portable xD

The_Duck1, nice one by the way :)"
,SomeGuy963,2013-05-06T02:02Z,"Awesome! Works perfectly! Thanks!

Can you really run this from a USB? Last time i had GTA Vice City, put the files in the USB stick, and it lost the sound, would this happen?"
,ZeBastard,2013-05-16T10:33Z,"Can anyone tell me how this is supposed to work? All I got were .2, .3....6 files, and a program that was basically an internet bookmark."
,schwker,2013-05-18T10:04Z,"Hi I downloaded and installed but I got an error saying: gta_sa.exe - Bad Image. It had this in the message: C:Program FilesPortableGTA San Andreasvorbis.dll is either not designed to run on Windows or it contains an error. Try ...

Please help and thanks in advance"
,lodspyro,2013-05-23T07:55Z,where the f*** does the shit installs?!?!?!
