User Type,Username,Date,Text
,bry68,2013-05-07T00:07Z,"which do you think is best?
"
,PirateDroid,2013-05-07T01:17Z,I like Poweramp Music Player.
[V],dohduhdah,2013-05-25T19:05Z,"Which players work together nicely? Meaning that advancing to the next track in one player doesn't cause another player to stop. So far I've found that winamp, jetaudio and rocketplayer work nicely together."
,PirateDroid,2013-05-26T12:29Z,"@dohduhdah 

I never used 2 players together, might give conflicting yes."
