User Type,Username,Date,Text
,echo_mk,2013-03-25T12:17Z,"thanks great effort

keep this kind flowing :)"
,W123.130,2013-03-25T14:48Z,"Thanks.

Be sure to keep res.dat in the same folder as the keygen or it will not make a key."
,echo_mk,2013-03-25T18:45Z,"@W123.130:

plz (if u have)  share things of CAT or CUM documents/Tutorial/Diagnostic/repairing/Manuals..etc

it will help a lot of people

thanks in advance"
,W123.130,2013-04-12T08:19Z,Will do if I can find them.
,mrbamcclain,2013-04-19T05:28Z,I keep getting an error with the keygen. Any tips to it? I haven't moved the res.dat file out of the folder.
,shawnbelieu,2013-05-04T05:48Z,im not too sure i did this right im looking for cummins and even cat ob2 files to send from the ecm to the computer ? some one help? shawnbelieu@hotmail.com
,shawnbelieu,2013-05-04T06:48Z,im not too sure i did this right im looking for cummins and even cat ob2 files to send from the ecm to the computer ? some one help? 
,shawnbelieu,2013-05-09T06:52Z,w123.130 i need help here i want the cummins insite and i want to log into it i guess what im kinda saying is i dont really understand how to make this work insite? im a diesel mechanic and my boss would probably give me a raise if you know what i mean ;) 
