User Type,Username,Date,Text
,omalansky,2013-04-15T02:09Z,"This torrent is far too large for most people to download. Can you please break it up into more manageable pieces? And please don't say, ""If you don't like it, don't download it."" When someone posts a torrent that is useless to most visitors to this site, a complaint is totally justified."
,woritstoh,2013-04-15T11:51Z,"Another huge upload from gatasalvaje.
Thanks."
[V],gatasalvaje,2013-04-15T16:35Z,"
Next time, I'll do it in parts, greetings ........"
,BozMozzis,2013-04-23T20:09Z,I can't unpack it... i think it's problem in too long filenames...or what?
,CaptPeacock,2013-05-07T07:23Z,With what program do you unpack this thing?
,CaptPeacock,2013-05-07T07:49Z,How and with what do you unpack this?
,CaptPeacock,2013-05-10T22:08Z,Anyone Home?  I'd like to know how to open this file!  A little help PLEASE!
,CaptPeacock,2013-05-10T22:11Z,"Better instructions that what is in the notes are needed!  

""Created one Image problems renaming files and creating the torrent, extract image, greetings and thanks.""

The above is of no use!"
,CaptPeacock,2013-05-22T07:28Z,"Still, no one home.  No big surprise!  I wouldn't d/l this.  What a waste!"
