User Type,Username,Date,Text
,chacrE5a,2013-01-12T02:21Z,"This is not a ""loader"" at all and it just a dirty hackaround same as rest of the so-called ""activations"".

Just activate via a KMS server or get a cheap upgrade license for now until Daz from mydigitallife forums comes up with a real OEM loader.

Avoid these crappy hacktivations as they just lead to issues and possibly infections."
,suiteo,2013-01-12T17:00Z,Thanks for the heads up chacrE5a.
,jacob5800,2013-01-12T21:12Z,"this is true ,it does not activate properly only make belive that it is activate but if u use aida 64 extreme  it will show that ure window is not activated  i tried them all and its the same only works for a while and have to be reactivated so on  Windows 8  is protected "
