User Type,Username,Date,Text
,neo3075,2013-02-04T10:16Z,Faltan los subtítulos forzados para las partes habladas en árabe.
,soumyaz,2013-02-08T14:42Z,"A10 V10 - Great movie, top 10 in the last few years for sure! Storyline is intelligent and entertaining, i wouldn't change it even a bit. Actors rocked, really really good acting! Quality was great! At site aole.ciroblazevic.com there is Django and Hobbit in HD already, great stuff! Thnx once again for this fantastic movie!"
,DRAKE-2,2013-04-26T20:06Z,"Hola, 
A/V 10 - ST, es verdad que cuando hablan en árabe, te quedas un poco bobo.
La peli es un muy buen trabajo, no hay nada que decir ni sobre la adaptación, ni sobre la actuación, pero si es un muy agradable divertimiento, no creo que da para Oscar (es)... Este premio se parece cada vez mas a un incentivo político.
Gracias por compartir."
