User Type,Username,Date,Text
[V],totomas1,2013-02-04T16:09Z,"Man kan tro att det rör sig om att springa med papegojor (aror), men det gör det inte :). Låter annars som en variant av Kevin Kostners Dansa med vargar."
[V],totomas1,2013-02-05T19:24Z,Ingen som tyckte att det här var en bok värd att tacka för :(
,Gasoler,2013-02-07T18:50Z,"Häpnadsväckade att folk inte orkar tacka för en bok som kostar ett par hundringar i affären och som serveras gratis av dej.

Boken är inte min ""kopp med The"" men blir lika glad för varje svensk ljudbok som jag ser på TPB"
,swe.rogge,2013-04-05T18:12Z,"Då jag nyss läst bra recension om denna bok så tänker jag ge den en chans. Tack totomas1, på förhand så ser vi snart om det finns någon lr några som bjuder in mig på denna.. :)"
