User Type,Username,Date,Text
,Calel1234,2013-05-21T12:54Z,Congrats on skull. Well-deserved. 
[V],blackcanary,2013-05-21T15:54Z,Congrats STFmaryville. :)
,binderguy1,2013-05-21T16:18Z,"Congrats on your Green Skull, STFmaryville!

Thanks for the ul.

PS. are you still going to ul some Elektra?"
,tdurden83,2013-05-21T19:21Z,"thx stf, and congrats. you definitely earned it"
[V],STFmaryville,2013-05-21T20:07Z,"binderguy1, i sincerely don't know when i'll ever have time. i would like to.  :-(

thanks everyone! it's always rewarding, though not always easy, to share... hopefully i've made it possible for people to read some great comics they otherwise couldn't read.  :-)"
,marvelnerd76,2013-05-21T21:30Z,Congrats! Hope all is well with you.
,new52,2013-05-22T19:02Z,Congrats and thank you STFmaryville!
,riverchase,2013-05-23T05:15Z,do you have the bounce from image comics. I can't find it online
