User Type,Username,Date,Text
,Mela13,2013-03-11T04:12Z,Thank you for being so fast
,a.s4,2013-03-11T04:41Z,thx you for this
,graff3,2013-03-11T05:38Z,Thanks for the quick upload. Need faster seeders it is dling at slower than 1kb/s
,M.CTI,2013-03-11T07:25Z,"You're the best, no doubt.
Does anyone have good subs, please ? :)"
,Viciously,2013-03-11T08:58Z,Thanks.
,dubblue4,2013-03-11T10:27Z,thanks
,CurleyBallz,2013-03-11T10:30Z,Seeed you selfish fucks.. ive been downloading for an hour and im at 39% leeeeching my net -.-
,CurleyBallz,2013-03-11T10:35Z,will seed for 2 weeks.. if i see an increase in the seed / leech ratio
,waldorfx,2013-03-11T10:36Z,English subtitles: http://www.correctsubs.com/The.Walking.Dead.S03E13.720p.HDTV.x264-EVOLVE.srt
,fuhgawzzz,2013-03-11T12:12Z,"Speed is reallly slow on this, been downloading for over an hour and it's only at 39%. These hi-res episodes usually download in about 15 minutes for me, what's the problem with this one?"
,sleepzou,2013-03-11T12:15Z,thank you!
,smisleno,2013-03-11T20:11Z,Love you tx frome Macedonia ACID onia ;)
,malekisaman,2013-03-11T22:31Z,I usually download with 900 kb/s but this one 300kb/s . I wonder why the seeder number is this high!!!
,malekisaman,2013-03-11T22:49Z,well it speeded up to 700 kb/s after a while. its not that bad after all
,henrix343,2013-03-11T23:28Z,THX !
,CrAcKeZ,2013-03-18T03:08Z,"V:7 (I expected better quality for a 720p 1.32gb video..not complaing just saying)
A:10

Thanks eztv for the upload"
,superroastburgr,2013-03-18T06:18Z,It's Real and great!!!!
,Bjakkz,2013-03-30T00:41Z,you are a god or a goddess of torrentz
