User Type,Username,Date,Text
,phase700b,2013-03-01T14:35Z,Thanks DownTYU! Just thinking about this one makes my Pineal gland itch : )
,mt_phile,2013-03-01T15:54Z,"For those who don't get the above comment, from the IMDB description of the movie:

""Scientists create a resonator to stimulate the pineal gland (sixth sense), and open up a door to a parallel (and hostile) universe. Based on a true story by H. P. Lovecraft."""
,Ryall,2013-03-07T16:02Z,"Thanks DownTYU.

@mt_phile
""Based on a true story"" bahaha uh no, it's fiction. Lovecraft wrote fiction."
