User Type,Username,Date,Text
,anymore2,2013-02-27T00:39Z,RAAS update please upload.
,sososo93,2013-02-27T00:42Z,its ok dude? thx for your works;)
,Dmitry_bravo,2013-02-27T01:14Z,Thanks!
,kolwochkor,2013-02-27T12:49Z,"Thank you for great work, but still have msg: product not active, haw removed, and thank you again"
[T],_SnakEye,2013-02-27T14:59Z,"@kolwochkor, you must uninstall your previous version 1st.
on my machine it works great. "
,blabla2a,2013-03-01T17:49Z,I unistall the prev ver and install this and I still have the message about the unactivation
,sososo93,2013-03-01T17:53Z,"@SnakEye
 eh dude they are a big problem with Toulouse airports after many desinstall with reinstall when i launch th scenery in FSX i see on the scenery a BIG TEXT say YOUR PRODUCT NOT ACTIVE  any idea dude mayby the AEROSTYLE.dll no?"
,sososo93,2013-03-01T20:14Z,"@SnakEye
 resolved with reinstall version1.00 not this release,why i dont know."
,aveandor,2013-03-01T20:57Z,"delete ASA on App dataRoamingMicrosoftFSXxml.dll :

		ASE-Data
		False
		False		AerosoftASE_DATAAseData.dll


and woking perfect , GREAT SnakEye !!!"
,eshborn,2013-03-02T22:41Z,"First of thank you Again and again SnakEye , Downloading now and i dont have any previous version ,, so will i run into any problems ? and why do i have to delete AES data ??  i dont understand if any one can help out thanks  before i install "
,bikaaar,2013-03-03T21:39Z,"plz send some seed to me , i'm suck on 99.9%!!!!!!!!!
plz help me to doing this , tnx guys for your help"
