User Type,Username,Date,Text
,Feetback,2013-06-11T21:12Z,"Thank you! "".BONE."" you're the Best, Excellent job, A/V 10 , Appreciate Small files. keep eem coming :) "
,Pakosan,2013-06-11T22:45Z,Everything Feetback said. Thnx.
,yaboo_56,2013-06-11T23:48Z,"Thank for your efforts Bone ..BUT , wrong picture for this movie, the pic showing is from TV Mini Series Chosen with Milo Ventimiglia. 

This upload is Chosen movie .  :-)"
,asdfkjjj,2013-06-12T12:58Z,http://www.imdb.com/title/tt1753521/
,zakimar5,2013-06-12T22:20Z,"Thanks for the small file size. The preview cover is WAY different from the one on IMDB.

http://www.imdb.com/title/tt2606292/"
,Jerseyboy68,2013-06-13T23:30Z,that is the right cover for the movie
,Jerseyboy68,2013-06-13T23:32Z,just the wrong chosen
