Filename,Size,Unit
V1/01 Extent & Millitary Force of the Empire.mp3,51.27,M
V1/02 Union & Internal Prosperity of the Empire.mp3,35.89,M
V1/03 Constitution of the Empire.mp3,24.61,M
V1/04 Commodus - Pertinax.mp3,32.73,M
V1/05 Julianus - Severus.mp3,18.53,M
V1/06 Children of Severus.mp3,47.85,M
V1/07 From Maximin to Philip.mp3,34.3,M
V1/08 From Decius to Gallienus.mp3,36.43,M
V1/09 Gothic Claudius - Aurelian.mp3,46.74,M
V1/10 Tacitus - Probus - Carus & Sons.mp3,31.72,M
V1/11 Diocletian.mp3,35.81,M
V1/12 The Rise of Constantine.mp3,44.63,M
V1/13 Progress of Christianity.mp3,35.9,M
V1/14 Religious Persecution.mp3,76.63,M
V2/01 Foundation of Constantinople.mp3,30.65,M
V2/02 Character of Constantine.mp3,7.48,M
V2/03 Constantius - Gallus - Julian.mp3,32.7,M
V2/04 Establishment of Christianity.mp3,16.71,M
V2/05 Julian Declared Emperor.mp3,57.85,M
V2/06 Apostasy of Julian.mp3,8.32,M
V2/07 Julian in Persia - Jovian.mp3,14.44,M
V2/08 Election of Valentinian - His Sons.mp3,19.42,M
V2/09 Gothic War - Theodosius.mp3,24.86,M
V3/01 Deaths of Gratian & Theodosius.mp3,2.93,M
V3/02 Sons of Theodosius.mp3,5.11,M
V3/03 Alaric Invades Greece.mp3,22.17,M
V3/04 Alaric Sacks Rome.mp3,35.88,M
V3/05 Barbarians - Attila & Genseric.mp3,3.52,M
"V3/06 Odoacer, First Barbarian King of Italy.mp3",11.61,M
V3/07 Observations on the Fall of the Western Empire.mp3,14.58,M
