User Type,Username,Date,Text
,rizzi77,2013-01-15T13:43Z,"Thanks soooooo much, MsFenmore!
Much appreciated!!"
,disneydreams,2013-01-15T14:27Z,thanks
,ZebreBleu,2013-01-15T15:31Z,Thank you so much !
,ninjasource,2013-01-15T19:49Z,"Thank you very much Ms fenmore for all these years of continuous B&B uploads!
I dont know what I would do without you! :-)
Actually im also paying an official webtv service (TV4PLAY.se) to watch B&B but we are 3 1/2 months behind here in sweden :-( :-)

And you have a genious nickname - MsFenmore who have been a character both in B&B and Y&R - both shows which you provide us with :-)"
[T],MsFenmore,2013-01-15T21:21Z,You´re welcome..! Yeah my Nickname is based on Lauren...my favorite Y&R character!! 
,Fleetgang,2013-01-16T00:17Z,Thanks from Australia.
,negyretlif,2013-01-16T05:59Z,Thanks from Australia MsFenmore!! Cage123U I don't think MsFenmore is in the States.. btw I don't want Hope to get with Liam. This story line is driving me nuts lololol :D
[T],MsFenmore,2013-01-16T11:38Z,"I´m sorry, since I have to download them from the web as well, I don´t have the chance to get them in HD.."
,leasine,2013-01-17T02:13Z,Thanks so much again!
