User Type,Username,Date,Text
,grn2012,2013-03-31T17:53Z,You fucking leeching tools. Seed this mafukka.
,spied1,2013-04-01T04:56Z,Any one know of an avi for this? All the mp4's so far will not play on my tv. Thank you.
,Dexter787,2013-04-01T13:38Z,"All right, if it's a good torrent then I promise to seed 
for a while"
,Dexter787,2013-04-01T14:46Z,Yep that was a great torrent. you got your seed:)
,Karyobin,2013-04-01T17:12Z,"AVI version here:

http://thepiratebay.sx/torrent/8328351/Doctor_Who_S07E06_The_Bells_Of_Saint_John_AVI

For some reason it isn't showing up in the search results."
