User Type,Username,Date,Text
[V],HobbitWarez,2013-01-28T01:29Z,"Android Applications [01-27-13]

1Tap Eraser Pro v1.7 Android App
Alarm Clock NFC v1.2.7 Android App
Alarm Clock Xtreme v3.5.6p-AnDrOiD
Alex (Siri for Android) Pro v1.22 Android App
Android Accordion v1.6.1 Android App
Anti theft alarm Pro v1.0-AnDrOiD
Battery Indicator Pro v7.0.4 Android App
Battery Monitor Widget Pro v2.6.12 Android App
BlackedOut CM10 Theme Donate v2.7 Android App
Build A Perfect Body Full v1.0-AnDrOiD
c•PRO+ craigslist Client Droid v1.962 Android App
Call & Message blocker v4.1.0 Android App
CaroO Pro (Blackbox & OBD) v1.1.5 Android App
Clean Calendar Widget Pro v4.12-AnDrOiD
Cloud SMS v2.1.6 Android App
CM10.1 CM9 TouchWiz 5.0 theme v3.4.4 Android App
Couch-to-5K v1.7.0.0009 Android App
Due Today v2.0.12.165-AnDrOiD
EVA - Virtual Assistant v2.70 Android App
Fairy Night Garden LW v1.5-AnDrOiD
Falcon Pro (for Twitter) v1.6.2 Android App
Fast Burst Camera v4.0.9-AnDrOiD
Flightradar24 Pro v3.6.4 Android App
FolderSync v2.4.5-AnDrOiD
franco.Kernel updater v8.4 (Android 4.0.3 and 4.0.4 ICS only) Android App
Ghost Radar LEGACY 3.5.3 Android App
GMD Speed Time v1.0-ROOTED DEVICES ONLY-AnDrOiD
gReader Pro (Google Reader) v3.1.2 Android App
Instapaper v1.2 Android App
InstaPicFramePRO for Instagram v1.1.0 Android App
IP Cam Viewer Pro v4.7.7 Android App
KITT Voice Box & Speedometer v1.27 Android App
KVADGroup - Photo Studio PRO v0.9.11 Android App
LockerPro Lockscreen v2.6 Android App
Mood O'Clock Alarm v1.01 Android App
MoviesBook v3.0.7 Android App
My Budget Book v3.7 Android App
n7player Music Player v2.0.7b (Full) Android App
Next Launcher 3D v1.16-AnDrOiD
Notification Weather Pro v0.7.3 Android App
Paperland Pro Live Wallpaper v1.9.5 Android App
Paperless-Draw, sketch, tablet v1.1.6 Android App
Photo Translator v1.3-AnDrOiD
Pocket Bear HD v1.0 Android App
Premium Widgets and Weather v1.3.1-AnDrOiD
Premium Widgets HD v1.0.6.6 Android App
Punchy Apex Nova ADW v1.1 Android App
Real Bokeh(Light effect) v1.2 Android App
Reddit News v6.11 Android App
RocketDial Pro Dialer And Contacts v3.3.3-AnDrOiD
Scanthing OCR v1.33 Android App
Screen maker – nice screenshot v1.4.16 Android App
Smart Measure Pro v2.3.5 Android App
Snap Camera v1.4.001-AnDrOiD
Songsterr v1.38 Android App
Spirit FM Radio Unlocked vJan25 Android App
Titanium Backup Pro 6.0.0 Full-ROOTED DEVICES ONLY-AnDrOiD
Titanium Backup Pro 6.0.0 Patched-ROOTED DEVICES ONLY-AnDrOiD
Torque Pro (OBD2 and Car) v1.6.32-AnDrOiD
Whistle Android Finder PRO v4.2 Android App
White Noise v4.7.3 Android App
ZPlayer v3.6.3.1 Android App"
,kidlonewolf,2013-01-28T02:04Z,"HobbitWarez thanks, question: do you upload same app twice? and are these all paid? thank you"
[V],shirepirate,2013-01-28T02:34Z,"@kidlonewolf

i upload updates of apps. all are paid, premium, unlocked, full, etc"
,kidlonewolf,2013-01-28T11:37Z,"Thanks for reply, one more question: is TSF Shell in any over your older ups?"
,CashAndPotatoes,2013-01-28T15:32Z,"@kidlonewolf
Use HobbitWarez's customized google serach and find out for yourself 

@HobbitWarez Thank you once again for an awsome app pack!"
,JuicyDrops,2013-01-28T23:55Z,"Hobbit can you upload a big list of android games that have been modded with 100% completion/unlimited money/gameplay mods?

Just a suggestion and if you know someone who already did this could you give me a link to it?

Thanks for reading, keep up the awesome work!"
